publish_date,title,url,media_name
2015-01-07,"PHOTOS: Shock, as 4 cartoonists including chief editor of Charlie Hebdo newspaper amongst 12 reported killed by gunmen in Paris.",http://jide-salu.com/2015/01/07/photos-shock-as-4-cartoonists-including-chief-editor-of-charlie-hebdo-newspaper-amongst-12-reported-killed-by-gunmen-in-paris/,jide-salu.com
2015-01-07,"Obama condemns France shooting, offers U.S. assistance",http://www.worldbulletin.net/haberler/152444/obama-condemns-france-shooting-offers-us-assistance,worldbulletin.net
2015-01-07,Soaring Bond Prices May Sound an Economic Warning,http://www.memeorandum.com/150107/p20#a150107p20,memeorandum.com
2015-01-07,12 DEAD IN PARIS MASSACRE: Islamic gunmen execute French police officer as he pleads for his life,http://www.freerepublic.com/focus/f-news/3244329/posts,freerepublic.com
2015-01-07,The Religion Of Peace Strikes Again,http://www.freerepublic.com/focus/f-bloggers/3244332/posts,freerepublic.com
2015-01-07,Gunmen in Paris Stage Deadly Attack on Offices of Satirical Newspaper,http://rss.nytimes.com/c/34625/f/640316/s/421538ad/sc/3/l/0L0Snytimes0N0C20A150C0A10C0A80Cworld0Ceurope0Ccharlie0Ehebdo0Eparis0Eshooting0Bhtml0Dpartner0Frss0Gemc0Frss/story01.htm,nytimes.com
2015-01-07,12 dead in shooting at satirical magazine office in Paris: interior minister,http://www.citynews.ca/2015/01/07/12-dead-in-shooting-at-satirical-magazine-office-in-paris-interior-minister/,citynews.ca
2015-01-07,Video: Charlie Hebdo massacre,http://www.belfasttelegraph.co.uk/news/world-news/video-charlie-hebdo-massacre-france-a-nation-in-shock-as-paris-gun-attack-leaves-12-dead-and-four-critically-injured-30889205.html,belfasttelegraph.co.uk
2015-01-07,Editor among 12 killed in terror attack on French satirical newspaper,http://www.dallasnews.com/news/local-news/20150107-editor-among-12-killed-in-terror-attack-on-french-satirical-newspaper.ece,dallasnews.com
2015-01-07,"12 dead in attack on Paris satirical weekly, 3 gunmen sought",http://feeds.baltimoresun.com/~r/baltimoresun/business/careers/rss2/~3/-H_B6eMRcX8/chi-paris-newspaper-shooting-20150107-story.html,baltimoresun.com
2015-01-07,"12 dead in attack on Paris satirical weekly, 3 gunmen sought",http://feeds.baltimoresun.com/~r/baltimoresun/features/booksmags/rss2/~3/-H_B6eMRcX8/chi-paris-newspaper-shooting-20150107-story.html,baltimoresun.com
2015-01-07,Charlie Hebdo terror attack: Sickening moment 'policeman executed by militants as he held up hands in surrender',http://www.mirror.co.uk/news/world-news/charlie-hebdo-terror-attack-sickening-4935314,mirror.co.uk
2015-01-07,11 dead as gunmen attack magazine offices,https://www.euroweeklynews.com/news/world-news/item/124858-11-dead-as-gunmen-attack-magazine-offices,euroweeklynews.com
2015-01-07,REPORT: A Car Has Exploded In Front Of A French Synagogue,http://feedproxy.google.com/~r/businessinsider/~3/bgdq_8xGLa8/report-sarcelles-synagogue-car-explodes-2015-1,google.com
2015-01-07,«Charlie Hebdo»: choc et horreur dans le monde entier,http://24heures.ch/monde/europe/Charlie-Hebdo-choc-et-horreur-dans-le-monde-entier/story/23930465,24heures.ch
2015-01-07,"12 dead in attack on Paris satirical weekly, 3 gunmen sought",http://feeds.orlandosentinel.com/~r/orlandosentinel/~3/2Y0YfEZf1aQ/chi-paris-newspaper-shooting-20150107-story.html,orlandosentinel.com
2015-01-07,Obama offers US help to purse terrorists in French attack,http://www.seattlepi.com/news/politics/article/Obama-spokesman-US-stands-with-French-in-time-5998955.php,seattlepi.com
2015-01-07,Paris Gunmen Are Skilful Professional Killers,http://news.sky.com/story/1403776,sky.com
2015-01-07,"12 dead in attack on Paris satirical weekly, 3 gunmen sought",http://feeds.orlandosentinel.com/~r/orlandosentinel/news/local/state/~3/2Y0YfEZf1aQ/chi-paris-newspaper-shooting-20150107-story.html,orlandosentinel.com
2015-01-07,Obehag i Sverige efter Parisattentat,http://ekuriren.se/nyheter/varlden/1.2887595-obehag-i-sverige-efter-parisattentat,ekuriren.se
2015-01-07,Obama Condemns Attack on French Newspaper,http://www.nytimes.com/politics/first-draft/2015/01/07/obama-condemns-attack-on-french-newspaper/,nytimes.com
2015-01-07,"World Leaders, Media Groups Condemn 'Barbaric' Paris Attack",http://www.naharnet.com/stories/en/162012-world-leaders-media-groups-condemn-barbaric-paris-attack,naharnet.com
2015-01-07,At least 12 dead after terror attack at Paris newspaper office,http://www.csmonitor.com/World/Latest-News-Wires/2015/0107/At-least-12-dead-after-terror-attack-at-Paris-newspaper-office,csmonitor.com
2015-01-07,"HILLARY HUDDLES with Mook, Benenson as she finalizes team – BOEHNER MANS UP -- OBAMA SIDES WITH LIONS – EARNEST wit – CHARLES KOCH on how to reduce poverty -- B’DAY: Katie Couric, Rand Paul",http://www.politico.com/playbook/0115/playbook16626.html,politico.com
2015-01-07,Charlie Hebdo's long history of provocative religious satire,http://www.nydailynews.com/news/crime/charlie-hebdo-long-history-provocative-religious-satire-article-1.2068634,nydailynews.com
2015-01-07,Terror Attack Hits Paris In Fraught Times,http://www.forbes.com/sites/marcelmichelson/2015/01/07/terror-attack-hits-paris-in-fraught-times/,forbes.com
2015-01-07,Nach Terroranschlag in Paris weitere Todesopfer befürchtet,http://www.finanznachrichten.de/nachrichten-2015-01/32458200-nach-terroranschlag-in-paris-weitere-todesopfer-befuerchtet-003.htm,finanznachrichten.de
2015-01-07,Obama offers US help to bring terrorists to justice after 'horrific shooting' in Paris,http://www.startribune.com/politics/national/287769101.html,startribune.com
2015-01-07,Ett fasansfullt vämjeligt dåd,http://www.sn.se/asikter/opinion/1.2887980,sn.se
2015-01-07,"Pro-Russian Group Hacks Websites of Merkel, Bundestag",http://www.novinite.com/articles/165816/Pro-Russian+Group+Hacks+Websites+of+Merkel%2C+Bundestag,novinite.com
2015-01-07,Financial Mirror dot com,http://www.financialmirror.com/news-details.php?nid=33680,financialmirror.com
2015-01-07,Paris Satire Weekly Renowned for Publishing Prophet Caricatures,http://www.voanews.com/content/charlie-hebdo-renowned-for-publishing-prophet-caricatures/2588803.html,voanews.com
2015-01-07,Paris attack France's deadliest in decades,http://www.deccanherald.com/content/452131/paris-attack-frances-deadliest-decades.html,deccanherald.com
2015-01-07,"Bloodthirsty Liberal » Activists Attack French Newspaper, Killing 11 [Update – 12 Dead]",http://bloodthirstyliberal.com/2015/01/07/activists-attack-french-newspaper-killing-11/,bloodthirstyliberal.com
2015-01-07,Twelve shot dead in 'terrorist' attack on French newspaper,http://www.bangkokpost.com/news/world/455033/twelve-shot-dead-in-terrorist-attack-on-french-newspaper,bangkokpost.com
2015-01-07,"Paris shooting: World leaders, media groups condemn âbarbaricâ attack",http://www.thestar.com.my/News/World/2015/01/07/Paris-shoting-condemn,thestar.com.my
2015-01-07,France: Terrorists attack magazine headquarters,http://www.speroforum.com/a/JVADMGQTHA52/75459-France-Terrorists-attack-magazine-headquarters,speroforum.com
2015-01-07,Magazine attacked in Paris skirted controversy with cartoons of Prophet,http://www.theglobeandmail.com/news/world/magazine-attacked-in-paris-skirted-controversy-with-cartoons-of-prophet/article22330111/?cmpid=rss1,theglobeandmail.com
2015-01-07,Merkel says shooting in France attack on core democratic freedoms,http://feeds.reuters.com/~r/reuters/cyclicalconsumergoodsNews/~3/DSHx9bCCbQw/france-shooting-germany-idUSB4N0T200T20150107,reuters.com
2015-01-07,Update 4: At least 12 dead in Paris after attack on satirical newspaper,http://www.timesofmalta.com/articles/view/20150107/world/update-3-at-least-12-dead-in-paris-after-attack-on-satirical-newspaper.550971,timesofmalta.com
2015-01-07,12 dead in attack on Paris paper; French leader labels it terrorism,http://feeds.latimes.com/~r/latimes/news/~3/e-zkW7jWn44/la-fg-paris-newspaper-shooting-20150107-story.html,latimes.com
2015-01-07,Charlie Hebdo: Islamistischer Terror in Europa,http://www.direktbroker.de/news/charlie-hebdo-islamistischer-terror-in-europa-41141297,direktbroker.de
2015-01-07,Charlie Hebdo: Satireblatt mit Skandal-Tradition,http://www.direktbroker.de/news/charlie-hebdo-satireblatt-mit-skandal-tradition-41141300,direktbroker.de
2015-01-07,«Nous sommes consternés»,http://www.lessentiel.lu/fr/news/dossier/charliehebdo/story/14451387,lessentiel.lu
2015-01-07,Raw: At Least 11 Dead in Paris Newspaper Attack,http://www.philly.com/philly/video/287772411.html,philly.com
2015-01-07,FOOTAGE: Paris gunmen shoot and kill police officer,http://www.news24.com/Live/World/FOOTAGE-Paris-gunmen-shoot-and-kill-police-officer-20150107,news24.com
2015-01-07,Obama spokesman: US stands with French in time of suffering,http://globegazette.com/news/national/obama-spokesman-us-stands-with-french-in-time-of-suffering/article_7467e07f-520b-54d1-88a7-fb714f6125bb.html,globegazette.com
2015-01-07,"12 dead in attack on Paris newspaper, including the editor",http://www.newson6.com/story/27779829/12-dead-in-attack-on-paris-newspaper-including-the-editor,newson6.com
2015-01-07,Charlie Hebdo shootings Europe's latest deadly terror attack,http://www.newson6.com/story/27781014/charlie-hebdo-shootings-europes-latest-deadly-terror-attack,newson6.com
2015-01-07,CPJ condemns murderous attack on French magazine Charlie Hebdo,https://www.premiumtimesng.com/news/more-news/174416-cpj-condemns-murderous-attack-french-magazine-charlie-hebdo.html,premiumtimesng.com
2015-01-07,11 killed in France as gunmen storm office of satirical newspaper,https://www.premiumtimesng.com/news/headlines/174410-11-killed-france-gunmen-storm-office-satirical-newspaper.html,premiumtimesng.com
2015-01-07,Paris on high alert after 12 killed in shooting at office of French magazine,http://www.washingtonexaminer.com/paris-on-high-alert-after-12-killed-in-shooting-at-office-of-french-magazine/article/2558287?custom_click=rss,washingtonexaminer.com
2015-01-07,12 dead in 'terrorist' attack at Paris paper,http://www.gulf-times.com/UK-Europe/183/details/422392/12-dead-in-%27terrorist%27-attack-at-Paris-paper,gulf-times.com
2015-01-07,Hollandes löfte: De ska få sitt straff,http://www.expressen.se/nyheter/hollandes-lofte-de-ska-fa-sitt-straff/,expressen.se
2015-01-07,"Carl Bildt: ""Visar att vi lever i en farligare tid""",http://www.expressen.se/nyheter/carl-bildt-visar-att-vi-lever-i-en-farligare-tid/,expressen.se
2015-01-07,Charlie Hebdo editor and cartoonist among those killed,http://www.itv.com/news/update/2015-01-07/charlie-hebdo-editor-and-cartoonist-among-those-killed/,itv.com
2015-01-07,Police 'in pursuit of three suspects' in Paris attack,http://www.itv.com/news/update/2015-01-07/police-in-pursuit-of-three-suspects-in-paris-attack/,itv.com
2015-01-07,Woman seen cowering behind cars during Paris gun fight,http://www.itv.com/news/update/2015-01-07/woman-seen-cowering-behind-cars-during-paris-gun-fight/,itv.com
2015-01-07,Witness: Gunmen 'claimed to be from al Qaida',http://www.itv.com/news/update/2015-01-07/witness-gunmen-claimed-to-be-from-al-qaida/,itv.com
2015-01-07,Fight intimidation with controversy: Charlie Hebdo’s response to critics,http://feeds.theguardian.com/c/34708/f/663828/s/4215ed97/sc/11/l/0L0Stheguardian0N0Cworld0C20A150Cjan0C0A70Ccharlie0Ehebdo0Esatire0Eintimidation0Eanalysis/story01.htm,theguardian.com
2015-01-07,Charlie Hebdo Shooting: 12 Killed at Muhammad Cartoons Magazine in Paris,http://feeds.nbcnews.com/c/35197/f/663376/s/4215072a/sc/7/l/0L0Snbcnews0N0Cnews0Cworld0Ccharlie0Ehebdo0Eshooting0E110Ekilled0Emagazine0Eran0Emuhammad0Ecartoons0En281266/story01.htm,nbcnews.com
2015-01-07,"12 dead in terror attack on Paris paper, including editor",http://mynorthwest.com/17/2683897/12-dead-in-attack-on-Paris-newspaper-including-the-editor,mynorthwest.com
2015-01-07,World Leaders Condemn Attack on Charlie Hebdo,http://feedproxy.google.com/~r/timeblogs/real_clear_politics/~3/xQtt87MkFYw/,google.com
2015-01-07,French president calls newspaper shooting terrorist attack,http://english.people.com.cn//n/2015/0107/c90000-8833011.html,people.com.cn
2015-01-07,At least 12 dead in armed attack on Paris newspaper,http://english.people.com.cn//n/2015/0107/c90000-8833008.html,people.com.cn
2015-01-07,Francois Hollande calls Charlie Hebdo shooting terrorist attack,http://english.people.com.cn//n/2015/0107/c90777-8833013.html,people.com.cn
2015-01-07,NYPD reassessing security after French terror attacks,http://www.nydailynews.com/new-york/nypd-reassessing-security-french-terror-attacks-article-1.2068581,nydailynews.com
2015-01-07,US condemns deadly attacks on Paris newspaper,http://www.gmanetwork.com/news/story/400323/news/world/us-condemns-deadly-attacks-on-paris-newspaper,gmanetwork.com
2015-01-07,Press groups condemn attack on Charlie Hebdo,http://www.gmanetwork.com/news/story/400347/news/world/press-groups-condemn-attack-on-charlie-hebdo,gmanetwork.com
2015-01-07,12 Dead In Terrorist Attack In Paris,http://rightwingnews.com/war-on-terrorism/12-dead-terrorist-attack-paris/,rightwingnews.com
2015-01-07,World Leaders Condemn Attack on Charlie Hebdo,http://feedproxy.google.com/~r/timeblogs/middle_east/~3/xQtt87MkFYw/,google.com
2015-01-07,Manhunt after Paris paper massacre,http://www.independent.ie/world-news/12-dead-in-paris-newspaper-attack-30889171.html,independent.ie
2015-01-07,"Obama condemns Paris shooting, offers U.S. help",http://rssfeeds.usatoday.com/~/82712519/0/usatodaycompolitics-topstories~Obama-condemns-horrific-shooting/,usatoday.com
2015-01-07,Tystnad får inte bli svaret,http://arbetet.se/2015/01/07/tystnad-far-inte-bli-svaret/,arbetet.se
2015-01-07,At Least 11 Killed At Paris Office Of Satirical Newspaper Charlie Hebdo,http://www.channelstv.com/2015/01/07/at-least-11-killed-at-paris-office-of-satirical-newspaper-charlie-hebdo/,channelstv.com
2015-01-07,"12 dead in terror attack on Paris paper, including editor",http://seattletimes.nwsource.com/html/nationworld/2025398897_apxfrancenewspaperattack.html?syndication=rss,nwsource.com
2015-01-07,Obama spokesman: US stands with French in time of suffering,http://wcfcourier.com/news/national/obama-spokesman-us-stands-with-french-in-time-of-suffering/article_65f6bfd8-5bb8-571a-b303-be938c4e1761.html,wcfcourier.com
2015-01-07,Charlie Hebdo shootings Europe's latest deadly terror attack,http://feedproxy.google.com/~r/bostonherald/~3/v7MHiI5YDV4/charlie_hebdo_shootings_europes_latest_deadly_terror,google.com
2015-01-07,Gunmen kill 12 at Paris headquarters of satirical magazine Charlie Hebdo,http://feeds.dailykos.com/~r/dailykos/index/~3/sV7s9AMo7Bc/-Gunmen-kill-12-at-Paris-headquarters-of-satirical-magazine-Charlie-Hebdo,dailykos.com
2015-01-07,Thomas Nordanstad: Det kommer bli demonstrationer,http://www.gp.se/nyheter/varlden/1.2594547-thomas-nordanstad-det-kommer-bli-demonstrationer,gp.se
2015-01-07,Charlie Hebdo shootings Europe's latest deadly terror attack,http://globegazette.com/news/world/charlie-hebdo-shootings-europe-s-latest-deadly-terror-attack/article_70ae4a09-d141-521b-b848-9f78bf54812c.html,globegazette.com
2015-01-07,Charlie Hebdo shootings Europe's latest deadly terror attack,http://www.wboc.com/story/27781014/charlie-hebdo-shootings-europes-latest-deadly-terror-attack,wboc.com
2015-01-07,"World leaders, media groups condemn 'barbaric' Paris attack",http://www.freemalaysiatoday.com/category/world/2015/01/07/world-leaders-media-groups-condemn-barbaric-paris-attack/,freemalaysiatoday.com
2015-01-07,12 Dead in Attack on the Weekly Charlie Hebdo Paris Newspaper,http://www.usnews.com/news/business/articles/2015/01/07/12-dead-in-attack-on-paris-newspaper-france-goes-on-alert,usnews.com
2015-01-07,Gunmen massacre staff at French magazine that published Islamic gay kiss,http://feedproxy.google.com/~r/Pinknews/~3/SK2wx9aaSBM/,google.com
2015-01-07,David Cameron condemns attack on Charlie Hebdo magazine in Paris – video,http://feeds.theguardian.com/c/34708/f/663879/s/4215ab2e/sc/11/l/0L0Stheguardian0N0Cworld0Cvideo0C20A150Cjan0C0A70Cdavid0Ecameron0Echarlie0Ehebdo0Eparis0Evideo/story01.htm,theguardian.com
2015-01-07,Charlie Hebdo attack – in pictures,http://feeds.theguardian.com/c/34708/f/663879/s/4216007d/sc/11/l/0L0Stheguardian0N0Cworld0Cgallery0C20A150Cjan0C0A70Ccharlie0Ehebdo0Eattack0Ein0Epictures/story01.htm,theguardian.com
2015-01-07,Gunmen filmed shooting Paris police officer during attack on Charlie Hebdo offices – video,http://feeds.theguardian.com/c/34708/f/663879/s/4215df82/sc/6/l/0L0Stheguardian0N0Cworld0Cvideo0C20A150Cjan0C0A70Cgunmen0Eshooting0Eparis0Epolice0Eofficer0Echarlie0Ehebdo0Evideo/story01.htm,theguardian.com
2015-01-07,Aftermath of attack on Charlie Hebdo magazine office in Paris – video,http://feeds.theguardian.com/c/34708/f/663879/s/4215ab34/sc/11/l/0L0Stheguardian0N0Cworld0Cvideo0C20A150Cjan0C0A70Caftermath0Eattack0Echarlie0Ehebdo0Eparis0Evideo/story01.htm,theguardian.com
2015-01-07,Paris terror attack: what we know so far,http://feeds.theguardian.com/c/34708/f/663879/s/42160075/sc/11/l/0L0Stheguardian0N0Cworld0C20A150Cjan0C0A70Cparis0Eterror0Eattack0Ewhat0Ewe0Eknow0Eso0Efar/story01.htm,theguardian.com
2015-01-07,World Leaders Condemn Attack on Charlie Hebdo,http://feedproxy.google.com/~r/time/mostemailed/~3/xQtt87MkFYw/,google.com
2015-01-07,Video: Charlie Hebdo massacre,http://www.belfasttelegraph.co.uk/news/world-news/charlie-hebdo-massacre-france-a-nation-in-shock-as-paris-gun-attack-leaves-12-dead-and-four-critically-injured-30889205.html,belfasttelegraph.co.uk
2015-01-07,"12 dead, including newspaper editor, as Paris police hunt three gunmen",http://feeds.breakingnews.ie/~r/bntopstories/~3/3T9tG_9OkFM/12-dead-including-newspaper-editor-as-paris-police-hunt-three-gunmen-657092.html,breakingnews.ie
2015-01-07,"Extremist British Islamist Makes Excellent Case for an Unadulterated First Amendment, Free of Hate Speech and Other Exceptions",http://feedproxy.google.com/~r/reason/HitandRun/~3/-LqFgO4_VfM/extremist-british-islamist-makes-excelle,google.com
2015-01-07,Obama spokesman: US stands with French in time of suffering,http://indianexpress.com/article/world/europe/obama-spokesman-us-stands-with-french-in-time-of-suffering/,indianexpress.com
2015-01-07,Paris attack France’s deadliest in decades,http://allnews.rss.themalaysianinsider.com/c/33362/f/567634/s/4215b919/sc/30/l/0L0Sthemalaysianinsider0N0Cworld0Carticle0Cparis0Eattack0Efrances0Edeadliest0Ein0Edecades/story01.htm,themalaysianinsider.com
2015-01-07,"12 dead, including newspaper editor, as Paris police hunt three gunmen",http://feeds.breakingnews.ie/~r/bnworld/~3/RmSaVqzSiV0/12-dead-including-newspaper-editor-as-paris-police-hunt-gunmen-657092.html,breakingnews.ie
2015-01-07,"12 Dead In Attack On Paris Newspaper, Including The Editor",http://blackamericaweb.com/2015/01/07/12-dead-in-attack-on-paris-newspaper-including-the-editor/,blackamericaweb.com
2015-01-12,Shooting at Satirical Publication's Office Leaves 12 Dead in Paris,http://www.complex.com/pop-culture/2015/01/12-dead-shooting-charlie-hebdo-office,complex.com
2015-01-07,Charlie Hebdo Shooting: 12 Killed at Muhammad Cartoons Magazine in Paris,http://feeds.nbcnews.com/c/35197/f/663376/s/4216361e/sc/11/l/0L0Snbcnews0N0Cstoryline0Cparis0Emagazine0Eattack0Ccharlie0Ehebdo0Eshooting0E120Ekilled0Emuhammad0Ecartoons0Emagazine0En281266/story01.htm,nbcnews.com
2015-01-07,Charlie Hebdo Shooting: 12 Killed at Muhammad Cartoons Magazine in Paris,http://feeds.nbcnews.com/c/35002/f/663303/s/421605c6/sc/11/l/0L0Snbcnews0N0Cstoryline0Cparis0Emagazine0Eattack0Cparis0Eterror0Eattack0E120Ekilled0Emagazine0Eran0Emuhammad0Ecartoons0En281266/story01.htm,nbcnews.com
2015-01-07,Paris Terror Attack: France Has Been Victimized by Islamists in Past,http://feeds.nbcnews.com/c/35002/f/663303/s/421605c8/sc/30/l/0L0Snbcnews0N0Cstoryline0Cparis0Emagazine0Eattack0Cparis0Eterror0Eattack0Efrance0Ehas0Ebeen0Evictimized0Eislamists0Epast0En28130A1/story01.htm,nbcnews.com
2015-01-07,France Goes on Alert,http://www.realclearworld.com/articles/2015/01/07/france_goes_on_alert_110889.html,realclearworld.com
2015-01-07,Gruesome Attack Hits French Magazine,http://www.realclearworld.com/2015/01/07/gruesome_attack_hits_french_magazine_163968.html,realclearworld.com
2015-01-07,PHOTOS: Caricatures of the Prophet Mohammed by French satirical magazine Charlie Hebdo may have killed at least 12 people; Armed men attacked office in Paris.,http://jide-salu.com/2015/01/07/photos-because-of-this-caricature-of-prophet-mohammed-french-satirical-magazine-charlie-hebdo-has-been-attacked-at-least-11-people-killed/,jide-salu.com
2015-01-07,The Jawa Report: 12 Murdered in Attack on Charlie Hebdo Office in Paris,http://mypetjawa.mu.nu/archives/219266.php,mu.nu
2015-01-07,The Cartoons That Possibly Motivated The Paris Terror Attack,http://nation.foxnews.com/2015/01/07/cartoons-possibly-motivated-paris-terror-attack,foxnews.com
2015-01-07,"Carter’s confirmation hearing expected in early February — McCain gets SASC gavel, but few defense dollars — 2 dead in shooting at Fort Bliss",http://www.politico.com/morningdefense/0115/morningdefense16628.html,politico.com
2015-01-07,Charlie Hebdo shootings Europe's latest deadly terror attack,http://www.seattlepi.com/news/crime/article/Charlie-Hebdo-shootings-Europe-s-latest-deadly-5999030.php,seattlepi.com
2015-01-07,Reuters: At least 12 dead in Paris after attack on satirical newspaper,http://kyivpost.com/content/world/reuters-at-least-12-dead-in-paris-after-attack-on-satirical-newspaper-376870.html,kyivpost.com
2015-01-07,Cartoonists who mocked Islam were killed in Charlie Hebdo massacre,http://www.dailymail.co.uk/news/article-2900519/Cartoonists-mocked-Islam-refused-threatened-Quranic-law-killed-Charlie-Hebdo-massacre-terrorists-asked-name.html?ITO=1490&ns_mchannel=rss&ns_campaign=1490,dailymail.co.uk
2015-01-07,Hollande: We Are Threatened Because We Are Free,http://news.sky.com/story/1403757,sky.com
2015-01-07,Je Suis Charlie: Online Solidarity After Attack,http://news.sky.com/story/1403783,sky.com
2015-01-07,"Juncker verdammt Anschlag auf Satiremagazin ""Charlie Hebdo""",http://www.euractiv.de/sections/eu-innenpolitik/eu-verdammt-anschlag-auf-satiremagazin-charlie-hebdo-311091,euractiv.de
2015-01-07,Morning Must Reads: January 7,http://feedproxy.google.com/~r/timeblogs/swampland/~3/TM3SJIJN2Q4/,google.com
2015-01-07,Gunmen kill 12 at Paris headquarters of satirical magazine Charlie Hebdo,http://rss.dailykos.com/~r/dailykos/index/~3/sV7s9AMo7Bc/-Gunmen-kill-12-at-Paris-headquarters-of-satirical-magazine-Charlie-Hebdo,dailykos.com
2015-01-07,"10 things you need to know today: January 7, 2015",http://theweek.com/article/index/274567/10-things-you-need-to-know-today-january-7-2015,theweek.com
2015-01-12,12 dead in ‘terrorist’ attack at Paris paper,http://www.capitalfm.co.ke/news/2015/01/12-dead-in-terrorist-attack-at-paris-paper/,capitalfm.co.ke
2015-01-07,Another Attack on Freedom in France,http://www.washingtonmonthly.com/political-animal-a/2015_01/another_attack_on_freedom_in_f053616.php,washingtonmonthly.com
2015-01-08,Gunmen in Paris Kill 12 at Offices of Satirical Newspaper,http://www.memeorandum.com/150107/p14#a150107p14,memeorandum.com
2015-01-07,What is Charlie Hebdo and why did terrorists target French satirical magazine?,http://www.dailyrecord.co.uk/news/uk-world-news/what-charlie-hebdo-terrorists-target-4935063,dailyrecord.co.uk
2015-01-07,Paris terror attack: Video captures terrifying moment gunmen stormed building,http://www.dailyrecord.co.uk/news/uk-world-news/charlie-hebdo-paris-terror-attack-4934797,dailyrecord.co.uk
2015-01-07,Merkel says shooting in France attack on core democratic freedoms,http://www.thestar.com.my/News/World/2015/01/07/Merkel-says-shooting-in-France-attack-on-core-democratic-freedoms,thestar.com.my
2015-01-07,Gunmen Hunted After 11 Killed At Paris Magazine,https://www.newsday.co.zw/2015/01/07/gunmen-hunted-11-killed-paris-magazine/,newsday.co.zw
2015-01-07,US stands with French in time of suffering,http://thehimalayantimes.com/rssReference.php?id=NDQwMDM2,thehimalayantimes.com
2015-01-07,Editor slaughtered by terrorists didn’t fear threats,http://www.wnd.com/2015/01/editor-slaughtered-by-terrorists-didnt-fear-threats/,wnd.com
2015-01-07,Paris terror: ‘We have avenged the prophet’,http://www.wnd.com/2015/01/paris-terror-we-have-avenged-the-prophet/,wnd.com
2015-01-07,News From The Associated Press,http://hosted.ap.org/dynamic/stories/E/EU_FRANCE_NEWSPAPER_ATTACK_TIMELINE?SITE=PAYOK&SECTION=HOME&TEMPLATE=DEFAULT,ap.org
2015-01-07,Paris Police Respond to 'Charlie Hebdo' Attack,http://feedproxy.google.com/~r/timeblogs/real_clear_politics/~3/SnccqrsVGWU/,google.com
2015-01-07,The Provocative History of French Satirical Magazine <i>Charlie Hebdo</i>,http://feedproxy.google.com/~r/timeblogs/real_clear_politics/~3/F7gTxloHNcM/,google.com
2015-01-07,At Least 12 Dead in Shooting Attack on Paris Satirical Newspaper,http://feedproxy.google.com/~r/timeblogs/real_clear_politics/~3/dFNr5AE3NZg/,google.com
2015-01-07,Obama spokesman: US stands with French in time of suffering,http://feedproxy.google.com/~r/bostonherald/~3/1u8aLBybeFk/obama_spokesman_us_stands_with_french_in_time_of_suffering,google.com
2015-01-07,Paris attackers shouted 'we have avenged the prophet': police,http://www.deccanherald.com/content/452128/paris-attackers-shouted-we-have.html,deccanherald.com
2015-01-07,<!-- document.write(partnertitle); // -->,http://hosted.ap.org/dynamic/stories/E/EU_FRANCE_NEWSPAPER_ATTACK_TIMELINE?SITE=RIPRJ&SECTION=HOME&TEMPLATE=DEFAULT,ap.org
2015-01-07,Gunmen open fire inside offices of satirical French publication,http://feeds.foxnews.com/~r/foxnews/world/~3/wjalKZjwdZE/,foxnews.com
