publish_date,title,url,media_name
2015-01-07,Islamic State fighter praises attack on Paris satirical magazine,http://news.yahoo.com/islamic-state-fighter-praises-attack-paris-satirical-magazine-165557437--business.html,yahoo.com
2015-01-07,World expresses shock at attack on Charlie Hebdo newspaper,http://news.yahoo.com/world-expresses-shock-attack-charlie-hebdo-newspaper-172709702--finance.html,yahoo.com
2015-01-07,FBI aiding France in hunt for Charlie Hebdo attackers,http://www.itv.com/news/update/2015-01-07/fbi-aiding-france-in-hunt-for-charlie-hebdo-attackers/,itv.com
2015-01-07,Hundreds gather for Charlie Hebdo vigil in Paris,http://www.itv.com/news/update/2015-01-07/hundreds-gather-for-charlie-hebdo-vigil-in-paris/,itv.com
2015-01-07,Eyewitness claims masked gunmen dumped car,http://www.itv.com/news/update/2015-01-07/eyewitness-claims-gunmen-dumped-car-and-hijacked-another/,itv.com
2015-01-07,Paris terror attack: What we know so far,http://www.itv.com/news/update/2015-01-07/paris-terror-attack-what-we-know-so-far/,itv.com
2015-01-07,Reid Standish: Putin's Eurasian dream is over before it began,http://kyivpost.com/opinion/op-ed/reid-standish-putins-eurasian-dream-is-over-before-it-began-376888.html,kyivpost.com
2015-01-07,Queen sends 'sincere condolences' after Paris shooting,http://www.itv.com/news/update/2015-01-07/queen-sends-sincere-condolences-after-paris-shooting/,itv.com
2015-01-07,Rushdie attacks 'totalitarianism' after Paris massacre,http://www.itv.com/news/update/2015-01-07/rushdie-attacks-religious-totalitarianism-after-paris-massacre/,itv.com
2015-01-07,Hundreds in Bordeaux show solidarity with terror victims,http://www.itv.com/news/update/2015-01-07/hundreds-show-solidarity-with-terror-victims-in-bordeaux/,itv.com
2015-01-07,Salman Rushdie Says 'I Stand With Charlie Hebdo' After Paris Attack,http://feedproxy.google.com/~r/timeblogs/real_clear_politics/~3/AskRD0Z89P4/,google.com
2015-01-07,The best video games to play in 2015,http://rss.feedsportal.com/c/266/f/3492/s/421787c1/sc/36/l/0L0Sindependent0O0Clife0Estyle0Cgadgets0Eand0Etech0Cgaming0Cfrom0Ezelda0Eto0Euncharted0E20A0Ebest0Evideo0Egames0Ein0E20A150E99628670Bhtml/story01.htm,feedsportal.com
2015-01-07,"1795 time capsule opened, centuries after Revere and Adams buried it",http://www.memeorandum.com/150107/p44#a150107p44,memeorandum.com
2015-01-07,Foreword: The Supreme Court's Shadow Docket,http://www.memeorandum.com/150107/p42#a150107p42,memeorandum.com
2015-01-07,Terrorists shouted they were from al-Qaeda in the Yemen before Charlie Hebdo attack,http://www.memeorandum.com/150107/p43#a150107p43,memeorandum.com
2015-01-07,House rule sets up election-year battle over Social Security,http://www.memeorandum.com/150107/p40#a150107p40,memeorandum.com
2015-01-08,EU's condemns 'barbarism' of Paris magazine attack,http://en.republika.co.id/berita/en/international/15/01/08/nhthh7-eus-condemns-barbarism-of-paris-magazine-attack,republika.co.id
2015-01-08,Obama condemns 'horrific' attack on Charlie Hebdo,http://en.republika.co.id/berita/en/international/15/01/08/nhthr7-obama-condemns-horrific-attack-on-emcharlie-hebdoem,republika.co.id
2015-01-07,Charlie Hebdo attack: At least 12 killed (Cowards Blurred out Charlie Hebdo Cover in story),http://www.freerepublic.com/focus/f-news/3244402/posts,freerepublic.com
2015-01-07,The Charlie Hebdo terror attack victims: What we know so far,http://feedproxy.google.com/~r/Mashable/~3/ofvehi5v7zo/,google.com
2015-01-07,"(UPDATED) Arab League, top Muslim body condemn Paris attack",http://news2.onlinenigeria.com/news/general/394780-updated-arab-league-top-muslim-body-condemn-paris-attack.html,onlinenigeria.com
2015-01-07,Obama calls French shooting 'cowardly evil attacks',http://www.newson6.com/story/27780502/obama-paris-shooting-a-cowardly-attack-on-journalists,newson6.com
2015-01-07,Charlie Hebdo's Brazen Defiance,http://feedproxy.google.com/~r/TheAtlantic/~3/SRLDCNSdEpk/story01.htm,google.com
2015-01-07,Terrorists massacre 12 in Paris to avenge cartoon,http://twocircles.net/2015jan07/1420652235.html,twocircles.net
2015-01-07,Extremists amongst us,http://twocircles.net/2015jan07/1420651672.html,twocircles.net
2015-01-07,Paris on Alert as Gunmen Kill 12 in Massacre at Magazine Office,http://www.vice.com/read/paris-on-alert-as-gunmen-kill-twelve-in-massacre-at-magazine-office,vice.com
2015-01-07,Europe's struggle with Islamism,http://www.bbc.co.uk/news/world-europe-30717728#sa-ns_mchannel=rss&ns_source=PublicRSS20-sa,bbc.co.uk
2015-01-07,Dove si trova la redazione di Charlie Hebdo a Parigi,http://www.internazionale.it/notizie/2015/01/07/dove-si-trova-la-redazione-di-charlie-hebdo-a-parigi,internazionale.it
2015-01-07,Suspected Islamists kill 12 in Paris attack on satirical magazine,http://bdnews24.com/world/2015/01/07/suspected-islamists-kill-12-in-paris-attack-on-satirical-magazine,bdnews24.com
2015-01-07,"In solidarity, Spanish monthly retweets Charlie Hebdo cartoon",http://www.andes.info.ec/es/node/39458,andes.info.ec
2015-01-07,"Obama, Kerry Condemn Paris Terror Attack",http://online.wsj.com/articles/obama-condemns-paris-terror-attack-1420648467?mod=europe_home,wsj.com
2015-01-07,Enot (female),http://enot.livejournal.com/930918.html,enot.livejournal.com
2015-01-07,Björn Wiman: Dådet i Paris är en attack mot upplysningens hjärtpunkt,http://www.dn.se/kultur-noje/bjorn-wiman-dadet-i-paris-ar-en-attack-mot-upplysningens-hjartpunkt/,dn.se
2015-01-07,Cartoonisten uiten woede over aanslag via tekeningen,http://www.ed.nl/algemeen/buitenland/cartoonisten-uiten-woede-over-aanslag-via-tekeningen-1.4703680,ed.nl
2015-01-07,Charlie Hebdo attack: cartoonists show solidarity with Paris victims,http://www.theguardian.com/world/2015/jan/07/charlie-hebdo-attack-cartoonists-show-solidarity-victims,theguardian.com
2015-01-07,12 dead in terror attack on Paris paper; manhunt for gunmen,https://voxxi.com/2015/01/dead-terror-attack-paris-paper/,voxxi.com
2015-01-08,Paris terror attack: 12 dead,http://www.stuff.co.nz/world/europe/64749010/Paris-attack-12-killed-at-satirical-newspaper-Charlie-Hebdo,stuff.co.nz
2015-01-07,12 killed in terrorist attack on French magazine,http://nationalmirroronline.net/new/12-killed-in-terrorist-attack-on-french-magazine/,nationalmirroronline.net
2015-01-07,Nous Sommes Tous Charlie,http://www.balloon-juice.com/2015/01/07/nous-sommes-tous-charlie/,balloon-juice.com
2015-01-07,Salman Rushdie Issues Statement Against Terrorist Attack In Paris,http://www.buzzfeed.com/isaacfitzgerald/vive-charlie-hebdo?utm_term=4ldqpia,buzzfeed.com
2015-01-07,When terror struck the media,http://www.rediff.com/news/report/when-terror-struck-the-media/20150107.htm,rediff.com
2015-01-07,Året börjar på det mest fruktansvärda sätt,http://www.sydsvenskan.se/ingen-sektion/aret-borjar-pa-det-mest-fruktansvarda-satt/,sydsvenskan.se
2015-01-07,"Profile in cowardice: UK Telegraph blurs, crops out Muhammad cartoon while reporting on Paris shooting",http://twitchy.com/2015/01/07/profile-in-cowardice-uk-telegraph-blurs-crops-out-muhammad-cartoon-while-reporting-on-paris-shooting/,twitchy.com
2015-01-07,Paris police hunt magazine massacre gunmen,http://feeds.breakingnews.ie/~r/bntopstories/~3/E7OrZCPHjPQ/paris-police-hunt-magazine-massacre-gunmen-657133.html,breakingnews.ie
2015-01-07,Obama vows to help France after 'horrific shooting',http://feeds.breakingnews.ie/~r/bntopstories/~3/5NLKQQE1CsU/obama-vows-to-help-france-after-horrific-shooting-657127.html,breakingnews.ie
2015-01-07,Here Are 5 Victims Of The Merciless Massacre In Paris And Images That May Have Provoked Their Killers,http://www.westernjournalism.com/5-victims-merciless-massacre-paris-images-may-provoked-killers/?utm_source=rss&utm_medium=rss&utm_campaign=5-victims-merciless-massacre-paris-images-may-provoked-killers,westernjournalism.com
2015-01-07,Obama ofrece ayuda a Francia para capturar a terroristas,http://voces.huffingtonpost.com/2015/01/07/obama-ofrece-ayuda-francia_n_6429436.html?utm_hp_ref=voces&ir=Voces,huffingtonpost.com
2015-01-07,Bilder från polisjakten på Paris gator,http://www.tv4.se/nyheterna/klipp/3040251,tv4.se
2015-01-07,"Wallström: ""En attack på det fria ordet""",http://www.tv4.se/nyheterna/klipp/3040254,tv4.se
2015-01-07,"John Kerry: ""Varje amerikan står med er i dag""",http://www.tv4.se/nyheterna/klipp/3040253,tv4.se
2015-01-07,Viñeta especial de Forges tras el atentado contra 'Charlie Hebdo',http://elpais.com/elpais/2015/01/07/vinetas/1420648466_883696.html,elpais.com
2015-01-07,John Kerry: Charlie Hebdo Attackers ‘Opposed to a Civilized World’,http://www.usnews.com/news/articles/2015/01/07/john-kerry-charlie-hebdo-attackers-opposed-to-a-civilized-world,usnews.com
2015-01-07,Skypo: Attacker mot tidningar osannolika i Finland,http://hbl.fi/nyheter/2015-01-07/703476/skypo-attacker-mot-tidningar-osannolika-i-finland,hbl.fi
2015-01-07,The Slain Editor Of Charlie Hebdo's Last Cartoon Is Tragically Prescient,http://feedproxy.google.com/~r/businessinsider/~3/SQyUDLLsCv4/the-editor-of-charlie-hebdos-last-cartoon-is-tragically-prescient-2015-1,google.com
2015-01-07,"Ruthless"" attack on Charlie Hebdo media workers condemned",http://www.unmultimedia.org/radio/english/2015/01/ruthless-attack-on-charlie-hebdo-media-workers-condemned/,unmultimedia.org
2015-01-07,"Attack on French paper ""direct assault"" on democracy",http://www.unmultimedia.org/radio/english/2015/01/attack-on-french-paper-direct-assault-on-democracy/,unmultimedia.org
2015-01-07,12 Killed & Seven Critically Injured After Gunmen Attack Paris Office Of French Satirical Magazine Charlie Hebdo,http://newswirengr.com/2015/01/07/12-killed-seven-critically-injured-after-gunmen-attack-paris-office-of-french-satirical-magazine-charlie-hebdo/,newswirengr.com
2015-01-07,"Bratton beefs up security around NYC following Paris terrorist attack, report says",http://www.silive.com/news/index.ssf/2015/01/bratton_beefs_up_security_arou.html,silive.com
2015-01-07,"Charlie Hebdo: witness, they said ""we are Al Qaida Yemen""",http://www.ansa.it/ansamed/en/news/sections/generalnews/2015/01/07/charlie-hebdo-witness-they-said-we-are-al-qaida-yemen_9690aca1-4c42-4f70-926f-519bd414a47c.html,ansa.it
2015-01-07,#JeSuisCharlie: Charlie Hebdo Attack Sparks Online Solidarity,http://www.rferl.org/content/jesuischarlie-charlie-/26781632.html,rferl.org
2015-01-07,NYPD Deploying Counterterrorism Patrols at Landmarks After Paris Massacre,http://jpupdates.com/2015/01/07/nypd-deploying-counterterrorism-patrols-landmarks-paris-massacre/,jpupdates.com
2015-01-07,Egypt condemns killings in France,http://www.dailynewsegypt.com/2015/01/07/egypt-condemns-killings-france/,dailynewsegypt.com
2015-01-07,Salman Rushdie Says 'I Stand With Charlie Hebdo' After Paris Attack,http://feedproxy.google.com/~r/time/topstories/~3/AskRD0Z89P4/,google.com
2015-01-07,"Flashback Video: Obama Tells U.N., “The Future does Not Belong to those who Slander the Prophet of Islam” – Video 9/25/2012",http://freedomslighthouse.net/2015/01/07/flashback-video-obama-tells-u-n-the-future-does-not-belong-to-those-who-slander-the-prophet-of-islam-video-9252012/,freedomslighthouse.net
2015-01-07,France's Muslim leaders denounce 'barbaric' attack,http://www.dnaindia.com/world/report-france-s-muslim-leaders-denounce-barbaric-attack-2050630,dnaindia.com
2015-01-07,French newspaper has history of angering Muslims,http://nypost.com/2015/01/07/french-newspaper-has-history-of-angering-muslims/,nypost.com
2015-01-07,Satirical French Newspaper Faces Deadly Attack,http://feedproxy.google.com/~r/firedoglake/fdl/~3/9u849c1juaI/,google.com
2015-01-07,Paris Attack France's Deadliest in Four Decades,http://www.naharnet.com/stories/en/162026-paris-attack-france-s-deadliest-in-four-decades,naharnet.com
2015-01-07,Paris Massacre Weekly Charlie Hebdo Often Mocked Islam,http://www.naharnet.com/stories/en/162034-paris-massacre-weekly-charlie-hebdo-often-mocked-islam,naharnet.com
2015-01-07,White House Questioned French Magazine’s Judgement in 2012,http://blogs.wsj.com/washwire/2015/01/07/white-house-questioned-french-magazines-judgement-in-2012/?mod=WSJBlog,wsj.com
2015-01-07,Paris terror attack: Journalism is under fire,http://www.foxnews.com/opinion/2015/01/07/paris-terror-attack-journalism-is-under-fire/,foxnews.com
2015-01-07,Gunmen escape after killing 12 in attack on satirical newspaper,http://www.abc.net.au/news/2015-01-07/charlie-hebdo-satirical-newspaper-shooting-paris-12-killed/6005524,abc.net.au
2015-01-08,Charlie Hebdo: A history of controversy,http://www.abc.net.au/news/2015-01-08/charlie-hebdo-profile/6005610,abc.net.au
2015-01-07,Islamist Terror Attack in Paris France … 12 Killed at French Satirical Magazine Charlie Hebdo (VIDEO of Attack)(Update: Shouted “Allahu Akbar!”),http://scaredmonkeys.com/2015/01/07/terror-attack-in-paris-france-12-killed-at-french-satirical-magazine-charlie-hebdo/,scaredmonkeys.com
2015-01-07,Cartoonisten uiten woede over aanslag via tekeningen,http://www.gelderlander.nl/algemeen/buitenland/cartoonisten-uiten-woede-over-aanslag-via-tekeningen-1.4703680,gelderlander.nl
2015-01-07,Blutiger Anschlag in Paris,http://www.direktbroker.de/news/blutiger-anschlag-in-paris-die-taeter-riefen-allahu-akbar-41144893,direktbroker.de
2015-01-07,Angriff auf Charlie Hebdo,http://www.direktbroker.de/news/angriff-auf-charlie-hebdo-fluchtvideo-zeigt-schiessende-taeter-41144894,direktbroker.de
2015-01-07,'Je suis Charlie' ('I am Charlie') trends post terror attack,http://www.nydailynews.com/news/world/je-suis-charlie-charlie-trends-post-terror-attack-article-1.2068780,nydailynews.com
2015-01-07,The Reference Frame: Charlie Hebdo: France mustn't allow to be changed by murders,http://feedproxy.google.com/~r/LuboMotlsReferenceFrame/~3/PAM24Lu8K0o/charlie-hebdo-france-mustnt-allow-to-be.html,google.com
2015-01-07,Danish Paper That Published 12 Muhammad Cartoons Boosts Security,http://feeds.nbcnews.com/c/35002/f/663303/s/4216e227/sc/11/l/0L0Snbcnews0N0Cstoryline0Cparis0Emagazine0Eattack0Cdanish0Epaper0Epublished0E120Emuhammad0Ecartoons0Eboosts0Esecurity0En281396/story01.htm,nbcnews.com
2015-01-07,"Charlie Hebdo, solidarietà su Twitter e Facebook. Piazze d'Europa mobilitate",http://www.ilfattoquotidiano.it/2015/01/07/charlie-hebdo-solidarieta-twitter-facebook-piazze-deuropa-si-mobilitano/1320936/,ilfattoquotidiano.it
2015-01-07,The 'Charlie Hebdo' Attackers Were Attacking You Too,http://feedproxy.google.com/~r/timeblogs/real_clear_politics/~3/NlRzofk9dRM/,google.com
2015-01-07,Arab world reacts to Charlie Hebdo magazine attack,http://feedproxy.google.com/~r/bostonherald/~3/CCnhxLiT1hQ/arab_world_reacts_to_charlie_hebdo_magazine_attack,google.com
2015-01-07,"PMQs Verdict: Miliband slams ""political football"" into Cameron's net",http://feedproxy.google.com/~r/LabourListLatestPosts/~3/qaB94kGToO0/,google.com
2015-01-07,Charlie Hebdo attack roils an already on-edge France,http://www.csmonitor.com/World/Europe/2015/0107/Charlie-Hebdo-attack-roils-an-already-on-edge-France,csmonitor.com
2015-01-07,12 dead in terrorist attack on Paris weekly; gunmen escape,http://mynorthwest.com/17/2683897/12-dead-in-terrorist-attack-on-Paris-weekly-gunmen-escape,mynorthwest.com
2015-01-07,Have an order of eggs and home fries while you check out the best diners in every state. Bonus: Kentucky's is Drew's Saturday morning hangout,http://www.fark.com/comments/8550064?utm_source=feed&utm_medium=comments&utm_campaign=fark,fark.com
2015-01-07,The 'Charlie Hebdo' Attackers Were Attacking You Too,http://feedproxy.google.com/~r/time/mostemailed/~3/NlRzofk9dRM/,google.com
2015-01-07,Either this is the luckiest woman alive or Final Destination 7 has begun shooting in Brazil,http://www.fark.com/comments/8549918?utm_source=feed&utm_medium=comments&utm_campaign=fark,fark.com
2015-01-07,"Man says a gang told him to bring a gun and drugs to a police station to test police security, and the results weren't as bad as you might expect. Nice mugshot included in the article as well",http://www.fark.com/comments/8550028?utm_source=feed&utm_medium=comments&utm_campaign=fark,fark.com
2015-01-07,What is Charlie Hebdo? Behind the covers of the French satirical magazine targeted in deadly attack,http://feedproxy.google.com/~r/Mashable/~3/g-k4jbnf2_E/,google.com
2015-01-07,Paris shooting latest in Europe's deadly terror attacks: Timeline,http://feedproxy.google.com/~r/Mashable/~3/OfMj2mRRrO0/,google.com
2015-01-07,Nach Anschlag auf Charlie Hebdo: Trauer und Bestürzung im Netz,http://www.stuttgarter-zeitung.de/inhalt.nach-anschlag-auf-charlie-hebdo-trauer-und-bestuerzung-im-netz.2ac2e3d0-f777-4199-a608-95ccd55de978.html,stuttgarter-zeitung.de
2015-01-07,#CharlieHebdo Massacre… Protests against Pegida was growing louder but… Eurosphere agenda…,http://erkansaka.net/charliehebdo-massacre-protests-against-pegida-was-growing-louder-but-eurosphere-agenda/,erkansaka.net
2015-01-07,"Armed gunmen attack French weekly, 12 killed | The Economic Times Video",http://economictimes.indiatimes.com/et-now/daily/armed-gunmen-attack-french-weekly-12-killed/videoshow/45795593.cms,indiatimes.com
2015-01-07,Obama condemns French newspaper terror attack that left 12 dead,http://www.the-star.co.ke/news/obama-condemns-french-newspaper-terror-attack-left-12-dead,the-star.co.ke
2015-01-07,"Paris shooting: Prefer to die standing than live on knees, believed slain editor of Charlie Hebdo",http://www.dnaindia.com/world/report-paris-shooting-prefer-to-die-standing-than-live-on-knees-believed-slain-editor-of-charlie-hebdo-2050625,dnaindia.com
2015-01-07,Religion Clause: Terrorists Attack French Satirical Magazine,http://religionclause.blogspot.com/2015/01/terrorists-attack-french-satirical.html,religionclause.blogspot.com
2015-01-07,Charlie Hebdo: Islamists tap into the West’s war on free speech,http://www.anorak.co.uk/412914/news/charlie-hebdo-islamists-tap-into-the-wests-war-on-free-speech.html/,anorak.co.uk
2015-01-07,Radical Islam declares war on taking the piss and everything we should value,http://www.anorak.co.uk/412901/news/radical-islam-declares-war-on-taking-the-piss-and-everything-we-should-value.html/,anorak.co.uk
2015-01-07,The 'Charlie Hebdo' Attackers Were Attacking You Too,http://feedproxy.google.com/~r/time/topstories/~3/NlRzofk9dRM/,google.com
2015-01-07,"Everything to Know About “Charlie Hebdo,” the Magazine Attacked by Terrorists in Paris",http://www.complex.com/pop-culture/2015/01/everything-to-know-about-charlie-hebdo-the-magazine-attacked-by-terrorists-in-paris,complex.com
2015-01-07,Obama offers US help to pursue terrorists in French attack,http://www.newson6.com/story/27780502/obama-offers-us-help-to-pursue-terrorists-in-french-attack,newson6.com
2015-01-07,12 dead in terrorist attack on Paris weekly; gunmen escape,http://www.newson6.com/story/27779829/12-dead-in-terrorist-attack-on-paris-weekly-gunmen-escape,newson6.com
2015-01-07,"Romanian officials condemn the terrorist attack on the offices of Charlie Hebdo magazine, voice compassion and solidarity with the French nation",http://www.nineoclock.ro/romanian-officials-condemn-the-terrorist-attack-on-the-offices-charlie-hebdo-magazine-voice-compassion-and-solidarity-with-the-french-nation/,nineoclock.ro
2015-01-07,"12 Dead in ""Terroristic Attack"" at French Newspaper",http://www.wboc.com/story/27781289/12-dead-in-terroristic-attack-at-french-newspaper,wboc.com
2015-01-07,"Gunmen storm Paris satirical newspaper, killing at least 12",http://www.memeorandum.com/150107/p35#a150107p35,memeorandum.com
2015-01-07,"No Justice, No Police — Mayor Bill de Blasio has been in …",http://www.memeorandum.com/150107/p34#a150107p34,memeorandum.com
2015-01-07,Charlie Hebdo Editor Killed In Terrorist Attack Was Known For Challenging Extremists,http://feedproxy.google.com/~r/businessinsider/~3/O5YqK36RGhk/charlie-hebdos-editor-charb-killed-in-paris-terrorist-attack-2015-1,google.com
2015-01-07,JOHN KERRY: 'Today's Murders Are Part Of A Larger Confrontation',http://feedproxy.google.com/~r/businessinsider/~3/3cVuYdCH0bA/john-kerry-todays-murders-are-part-of-a-larger-confrontation-2015-1,google.com
2015-01-07,Swiss condemn massacre of Charlie Hebdo journalists,http://www.swissinfo.ch/eng/swiss-condemn-massacre-of-charlie-hebdo-journalists/41203868?rss=true,swissinfo.ch
2015-01-07,Obama offers US help to pursue terrorists in French attack,http://www.denverpost.com/nationworld/ci_27273223/obama-spokesman-us-stands-french-time-suffering?source=rss,denverpost.com
2015-01-07,12 dead in terrorist attack on Paris weekly; gunmen escape,http://www.denverpost.com/nationworld/ci_27272991/shots-fired-at-french-satirical-paper-say-police?source=rss,denverpost.com
2015-01-07,"Profile in cowardice: UK Telegraph blurs, crops out Muhammad cartoon while reporting on Paris",http://www.freerepublic.com/focus/f-news/3244373/posts,freerepublic.com
2015-01-07,Drieduizend agenten jagen op schutters Parijs,http://s.ad.nl/3824895,ad.nl
2015-01-07,Cartoonisten uiten woede over aanslag via tekeningen,http://www.pzc.nl/algemeen/buitenland/cartoonisten-uiten-woede-over-aanslag-via-tekeningen-1.4703680,pzc.nl
2015-01-07,Headlines at 7:30: Bill Cosby's TV wife Phylicia Rashad defends comedian,http://feeds.cbsnews.com/~r/CBSNewsEarlyShow/~3/O0nejVqu4cI/,cbsnews.com
2015-01-07,Headlines at 8:30: 2015 will be one second longer,http://feeds.cbsnews.com/~r/CBSNewsEarlyShow/~3/RnCF05VNqqE/,cbsnews.com
2015-01-07,3 gunmen sought in deadly attack on Paris newspaper,http://feeds.baltimoresun.com/~r/baltimoresun/sports/tennis/rss2/~3/-H_B6eMRcX8/chi-paris-newspaper-shooting-20150107-story.html,baltimoresun.com
2015-01-07,Målet i Paris och Köpenhamn: Döda för att tysta,http://www.sydsvenskan.se/varlden/malet-i-paris-och-kopenhamn-doda-for-att-tysta/,sydsvenskan.se
2015-01-07,Welcome to Linda Ikeji's Blog,http://feedproxy.google.com/~r/blogspot/OqshX/~3/Q0hZZJLK7js/see-last-tweet-from-charlie-hebdo.html,google.com
2015-01-07,French President Says Attack on Newspaper Office “Definitely” a Terrorist Attack; Vows to Hunt down Perpetrators – Video 1/7/15,http://freedomslighthouse.net/2015/01/07/french-president-says-attack-on-newspaper-office-definitely-a-terrorist-attack-vows-to-hunt-down-perpetrators-video-1715/,freedomslighthouse.net
2015-01-07,Attack mot friheten - Start,http://www.unt.se/start/attack-mot-friheten-3543207.aspx,unt.se
2015-01-07,12 killed in shooting at office of French satirical magazine Charlie Hebdo,http://rss.feedsportal.com/c/32545/f/492401/p/1/s/4f2a5253/l/0L0Sdigitalspy0O0Cmedia0Cnews0Ca6198580C120Ekilled0Ein0Eshooting0Eat0Eoffice0Eof0Efrench0Esatirical0Emagazine0Echarlie0Ehebdo0Bhtml0Drss/story01.htm,feedsportal.com
2015-01-07,Charlie Hebdo attack – in pictures,http://www.theguardian.com/world/gallery/2015/jan/07/charlie-hebdo-attack-in-pictures,theguardian.com
2015-01-07,Obama offers US help to pursue terrorists in French attack,http://news.yahoo.com/obama-offers-us-help-pursue-terrorists-french-attack-162619450--politics.html,yahoo.com
2015-01-07,Obama Condemns Terror Attack on Paris Paper; 12 Dead (Video),http://www.eurweb.com/2015/01/obama-condemns-terror-attack-on-paris-paper-12-dead-video/,eurweb.com
2015-01-07,Charlie Hebdo website back online after terror attack,http://www.itv.com/news/update/2015-01-07/charlie-hebdo-website-back-online-after-terror-attack/,itv.com
2015-01-07,US 'stands in solidarity with France',http://www.itv.com/news/update/2015-01-07/us-stands-in-solidarity-with-france/,itv.com
2015-01-07,Cameron and Merkel 'united in condemnation' of Paris murders,http://www.itv.com/news/update/2015-01-07/cameron-and-merkel-united-in-condemnation-of-paris-murders/,itv.com
2015-01-07,PM to receive 'full intelligence briefing' on Paris attack,http://www.itv.com/news/update/2015-01-07/pm-to-receive-full-intelligence-briefing-on-paris-attack/,itv.com
2015-01-07,Private Eye editor: 'Very little seems funny today',http://www.itv.com/news/update/2015-01-07/private-eye-editor-very-little-seems-funny-today/,itv.com
2015-01-07,UN chief: Attack was 'horrendous and cold-blooded crime',http://www.itv.com/news/update/2015-01-07/un-chief-attack-was-horrendous-and-cold-blooded-crime/,itv.com
2015-01-07,"Soldiers on the streets: Military is brought in to protect Eiffel Tower, media offices, places of worship and public transport links as France responds to terror attack",http://www.dailymail.co.uk/news/article-2900755/Soldiers-streets-Military-brought-protect-Eiffel-Tower-media-offices-places-worship-public-transport-links-France-responds-terror-attack.html?ITO=1490&ns_mchannel=rss&ns_campaign=1490,dailymail.co.uk
2015-01-07,Charlie Hebdo cartoonist reveals how she survived attack,http://www.dailymail.co.uk/news/article-2900750/I-let-terrorists-Charlie-Hebdo-offices-cowered-desk-daughter-watched-execute-cartoonists-Cartoonist-reveals-survived-attack.html?ITO=1490&ns_mchannel=rss&ns_campaign=1490,dailymail.co.uk
2015-01-07,#JeSuisCharlie sweeps Twitter in solidarity with Charlie Hebdo,http://www.dailymail.co.uk/news/article-2900720/JeSuisCharlie-sweeps-Twitter-Internet-users-rush-solidarity-French-satirical-news-magazine-massacre.html?ITO=1490&ns_mchannel=rss&ns_campaign=1490,dailymail.co.uk
2015-01-07,#JeSuisCharlie trendar över världen,http://www.svt.se/nyheter/varlden/jesuischarlie-trendar-over-varlden,svt.se
2015-01-07,Arab League and Top Muslim Body Condemn Paris Attack,http://www.naharnet.com/stories/en/162025-arab-league-and-top-muslim-body-condemn-paris-attack,naharnet.com
2015-01-07,Russia Outraged by Terrorist Attack on Charlie Hebdo Office in Paris,http://sputniknews.com/europe/20150107/1016620802.html,sputniknews.com
2015-01-07,Attack on Charlie Hebdo Attempts to Inhibit Free Speech: Newspaper Guild,http://sputniknews.com/europe/20150107/1016620917.html,sputniknews.com
