publish_date,title,url,media_name
2015-01-07,"Charlie Hebdo, solidarietà in Europa: in migliaia in piazza da Parigi a Londra",http://www.ilfattoquotidiano.it/2015/01/07/charlie-hebdo-solidarieta-in-tutta-europa-in-migliaia-in-piazza-parigi-londra/1321833/,ilfattoquotidiano.it
2015-01-07,"Cartoonists, police among terror attack dead",http://rssfeeds.usatoday.com/~/82728239/0/usatodaycomworld-topstories~Cartoonists-police-among-terror-attack-dead/,usatoday.com
2015-01-07,Flera publicerar Charlie-bilder,http://www.svd.se/nyheter/utrikes/flera-publicerar-charlie-bilder_4235197.svd,svd.se
2015-01-07,"Islamo-Nazis In Paris Slaughter 12, Wound 10 More Over Cartoons (Pictures/Video)",http://thedaleygator.wordpress.com/2015/01/07/islamo-nazis-in-paris-slaughter-12-wound-10-more-over-cartoons-picturesvideo/,thedaleygator.wordpress.com
2015-01-07,Charlie Hebdo's Slain Editor Charb Long Defended Offensive Material,http://feeds.nbcnews.com/c/35002/f/663303/s/42185794/sc/11/l/0L0Snbcnews0N0Cstoryline0Cparis0Emagazine0Eattack0Ccharlie0Ehebdos0Eslain0Eeditor0Echarb0Elong0Edefended0Eoffensive0Ematerial0En281371/story01.htm,nbcnews.com
2015-01-08,Attackers at French newspaper Charlie Hebdo seen as trained Islamist fighters,http://www.dnaindia.com/world/report-attackers-at-french-newspaper-charlie-hebdo-seen-as-trained-islamist-fighters-2050689,dnaindia.com
2015-01-07,French president urges nation to stay united after attack,http://mynorthwest.com/17/2684087/French-president-urges-nation-to-stay-united-after-attack,mynorthwest.com
2015-01-07,"Planned, cold-blooded killings mark French newspaper attack",http://mynorthwest.com/17/2684095/Planned-coldblooded-killings-mark-French-newspaper-attack,mynorthwest.com
2015-01-07,<!-- document.write(partnertitle); // -->,http://hosted.ap.org/dynamic/stories/E/EU_FRANCE_CHARLIE_HEBDO_PROFILES?SITE=RIPRJ&SECTION=HOME&TEMPLATE=DEFAULT,ap.org
2015-01-07,<!-- document.write(partnertitle); // -->,http://hosted.ap.org/dynamic/stories/E/EU_FRANCE_NEWSPAPER_ATTACK_THE_SCENE?SITE=RIPRJ&SECTION=HOME&TEMPLATE=DEFAULT,ap.org
2015-01-07,What Muslims Really Believe About Cartoons Of Muhammad,http://thinkprogress.org/world/2015/01/07/3609072/what-muslims-really-believe-about-cartoons-of-muhammad/,thinkprogress.org
2015-01-07,French president urges nation to stay united after attack,http://www.seattlepi.com/news/world/article/French-president-urges-nation-to-stay-united-5999755.php,seattlepi.com
2015-01-07,"Cartoonists, economist among the dead in Paris terror attack",http://www.seattlepi.com/news/world/article/Cartoonists-economist-among-the-dead-in-Paris-5999681.php,seattlepi.com
2015-01-07,Flera publicerar Charlie-bilder,http://ekuriren.se/nyheter/varlden/1.2888681-flera-publicerar-charlie-bilder,ekuriren.se
2015-01-07,Murdered editor said he'd 'prefer to die than live like a rat',http://www.mirror.co.uk/news/world-news/charlie-hebdo-paris-shooting-murdered-4937542,mirror.co.uk
2015-01-07,Photos: Thousands in Europe hold up pens in solidarity after terrorist attack,http://www.vox.com/2015/1/7/7509015/charlie-hebdo-photos,vox.com
2015-01-07,Watch Live: Parisians Gather for a Vigil After <i>Charlie Hebdo</i> Attack,http://feedproxy.google.com/~r/time/topstories/~3/BgrSH-tQAGk/,google.com
2015-01-07,Candlelit vigil for Paris victims,http://www.bbc.co.uk/news/world-europe-30719690#sa-ns_mchannel=rss&ns_source=PublicRSS20-sa,bbc.co.uk
2015-01-07,French President Announces Day of Mourning After Attack on Charlie Hebdo,http://sputniknews.com/europe/20150107/1016630220.html,sputniknews.com
2015-01-07,French Muslim Leaders Condemn Charlie Hebdo Terrorist Attack: Reports,http://sputniknews.com/europe/20150107/1016630651.html,sputniknews.com
2015-01-07,Photos From Paris Following the Attack on Charlie Hebdo,http://www.slate.com/articles/news_and_politics/photography/2015/01/charlie_hebdo_heightened_security_and_parisians_gather_in_solidarity_for.html,slate.com
2015-01-07,#JeSuisCharlie: What does Twitter activism accomplish?,http://www.csmonitor.com/World/Europe/2015/0107/JeSuisCharlie-What-does-Twitter-activism-accomplish,csmonitor.com
2015-01-07,Avskyvärd attack mot Charlie Hebdo,http://www.journalisten.se/ledare/avskyvard-attack-mot-charlie-hebdo,journalisten.se
2015-01-07,”Att bli extra rädd vore den farligaste utvecklingen av alla”,http://www.journalisten.se/nyheter/att-bli-extra-radd-vore-den-farligaste-utvecklingen-av-alla,journalisten.se
2015-01-07,#JeSuisCharlie: World stands with Charlie Hebdo victims,http://rt-tv.f29hgb.ru/news/220659-support-charlie-hedbo-world/,f29hgb.ru
2015-01-07,"12 dead in shooting at French satirical weekly Charlie Hebdo in Paris (PHOTOS, VIDEOS)",http://rt-tv.f29hgb.ru/news/220519-shooting-france-police-paris/,f29hgb.ru
2015-01-07,The Guardian view on the crisis in A : only part of the story,http://www.theguardian.com/commentisfree/2015/jan/07/guardian-view-crisis-accident-emergency-part-story,theguardian.com
2015-01-07,Nous Sommes Tous Charlie Hebdo,http://feeds.voiceofsandiego.org/~r/voice-of-san-diego-all-articles/~3/90adAY5-fEI/,voiceofsandiego.org
2015-01-07,"ISIS fighter praises Charlie Hebdo attack, promises terror",http://www.nydailynews.com/news/world/isis-fighter-praises-charlie-hebdo-attack-promises-terror-article-1.2069127,nydailynews.com
2015-01-07,Nach dem Terroranschlag auf die islamkritische Satirezeitschrift Charlie Hebdo mit mindestens zwölf Todesopfern ist Frankreich im Ausnahmezustand :: AD HOC NEWS,http://www.ad-hoc-news.de/frankreich-nach-terroranschlag-unter-schock--/de/News/41148518,ad-hoc-news.de
2015-01-07,Flera publicerar Charlie-bilder,http://kkuriren.se/nyheter/varlden/1.2888684,kkuriren.se
2015-01-07,Massacre at French magazine office,http://nehandaradio.com/2015/01/07/massacre-french-magazine-office/,nehandaradio.com
2015-01-07,The Charlie Hebdo killings are the deadliest attack on Western journalists in decades,http://feeds.washingtonpost.com/c/34656/f/669525/s/42189523/sc/11/l/0L0Swashingtonpost0N0Cblogs0Cwonkblog0Cwp0C20A150C0A10C0A70Cthe0Echarlie0Ehebdo0Ekillings0Eare0Ethe0Edeadliest0Eattack0Eon0Ewestern0Ejournalists0Ein0Edecades0C/story01.htm,washingtonpost.com
2015-01-07,Watch Live: Parisians Gather for a Vigil After <i>Charlie Hebdo</i> Attack,http://feedproxy.google.com/~r/timeblogs/real_clear_politics/~3/BgrSH-tQAGk/,google.com
2015-01-07,Frankreich nach Terroranschlag unter Schock,http://www.finanznachrichten.de/nachrichten-2015-01/32461259-frankreich-nach-terroranschlag-unter-schock-003.htm,finanznachrichten.de
2015-01-07,Peter King: Surveillance of Muslim community vital for national security,http://www.washingtonexaminer.com/peter-king-surveillance-of-muslim-community-vital-for-national-security/article/2558311?custom_click=rss,washingtonexaminer.com
2015-01-07,Hollande: Tomorrow will be national day of mourning,http://www.itv.com/news/update/2015-01-07/hollande-tomorrow-will-be-national-day-of-mourning/,itv.com
2015-01-07,Karikaturisti u čast ubijenih kolega,http://www.e-novine.com/svet/svet-vesti/114807-Karikaturisti-ast-ubijenih-kolega.html,e-novine.com
2015-01-08,Twelve killed in attack on Paris newspaper offices,http://thehimalayantimes.com/rssReference.php?id=NDQwMDk3,thehimalayantimes.com
2015-01-08,Paris terrorist attack: Charlie Hebdo editor Stephane Charbonnier's mission was to mock religious extremists,http://www.brisbanetimes.com.au/world/paris-terrorist-attack-charlie-hebdo-editor-stephane-charbonniers-mission-was-to-mock-religious-extremists-20150108-12ju5v.html,brisbanetimes.com.au
2015-01-07,Will terrorist attack on French press raise calls for more gun control?,http://www.examiner.com/article/will-terrorist-attack-on-french-press-raise-calls-for-more-gun-control,examiner.com
2015-01-07,Muslim Cowards Attack French Magazine,http://www.examiner.com/article/muslim-cowards-attack-french-magazine?cid=rss,examiner.com
2015-01-07,"Religion must be subject to satire, Rushdie says",http://news.yahoo.com/religion-must-subject-satire-rushdie-says-191155289.html,yahoo.com
2015-01-07,Attackers at French newspaper seen as trained Islamist fighters,http://news.yahoo.com/attackers-french-newspaper-seen-trained-islamist-fighters-191132911.html,yahoo.com
2015-01-07,Spain raises security level after French newspaper attack,http://news.yahoo.com/spain-raises-security-level-french-newspaper-attack-191041310--finance.html,yahoo.com
2015-01-07,Las reacciones de los artistas gráficos por el ataque a Charlie Hebdo,http://www.cooperativa.cl/noticias/entretencion/comic/las-reacciones-de-los-artistas-graficos-por-el-ataque-a-charlie-hebdo/2015-01-07/162520.html,cooperativa.cl
2015-01-07,Why would terrorists kill cartoonists?,http://feeds.washingtonpost.com/c/34656/f/636708/s/4217bc57/sc/11/l/0L0Swashingtonpost0N0Cwhy0Ewould0Eterrorists0Ekill0Ecartoonists0C20A150C0A10C0A70C5620A82b60Eb6620E47510E8a0Ad0E4c473552316f0Istory0Bhtml0Dwprss0Frss0Iworld/story01.htm,washingtonpost.com
2015-01-08,Spain raises security level after French newspaper attack,http://www.thestar.com.my/News/World/2015/01/08/Spain-raises-security-level-after-French-newspaper-attack,thestar.com.my
2015-01-08,Attackers at French newspaper seen as trained Islamist fighters,http://www.thestar.com.my/News/World/2015/01/08/Attackers-at-French-newspaper-seen-as-trained-Islamist-fighters,thestar.com.my
2015-01-07,UPDATE 1-Spanish newspapers call in police over suspect packages,http://feeds.reuters.com/~r/reuters/USmediaDiversifiedNews/~3/vG7PJ8iZju0/france-shooting-spain-idUSL6N0UM2WS20150107,reuters.com
2015-01-07,David Cameron: Appalling terrorist outrage in Paris,http://www.nbcnews.com/watch/cnbc/david-cameron-appalling-terrorist-outrage-in-paris-381203011670,nbcnews.com
2015-01-12,12 Dead After Attack on Offices of Satirical Newspaper in Paris |News,http://www.towleroad.com/2015/01/12-dead-after-attack-on-offices-of-satirical-newspaper-in-paris.html,towleroad.com
2015-01-07,Paris massacre: What we know,http://www.nbcnews.com/watch/cnbc/paris-massacre-what-we-know-381162051714,nbcnews.com
2015-01-07,Flera publicerar Charlie-bilder,http://hd.se/utrikes/2015/01/07/medier-oeniga-om-bildpublicering/?from=rss,hd.se
2015-01-07,'Je Suis Charlie': Huge crowds gather across Europe after Paris attack,http://feedproxy.google.com/~r/Mashable/~3/EdElWxfIxoI/,google.com
2015-01-07,Charlie Hebdo killings condemned by Arab states – but hailed online by extremists,http://feeds.theguardian.com/c/34708/f/663879/s/42182ff8/sc/11/l/0L0Stheguardian0N0Cworld0C20A150Cjan0C0A70Ccharlie0Ehebdo0Ekillings0Earab0Estates0Ejihadi0Eextremist0Esympathisers0Eisis/story01.htm,theguardian.com
2015-01-07,Representatives of French Muslim community horrified by Charlie Hebdo attack,http://feeds.theguardian.com/c/34708/f/663879/s/42184f12/sc/11/l/0L0Stheguardian0N0Cworld0Cvideo0C20A150Cjan0C0A70Crepresentatives0Efrench0Emuslim0Ecommunity0Ehorrified0Echarlie0Ehebdo0Eattack0Evideo/story01.htm,theguardian.com
2015-01-07,Obama Calls French Shooting 'Cowardly Evil Attacks',http://feeds.bet.com/~r/AllBetcom/~3/feQ2oBYdsxQ/obama-calls-french-shooting-cowardly-evil-attacks.html,bet.com
2015-01-07,Witness: Methodical Paris gunmen knew 'exactly where to shoot',http://feeds.chicagotribune.com/~r/chicagotribune/career/~3/si6NFSguO-I/story01.htm,chicagotribune.com
2015-01-07,"Paris attack: 12 dead in terror attack on newspaper, including editor and cartoonist",http://www.dailydemocrat.com/ci_27271227/paris-attack-12-dead-attack-newspaper-france-goes?source=rss_viewed,dailydemocrat.com
2015-01-07,Police Arrived on Bikes at Charlie Hebdo – Had to Leave Because The Terrorists Were Armed,http://www.thegatewaypundit.com/2015/01/police-arrived-on-bikes-at-charlie-hebdo-had-to-leave-because-the-terrorists-were-armed/,thegatewaypundit.com
2015-01-07,SICK! Twisted Lefty & CNN Contributor Tweets Conservatives Worse Than Jihadists After Paris Attack,http://www.thegatewaypundit.com/2015/01/sick-twisted-lefty-sally-kohn-tweets-conservatives-worse-than-jihadists-after-paris-attack/,thegatewaypundit.com
2015-01-07,"PATHETIC: Obama White House Calls France Attack “Act of Violence,” Uses “If” Before Terror Attack",http://www.thegatewaypundit.com/2015/01/pathetic-obama-white-house-calls-france-attack-act-of-violence-uses-if-before-terror-attack/,thegatewaypundit.com
2015-01-07,Flashback: OBAMA WHITE HOUSE Condemned Charlie Hebdo Anti-Islamic Cartoons,http://www.thegatewaypundit.com/2015/01/flashback-obama-white-house-condemned-charlie-hebdo-anti-islamic-cartoons/,thegatewaypundit.com
2015-01-07,ALLAHU AKBAR! WORKPLACE VIOLENCE IN FRANCE!,http://angrywhitedude.com/2015/01/allahu-akbar-workplace-violence-france/,angrywhitedude.com
2015-01-07,Conservative Columnist Predictably Uses French Terror Attack To Criti…,http://www.politicususa.com/2015/01/07/conservative-columnist-predictably-french-terror-attack-criticize-president-obama.html,politicususa.com
2015-01-07,Medier oeniga om bildpublicering,http://www.dagbladet.se/allmant/utrikes/medier-oeniga-om-bildpublicering,dagbladet.se
2015-01-07,"Obama Condemns the Attack on Paris Magazine, Vows Assistance to Bring…",http://www.politicususa.com/2015/01/07/obama-condemns-attack-paris-magazine-directs-assistance-bring-terrorist-justice.html,politicususa.com
2015-01-07,Deadly Shooting at French Satirical Newspaper Office,http://www.newsplex.com/home/headlines/Deadly-Shooting-at-French-Satirical-Newspaper-Office-287790821.html,newsplex.com
2015-01-07,RSF deeply shocked by attack on Charlie Hebdo,"http://en.rsf.org/france-rwb-deeply-shocked-by-attack-on-07-01-2015,47451.html",rsf.org
2015-01-07,RWB appeals to media outlets to publish Charlie Hebdo cartoons,"http://en.rsf.org/france-rwb-appeals-to-media-outlets-to-07-01-2015,47454.html",rsf.org
2015-01-07,Black Wednesday: at least 12 shot dead in attack on French magazine Charlie Hebdo,"http://en.rsf.org/france-black-wednesday-more-than-12-07-01-2015,47449.html",rsf.org
2015-01-07,World expresses shock at attack on Charlie Hebdo newspaper,http://www.stltoday.com/news/world/world-expresses-shock-at-attack-on-charlie-hebdo-newspaper/article_40a1251d-76e6-51e4-9bb7-229e621bad04.html,stltoday.com
2015-01-07,The Heart of Policing — Few people really want to know what it takes to keep them safe.,http://www.memeorandum.com/150107/p63#a150107p63,memeorandum.com
2015-01-07,Manhunt after deadly attack on Paris newspaper,http://www.memeorandum.com/150107/p61#a150107p61,memeorandum.com
2015-01-07,VIDEO: Republican Governor Caught On Tape Demolishing The Legal Case Against Obamacare,http://www.memeorandum.com/150107/p65#a150107p65,memeorandum.com
2015-01-07,"With Veto Threat, Obama and Congress Head for Collision Over Keystone Pipeline",http://www.memeorandum.com/150107/p64#a150107p64,memeorandum.com
2015-01-07,The Most Powerful Pictures From The Fatal Charlie Hebdo Shooting,http://www.buzzfeed.com/jonpremosch/the-most-powerful-pictures-from-the-fatal-charlie-hebdo-shoo?utm_term=4ldqpia,buzzfeed.com
2015-01-07,Flera publicerar Charlie-bilder,http://www.sn.se/nyheter/utrikes/1.2888683,sn.se
2015-01-07,10 emotive Cartoons from artists responding to Charlie Hebdo killings,http://www.independent.ie/world-news/europe/10-emotive-cartoons-from-artists-responding-to-charlie-hebdo-killings-30890645.html,independent.ie
2015-01-07,"A Note from Paris » CounterPunch: Tells the Facts, Names the Names",http://www.counterpunch.org/2015/01/07/a-note-from-paris/?utm_source=rss&utm_medium=rss&utm_campaign=a-note-from-paris,counterpunch.org
2015-01-07,GayPatriot » Mohammedans Murder 12 Infidels in Paris,http://www.gaypatriot.net/2015/01/07/mohammedans-murder-12-infidels-in-paris/,gaypatriot.net
2015-01-07,12 Killed in Terror Attack at Satirical Magazine's Paris Office,http://feeds.feedblitz.com/~/82709591/0/alternet~At-Least-Killed-As-Shots-Fired-at-Satirical-Magazines-Paris-Office,feedblitz.com
2015-01-07,Charlie Hebdo cartoonist reveals terrorists threatened to murder her toddler unless she let them in,http://www.freerepublic.com/focus/f-news/3244449/posts,freerepublic.com
2015-01-07,LOSANTIVILLE: Attack in France,http://losantiville.blogspot.com/2015/01/attack-in-france.html,losantiville.blogspot.com
2015-01-07,The overlooked detail about the most recent cover of the magazine at the center of the Paris attack,http://www.freerepublic.com/focus/f-bloggers/3244447/posts,freerepublic.com
2015-01-07,The tragic story of a Gaza family drowned on a smugglers' boat as they tried to escape the death and destruction that claimed the lives of four young relatives,http://rss.feedsportal.com/c/266/f/3492/s/42185d74/sc/10/l/0L0Sindependent0O0Cnews0Cworld0Cmiddle0Eeast0Cthe0Etragic0Estory0Eof0Ea0Egaza0Efamily0Edrowned0Eon0Ea0Esmugglers0Eboat0Eas0Ethey0Etried0Eto0Eescape0Ethe0Edeath0Eand0Edestruction0Ethat0Eclaimed0Ethe0Elives0Eof0Efour0Eyoung0Erelatives0E99636570Bhtml/story01.htm,feedsportal.com
2015-01-07,Medier oeniga om bildpublicering,http://www.allehanda.se/allmant/utrikes/medier-oeniga-om-bildpublicering,allehanda.se
2015-01-07,"'Nossa melhor arma é nossa unidade', diz Hollande",http://www.otempo.com.br/capa/mundo/nossa-melhor-arma-%C3%A9-nossa-unidade-diz-hollande-1.970065,otempo.com.br
2015-01-07,President Obama Offers Condolences After Charlie Hebdo Magazine Shooting In Paris,http://madamenoire.com/501288/obama-offers-condolences-after-charlie-hebdo-shooting/,madamenoire.com
2015-01-07,"Cartoonists, economist among the dead in Paris terror attack",http://www.wboc.com/story/27784100/cartoonists-economist-among-the-dead-in-paris-terror-attack,wboc.com
2015-01-07,Ban outraged by 'horrendous and cold-blooded' attack on French magazine,http://www.zawya.com/story/Ban_outraged_by_horrendous_and_coldblooded_attack_on_French_magazine-WAM20150107190011610/,zawya.com
2015-01-07,21 südantlõhestavat karikatuuri vastuseks Prantsusmaa terrorirünnakule,http://elu24.postimees.ee/3048689/21-sudantlohestavat-karikatuuri-vastuseks-prantsusmaa-terrorirunnakule,postimees.ee
2015-01-07,Salmon Rushdie condemns Paris terror attack,http://www.newsletter.co.uk/salmon-rushdie-condemns-paris-terror-attack-1-6508677,newsletter.co.uk
2015-01-08,Tens of thousands join France rallies for attack victims,http://www.bangkokpost.com/news/world/455059/tens-of-thousands-join-france-rallies-for-attack-victims,bangkokpost.com
2015-01-07,"Gunmen storm Paris satirical newspaper, killing at least 12 ▪ Iranian.com",http://iranian.com/posts/view/post/43706,iranian.com
2015-01-07,Charlie Hebdo: Gun attack on French magazine kills 12 ▪ Iranian.com,http://iranian.com/posts/view/post/43708,iranian.com
2015-01-07,Monkey in the Middle: Je Suis Charlie,http://findalismonkeyinthemiddle.blogspot.com/2015/01/je-suis-charlie.html,findalismonkeyinthemiddle.blogspot.com
2015-01-07,President Obama Condemns ''Horrific'' Shooting at Paris Magazine,http://feeds.eonline.com/~r/eonline/topstories/~3/G5zBNM1y4ZU/president-barack-obama-offers-condolences-after-horrific-shooting-at-charlie-hebdo-in-paris,eonline.com
2015-01-07,Palestinian Pundit: Charlie Hebdo Shooting: 12 Killed in Attack on French Satirical Magazine Known for Muhammad Cartoons,http://palestinianpundit.blogspot.com/2015/01/charlie-hebdo-shooting-12-killed-in.html,palestinianpundit.blogspot.com
2015-01-07,De föll offer för terrordådet,http://www.sydsvenskan.se/kultur--nojen/de-foll-offer-for-terrordadet/,sydsvenskan.se
2015-01-07,Sri Lanka Guardian: France: 12 killed in attack on offices of French newspaper,http://feedproxy.google.com/~r/slguardian/~3/Nqtlwx8T_N8/france-12-killed-in-attack-on-offices.html,google.com
2015-01-07,Terrorn får aldrig tysta det fria ordet,http://www.sydsvenskan.se/opinion/huvudledare/terrorn-far-aldrig--tysta-det-fria-ordet/,sydsvenskan.se
2015-01-07,Charlie Hebdo Massacre Prompts Defense of Freedom of Speech,http://www.usnews.com/news/articles/2015/01/07/charlie-hebdo-massacre-prompts-defense-of-freedom-of-speech,usnews.com
2015-01-07,Paris and 'jihad in place': Column,http://rssfeeds.usatoday.com/~/82727854/0/news-opinion~Paris-and-jihad-in-place-Column/,usatoday.com
2015-01-07,Islamist Attacker Executes Parisian Cop During Charlie Hebdo Attack,http://www.jammiewf.com/2015/islamist-attacker-executes-parisian-cop-during-charlie-hebdo-attack/,jammiewf.com
2015-01-07,Islamists Slaughter 12 at French Satirical Magazine That Printed Mohammed Cartoons: “France is in shock”,http://www.jammiewf.com/2015/islamists-slaughter-11-at-french-satirical-magazine-that-printed-mohammed-cartoons-france-is-in-shock/,jammiewf.com
2015-01-08,"Obama condemns France shooting, offers US assistance",http://www.gmanetwork.com/news/story/400395/news/world/obama-condemns-france-shooting-offers-us-assistance,gmanetwork.com
2015-01-07,Who are Charlie Hebdo gunmen? They claimed to be 'Al Qaeda in Yemen',http://www.dailymail.co.uk/news/article-2900941/Who-Charlie-Hebdo-gunmen-Islamic-fanatics-claimed-Al-Qaeda-Yemen-shooting-12-dead.html?ITO=1490&ns_mchannel=rss&ns_campaign=1490,dailymail.co.uk
2015-01-07,Cartoonists produce profound & heartwrenching images after Charlie Hebdo attack,http://www.mirror.co.uk/news/world-news/charlie-hebdo-terror-attack-paris-4937174,mirror.co.uk
2015-01-07,World’s Cartoonists Respond to Charlie Hebdo Attack,http://nation.foxnews.com/2015/01/07/world-s-cartoonists-respond-charlie-hebdo-attack,foxnews.com
2015-01-07,The Charlie Hebdo terrorist attack in Paris,http://www.vox.com/2015/1/7/7507849/charlie-hebdo-attack-terrorists-paris-shooting,vox.com
2015-01-07,This New Yorker cartoon perfectly captures what Charlie Hebdo's critics get wrong,http://www.vox.com/2015/1/7/7507861/charlie-hebdo-cartoon,vox.com
2015-01-07,Terrorist attack on French magazine Charlie Hebdo: what we know and don't know,http://www.vox.com/2015/1/7/7507405/charlie-hebdo-attack-paris,vox.com
2015-01-07,"Charlie Hebdo editor on threats in 2012: ""I prefer to die than live like a rat""",http://www.vox.com/2015/1/7/7508607/charlie-hebdo-editor-in-chief-on-threats-in-2012-i-prefer-to-die-than,vox.com
2015-01-07,Charlie Hebdo terrorist attack: remembering the victims,http://www.vox.com/2015/1/7/7508335/charlie-hebdo-victims,vox.com
2015-01-07,"Gunmen who killed 12 at newspaper were 'calm, controlled'",http://nypost.com/2015/01/07/gunmen-who-killed-12-at-newspaper-were-calm-controlled/,nypost.com
2015-01-07,Sri Lanka: Death threats against activists highlight risk of violence around elections,http://www.amnesty.org/en/news/sri-lanka-death-threats-against-activists-highlight-risk-violence-around-elections-2015-01-07,amnesty.org
2015-01-07,Uganda/CAR: Dominic Ongwen must face trial for crimes against humanity,http://www.amnesty.org/en/news/ugandacar-dominic-ongwen-must-face-trial-crimes-against-humanity-2015-01-07,amnesty.org
2015-01-07,US Promises Help to Bring Charlie Hebdo Attackers to Justice,http://www.voanews.com/content/us-promises-help-to-bring-charlie-hebdo-attackers-to-justice/2589263.html,voanews.com
2015-01-07,Deadliest Terror Attacks in Europe since 1995,http://www.naharnet.com/stories/en/162043-deadliest-terror-attacks-in-europe-since-1995,naharnet.com
2015-01-07,French Satirical Newspaper High on Jihadist Hit-List,http://www.naharnet.com/stories/en/162039-french-satirical-newspaper-high-on-jihadist-hit-list,naharnet.com
2015-01-07,Why was French Magazine Charlie Hebdo an Islamist Target?,http://sputniknews.com/analysis/20150107/1016629003.html,sputniknews.com
2015-01-07,Obama to Speak to Hollande Amid Terrorist Attack at Paris Magazine Office,http://sputniknews.com/europe/20150107/1016629628.html,sputniknews.com
2015-01-07,Fearless: Murdered French cartoonists welcomed controversy,http://www.foxnews.com/world/2015/01/07/fearless-murdered-french-cartoonists-welcomed-controversy/,foxnews.com
2015-01-07,Medier oeniga om bildpublicering,http://ekuriren.se/nyheter/varlden/1.2888681-medier-oeniga-om-bildpublicering,ekuriren.se
2015-01-07,Paris Hebdo attack: France awash with black-market weaponry,http://www.csmonitor.com/World/Europe/2015/0107/Paris-Hebdo-attack-France-awash-with-black-market-weaponry,csmonitor.com
2015-01-07,The answer to the horror in Paris is more writing and sceptical laughter,http://www.theguardian.com/commentisfree/2015/jan/07/paris-charles-hebdo-writing-journalism-intolerance,theguardian.com
2015-01-07,Suspects still at large after terror attack kills 12 at French satirical newspaper,http://www.dallasnews.com/news/local-news/20150107-suspects-still-at-large-after-terror-attack-kills-12-at-french-satirical-newspaper.ece,dallasnews.com
2015-01-07,The massacre at Charlie Hebdo,http://www.memeorandum.com/150107/p57#a150107p57,memeorandum.com
2015-01-07,Rove: Common Core is Jeb's ‘biggest challenge’,http://www.memeorandum.com/150107/p60#a150107p60,memeorandum.com
2015-01-07,"Cartoonists, economist among the dead in Paris terror attack",http://news.yahoo.com/cartoonists-economist-among-dead-paris-terror-attack-185733077.html,yahoo.com
2015-01-07,The gunmen in Paris attacked more than a Muslim-baiting magazine,http://www.memeorandum.com/150107/p59#a150107p59,memeorandum.com
2015-01-07,Charlie Hebdo: Gun attack on French magazine kills 12,http://www.memeorandum.com/150107/p58#a150107p58,memeorandum.com
2015-01-07,Gunmen Attack Offices Of French Satirical Magazine In Paris,http://www.askmen.com/news/power_money/gunmen-attack-offices-of-french-satirical-magazine-in-paris.html,askmen.com
2015-01-07,Tampa Bay Online,http://feedproxy.google.com/~r/tbo/ap/world/~3/GG7emI2sGx4/EU_FRANCE_CHARLIE_HEBDO_PROFILES,google.com
2015-01-07,Victims of Paris attack included prominent economist and some of France's leading cartoonists,http://www.startribune.com/business/287817791.html,startribune.com
