publish_date,title,url,media_name
2015-01-12,Upper East Side vigil for french victims,https://www.ourtownny.com/news/local-news/upper-east-side-vigil-for-french-victims-JCNP1120150112150119996,ourtownny.com
2015-01-13,Witness on ‘Underwear Bomber’ plane speculates intelligence agencies behind Paris attack,https://1776channel.com/2015/01/13/us/witness-on-underwear-bomber-plane-speculates-intelligence-agencies-behind-paris-attack/#comment-2832,1776channel.com
2015-01-09,"Le ""Je Suis Charlie Hebdo"" Édition",https://shows.acast.com/political-gabfest/episodes/6965693bd87c2ca348b54bad,acast.com
2015-01-08,La presse mondiale est Charlie Hebdo,https://larevuedesmedias.ina.fr/la-presse-mondiale-est-charlie-hebdo,ina.fr
2015-01-11,More Net Neutrality Articles,http://washingtonexaminer.com/section/net-neutrality,washingtonexaminer.com
2015-01-07,French police ID gunmen who killed 12 in attack on newspaper,http://mynorthwest.com/17/2683897/French-police-ID-gunmen-who-killed-12-in-attack-on-newspaper,mynorthwest.com
2015-01-07,Brandi Glanville insists wine toss at Jeff Lewis on WWHL was 'a prank',http://www.dailymail.co.uk/tvshowbiz/article-2901185/Brandi-Glanville-insists-wine-toss-Jeff-Lewis-Watch-Happens-Live-prank.html?ITO=1490&ns_mchannel=rss&ns_campaign=1490,dailymail.co.uk
2015-01-07,Iggy Azalea says she's criticised in hip-hop because of her 'vagina',http://www.dailymail.co.uk/tvshowbiz/article-2901138/Iggy-Azalea-s-criticised-hip-hop-denies-sex-tape-says-did-d-completely-f-fine.html?ITO=1490&ns_mchannel=rss&ns_campaign=1490,dailymail.co.uk
2015-01-07,Hollywood Reacts to Charlie Hebdo Tragedy,http://feeds.eonline.com/~r/eonline/topstories/~3/_VlaIHQk8XE/charlie-hebdo-tragedy-hollywood-reacts-to-terrorist-attack-on-satirical-newspaper-in-paris-je-suis-charlie-and-more,eonline.com
2015-01-07,22 Heartbreaking Cartoons From Artists Responding To The Charlie Hebdo Shooting,http://www.memeorandum.com/150107/p94#a150107p94,memeorandum.com
2015-01-07,Paris Charlie Hebdo attack: live,http://www.memeorandum.com/150107/p95#a150107p95,memeorandum.com
2015-01-07,Unarmed Paris Police Retreated From Terrorist Gunmen [VIDEO],http://www.memeorandum.com/150107/p96#a150107p96,memeorandum.com
2015-01-07,"On Day 2, Senate Democrats Vow Aggressive Battle Against Republican Agenda",http://www.memeorandum.com/150107/p98#a150107p98,memeorandum.com
2015-01-07,FRENCH POLICE IDENTIFY 3 SUSPECTS IN ATTACK THAT KILLED 12,http://www.memeorandum.com/150107/p93#a150107p93,memeorandum.com
2015-01-07,MUSLIMS ARE RIGHT TO BE ANGRY,http://www.memeorandum.com/150107/p92#a150107p92,memeorandum.com
2015-01-07,Former ‘Onion’ editor: Freedom of speech cannot be killed,http://www.memeorandum.com/150107/p97#a150107p97,memeorandum.com
2015-01-07,Walker builds 2016 team with likely campaign manager,http://www.memeorandum.com/150107/p99#a150107p99,memeorandum.com
2015-01-07,Ilustradores y cartonistas expresan tristeza y enojo por atentado contra Charlie Hebdo,http://www.vanguardia.com.mx/ilustradoresycartonistasexpresantristezayenojoporatentadocontracharliehebdo-2244479.html,vanguardia.com.mx
2015-01-07,High Noon: Clash of cultures Charlie Hebdo slayings; opening day at the Colorado capitol,http://www.coloradoindependent.com/151113/high-noon-clash-of-cultures-lhebdo-slayings-opening-day-at-the-colorado-capitol,coloradoindependent.com
2015-01-07,"In Paris attack, clash on whether to limit press freedom",http://www.twincities.com/nation/ci_27276205/paris-attack-clash-whether-limit-press-freedom?source=rss,twincities.com
2015-01-07,The outrage it is about our right to be free to express ourselves,http://www.dailymail.co.uk/news/article-2901181/A-threat-single-one-cold-blooded-outrage-Paris-not-story-one-magazine-one-country-right-free-express-writes-DOUGLAS-MURRAY.html?ITO=1490&ns_mchannel=rss&ns_campaign=1490,dailymail.co.uk
2015-01-07,"They shouted out names... then fired: Minute by minute, how the horror unfolded in magazine newsroom",http://www.dailymail.co.uk/news/article-2901191/They-shouted-names-fired-Minute-minute-horror-unfolded-magazine-newsroom.html?ITO=1490&ns_mchannel=rss&ns_campaign=1490,dailymail.co.uk
2015-01-07,S.African cartoonist Zapiro warns of shrinking media freedom,http://www.modernghana.com/news/590711/1/safrican-cartoonist-zapiro-warns-of-shrinking-medi.html,modernghana.com
2015-01-07,A Brutal Awakening in France,http://www.politico.com/magazine/story/2015/01/charlie-hebdo-brutal-awakening-in-france-114054.html,politico.com
2015-01-07,Twelve dead in gun attack at French magazine,http://rss.feedsportal.com/c/534/f/641501/p/1/s/231a3f7f/l/0L0Syorkshirepost0O0Ctwelve0Edead0Ein0Egun0Eattack0Eat0Efrench0Emagazine0E10E70A38819/story01.htm,feedsportal.com
2015-01-07,French police ID gunmen who killed 12 in attack on newspaper,http://www.newson6.com/story/27779829/french-police-id-gunmen-who-killed-12-in-attack-on-newspaper,newson6.com
2015-01-07,Jewish cartoonist among victims of Paris terror attack,"http://www.ynetnews.com/articles/0,7340,L-4612722,00.html",ynetnews.com
2015-01-07,Killings at French journal Charlie Hebdo are assault on freedom,http://www.latimes.com/la-et-critics-notebook-france-20150108-column.html?track=rss,latimes.com
2015-01-07,Killings at French journal Charlie Hebdo are assault on freedom,http://feeds.latimes.com/~r/latimes/news/~3/3L2CGc_fLvU/la-et-critics-notebook-france-20150108-column.html,latimes.com
2015-01-07,Kerry’s statement on Paris attack,http://feedproxy.google.com/~r/powerlineblog/livefeed/~3/IarQZ_oEnM0/kerrys-statement-on-paris-attack.php,google.com
2015-01-07,"Althouse: ""Masked gunmen opened fire in the offices of a French satirical newspaper on Wednesday in Paris... as many as 12 people... killed and 10 wounded.""",http://feedproxy.google.com/~r/althouse/fullfeed/~3/d3ZnTHu_LHI/masked-gunmen-opened-fire-in-offices-of.html,google.com
2015-01-07,"In Paris attack, clash on whether to limit press freedom",http://globegazette.com/news/world/in-paris-attack-clash-on-whether-to-limit-press-freedom/article_aa989dbc-3fcf-54e4-9428-fd6194199634.html,globegazette.com
2015-01-08,Danish Newspaper Prints Controversial Charlie Hebdo Cartoons,http://feedproxy.google.com/~r/ndtv/TqgX/~3/5URCxw_PizI/story01.htm,google.com
2015-01-08,French Police Identify 3 Suspects in Charlie Hebdo Attack,http://feedproxy.google.com/~r/ndtv/TqgX/~3/ocLi3R1BH-E/story01.htm,google.com
2015-01-08,"Drama Prancūzijoje: identifikuoti užpuolikai, rengiamasi šturmui",http://www.delfi.lt/news/daily/world/drama-prancuzijoje-identifikuoti-uzpuolikai-rengiamasi-sturmui.d?id=66843164&utm_source=rss&utm_medium=rss&utm_campaign=rss,delfi.lt
2015-01-08,Charlie Hebdo's brazen defiance: a history of the French satire magazine,http://www.sbs.com.au/news/article/2015/01/08/charlie-hebdos-brazen-defiance-history-french-satire-magazine,sbs.com.au
2015-01-07,Charlie Hebdo: ISIS Muslim Terrorist Attack? Donald Trump Blames Gun Control Due To Unarmed Police,http://feeds.inquisitr.com/~r/google/yDYq/~3/aNzZ9emkE4Q/,inquisitr.com
2015-01-07,Mother Who Survived Charlie Hebdo Massacre Says Terrorist Threatened To Kill Her Daughter,http://woman.ng/2015/01/mother-who-survived-charlie-hebdo-massacre-says-terrorist-threatened-to-kill-her-daughter/,woman.ng
2015-01-07,News–UC Berkeley Graduate School of Journalism,http://journalism.berkeley.edu/news/2015/jan/07/comment-charlie-hebdo-attack/,berkeley.edu
2015-01-07,Locals React To Terrorist Attack In Paris,http://miami.cbslocal.com/2015/01/07/locals-react-to-terrorist-attack-in-paris/,cbslocal.com
2015-01-07,What Michel Houellebecq Represented to the Charlie Hebdo Shooters,http://feedproxy.google.com/~r/nymag/vulture/~3/MIE22LeoHdI/story01.htm,google.com
2015-01-07,The Attack on Charlie Hebdo Plays Right Into Marine Le Pen's Hands,http://www.newrepublic.com/article/120712/charlie-hebdo-attacks-religious-violence-europe,newrepublic.com
2015-01-07,Collaboration Can Combat Radicalization in Muslim Youths,http://www.usnews.com/news/articles/2015/01/07/collaboration-can-combat-radicalization-in-muslim-youths,usnews.com
2015-01-07,Cowardly Mainstream Media Won't Show Cartoons Of Muhammad,http://thedailybanter.com/2015/01/cowardly-mainstream-media-refuses-to-show-cartoons-of-muhammad/?utm_source=rss&utm_medium=rss&utm_campaign=cowardly-mainstream-media-refuses-to-show-cartoons-of-muhammad,thedailybanter.com
2015-01-07,"So, Who Is The 'Charlie' In Charlie Hebdo?",http://thedailybanter.com/2015/01/charlie-charlie-hebdo/?utm_source=rss&utm_medium=rss&utm_campaign=charlie-charlie-hebdo,thedailybanter.com
2015-01-08,Charlie Hebdo is no stranger to controversy,http://www.rediff.com/news/report/charlie-hebdo-is-no-stranger-to-controversy/20150108.htm,rediff.com
2015-01-07,Gutfeld Slams ‘Moral Blindness to Evil’,http://insider.foxnews.com/2015/01/07/greg-gutfeld-sounds-charlie-hebdo-attack,foxnews.com
2015-01-07,Terror in France; outrage in Washington — Obama's response more forceful than in past — Cartoonists respond — Senate to spend first workweek on workweek bill,http://www.politico.com/proreport/0115/proreport16643.html,politico.com
2015-01-08,Charlie Hebdo shooting: Tens of thousands join rallies across France and the world for attack victims,http://www.radioaustralia.net.au/international/2015-01-08/charlie-hebdo-shooting-tens-of-thousands-join-rallies-across-france-and-the-world-for-attack-victims/1404773,radioaustralia.net.au
2015-01-07,Princess Anne's prized Gloucestershire Old Spot pig is savaged to death by a wild boar after it broke into pen at the estate,http://www.dailymail.co.uk/news/article-2901188/Princess-Anne-s-prized-Gloucestershire-Old-Spot-pig-savaged-death-wild-boar-broke-pen-estate.html?ITO=1490&ns_mchannel=rss&ns_campaign=1490,dailymail.co.uk
2015-01-08,Shocked Parisians tell of 'rivers of blood' after terror attack in France,http://www.scmp.com/news/world/article/1676814/shocked-parisians-tell-rivers-blood-after-terror-attack-france,scmp.com
2015-01-07,"In Paris attack, clash on whether to limit press freedom",http://www.seattlepi.com/news/world/article/In-Paris-attack-clash-on-whether-to-limit-press-6000063.php,seattlepi.com
2015-01-07,Italy beefs up security after France newspaper attack,http://www.seattlepi.com/news/world/article/Italy-beefs-up-security-after-France-newspaper-6000047.php,seattlepi.com
2015-01-07,Muslims are right to be upset about Muhammed cartoons,http://www.speroforum.com/a/VEOUOTRXVF14/75462-Muslims-are-right-to-be-upset-about-Muhammed-cartoons,speroforum.com
2015-01-07,Islamic apologists need to stop giving a pass to Muslim fanatics,http://www.examiner.com/article/islamic-apologists-need-to-stop-giving-a-pass-to-muslim-fanatics?cid=rss,examiner.com
2015-01-07,President Obama vows support in Paris investigation,http://www.examiner.com/article/president-obama-vows-support-paris-investigation?cid=rss,examiner.com
2015-01-07,Paris gunmen: On the loose and highly professional,http://www.itv.com/news/2015-01-07/paris-gunmen-on-the-loose-and-highly-professional/,itv.com
2015-01-07,Paris Attack: Terror Raid Under Way In Reims,http://www.freerepublic.com/focus/f-news/3244514/posts,freerepublic.com
2015-01-07,"Charlie Hebdo Broke Taboos, Defying Threats and Violence",http://rss.nytimes.com/c/34625/f/642565/s/4219ba8b/sc/38/l/0L0Snytimes0N0C20A150C0A10C0A80Cworld0Ceurope0Ccharlie0Ehebdo0Ebroke0Etaboos0Edefying0Ethreats0Eand0Eviolence0Bhtml0Dpartner0Frss0Gemc0Frss/story01.htm,nytimes.com
2015-01-07,Je Suis Charlie': Huge crowds form to support Charlie Hebdo after terrorist attack,http://www.washingtonexaminer.com/je-suis-charlie-huge-crowds-form-to-support-charlie-hebdo-after-terrorist-attack/article/2558328?custom_click=rss,washingtonexaminer.com
2015-01-07,Vigils held across Europe for victims of Paris attack,http://feeds.theguardian.com/c/34708/f/663828/s/421986fd/sc/6/l/0L0Stheguardian0N0Cworld0Cvideo0C20A150Cjan0C0A70Cvigils0Eheld0Eacross0Eeurope0Evictims0Echarlie0Ehebdo0Eparis0Eattack0Evideo/story01.htm,theguardian.com
2015-01-07,Ahmadiyya Muslim Community UK Condemns the Attack on Charlie Hebdo,http://www.finanznachrichten.de/nachrichten-2015-01/32463108-ahmadiyya-muslim-community-uk-condemns-the-attack-on-charlie-hebdo-008.htm,finanznachrichten.de
2015-01-07,"World's Cartoonists, Satirists Unite in Condemning Paris Attack",http://news.yahoo.com/worlds-cartoonists-satirists-unite-condemning-paris-attack-224952281.html,yahoo.com
2015-01-07,Local view: Attack in Paris a mockery of Islam,http://feedproxy.google.com/~r/tbo/news/~3/zmPxXqUXLEE/,google.com
2015-01-07,Charlie Hebdo attack: France's worst terrorist attack in a generation leaves 12 dead,http://telegraph.feedsportal.com/c/32726/f/564430/s/42193f49/sc/11/l/0L0Stelegraph0O0Cnews0Cworldnews0Ceurope0Cfrance0C1133190A20CCharlie0EHebdo0Eattack0E120Ekilled0Ein0EFrances0Eworst0Eterrorist0Eattack0Ein0Ea0Egeneration0Bhtml/story01.htm,feedsportal.com
2015-01-07,Author Michel Houellebecq makes provocation an art,http://feeds.latimes.com/~r/latimes/classified/automotive/highway1/~3/pPTvtH63DZg/la-et-jc-michel-houellebecq-provocation-art-20150107-story.html,latimes.com
2015-01-07,12 dead in terror attack on Paris paper; manhunt for gunmen,http://feedproxy.google.com/~r/tbo/travel/~3/Fn2aGYoRSlA/french-police-identify--suspects-in-attack-that-killed--ap_worldd06631a519ed40e2b00d23f7a68647e0,google.com
2015-01-07,Vigils held across Europe for victims of Paris attack,http://www.theguardian.com/world/video/2015/jan/07/vigils-held-across-europe-victims-charlie-hebdo-paris-attack-video,theguardian.com
2015-01-08,Police hunt three Frenchmen after 12 killed in Paris attack,http://www.worldbulletin.net/haberler/152475/police-hunt-three-frenchmen-after-12-killed-in-paris-attack,worldbulletin.net
2015-01-07,Charlie Hebdo: Belfast Telegraph stands united with French colleagues to defend a free Press,http://www.belfasttelegraph.co.uk/opinion/editors-viewpoint/charlie-hebdo-belfast-telegraph-stands-united-with-french-colleagues-to-defend-a-free-press-30891028.html,belfasttelegraph.co.uk
2015-01-07,"Charlie Hebdo massacre: Manhunt for killers underway as thousands join vigils in Paris, Dublin and around the world in solidarity with journalists",http://www.belfasttelegraph.co.uk/news/world-news/charlie-hebdo-massacre-manhunt-for-killers-underway-as-thousands-join-vigils-in-paris-dublin-and-around-the-world-in-solidarity-with-journalists-30889205.html,belfasttelegraph.co.uk
2015-01-07,Italy beefs up security after France newspaper attack,http://www.timesunion.com/news/world/article/Italy-beefs-up-security-after-France-newspaper-6000047.php,timesunion.com
2015-01-07,French police ID gunmen who killed 12 in attack on newspaper,http://feedproxy.google.com/~r/bostonherald/~3/LltboTRDt7A/french_police_id_gunmen_who_killed_12_in_attack_on,google.com
2015-01-08,Cartoonists unite against Charlie Hebdo attack and terrorism,http://www.brisbanetimes.com.au/nsw/cartoonists-unite-against-charlie-hebdo-attack-and-terrorism-20150108-12jxdi.html,brisbanetimes.com.au
2015-01-07,Democrats Reintroduce Bill To Repeal Defense Of Marriage Act,http://www.memeorandum.com/150107/p88#a150107p88,memeorandum.com
2015-01-07,News orgs censor Charlie Hebdo cartoons after attack,http://www.memeorandum.com/150107/p89#a150107p89,memeorandum.com
2015-01-07,Internal CNN memo: ‘We are not at this time showing the Charlie Hebdo cartoons’,http://www.memeorandum.com/150107/p90#a150107p90,memeorandum.com
2015-01-07,Dems Respond To McConnell Taking Credit For Economic Growth: ‘Hahahahahahahahahahaha’,http://www.memeorandum.com/150107/p91#a150107p91,memeorandum.com
2015-01-07,Charlie Hebdo attack: 12 killed in shooting at Paris satirical magazine that mocked Muslim …,http://www.memeorandum.com/150107/p87#a150107p87,memeorandum.com
2015-01-07,Read TIME's Review of a Charlie Hebdo Documentary,http://feedproxy.google.com/~r/time/mostemailed/~3/cOpDh-WHbig/,google.com
2015-01-08,Attack beyond the pale: Sydney cartoonist,http://www.sbs.com.au/news/article/2015/01/08/attack-beyond-pale-sydney-cartoonist,sbs.com.au
2015-01-08,Cartoonists pay tribute to Charlie Hedbo shooting victims,http://www.sbs.com.au/news/article/2015/01/08/cartoonists-pay-tribute-charlie-hedbo-shooting-victims,sbs.com.au
2015-01-08,Paris in lockdown after newspaper attack,http://www.sbs.com.au/news/article/2015/01/08/paris-lockdown-after-newspaper-attack,sbs.com.au
2015-01-07,Trafalgar Square vigil for Paris,http://www.bbc.co.uk/news/uk-england-london-30721030#sa-ns_mchannel=rss&ns_source=PublicRSS20-sa,bbc.co.uk
2015-01-07,Paris Magazine Charlie Hebdo Suddenly Attacked Three Suspects Identified,http://guardianlv.com/2015/01/paris-magazine-charlie-hebdo-suddenly-attacked-three-suspects-identified/,guardianlv.com
2015-01-07,Charlie Hebdo attack: 3 suspects identified in killing of 12 at Paris newspaper office,http://www.contracostatimes.com/news/ci_27273275/12-dead-attack-paris-newspaper-france-goes-alert?source=rss,contracostatimes.com
2015-01-07,BizzyBlog,http://www.bizzyblog.com/2015/01/07/financial-times-house-editorial-refutes-associate-editor-who-criticized-french-magazine-for-baiting-muslims/,bizzyblog.com
2015-01-07,"Charlie Hebdo Attack in Paris Professionally Orchestrated, Experts Say",http://www.usnews.com/news/articles/2015/01/07/charlie-hebdo-attack-in-paris-professionally-orchestrated-experts-say,usnews.com
2015-01-07,Author Michel Houellebecq makes provocation an art,http://www.latimes.com/la-et-jc-michel-houellebecq-provocation-art-20150107-story.html?track=rss,latimes.com
2015-01-07,"News-JournalOnline.com: Daytona Beach news, sports, weather and classifieds",http://hosted.ap.org/dynamic/stories/E/EU_FRANCE_ATTACK_VALUES_CLASH?SITE=FLDAY&SECTION=HOME&TEMPLATE=DEFAULT,ap.org
2015-01-07,"Leftist Paris magazine publishing cartoons against Prophet Muhammad (pbuh), Christians and National Socialists attacked in Paris. Was it the KGB?",http://www.kavkazcenter.com/eng/content/2015/01/07/19836.shtml,kavkazcenter.com
2015-01-07,'Shut up already': Catholic League's Bill Donohue offers 'idiotic' take on terrorist attacks,http://twitchy.com/2015/01/07/shut-up-already-catholic-leagues-bill-donohue-offers-idiotic-take-on-terrorist-attacks/,twitchy.com
2015-01-07,"In Paris attack, clash on whether to limit press freedom",http://www.wboc.com/story/27785946/in-paris-attack-clash-on-whether-to-limit-press-freedom,wboc.com
2015-01-07,12 Dead in Terrorist Attack on Paris Offices of Satirical Newspaper,http://www.realclearpolitics.com/articles/2015/01/07/12_dead_in_terrorist_attack_on_paris_offices_of_satirical_newspaper_125176.html,realclearpolitics.com
2015-01-07,The Left Blames the Victims -- and America,http://feedproxy.google.com/~r/RushLimbaugh-AllContent/~3/wVyB3pfaavM/the_left_blames_the_victims_and_america,google.com
2015-01-07,Jornal dinamarquês publica caricaturas de revista francesa sobre Islã,"http://noticias.terra.com.br/mundo/europa/jornal-dinamarques-publica-caricaturas-de-revista-francesa-sobre-isla,00d7ddf2e46ca410VgnCLD200000b1bf46d0RCRD.html",terra.com.br
2015-01-07,Paris Attack Should Come as No Surprise,http://www.realclearworld.com/2015/01/07/paris_attack_should_come_as_no_surprise_163993.html,realclearworld.com
2015-01-07,A First-Hand Account of Attack in Paris,http://www.realclearworld.com/2015/01/07/a_first-hand_account_of_attack_in_paris_163991.html,realclearworld.com
2015-01-07,Why Islamists Targeted Charlie Hebdo,http://www.realclearworld.com/2015/01/07/why_islamists_targeted_charlie_hebdo_163987.html,realclearworld.com
2015-01-07,Charlie Hebdo attack: 3 suspects identified in killing of 12 at Paris newspaper office,http://www.insidebayarea.com/crime-courts/ci_27273275/12-dead-attack-paris-newspaper-france-goes-alert?source=rss,insidebayarea.com
2015-01-07,"After Charlie Hebdo attack, U.S. Catholic group says cartoonists ‘provoked’ slaughter",http://feeds.washingtonpost.com/c/34656/f/636708/s/42199371/sc/11/l/0L0Swashingtonpost0N0Cafter0Echarlie0Ehebdo0Eattack0Eus0Ecatholic0Egroup0Esays0Ecartoonists0Eprovoked0Eslaughter0C20A150C0A10C0A70Cb90A3110A30Ee8cc0E4a150Ead8d0Ef5cd445716f80Istory0Bhtml0Dwprss0Frss0Iworld/story01.htm,washingtonpost.com
2015-01-08,Special Operation Underway to Arrest Charlie Hebdo Attack Suspects: Reports,http://sputniknews.com/europe/20150108/1016639358.html,sputniknews.com
2015-01-07,Analyzing European Views of Muslims,http://blogs.wsj.com/washwire/2015/01/07/analyzing-european-views-of-muslims/?mod=WSJBlog,wsj.com
2015-01-07,Suicide bomber kills at least 37 at Yemen police academy,http://www.dailystar.com.lb/News/Middle-East/2015/Jan-08/283368-suicide-bomber-kills-at-least-37-at-yemen-police-academy.ashx,dailystar.com.lb
2015-01-07,Italy beefs up security after France newspaper attack,http://news.yahoo.com/italy-beefs-security-france-newspaper-attack-220920962.html,yahoo.com
2015-01-07,Vigils held across Europe for victims of Paris attack,http://feeds.theguardian.com/c/34708/f/663879/s/4219aa33/sc/6/l/0L0Stheguardian0N0Cworld0Cvideo0C20A150Cjan0C0A70Cvigils0Eheld0Eacross0Eeurope0Evictims0Echarlie0Ehebdo0Eparis0Eattack0Evideo/story01.htm,theguardian.com
2015-01-07,"In Paris attack, clash on whether to limit press freedom",http://www.chron.com/news/world/article/In-Paris-attack-clash-on-whether-to-limit-press-6000063.php,chron.com
2015-01-07,"In Paris attack, clash on whether to limit press freedom",http://news.yahoo.com/paris-attack-clash-whether-limit-press-freedom-221515060.html,yahoo.com
2015-01-07,"After Charlie Hebdo attack, U.S. Catholic group says cartoonists ‘provoked’ slaughter",http://feeds.washingtonpost.com/c/34656/f/636535/s/4218dfc9/sc/7/l/0L0Swashingtonpost0N0Cblogs0Cworldviews0Cwp0C20A150C0A10C0A70Cafter0Echarlie0Ehebdo0Eattack0Eu0Es0Ecatholic0Egroup0Esays0Ecartoonists0Eprovoked0Eslaughter0C/story01.htm,washingtonpost.com
2015-01-07,Tina Fey says attack is reminder of free speech,http://www.dailymail.co.uk/news/article-2901061/Tina-Fey-says-attack-reminder-free-speech.html?ITO=1490&ns_mchannel=rss&ns_campaign=1490,dailymail.co.uk
2015-01-07,Phlycia Rashad attacked pathetic defending Bill Cosby rape claims,http://www.dailymail.co.uk/news/article-2901131/Phylicia-Rashad-attacked-pathetic-defense-Bill-Cosby-rape-victims-lawyer-reveals-three-women-claim-molested-dares-sue.html?ITO=1490&ns_mchannel=rss&ns_campaign=1490,dailymail.co.uk
2015-01-07,Arrest made in 'Mrs. Doubtfire' arson in San Francisco,http://www.dailymail.co.uk/news/article-2901075/Arrest-Mrs-Doubtfire-arson-San-Francisco.html?ITO=1490&ns_mchannel=rss&ns_campaign=1490,dailymail.co.uk
2015-01-07,KTRS,http://feedproxy.google.com/~r/ktrs/national/~3/rbkOjZJp3Vg/FRANCE_ATTACK_VALUES_CLASH,google.com
2015-01-07,"In Paris attack, clash on whether to limit press freedom",http://www.newson6.com/story/27785946/in-paris-attack-clash-on-whether-to-limit-press-freedom,newson6.com
2015-01-07,Silencing the satirists,http://feeds.baltimoresun.com/~r/baltimoresun/news/opinion/rss2/~3/DA0BNVVT9bU/bs-ed-france-terrorists-20150107-story.html,baltimoresun.com
2015-01-07,Islamic Terrorists Attack Freedom Of Speech In Paris: 12 Dead,http://newsblaze.com/story/20150107121644nnnn.nb/topstory.html,newsblaze.com
2015-01-07,"Rubio: 'These terrorists don't hate cartoons, they hate freedom'",http://www.washingtonexaminer.com/rubio-these-terrorists-dont-hate-cartoons-they-hate-freedom/article/2558322?custom_click=rss,washingtonexaminer.com
2015-01-07,Media Institute: 'shocked and outraged' by Charlie Hebdo attack,http://feedproxy.google.com/~r/bostonherald/~3/eXF9b7hj-4E/media_institute_shocked_and_outraged_by_charlie_hebdo_attack,google.com
2015-01-07,Charlie Hebdo shootings Europe's latest deadly terror attack,http://www.usnews.com/news/world/articles/2015/01/07/charlie-hebdo-shootings-europes-latest-deadly-terror-attack,usnews.com
2015-01-07,Italy beefs up security at 'sensitive targets' after France newspaper attack,http://www.startribune.com/world/287841541.html,startribune.com
2015-01-07,Thousands gather for massive Paris demonstration after Charlie Hebdo attack,http://feedproxy.google.com/~r/bostonherald/~3/8sZEQ6tEj9w/thousands_gather_for_massive_paris_demonstration_after,google.com
2015-01-07,Intel shows off SmartSense camera to make dresses to drones smart,http://www.dailymail.co.uk/sciencetech/article-2901058/Smarter-average-computer-Intel-shows-SmartSense-teach-drone-fly-help-blind-walk-smart-clothing.html?ITO=1490&ns_mchannel=rss&ns_campaign=1490,dailymail.co.uk
2015-01-07,Hollande Reacts to Charlie Hebdo Attack,http://rss.nytimes.com/c/34625/f/640334/s/4216e8f5/sc/11/l/0L0Snytimes0N0Cvideo0Cworld0Ceurope0C10A0A0A0A0A0A0A34348850Chollande0Ereacts0Eto0Eparis0Eshooting0Bhtml0Dpartner0Frss0Gemc0Frss/story01.htm,nytimes.com
2015-01-07,Witness Videos of Paris Terror Attack,http://rss.nytimes.com/c/34625/f/640334/s/42181567/sc/11/l/0L0Snytimes0N0Cvideo0Cworld0Ceurope0C10A0A0A0A0A0A0A34351940Ceyewitness0Evideos0Eof0Eparis0Eterror0Eattack0Bhtml0Dpartner0Frss0Gemc0Frss/story01.htm,nytimes.com
2015-01-07,Hollande Pledges to Defend Freedom,http://rss.nytimes.com/c/34625/f/640334/s/42192d0c/sc/11/l/0L0Snytimes0N0Cvideo0Cworld0Ceurope0C10A0A0A0A0A0A0A34358280Chollande0Epledges0Eto0Edefend0Efreedom0Bhtml0Dpartner0Frss0Gemc0Frss/story01.htm,nytimes.com
2015-01-07,Obama on U.S. Solidarity With France,http://rss.nytimes.com/c/34625/f/640334/s/42190bd7/sc/11/l/0L0Snytimes0N0Cvideo0Cworld0Ceurope0C10A0A0A0A0A0A0A34355190Cobama0Eon0Eus0Esolidarity0Ewith0Efrance0Bhtml0Dpartner0Frss0Gemc0Frss/story01.htm,nytimes.com
2015-01-07,"In Two Languages, Kerry Condemns Attack",http://rss.nytimes.com/c/34625/f/640334/s/42181566/sc/11/l/0L0Snytimes0N0Cvideo0Cworld0Ceurope0C10A0A0A0A0A0A0A34351810Ckerry0Econdemns0Eparis0Eshooting0Bhtml0Dpartner0Frss0Gemc0Frss/story01.htm,nytimes.com
