publish_date,title,url,media_name
2013-03-07,Hugo Chavez’s Venezuela: Cuba’s Paymaster and Vassal,http://feedproxy.google.com/~r/reason/HitandRun/~3/uYl8MiDKYqY/hugo-chavezs-venezuela-cubas-paymaster-a,google.com
2013-03-07,"Venezuela slams Harper for Âblunt, insensitive, impertinentÂ remarks on Hugo ChavezÂs death",http://www.freerepublic.com/focus/f-news/2994484/posts,freerepublic.com
2013-06-07,Throngs of Venezuelans file past Chavez's coffin,http://feeds.boston.com/c/35022/f/646951/s/29516d0a/l/0L0Sboston0N0Cnews0Cworld0Clatin0Eamerica0C20A130C0A30C0A70Cthrongs0Evenezuelans0Efile0Epast0Echavez0Ecoffin0CfQGzgoc3GRJ4sKO6RYUPLP0Cstory0Bhtml/story01.htm,boston.com
2013-03-07,Throngs of Venezuelans file past Chavez's coffin,http://www.timesunion.com/news/world/article/Throngs-of-Venezuelans-file-past-Chavez-s-coffin-4334912.php,timesunion.com
2013-03-07,Throngs of Venezuelans file past Chavez's coffin,http://news.yahoo.com/throngs-venezuelans-file-past-chavezs-coffin-180515004.html,yahoo.com
2013-03-07,Venezuelans In Miami Want Consulate Re-Opened,http://miami.cbslocal.com/2013/03/07/venezuelans-in-miami-want-consulate-re-opened/,cbslocal.com
2013-03-07,NY Mets could have moved Jon Niese instead of R.A. Dickey; Yankees' Hal Steinbrenner speaks,http://www.nydailynews.com/blogs/baseballinsider/2013/03/ny-mets-could-have-moved-jon-niese-instead-of-ra-dickey-yankees-hal-steinbre,nydailynews.com
2013-03-07,MIAMI: Venezuelans in US: Reopen Miami consulate,http://www.miamiherald.com/2013/03/07/3272260/venezuelans-in-us-reopen-miami.html,miamiherald.com
2013-03-07,"Rebelo holds a sign, that stadiums in the 2014 World Cup will use the sign in their non-smoking areas, during the LOC news conference in Rio de Janeiro",http://news.yahoo.com/photos/rebelo-holds-sign-stadiums-2014-world-cup-sign-photo-172501753.html,yahoo.com
2013-03-07,FIFA Secretary General Valcke responds to a question during the 2014 World Cup Local Organizing Committee news conference in Rio de Janeiro,http://news.yahoo.com/photos/fifa-secretary-general-valcke-responds-during-2014-world-photo-172140702.html,yahoo.com
2013-03-07,Brazilian Football Confederation President Marin listens to Brazil's Minister of Sports Rebelo during the 2014 World Cup LOC news conference in Rio de Janeiro,http://news.yahoo.com/photos/brazilian-football-confederation-president-marin-listens-brazils-minister-photo-172702453.html,yahoo.com
2013-03-06,Venezuela after Hugo Chavez: why US eyes upcoming elections warily (+video),http://rss.csmonitor.com/~r/feeds/usa/~3/MCgPOTXn7ZE/Venezuela-after-Hugo-Chavez-why-US-eyes-upcoming-elections-warily-video,csmonitor.com
2013-03-07,Crufts Dog Show kicks off,http://news.yahoo.com/photos/crufts-dog-show-slideshow/,yahoo.com
2013-03-07,FIFA Secretary General Valcke listens to a question during the 2014 World Cup Local Organizing Committee news conference in Rio de Janeiro,http://news.yahoo.com/photos/fifa-secretary-general-valcke-listens-during-2014-world-photo-171717162.html,yahoo.com
2013-03-07,Former Brazilian striker and member of 2014 World Cup LOC Ronaldo listens to questions next to FIFA Secretary General Valcke in Rio de Janeiro,http://news.yahoo.com/photos/former-brazilian-striker-member-2014-world-cup-loc-photo-172000684.html,yahoo.com
2013-03-07,Can Cuba survive the loss of Venezuela's Hugo Chávez?,http://rss.csmonitor.com/~r/feeds/world/~3/R9xDkHB5klw/Can-Cuba-survive-the-loss-of-Venezuela-s-Hugo-Chavez,csmonitor.com
2013-03-07,Hugo Chavez brought 'home' to military academy where career began,http://rss.csmonitor.com/~r/feeds/world/~3/L8FPnNBtPN8/Hugo-Chavez-brought-home-to-military-academy-where-career-began,csmonitor.com
2013-03-07,FIFA Secretary General Valcke smiles during the 2014 World Cup Local Organizing Committee news conference in Rio de Janeiro,http://news.yahoo.com/photos/fifa-secretary-general-valcke-smiles-during-2014-world-photo-171436295.html,yahoo.com
2013-03-07,FIFA Secretary General Valcke and CBF President Marin arrive to the 2014 World Cup Local Organizing Committee news conference in Rio de Janeiro,http://news.yahoo.com/photos/fifa-secretary-general-valcke-cbf-president-marin-arrive-photo-171253382.html,yahoo.com
2013-03-07,Former Brazilian striker and member of the 2014 World Cup LOC Ronaldo holds a no-smoking sign during a news conference in Rio de Janeiro,http://news.yahoo.com/photos/former-brazilian-striker-member-2014-world-cup-loc-photo-170448926--spt.html,yahoo.com
2013-03-07,FIFA Secretary General Valcke listens to a question during the 2014 World Cup Local Organizing Committee news conference in Rio de Janeiro,http://news.yahoo.com/photos/fifa-secretary-general-valcke-listens-during-2014-world-photo-171549315.html,yahoo.com
2013-03-07,"FIFA Secretary General Valcke, Former Brazilian striker and member of 2014 World Cup LOC Ronaldo and CBF President Marin arrive for a LOC news conference in Rio de Janeiro",http://news.yahoo.com/photos/fifa-secretary-general-valcke-former-brazilian-striker-member-photo-170927757.html,yahoo.com
2013-03-07,Former Brazilian striker and member of the 2014 World Cup LOC Ronaldo laughs with FIFA Secretary General Valcke during a news conference in Rio de Janeiro,http://news.yahoo.com/photos/former-brazilian-striker-member-2014-world-cup-loc-photo-170630913.html,yahoo.com
2013-03-07,Will U.S. relations with Venezuela improve after Hugo Chavez's death?,http://news.yahoo.com/u-relations-venezuela-improve-hugo-chavezs-death-114500750.html,yahoo.com
2013-03-07,<!-- document.write(partnertitle); // -->,http://hosted.ap.org/dynamic/stories/L/LT_VENEZUELA_CHAVEZS_DEATH?SITE=RIPRJ&SECTION=HOME&TEMPLATE=DEFAULT,ap.org
2013-03-07,Former Brazilian striker Ronaldo holds a no-smoking sign next to FIFA Secretary General Valcke during a news conference in Rio de Janeiro,http://news.yahoo.com/photos/former-brazilian-striker-ronaldo-holds-no-smoking-sign-photo-170041553.html,yahoo.com
2013-03-07,Kenyan PM's coalition says vote counting 'lacks integrity',http://www.cbc.ca/news/world/story/2013/03/07/wrd-kenya-presidential-election.html?cmp=rss,cbc.ca
2013-03-07,"News-JournalOnline.com: Daytona Beach news, sports, weather and classifieds",http://hosted.ap.org/dynamic/stories/L/LT_VENEZUELA_CHAVEZS_DEATH?SITE=FLDAY&SECTION=HOME&TEMPLATE=DEFAULT,ap.org
2013-03-07,Citgo Offices Fly Flags at Half Staff for Hugo Chavez,http://www.newsmax.com/US/citgo-half-staff-flags/2013/03/07/id/493600,newsmax.com
2013-03-07,Hugo Chavez’s last words: ‘Please don’t let me die’,http://feedproxy.google.com/~r/FOREIGN-TheWashingtonTimesAmericasNewspaper/~3/gEchUfJPDas/,google.com
2013-03-07,Why post-Chavez Venezeula won't be a U.S. ally anytime soon,http://drezner.foreignpolicy.com/posts/2013/03/07/why_post_chavez_venezeula_wont_be_a_us_ally_anytime_soon,foreignpolicy.com
2013-03-06,Tito's pet film studio at risk of Yugoslav fate,http://feeds.reuters.com/~r/reuters/entertainment/~3/ziPX4Mq9LqI/entertainment-us-serbia-film-idUSBRE9260CM20130307,reuters.com
2013-03-07,UN predicts wheat production will be near record,http://www.cbc.ca/news/world/story/2013/03/07/un-wheat-production.html?cmp=rss,cbc.ca
2013-03-07,U.S. trade deficit widened in January,http://www.cbc.ca/news/world/story/2013/03/07/us-trade-deficit.html?cmp=rss,cbc.ca
2013-03-07,U.S. senator ends anti-drone filibuster,http://www.cbc.ca/news/world/story/2013/03/07/drone-paul-filibuster.html?cmp=rss,cbc.ca
2013-03-07,Cardinals briefed on Vatican finances ahead of conclave,http://www.cbc.ca/news/world/story/2013/03/07/wrd-vatican-city-cardinal-pope-conclave.html?cmp=rss,cbc.ca
2013-03-07,"News-JournalOnline.com: Daytona Beach news, sports, weather and classifieds",http://hosted.ap.org/dynamic/stories/U/US_CHAVEZ_AMERICAN_APPEAL?SITE=FLDAY&SECTION=HOME&TEMPLATE=DEFAULT,ap.org
2013-03-07,"'I don't want to die, please don't let me die': Last words of Hugo Chavez revealed as medics admit president died of heart attack",http://www.dailymail.co.uk/news/article-2289477/Hugo-Chavez-dead-Venezuelan-Presidents-cause-death-heart-attack-admit-medics.html?ITO=1490&ns_mchannel=rss&ns_campaign=1490,dailymail.co.uk
2013-03-06,Peru's police chief quits as crime fears pressure Humala,http://feeds.reuters.com/~r/Reuters/worldNews/~3/F7XFUkZ-cUw/us-peru-crime-idUSBRE9260VF20130307,reuters.com
2013-07-03,Chavez’s body brought ‘home’ to military academy,http://www.dailyherald.com/article/20130307/news/703079803/,dailyherald.com
2013-03-06,Nigeria president says little chance of Islamist amnesty,http://feeds.reuters.com/~r/Reuters/worldNews/~3/VXGn42VRxx8/us-nigeria-bokoharam-idUSBRE9260UZ20130307,reuters.com
2013-03-07,Hugo Chavez funeral: sea of Venezuelans view his remains,http://feedproxy.google.com/~r/NdtvNews-TopStories/~3/X4cpSgQwNb4/story01.htm,google.com
2013-03-07,General: Hugo Chavez Died Of A Heart Attack,http://miami.cbslocal.com/2013/03/07/general-hugo-chavez-died-of-a-heart-attack/,cbslocal.com
2013-03-06,Hezbollah member to hear Cyprus plot verdict March 21,http://feeds.reuters.com/~r/Reuters/worldNews/~3/XpmpsI5cI7A/us-cyprus-hezbollah-trial-idUSBRE9260UF20130307,reuters.com
2013-03-07,Hugo Chavez's legacy,"http://feeds.latimes.com/~r/latimes/news/opinion/~3/yA03YODVuhg/la-ed-chavez-20130307,0,5276088.story",latimes.com
2013-03-07,‘Venezuela to stay on Chavez’s course no matter who next president is’ — RT Op-Edge,http://rt.com/op-edge/maduro-chavez-venezuela-us-957/,rt.com
2013-03-06,Ousted Pistorius detective quits South African police,http://feeds.reuters.com/~r/Reuters/worldNews/~3/Q6PFzM6I1_8/us-safrica-pistorius-idUSBRE9260UB20130307,reuters.com
2013-03-06,U.N. Security Council hits North Korea with more sanctions,http://feeds.reuters.com/~r/Reuters/worldNews/~3/nljY5TwSLhs/us-korea-north-un-sanctions-idUSBRE9260TK20130307,reuters.com
2013-03-07,"Chavez's body returns ""home"" to military academy",http://feeds.cbsnews.com/~r/CBSNewsMain/~3/NQlhsZTGMTs/,cbsnews.com
2013-03-07,breaking news - national news - world news,http://hosted.ap.org/dynamic/stories/U/US_CHAVEZ_AMERICAN_APPEAL?SITE=AZPHG&SECTION=HOME&TEMPLATE=DEFAULT,ap.org
2013-03-07,Chavez's try to be savior of poor floundered in US,http://www.local10.com/news/Chavez-s-try-to-be-savior-of-poor-floundered-in-US/-/1717324/19217358/-/2p22m7/-/index.html,local10.com
2013-03-07,"A.M. Links: Filibuster Ends After Highlighting Civil Liberties, Holder A-OK With Swartz Prosecution, North Korea Threatens Nuclear Strike",http://feedproxy.google.com/~r/reason/HitandRun/~3/R7TlVA3PDm0/am-links-filibuster-ends-after-highlight,google.com
2013-03-06,Most large employers to keep health insurance benefit: survey,http://feeds.reuters.com/~r/reuters/healthNews/~3/6aY_csrpTV4/us-healthinsurance-survey-idUSBRE9260S320130307,reuters.com
2013-03-06,Closing arguments begin in New York cannibal cop case,http://feeds.reuters.com/~r/Reuters/domesticNews/~3/FOy67q49Bh4/us-usa-crime-cannibal-idUSBRE9260T720130307,reuters.com
2013-03-06,Tito's pet film studio at risk of Yugoslav fate,http://feeds.reuters.com/~r/reuters/lifestyle/~3/ulx5313jpOk/entertainment-us-serbia-film-idUSBRE9260CM20130307,reuters.com
2013-03-07,Curiosity rover powered down for solar blast,http://www.cbc.ca/news/technology/story/2013/03/07/technology-curiosity-rover-solar.html?cmp=rss,cbc.ca
2013-03-07,Facebook to unveil 'new look' for News Feed,http://www.cbc.ca/news/technology/story/2013/03/07/technology-facebook-news-feed.html?cmp=rss,cbc.ca
2013-03-06,Senator urges early renewal of Africa trade bill,http://feeds.reuters.com/~r/Reuters/PoliticsNews/~3/kluv6a9DN7Y/us-usa-africa-trade-idUSBRE9260S720130307,reuters.com
2013-03-07,What's Next For Venezuela,http://www.forbes.com/sites/dougschoen/2013/03/07/whats-next-for-venezuela/,forbes.com
2013-03-06,"Rakhine crisis risks spread, endangering Myanmar reforms: U.N.",http://feeds.reuters.com/~r/Reuters/worldNews/~3/EL-bIUY3iaQ/us-myanmar-un-rights-idUSBRE9260RP20130307,reuters.com
2013-03-07,Benefactor's death worries many nations,http://www.sacbee.com/2013/03/07/5242583/benefactors-death-worries-many.html#mi_rss=Bee%20Nation/World%20News,sacbee.com
2013-03-07,New England braces for winter storm blast,http://www.cbc.ca/news/world/story/2013/03/07/winter-storm-new-england.html?cmp=rss,cbc.ca
2013-03-07,Lion attacks intern at California zoo,http://www.cbc.ca/news/world/story/2013/03/07/lion-california.html?cmp=rss,cbc.ca
2013-03-07,Mort de Chavez: Haïti craint pour son avenir,http://www.rfi.fr/ameriques/20130307-chavez-haiti-petrole-petrocaribe,rfi.fr
2013-03-07,La mort de Chavez risque de porter un mauvais coup à l'économie russe,http://www.rfi.fr/ameriques/20130307-mort-chavez-risque-porter-mauvais-coup-economie-russe,rfi.fr
2013-03-07,Hugo Chavez's Legacy of Ruin,http://www.realclearpolitics.com/2013/03/07/hugo_chavez039s_legacy_of_ruin_303439.html,realclearpolitics.com
2013-03-06,Nokia says to get more than it gives to Microsoft this year,http://feeds.reuters.com/~r/reuters/technologyNews/~3/FHoPh29H3IE/us-nokia-microsoft-idUSBRE9260R920130307,reuters.com
2013-03-07,Mr. Paul Goes to Washington to Protect Your Rights,http://www.realclearpolitics.com/2013/03/07/mr_paul_goes_to_washington_to_protect_your_rights_303437.html,realclearpolitics.com
2013-03-06,Mozambican tribal queen stands up to Rio Tinto over land,http://feeds.reuters.com/~r/reuters/environment/~3/1J8rBOruCcQ/us-mozambique-communities-idUSBRE92605T20130307,reuters.com
2013-03-07,The Death of a Despot,http://www.freerepublic.com/focus/f-news/2994399/posts,freerepublic.com
2013-03-07,Hugo Chavez brought 'home' to military academy where career began,http://www.csmonitor.com/World/Latest-News-Wires/2013/0307/Hugo-Chavez-brought-home-to-military-academy-where-career-began,csmonitor.com
2013-03-06,Samsung loses latest Apple patent suit in UK,http://feeds.reuters.com/~r/reuters/technologyNews/~3/Fe7wP6cEFfQ/us-samsung-apple-uk-court-idUSBRE9260PS20130307,reuters.com
2013-03-06,Gun-control drive to get first votes in Congress,http://feeds.reuters.com/~r/Reuters/domesticNews/~3/7Rg5JBYgcZA/us-usa-guns-senate-idUSBRE92607I20130307,reuters.com
2013-03-06,BP faces escalating spill payouts after court ruling,http://feeds.reuters.com/~r/Reuters/domesticNews/~3/bJ6x4rkPalI/us-bp-spill-idUSBRE9260NM20130307,reuters.com
2013-03-07,President Hugo Chavez died of massive heart attack: Venezuela official,http://feeds.nydailynews.com/~r/nydnrss/news/~3/Dnc8sduE-Ek/story01.htm,nydailynews.com
2013-03-07,Aboriginal prison population has jumped in 10 years,http://www.cbc.ca/news/politics/story/2013/03/07/canada-aboriginal-prison-population-report.html?cmp=rss,cbc.ca
2013-03-07,Iran’s President Says “Chavez Will Return with Christ” · Global Voices,http://globalvoicesonline.org/2013/03/07/irans-president-says-chavez-will-return-with-christ/,globalvoicesonline.org
2013-03-07,Can Cuba survive the loss of Venezuela's Hugo Chávez?,http://www.csmonitor.com/World/Americas/Latin-America-Monitor/2013/0307/Can-Cuba-survive-the-loss-of-Venezuela-s-Hugo-Chavez,csmonitor.com
2013-03-06,Venezuela after Hugo Chavez: why US eyes upcoming elections warily (+video),http://www.csmonitor.com/USA/Foreign-Policy/2013/0306/Venezuela-after-Hugo-Chavez-why-US-eyes-upcoming-elections-warily-video,csmonitor.com
2013-03-06,Palestinian wounded in clash with Israelis dies in hospital,http://feeds.reuters.com/~r/Reuters/worldNews/~3/-bRnMVBAuDY/us-palestinians-israel-violence-idUSBRE9260QB20130307,reuters.com
2013-03-07,Sachin Pilot to represent India at Hugo Chavez funeral,http://feedproxy.google.com/~r/ndtv/Lsgd/~3/kUvPb-rCs0w/story01.htm,google.com
2013-03-07,Chavez's try to be savior of poor floundered in US,http://seattletimes.com/html/nationworld/2020503815_apuschavezamericanappeal.html?syndication=rss,seattletimes.com
2013-03-06,"ECB holds rates, to stand firm on bond buys",http://feeds.reuters.com/~r/reuters/businessNews/~3/9z7zcRlwlHQ/us-ecb-rates-idUSBRE9260A520130307,reuters.com
2013-03-07,Wireless spectrum auction to start November 19th,http://www.cbc.ca/news/politics/story/2013/03/07/business-wireless-spectrum.html?cmp=rss,cbc.ca
2013-03-07,7 March SWJ Roundup,http://smallwarsjournal.com/node/13857,smallwarsjournal.com
2013-03-07,Chavez's try to be savior of poor floundered in US,http://seattletimes.nwsource.com/html/nationworld/2020503815_apuschavezamericanappeal.html?syndication=rss,nwsource.com
2013-03-07,"Despite oil donations, offers of Katrina aid, Chavez never caught on as savior of poor in US",http://www.startribune.com/nation/195857301.html,startribune.com
2013-03-07,General: Heart attack killed a suffering Chavez,http://newsok.com/general-heart-attack-killed-a-suffering-chavez/article/feed/510153?custom_click=rss,newsok.com
2013-03-07,Oil price rises as US economy seen strengthening,http://www.seattlepi.com/business/energy/article/Oil-price-rises-as-US-economy-seen-strengthening-4334832.php,seattlepi.com
2013-07-03,Oil up on growing crude supplies,http://www.dailyherald.com/article/20130307/business/703079849/,dailyherald.com
2013-03-06,Dancer says did not want acid used in Bolshoi attack,http://feeds.reuters.com/~r/reuters/topNews/~3/NoQu8M47p8s/entertainment-us-russia-bolshoi-idUSBRE92609820130307,reuters.com
2013-03-07,We'll carry on your fight': Venezuelans mourn and prepare for Hugo Chavez funeral,http://worldnews.nbcnews.com/_news/2013/03/07/17222948-well-carry-on-your-fight-venezuelans-mourn-and-prepare-for-hugo-chavez-funeral?lite,nbcnews.com
2013-03-06,Dancer says did not want acid used in Bolshoi attack,http://feeds.reuters.com/~r/reuters/topNews/~3/-HD-pAUz0IU/us-russia-bolshoi-idUSBRE92609820130307,reuters.com
2013-03-07,"U.S. jobless claims fall to 340,000",http://www.marketwatch.com/news/story.asp?guid=%7BEA65047F-EE71-451C-909E-4CEF6050E7E1%7D&siteid=rss&rss=1,marketwatch.com
2013-03-06,Iran's leader condemns West for not making nuclear concessions,http://feeds.reuters.com/~r/Reuters/worldNews/~3/dt87VgDbuCo/us-iran-nuclear-khamenei-idUSBRE9260NY20130307,reuters.com
2013-03-07,Oil price rises as US economy seen strengthening,http://www.sacbee.com/2013/03/07/5243653/oil-price-rises-as-us-economy.html#mi_rss=Wire%20Business%20News,sacbee.com
2013-03-06,Martha Hall Findlay takes 2nd run at Liberal leadership,http://www.cbc.ca/news/politics/story/2013/03/06/pol-martha-hall-findlay-liberal-leadership-profile.html?cmp=rss,cbc.ca
2013-03-07,Business Breaking News,http://www.miamiherald.com/2013/03/07/3271892/oil-price-rises-as-us-economy.html,miamiherald.com
2013-03-06,"Ford recalls 230,000 minivans for corrosion issue",http://feeds.reuters.com/~r/Reuters/domesticNews/~3/Qgja_NIryGw/us-ford-minivanrecall-idUSBRE9260O520130307,reuters.com
2013-03-07,Oil price rises as US economy seen strengthening,http://www.kansascity.com/2013/03/07/4105443/oil-price-rises-as-us-economy.html#storylink=rss,kansascity.com
2013-03-07,News From AP,http://feedproxy.google.com/~r/tbo/ap/world/~3/c_Irs1PfcXE/LT_VENEZUELA_CHAVEZS_DEATH,google.com
2013-03-07,Oil price rises as US economy seen strengthening,http://seattletimes.com/html/businesstechnology/2020501919_apoilprices.html?syndication=rss,seattletimes.com
2013-03-06,Hugo Chavez: A ding-dong is dead,http://feedproxy.google.com/~r/tribunereviewopinion/~3/5rSdhnxGVac/chavez-ding-dong,google.com
2013-03-07,Oil price rises as US economy seen strengthening,http://www.bellinghamherald.com/2013/03/07/2909273/oil-price-rises-as-us-economy.html#storylink=rss,bellinghamherald.com
2013-03-06,U.S. probes racial disparities in Seattle school discipline,http://feeds.reuters.com/~r/Reuters/domesticNews/~3/qBjSD0W_gZ8/us-usa-schools-seattle-idUSBRE9260KJ20130307,reuters.com
2013-03-07,Oil price rises as US economy seen strengthening,http://seattletimes.nwsource.com/html/businesstechnology/2020501919_apoilprices.html?syndication=rss,nwsource.com
2013-03-07,Oil price rises as US economy seen strengthening,http://news.yahoo.com/oil-price-rises-us-economy-seen-strengthening-132748895--finance.html,yahoo.com
2013-03-07,Anger at Venezuela oil firm that lowered flags for Chavez in Houston,http://www.dailymail.co.uk/news/article-2289488/Anger-Venezuela-oil-firm-lowered-flags-Chavez-Houston.html?ITO=1490&ns_mchannel=rss&ns_campaign=1490,dailymail.co.uk
2013-03-07,Chavez's body brought 'home' to military academy,http://seattletimes.com/html/nationworld/2020501913_apltvenezuelachavez.html?syndication=rss,seattletimes.com
2013-03-07,"With Hugo Chavez Dead, Will Chavismo Also Die?",http://www.forbes.com/sites/dougbandow/2013/03/07/with-hugo-chavez-dead-will-chavismo-also-die/,forbes.com
2013-03-07,Chavez's try to be savior of poor floundered in US,http://wcfcourier.com/news/national/chavez-s-try-to-be-savior-of-poor-floundered-in/article_fe4b762e-f285-53ff-b9b1-6fb67e66ccfb.html,wcfcourier.com
2013-03-06,Tunisia's Islamists fail to broaden coalition government,http://feeds.reuters.com/~r/Reuters/worldNews/~3/qtx_6OEBxw0/us-tunisia-politics-idUSBRE9260N120130307,reuters.com
2013-03-07,"Death of Hugo Chavez rattles market, but prices hold steady",http://www.upi.com/Business_News/2013/03/07/Crude-oil-steady-in-uncertain-market/UPI-26891362662164/,upi.com
2013-03-07,Chavez's body brought 'home' to military academy,http://seattletimes.nwsource.com/html/nationworld/2020501913_apltvenezuelachavez.html?syndication=rss,nwsource.com
2013-03-06,Tribesmen kidnap two UK tourists in Egypt's Sinai: sources,http://feeds.reuters.com/~r/Reuters/worldNews/~3/LN44EQfaXqQ/us-egypt-kidnapping-idUSBRE9260MC20130307,reuters.com
2013-03-06,Twenty-one jailed in Saudi Arabia after deadly floods,http://feeds.reuters.com/~r/Reuters/worldNews/~3/tHdTa2dsVcA/us-saudi-floods-court-idUSBRE9260ML20130307,reuters.com
2013-03-07,Multitudes bring late President Chavez 'home' to military academy after emotional procession,http://www.startribune.com/world/195847681.html,startribune.com
2013-03-07,<!-- document.write(partnertitle); // -->,http://hosted.ap.org/dynamic/stories/U/US_CHAVEZ_AMERICAN_APPEAL?SITE=RIPRJ&SECTION=HOME&TEMPLATE=DEFAULT,ap.org
2013-03-06,Croatia reaches deal with Slovenia to unblock EU entry,http://feeds.reuters.com/~r/Reuters/worldNews/~3/61INohI59lU/us-croatia-slovenia-eu-idUSBRE9260M620130307,reuters.com
2013-03-06,Dell says Icahn opposes go-private deal,http://feeds.reuters.com/~r/reuters/topNews/~3/fNRMPL9BIgk/us-dell-specialcommittee-idUSBRE9250MU20130307,reuters.com
2013-03-06,Apartheid death squad commander Coetzee dies in South Africa,http://feeds.reuters.com/~r/Reuters/worldNews/~3/m0-jJZjeRw0/us-safrica-assassin-idUSBRE9260L420130307,reuters.com
2013-03-06,Malaysia troops kill 31 Philippine militants; ceasefire offer rejected,http://feeds.reuters.com/~r/Reuters/worldNews/~3/t6ejmQjN07Q/us-malaysia-philippines-najib-idUSBRE9260KU20130307,reuters.com
2013-03-07,Venezuela-US Relations Unlikely to Change After Chavez,http://www.voanews.com/content/venezuela-us-relations-unlikely-to-change-after-chavez/1616806.html,voanews.com
2013-03-07,News From AP,http://feedproxy.google.com/~r/tbo/ap/usnews/~3/G9xR6axOV0s/US_CHAVEZ_AMERICAN_APPEAL,google.com
2013-03-07,"Philippines, Syria in talks for release of UN peacekeepers",http://www.cbc.ca/news/world/story/2013/03/07/wrd-syria-philippines-un-peacekeeper-negotiations.html?cmp=rss,cbc.ca
2013-03-06,"Hugo Chavez successor inherits goodwill, hard times","http://feeds.latimes.com/~r/latimes/sports/basketball/wnba/sparks/~3/Y4JwFsqX600/la-fg-venezuela-maduro-20130307,0,830071.story",latimes.com
2013-03-06,Walmart.com to sell goods made by small women-owned businesses,http://feeds.reuters.com/~r/reuters/businessNews/~3/MEX8-dq9DGo/us-walmart-women-idUSBRE9260JG20130307,reuters.com
2013-03-06,Medical tourism offers travel firms untapped growth,http://feeds.reuters.com/~r/reuters/healthNews/~3/PeibOVRp0Zk/us-medical-tourism-idUSBRE9260C220130307,reuters.com
2013-03-06,GlaxoSmithKline files for European approval of diabetes drug albiglutide,http://feeds.reuters.com/~r/reuters/healthNews/~3/-plgLORRjto/us-glaxosmithkline-diabetes-idUSBRE9260JS20130307,reuters.com
2013-03-07,Israel Matzav: Obama sending delegation to Chavez funeral,http://israelmatzav.blogspot.com/2013/03/obama-sending-delegation-to-chavez.html,israelmatzav.blogspot.com
2013-03-07,CNN Washington AM Note,http://rss.cnn.com/~r/rss/cnn_politicalticker/~3/9DEv5ZLNXUQ/,cnn.com
2013-03-07,Politicians and experts weigh in on Venezuelan President Hugo Chavez's death,http://blog.syracuse.com/opinion/2013/03/politicians_and_experts_weigh_1.html,syracuse.com
2013-03-07,Venezuelan General: Heart Attack Killed a Greatly Suffering Chavez,http://www.newsmaxworld.com/GlobalTalk/chavez-death-heart-attack/2013/03/07/id/493548,newsmaxworld.com
2013-03-07,Indonesian volcano spews ash into sky,http://www.cbc.ca/news/world/story/2013/03/07/indonesia-volcano.html?cmp=rss,cbc.ca
2013-03-06,Walmart.com to sell goods made by small women-owned businesses,http://feeds.reuters.com/~r/reuters/technologyNews/~3/nR9H5yg7Kak/us-walmart-women-idUSBRE9260JG20130307,reuters.com
2013-03-07,"Hugo Chavez's last words: 'Please don't let me die,' general says",http://worldnews.nbcnews.com/_news/2013/03/07/17221344-hugo-chavezs-last-words-please-dont-let-me-die-general-says?lite,nbcnews.com
2013-03-07,Chavez's try to be savior of poor floundered in US,http://www.timesunion.com/news/us/article/Chavez-s-try-to-be-savior-of-poor-floundered-in-US-4335095.php,timesunion.com
2013-03-07,Plus ça change,http://www.samizdata.net/2013/03/plus-a-change/,samizdata.net
2013-03-06,"Hugo Chavez successor inherits goodwill, hard times",http://feeds.latimes.com/~r/latimes/news/~3/2eiJ7hgKkdA/story01.htm,latimes.com
2013-03-06,Dell says Icahn opposes go-private deal,http://feeds.reuters.com/~r/reuters/businessNews/~3/NZywhQGk3Jo/us-dell-specialcommittee-idUSBRE9250MU20130307,reuters.com
