publish_date,title,url,media_name
2013-03-01,"News-JournalOnline.com: Daytona Beach news, sports, weather and classifieds",http://hosted.ap.org/dynamic/stories/L/LT_VENEZUELA_A_REPORTERS_VIEW?SITE=FLDAY&SECTION=HOME&TEMPLATE=DEFAULT,ap.org
2013-03-01,Australia's DJ Ajax struck and killed by truck in Melbourne at age 41,http://www.upi.com/Entertainment_News/Music/2013/03/01/Australias-DJ-Ajax-struck-and-killed-by-truck-in-Melbourne-at-age-41/UPI-83731362167513/,upi.com
2013-03-01,AP News,http://hosted.ap.org/dynamic/stories/L/LT_VENEZUELA_A_REPORTERS_VIEW?SITE=CAMAR&SECTION=HOME&TEMPLATE=DEFAULT,ap.org
2013-03-01,breaking news - national news - world news,http://hosted.ap.org/dynamic/stories/L/LT_VENEZUELA_A_REPORTERS_VIEW?SITE=AZPHG&SECTION=HOME&TEMPLATE=DEFAULT,ap.org
2013-03-01,Gov. Rick Snyder declares fiscal emergency in Detroit,http://www.upi.com/Top_News/US/2013/03/01/Gov-Snyder-declares-Detroit-emergency/UPI-39101362142428/,upi.com
2013-05-01,Opposition: Venezuela lying about Chavez's health,http://feeds.boston.com/c/35022/f/646951/s/291b8d6a/l/0L0Sboston0N0Cnews0Cworld0Clatin0Eamerica0C20A130C0A30C0A10Copposition0Evenezuela0Elying0Eabout0Echavez0Ehealth0C8FYk2XQW5lr0AD6X31OaiLI0Cstory0Bhtml/story01.htm,boston.com
2013-03-01,Opposition: Venezuela lying about Chavez's health,http://www.kansascity.com/2013/03/01/4094235/opposition-venezuela-lying-about.html#storylink=rss,kansascity.com
2013-03-01,News From The Associated Press,http://hosted.ap.org/dynamic/stories/L/LT_VENEZUELA_A_REPORTERS_VIEW?SITE=PAYOK&SECTION=HOME&TEMPLATE=DEFAULT,ap.org
2013-03-01,<!-- document.write(partnertitle); // -->,http://hosted.ap.org/dynamic/stories/L/LT_VENEZUELA_A_REPORTERS_VIEW?SITE=RIPRJ&SECTION=HOME&TEMPLATE=DEFAULT,ap.org
2013-03-01,Opposition: Venezuela lying about Chavez's health,http://www.timesunion.com/news/world/article/Opposition-Venezuela-lying-about-Chavez-s-health-4320876.php,timesunion.com
2013-03-01,"Benedict XVI at summer retreat, pledges obedience to successor",http://www.upi.com/Top_News/World-News/2013/03/01/Benedict-XVI-staying-at-summer-retreat/UPI-96781362166043/,upi.com
2013-03-01,"CARACAS, Venezuela: Opposition: Venezuela lying about Chavez's health",http://www.miamiherald.com/2013/03/01/3261417/opposition-venezuela-lying-about.html,miamiherald.com
2013-03-01,Opposition leader says Venezuela government lying about Chavez's health,http://feeds.foxnews.com/~r/foxnews/world/~3/SDi7pmhDMjU/,foxnews.com
2013-03-01,Most who saw Russian meteor failed to correctly identify it as such,http://www.upi.com/Science_News/2013/03/01/Russian-meteor-misidentified-by-most/UPI-82591362165601/,upi.com
2013-03-01,Nevada crash leaves interstate 'bloody' with ketchup,http://www.upi.com/Odd_News/2013/03/01/Ketchup-leaves-bloody-accident-on-road/UPI-90781362165802/,upi.com
2013-03-01,"Herbert Barron arrested for beating dogs, forcing them to drink rum",http://www.upi.com/Top_News/US/2013/03/01/Man-arrested-on-animal-cruelty-charges/UPI-17441362165934/,upi.com
2013-03-01,"CARACAS, Venezuela: Opposition: Venezuela lying about Chavez's health",http://www.bellinghamherald.com/2013/03/01/2900907/opposition-venezuela-lying-about.html#storylink=rss,bellinghamherald.com
2013-03-01,Opposition leader says Venezuela government lying about Chavez's health,http://www.startribune.com/world/194318961.html,startribune.com
2013-03-01,Opposition: Venezuela lying about Chavez's health,http://seattletimes.com/html/nationworld/2020463311_apltvenezuelachavez.html?syndication=rss,seattletimes.com
2013-03-01,Venezuela in the Chavez era: a reporter's view,http://www.kansascity.com/2013/03/01/4094198/venezuela-in-the-chavez-era-a.html#storylink=rss,kansascity.com
2013-03-01,Rebels unenthused by new Syrian aid,http://www.upi.com/Top_News/World-News/2013/03/01/Rebels-unenthused-by-new-Syrian-aid/UPI-14391362165363/,upi.com
2013-03-01,Dust blown across the Pacific can impact Calif. rain and snow,http://www.upi.com/Science_News/2013/03/01/African-Asian-dust-affects-Calif-weather/UPI-49381362164854/,upi.com
2013-03-01,Christian Slater and Brittany Lopez get engaged,http://www.upi.com/Entertainment_News/TV/2013/03/01/Christian-Slater-and-Brittany-Lopez-get-engaged/UPI-84391362165039/,upi.com
2013-03-01,Venezuela in the Chavez era: a reporter's view,http://seattletimes.nwsource.com/html/nationworld/2020463208_apltvenezuelaareportersview.html?syndication=rss,nwsource.com
2013-03-01,'One Day at a Time' actress Bonnie Franklin dead at 69,http://www.upi.com/Entertainment_News/TV/2013/03/01/One-Day-at-a-Time-actress-Bonnie-Franklin-dead-at-69/UPI-65251362164534/,upi.com
2013-03-01,Israeli doctor under investigation in rapes of female soldiers,http://www.upi.com/Top_News/World-News/2013/03/01/Israeli-doctor-eyed-in-rape-of-soldiers/UPI-19621362164629/,upi.com
2013-03-01,A reporter's view: reflections on 8 years covering Venezuela and Hugo Chavez,http://feeds.foxnews.com/~r/foxnews/world/~3/9lFl0ONWm08/,foxnews.com
2013-03-01,Venezuela in the Chavez era: a reporter's view,http://www.newson6.com/story/21437367/venezuela-in-the-chavez-era-a-reporters-view,newson6.com
2013-03-01,Venezuela in the Chavez era: a reporter's view,http://www.sacbee.com/2013/03/01/5228796/venezuela-in-the-chavez-era-a.html#mi_rss=Wire%20World%20News,sacbee.com
2013-03-01,Venezuela in the Chavez era: a reporter's view,http://feeds.boston.com/c/35022/f/646951/s/291b6748/l/0L0Sboston0N0Cnews0Cworld0Clatin0Eamerica0C20A130C0A30C0A10Cvenezuela0Ethe0Echavez0Eera0Ereporter0Eview0CaqPKCBg4MAc8qYOeZV7UMO0Cstory0Bhtml/story01.htm,boston.com
2013-03-01,Venezuela in the Chavez era: a reporter's view,http://www.timesunion.com/news/world/article/Venezuela-in-the-Chavez-era-a-reporter-s-view-4320788.php,timesunion.com
2013-03-01,Spain: Arrest of 3 suspected terrorists in France linked to 2012 raids,http://www.upi.com/Top_News/World-News/2013/03/01/3-alleged-terrorists-arrested-in-France/UPI-96561362163623/,upi.com
2013-03-01,British skepticism over EU ties caps eurozone jobless spiral,http://www.upi.com/Top_News/Special/2013/03/01/British-skepticism-caps-EU-jobless-spiral/UPI-71961362163840/,upi.com
2013-03-01,Venezuela in the Chavez era: a reporter's view,http://www.wboc.com/story/21437367/venezuela-in-the-chavez-era-a-reporters-view,wboc.com
2013-03-01,"CARACAS, Venezuela: Venezuela in the Chavez era: a reporter's view",http://www.bellinghamherald.com/2013/03/01/2900851/venezuela-in-the-chavez-era-a.html#storylink=rss,bellinghamherald.com
2013-03-01,A reporter's view: reflections on 8 years covering Venezuela and Hugo Chavez,http://www.startribune.com/world/194295521.html,startribune.com
2013-03-01,"CARACAS, Venezuela: Venezuela in the Chavez era: a reporter's view",http://www.miamiherald.com/2013/03/01/3261312/venezuela-in-the-chavez-era-a.html,miamiherald.com
2013-03-01,Venezuela in the Chavez era: a reporter's view,http://news.yahoo.com/venezuela-chavez-era-reporters-view-183356362.html,yahoo.com
2013-03-01,10 die in two blasts in Kunar province,http://www.upi.com/Top_News/World-News/2013/03/01/10-die-in-two-blasts-in-Kunar-province/UPI-37181362163186/,upi.com
2013-03-01,Orange County Register,http://hosted.ap.org/dynamic/stories/L/LT_VENEZUELA_A_REPORTERS_VIEW?SITE=CAANR&SECTION=HOME&TEMPLATE=DEFAULT,ap.org
2013-03-01,Venezuela in the Chavez era: a reporter's view,http://seattletimes.com/html/nationworld/2020463208_apltvenezuelaareportersview.html?syndication=rss,seattletimes.com
2013-03-01,"Venezuela decries ""absurd"" rumors over Chavez death",http://feeds.chicagotribune.com/~r/chicagotribune/news/nationworld/~3/f1vu7Hr8RnU/story01.htm,chicagotribune.com
2013-03-01,U.N. sees need for Malian reconciliation,http://www.upi.com/Top_News/Special/2013/03/01/UN-sees-need-for-Malian-reconciliation/UPI-94851362162689/,upi.com
2013-03-01,SpaceX capsule on way to space station suffering thruster problems,http://www.upi.com/Science_News/2013/03/01/Mission-to-space-station-has-orbit-problem/UPI-67871362162719/,upi.com
2013-03-01,Bob Woodward denies saying White House 'threatened' him,http://www.upi.com/Top_News/US/2013/03/01/Bob-Woodward-I-did-not-say-threatened/UPI-73081362162320/,upi.com
2013-03-01,Chicago marathon to hold lottery for remaining slots after site crash,http://www.upi.com/Top_News/US/2013/03/01/Chicago-marathon-to-hold-lottery-for-slots/UPI-34441362162465/,upi.com
2013-03-01,Musharraf: I will return to Pakistan after interim government in place,http://www.upi.com/Top_News/World-News/2013/03/01/Musharraf-My-return-crucial-to-Pakistan/UPI-70331362161973/,upi.com
2013-03-01,South African police involved in van-dragging arrested; victim dies,http://www.upi.com/Top_News/World-News/2013/03/01/8-officers-arrested-in-van-dragging-of-man/UPI-20661362123000/,upi.com
2013-03-01,"Rape of girl, 7, at school sparks violent New Delhi protests",http://www.upi.com/Top_News/World-News/2013/03/01/Protests-sparked-by-rape-of-Indian-girl-7/UPI-91941362160578/,upi.com
2013-03-01,"Obama, congressional leaders fail to reach agreement on sequester",http://www.upi.com/Top_News/US/2013/03/01/WH-talks-yield-no-sequester-breakthrough/UPI-65311362128400/,upi.com
2013-03-01,Taco Bell in Britain removes beef from menu after horse DNA found,http://www.upi.com/Top_News/World-News/2013/03/01/Taco-Bell-in-Britain-takes-beef-off-menu/UPI-46341362160930/,upi.com
2013-03-01,"Hell Holes: Torture, starvation and murder the norm at world’s worst gulags",http://www.foxnews.com/world/2013/03/01/hell-holes-torture-starvation-and-murder-norm-at-worlds-worst-gulags/,foxnews.com
2013-03-01,Hugo Chavez near death? Many Venezuelans believe in leader's recovery,http://rss.csmonitor.com/~r/feeds/world/~3/1WDitHfJdLw/Hugo-Chavez-near-death-Many-Venezuelans-believe-in-leader-s-recovery,csmonitor.com
2013-03-01,European Commission member tells Britain that unity beat for EU,http://www.upi.com/Top_News/Special/2013/03/01/Unity-best-option-EU-tells-Britain/UPI-33941362159527/,upi.com
2013-03-01,Venezuela rebuffs 'absurd' rumors over Chavez death,http://my.news.yahoo.com/venezuela-govt-mocks-rumors-over-chavezs-death-150227817.html,yahoo.com
2013-03-01,S. Korea's Park urges Japan to take responsibility colonial rule acts,http://www.upi.com/Top_News/World-News/2013/03/01/Park-urges-Japan-to-own-colonial-rule-acts/UPI-31161362159076/,upi.com
2013-03-01,Myanmar called to improve human rights,http://www.upi.com/Top_News/Special/2013/03/01/Rights-groups-put-pressure-on-Myanmar/UPI-68211362158956/,upi.com
2013-03-01,Thousands of gallons of whiskey accidentally dumped into sewer,http://www.upi.com/Odd_News/2013/03/01/Whiskey-ends-up-in-sewer/UPI-53001362159084/,upi.com
2013-03-01,European Union wants Ukraine to be serious about political reforms,http://www.upi.com/Top_News/Special/2013/03/01/EU-tells-Kiev-to-get-serious-about-reform/UPI-93161362158682/,upi.com
2013-03-01,Russian President Vladimir Putin seeks election law change,http://www.upi.com/Top_News/Special/2013/03/01/Putin-seeks-election-law-revision/UPI-14221362158260/,upi.com
2013-03-01,Putin visits memorial for soldiers killed Chechnya in 2000,http://www.upi.com/Top_News/World-News/2013/03/01/Putin-honors-soldiers-who-died-in-Chechnya/UPI-14911362157719/,upi.com
2013-03-01,1 March SWJ Roundup,http://smallwarsjournal.com/node/13841,smallwarsjournal.com
2013-03-01,Kilpatrick's emails reveal undisclosed cash; jury deliberations resume,http://www.upi.com/Top_News/US/2013/03/01/Kilpatrick-emails-reveal-undisclosed-cash/UPI-71651362156335/,upi.com
2013-03-01,Hugo Chavez near death? Many Venezuelans believe in leader's recovery,http://www.csmonitor.com/World/Latest-News-Wires/2013/0301/Hugo-Chavez-near-death-Many-Venezuelans-believe-in-leader-s-recovery,csmonitor.com
2013-03-01,Many Venezuelans believe Hugo Chavez will return to power,http://www.nydailynews.com/news/world/venezuelans-chavez-better-article-1.1276892?localLinksEnabled=false,nydailynews.com
2013-03-01,'Hobbit' to top $1 billion at global box office this weekend,http://www.upi.com/Entertainment_News/Movies/2013/03/01/Hobbit-to-top-1-billion-at-global-box-office-this-weekend/UPI-76801362155454/,upi.com
2013-03-01,"318 bottles of stolen wine worth $93,643 returned to French vineyard",http://www.upi.com/Odd_News/2013/03/01/Stolen-93643-in-wine-is-back-in-vineyard/UPI-67371362155036/,upi.com
2013-03-01,"Two men charged in kidnap, rape of escort worker",http://www.upi.com/Top_News/US/2013/03/01/Men-charged-in-escorts-kidnap-rape/UPI-50561362155210/,upi.com
2013-03-01,Russian President Putin submits bill to revise election laws,http://www.upi.com/Top_News/World-News/2013/03/01/Putin-submits-election-reform-bill/UPI-56311362154792/,upi.com
2013-03-01,Italian president says country has governrment despite mixed vote,http://www.upi.com/Top_News/World-News/2013/03/01/Napolitano-Italy-not-without-a-govemment/UPI-18891362153384/,upi.com
2013-03-01,"Grubs not suitable grub, French officials say in closing restaurant",http://www.upi.com/Odd_News/2013/03/01/Caterpillars-on-menu-close-French-diner/UPI-11091362153228/,upi.com
2013-03-01,Poll: Hollande least-liked French president in 30 years,http://www.upi.com/Top_News/World-News/2013/03/01/Poll-Hollande-most-unpopular-in-30-years/UPI-45311362153596/,upi.com
2013-03-01,Harvey settles suit with exonerated ex-con,http://www.upi.com/Top_News/US/2013/03/01/Harvey-settles-suit-with-exonerated-ex-con/UPI-53111362153065/,upi.com
2013-03-01,Labor council members drop opposition to Thatcher statue in hometown,http://www.upi.com/Top_News/World-News/2013/03/01/Thatcher-statue-may-go-on-display/UPI-46761362153024/,upi.com
2013-03-01,Red Cross wants ban on nuclear weapons,http://www.upi.com/Top_News/Special/2013/03/01/ICRC-calls-for-nuclear-ban/UPI-86261362152744/,upi.com
2013-03-01,27 hospitalized after chlorine leak,http://www.upi.com/Top_News/World-News/2013/03/01/27-hospitalized-after-chlorine-leak/UPI-26621362152617/,upi.com
2013-03-01,Venezuela Government Mocks Rumors Over Chavez's Death,http://www.nytimes.com/reuters/2013/03/01/world/americas/01reuters-venezuela-chavez.html?partner=rss&emc=rss,nytimes.com
2013-03-01,Kenya to invite Barack Obama to swearing in of next president,http://www.upi.com/Top_News/Special/2013/03/01/Obama-invited-to-Kenyan-swearing-in/UPI-60241362150699/,upi.com
2013-03-01,Kerry's trip to Turkey follows Ergogan's controversial Zionism remark,http://www.upi.com/Top_News/World-News/2013/03/01/Kerry-may-address-Erdogan-Zionism-remark/UPI-41501362150874/,upi.com
2013-03-01,"California judges' diversity rises, minorities still underrepresented",http://www.upi.com/Top_News/US/2013/03/01/Diversity-rises-among-California-judges/UPI-15261362151479/,upi.com
2013-03-01,Venezuela government mocks rumors over Chavez's death,"http://feedproxy.google.com/~r/baltimoresun/news/nation/rss2/~3/U-_aNhQVlmI/sns-rt-us-venezuela-chavezbre9200n7-20130301,0,6963884.story",google.com
2013-03-01,Hugo Chavez: Many Venezuelans believe in leader's recovery,http://www.csmonitor.com/World/Latest-News-Wires/2013/0301/Hugo-Chavez-Many-Venezuelans-believe-in-leader-s-recovery,csmonitor.com
2013-03-01,Russian boy believed killed by wild dogs or wolves in Siberia,http://www.upi.com/Top_News/World-News/2013/03/01/Report-Dogs-wolves-may-have-killed-boy/UPI-56201362149532/,upi.com
2013-03-01,Rockets said fired from Lebanon into Syria,http://www.upi.com/Top_News/Special/2013/03/01/Syria-rebels-accuses-Hezbollah-of-attack/UPI-31891362149056/,upi.com
2013-03-01,Chicago police recover sculpture stolen in 2007 after it's put on sale,http://www.upi.com/Top_News/US/2013/03/01/Police-recover-sculpture-stolen-in-2007/UPI-95991362148856/,upi.com
2013-03-01,Deaths from Bangladesh unrest rises to 44,http://www.upi.com/Top_News/World-News/2013/03/01/Bangladesh-unrest-death-toll-reaches-44/UPI-86651362148258/,upi.com
2013-03-01,Turkey calls for support for Democratic Republic of Congo,http://www.upi.com/Top_News/Special/2013/03/01/Turkey-latest-to-weigh-in-on-DRC-peace/UPI-77971362147467/,upi.com
2013-03-01,Chavez's cancer puts Venezuela on undeclared vote footing,http://sg.news.yahoo.com/chavezs-cancer-puts-venezuela-undeclared-vote-footing-123016424.html,yahoo.com
2013-03-01,Ivory Coast ex-president Larent Gbagbo tells court he's innocent,http://www.upi.com/Top_News/World-News/2013/03/01/ICC-to-decide-ex-President-Gbagbos-fate/UPI-16701362147130/,upi.com
2013-03-01,"Au Venezuela, Nicolas Maduro semble préparer l'après-Chavez",http://www.rfi.fr/ameriques/20130301-venezuela-maduro-hugo-chavez-cancer,rfi.fr
2013-03-01,"U.S., South Korea start military drills",http://www.upi.com/Top_News/Special/2013/03/01/US-South-Korea-start-military-drills/UPI-86231362146594/,upi.com
2013-03-01,Man swallowed by sinkhole under Florida house is presumed dead,http://www.upi.com/Top_News/US/2013/03/01/Man-swallowed-by-sinkhole-presumed-dead/UPI-87931362145825/,upi.com
2013-03-01,"Goats 'sing' songs by Swift, Usher, Cyrus",http://www.upi.com/Entertainment_News/Music/2013/03/01/Goats-sing-songs-by-Swift-Usher-Cyrus/UPI-34131362145171/,upi.com
2013-03-01,CW cancels low-rated '90210' after five seasons,http://www.upi.com/Entertainment_News/TV/2013/03/01/CW-cancels-low-rated-90210-after-five-seasons/UPI-12581362144139/,upi.com
2013-03-01,"Crews hope calmer winds aid in Riverside, Calf., fire-fighting effort",http://www.upi.com/Top_News/US/2013/03/01/Crews-hope-weather-aids-Calif-fire-battle/UPI-69271362144226/,upi.com
2013-03-01,Four Mekong River attackers executed,http://www.upi.com/Top_News/World-News/2013/03/01/Four-Mekong-River-attackers-executed/UPI-65891362144080/,upi.com
2013-03-01,Overhead wire damage leads to widespread train delays in Britain,http://www.upi.com/Top_News/World-News/2013/03/01/Wire-damage-leads-to-train-delays/UPI-66741362144743/,upi.com
2013-03-01,"Filipinos' siege in Malaysia ends in shootout, killing 14",http://www.upi.com/Top_News/World-News/2013/03/01/Filipinos-siege-ends-in-shootout-14-dead/UPI-71261362143750/,upi.com
2013-03-01,Friday is deadline for switch to direct deposit for Social Security,http://www.upi.com/Top_News/US/2013/03/01/Deadline-for-benefits-direct-deposit-looms/UPI-15431362142766/,upi.com
2013-03-01,Missing anchor in California was suffering from medical problem,http://www.upi.com/Top_News/US/2013/03/01/Missing-anchor-had-medical-problem/UPI-69931362143225/,upi.com
2013-03-01,Governor expected to appoint emergency financial manager for Detroit,http://www.upi.com/Top_News/US/2013/03/01/Snyder-expected-to-appoint-Detroit-manager/UPI-39101362142428/,upi.com
2013-03-01,Number of Chicago homicides in February lowest in more than a decade,http://www.upi.com/Top_News/US/2013/03/01/Chicago-homicides-drop-in-February/UPI-14701362142214/,upi.com
2013-03-01,"Gallup poll finds Hawaii residents most happy, West Virginia least",http://www.upi.com/Top_News/US/2013/03/01/Poll-Hawaii-happiest-state-W-Va-least/UPI-65551362141224/,upi.com
2013-03-01,Two U.S. servicemen sentenced for 2012 Okinawa rape,http://www.upi.com/Top_News/World-News/2013/03/01/US-servicemen-sentenced-for-Okinawa-rape/UPI-13291362141055/,upi.com
2013-03-01,Groupon CEO Andrew Mason says he was fired,http://www.upi.com/Science_News/Technology/2013/03/01/Groupon-CEO-Mason-I-was-fired-today/UPI-90231362140252/,upi.com
2013-03-01,Analysis: Chavez's cancer puts Venezuela on undeclared vote footing,http://news.yahoo.com/analysis-chavezs-cancer-puts-venezuela-undeclared-vote-footing-120234396.html,yahoo.com
2013-03-01,EU threatens sanctions over Israeli building projects,http://www.upi.com/Top_News/World-News/2013/03/01/EU-warns-against-Israeli-settlements/UPI-37731362139201/,upi.com
2013-03-01,Couple sues Los Angeles hotel for decomposing body in water tank,http://www.upi.com/Top_News/US/2013/03/01/Couple-sues-hotel-for-body-in-water-tank/UPI-74841362138054/,upi.com
2013-03-01,Venezuela VP: Chavez 'battling' for life,http://www.local10.com/news/Venezuela-VP-Chavez-battling-for-life/-/1717324/19135402/-/k8de5dz/-/index.html,local10.com
2013-03-01,Hugo Chavez is fighting for his life in a military hospital ten days after returning from cancer treatment in Cuba,http://www.dailymail.co.uk/news/article-2286389/Hugo-Chavez-fighting-life-military-hospital-days-returning-cancer-treatment-Cuba.html?ITO=1490&ns_mchannel=rss&ns_campaign=1490,dailymail.co.uk
2013-03-01,Venezuela VP Nicholas Maduro: Hugo Chavez 'battling for his life',http://www.upi.com/Top_News/World-News/2013/03/01/Maduro-Chavez-battling-for-his-life/UPI-68341362124800/,upi.com
2013-03-01,Venezuela's Hugo Chavez 'battling' for his life: Vice President,http://feedproxy.google.com/~r/ndtv/TqgX/~3/xboB7yIEk6k/story01.htm,google.com
2013-03-01,Many Venezuelans believe in Chavez recovery,http://news.yahoo.com/many-venezuelans-believe-chavez-recovery-224906127.html,yahoo.com
2013-03-01,Venezuela: l'hôpital où est soigné Chavez transformé en forteresse,http://www.rfi.fr/ameriques/20130301-venezuela-hopital-est-soigne-chavez-transforme-forteresse,rfi.fr
2013-03-02,"Venezuela's Chavez undergoing ""tough"" chemotherapy, VP says","http://feedproxy.google.com/~r/baltimoresun/news/nation/rss2/~3/YGyZWP_1uMc/sns-rt-us-venezuela-chavezbre9210cm-20130302,0,3341045.story",google.com
2013-03-01,"Venezuela's Chavez undergoing tough chemotherapy, VP says",http://feeds.reuters.com/~r/reuters/topNews/~3/BTkC_ckyyJQ/us-venezuela-chavez-idUSBRE9210CM20130302,reuters.com
2013-03-01,"Venezuela's Chavez undergoing tough chemotherapy, VP says",http://feeds.reuters.com/~r/Reuters/worldNews/~3/BeFuQ0dbXEw/us-venezuela-chavez-idUSBRE9210CM20130302,reuters.com
2013-03-02,"Venezuela's Chavez undergoing ""tough"" chemotherapy, VP says",http://news.yahoo.com/venezuelas-chavez-undergoing-tough-chemotherapy-vp-says-224112300.html,yahoo.com
2013-03-02,The US is the Don Corleone of international politics — RT Op-Edge,http://rt.com/op-edge/the-us-is-the-don-corleone-of-international-politics-730/,rt.com
2013-03-02,"Chavez undergoing ""tough"" chemotherapy: Venezuela VP",http://feeds.chicagotribune.com/~r/chicagotribune/news/nationworld/~3/H59qnLcZwsk/story01.htm,chicagotribune.com
2013-03-02,Chavez undergoing intense cancer treatment VP says,http://www.cbc.ca/news/world/story/2013/03/02/chavez-treatments.html?cmp=rss,cbc.ca
2013-03-02,Chavez Undergoing 'Tough' Chemotherapy: Venezuela VP,http://www.nytimes.com/reuters/2013/03/02/world/americas/02reuters-venezuela-chavez.html?partner=rss&emc=rss,nytimes.com
2013-03-02,Venezuela spokesmen reject as ‘absurd’ reports of Chavez’s death,http://feeds.nydailynews.com/~r/nydnrss/sports/basketball/nets/~3/nmPDmRoqBcE/venezuela-rejects-absurd-chavez-death-reports-article-1.1277704,nydailynews.com
2013-03-02,Venezuela spokesmen reject as ‘absurd’ reports of Chavez’s death,http://feeds.nydailynews.com/~r/nydnrss/latino/~3/nmPDmRoqBcE/venezuela-rejects-absurd-chavez-death-reports-article-1.1277704,nydailynews.com
2013-03-02,VP: Venezuela's Chavez Undergoing 'Tough' Chemotherapy,http://www.newsmax.com/GlobalTalk/Chavez-Venezuela-cancer-chemotherapy/2013/03/02/id/492766,newsmax.com
2013-03-01,Chavez undergoing tough chemotherapy: Venezuela VP,http://feeds.reuters.com/~r/reuters/topNews/~3/P9_c_CdMOwM/us-venezuela-chavez-idUSBRE9200YW20130302,reuters.com
2013-03-02,"Hugo Chavez in chemotherapy but in 'good spirits', says Venezuela",http://feedproxy.google.com/~r/ndtv/TqgX/~3/Gg9doxA9_lM/story01.htm,google.com
2013-03-02,"Venezuela Chavez having chemotherapy, says VP Maduro",http://www.democraticunderground.com/1014412729,democraticunderground.com
2013-03-02,"Hugo Chavez Receiving Chemotherapy, Venezuela Says",http://www.huffingtonpost.com/2013/03/02/hugo-chavez-chemotherapy_n_2794981.html,huffingtonpost.com
2013-03-02,Venezuela's Hugo Chavez in 'good spirits',http://www.aljazeera.com/news/americas/2013/03/2013327919809506.html,aljazeera.com
2013-03-02,Hugo Chavez 'has more chemotherapy',http://www.bbc.co.uk/news/world-latin-america-21639726#sa-ns_mchannel=rss&ns_source=PublicRSS20-sa,bbc.co.uk
2013-03-02,Venezuela says Chavez receiving chemotherapy,http://rssfeeds.usatoday.com/~r/usatoday-NewsTopStories/~3/7yoIzXhI7zM/,usatoday.com
2013-03-02,"Chavez Receiving Chemotherapy Again, Venezuelan Government Says",http://www.npr.org/2013/03/02/173296804/chavez-receiving-chemotherapy-again-venezuelan-government-says?ft=1&f=1001,npr.org
2013-03-02,President Hugo Chavez 'fighting for his life',http://rss.cnn.com/~r/rss/cnn_mostpopular/~3/Ltm7-AJJaG4/index.html,cnn.com
2013-03-01,Venezuela decries absurd rumors over Chavez death,http://www.reuters.com/article/2013/03/01/us-venezuela-chavez-idUSBRE9200N720130301,reuters.com
2013-03-01,2 March SWJ Roundup,http://smallwarsjournal.com/node/13843,smallwarsjournal.com
2013-03-02,"Chavez Receiving Chemotherapy Again, Venezuelan Government Says",http://www.npr.org/2013/03/02/173296804/chavez-receiving-chemotherapy-again-venezuelan-government-says?ft=1&f=1004,npr.org
2013-03-01,Venezuela says Chavez receiving chemotherapy,http://www.seattlepi.com/news/world/article/Venezuela-says-Chavez-receiving-chemotherapy-4320876.php,seattlepi.com
2013-03-02,Venezuela's vice president says Chavez receiving chemotherapy,http://feeds.foxnews.com/~r/foxnews/world/~3/PClRI1xMXVA/,foxnews.com
2013-03-02,Venezuela says Chavez receiving chemotherapy,http://www.newson6.com/story/21442033/venezuela-says-chavez-receiving-chemotherapy,newson6.com
2013-03-02,Venezuela's vice president says Chavez receiving chemotherapy,http://www.foxnews.com/world/2013/03/02/venezuela-says-chavez-receiving-chemotherapy/,foxnews.com
2013-03-01,Venezuela says Chavez receiving chemotherapy,http://www.thenewstribune.com/2013/03/01/2495271/opposition-venezuela-lying-about.html?storylink=rss,thenewstribune.com
2013-03-02,Chavez in Chemotherapy and 'Good Spirits',http://www.voanews.com/content/chavez-in-chemotherapy-and-good-spirits/1613835.html,voanews.com
