publish_date,title,url,media_name
2013-03-05,"Chavez widely mourned, but some hope change on way",http://www.sacbee.com/2013/03/05/5238881/chavez-death-echoes-with-leftists.html#mi_rss=Latest%20News,sacbee.com
2013-03-06,Arrest made in Whyte Avenue abduction attempt,http://www.cbc.ca/news/canada/edmonton/story/2013/03/06/edmonton-whyte-abduction-attempt-arrest.html?cmp=rss,cbc.ca
2013-03-06,Small-town mayors anxious about RCMP office closures,http://www.cbc.ca/news/canada/new-brunswick/story/2013/03/06/nb-mayors-rcmp-offices-722.html?cmp=rss,cbc.ca
2013-03-06,AV Group converts 2 mills to natural gas,http://www.cbc.ca/news/canada/new-brunswick/story/2013/03/06/nb-irving-av-group-natural-gas-756.html?cmp=rss,cbc.ca
2013-03-06,Bathurst airport adds daily flights into Quebec,http://www.cbc.ca/news/canada/new-brunswick/story/2013/03/06/nb-bathurst-airport-flights-934.html?cmp=rss,cbc.ca
2013-03-06,Venezuela's Hugo Chavez and his legacy of plunder,http://www.kansascity.com/2013/03/06/4103233/venezuelas-hugo-chavez-and-his.html#storylink=rss,kansascity.com
2013-06-03,"Even after death, Chavez gets choice of successor",http://www.dailyherald.com/article/20130306/news/703069864/,dailyherald.com
2013-03-06,"Maduro becomes Venezuela's interim leader and will run for president, just as Chavez ordained",http://feeds.foxnews.com/~r/foxnews/world/~3/uk8mFuDgQ6Q/,foxnews.com
2013-03-06,"Valcke tries to save a ball as he visits the Mineirao Stadium site, in preparation for the 2014 World Cup, in Belo Horizonte",http://news.yahoo.com/photos/valcke-tries-save-ball-visits-mineirao-stadium-preparation-photo-151903440.html,yahoo.com
2013-03-06,Valcke smiles next to Former Brazilian striker Ronaldo as they visit the Mineirao Stadium in Belo Horizonte,http://news.yahoo.com/photos/valcke-smiles-next-former-brazilian-striker-ronaldo-visit-photo-151956004.html,yahoo.com
2013-03-06,Laval shooting leaves man in hospital,http://www.cbc.ca/news/canada/montreal/story/2013/03/06/montreal-laval-shooting-gas-station.html?cmp=rss,cbc.ca
2013-03-06,FIFA Secretary General Valcke kicks the ball next to Ronaldo as they visit the Mineirao Stadium site in Belo Horizonte,http://news.yahoo.com/photos/fifa-secretary-general-valcke-kicks-ball-next-ronaldo-photo-151803863.html,yahoo.com
2013-03-06,Valcke and former Brazilian striker Ronaldo visit the Mineirao Stadium in Belo Horizonte,http://news.yahoo.com/photos/valcke-former-brazilian-striker-ronaldo-visit-mineirao-stadium-photo-152043061.html,yahoo.com
2013-03-06,"Valcke looks at a ball as he visits the Mineirao Stadium site, in preparation for the 2014 World Cup, in Belo Horizonte",http://news.yahoo.com/photos/valcke-looks-ball-visits-mineirao-stadium-preparation-2014-photo-152124910.html,yahoo.com
2013-06-03,Muskogee County jury acquitts man in toddler's shooting death,http://www.tulsaworld.com/site/articlepath.aspx?articleid=20130306_12_0_MUSKOG22186&rss_lnk=1,tulsaworld.com
2013-06-03,One killed in southwest Oklahoma house explosion,http://www.tulsaworld.com/site/articlepath.aspx?articleid=20130306_12_0_TEMPLE304066&rss_lnk=1,tulsaworld.com
2013-03-06,March 6 News: ‘Snowquester’ Has Arrived,http://thinkprogress.org.feedsportal.com/c/34726/f/638927/s/2944bd87/l/0Lthinkprogress0Borg0Cclimate0C20A130C0A30C0A60C1680A0A110Cmarch0E60Eclimate0Enews0C/story01.htm,feedsportal.com
2013-06-03,Two stabbed outside Oklahoma City arena at end of Thunder game,http://www.tulsaworld.com/site/articlepath.aspx?articleid=20130306_12_0_OKLAHO346204&rss_lnk=1,tulsaworld.com
2013-03-05,"CARACAS, Venezuela: Hugo Chavez, fiery Venezuelan leader, dies at 58",http://www.thestate.com/2013/03/05/2661509/hugo-chavez-fiery-venezuelan-leader.html#RSS=local,thestate.com
2013-03-06,No More Mister Nice Blog,http://nomoremister.blogspot.com/2013/03/no-one-on-american-right-actually-hated.html,nomoremister.blogspot.com
2013-03-06,"Maduro becomes Venezuela's interim leader and will run for president, just as Chavez ordained",http://www.startribune.com/world/195554401.html,startribune.com
2013-03-05,Athabasca University spent $125K to lobby province,http://www.cbc.ca/news/canada/edmonton/story/2013/03/05/edmonton-athabasca-university-lobbying.html?cmp=rss,cbc.ca
2013-03-05,New home 'nightmare' for northern Alberta family,http://www.cbc.ca/news/canada/edmonton/story/2013/03/05/edmonton-go-public-home-repairs-fight.html?cmp=rss,cbc.ca
2013-03-06,"1 million refugees have fled Syria, UN says",http://www.cbc.ca/news/world/story/2013/03/06/syrian-refugees.html?cmp=rss,cbc.ca
2013-03-06,Bolshoi dancer admits being behind acid attack,http://www.cbc.ca/news/arts/story/2013/03/06/bolshoi-acid-attack-confess-dancer.html?cmp=rss,cbc.ca
2013-03-06,"Chavez death brings uncertainty, hope to oil patch",http://seattletimes.nwsource.com/html/businesstechnology/2020495789_apuschavezdeathoilindustry.html?syndication=rss,nwsource.com
2013-03-06,Boston oilman Joe Kennedy mourns Chavez death,http://washingtonexaminer.com/boston-oilman-joe-kennedy-mourns-chavez-death/article/2523405?custom_click=rss,washingtonexaminer.com
2013-03-06,"Big Night For Team Venezuela, As Fans Focus On Chavez’ Death",http://miami.cbslocal.com/2013/03/06/big-night-for-team-venezuela-as-fans-focus-on-chavez-death/,cbslocal.com
2013-03-06,"Chavez death brings uncertainty, hope to oil patch",http://seattletimes.com/html/businesstechnology/2020495789_apuschavezdeathoilindustry.html?syndication=rss,seattletimes.com
2013-03-06,"Venezuela more equal, less stable now?",http://www.local10.com/news/money/Venezuela-more-equal-less-stable-now/-/1717308/19197776/-/9pu4mo/-/index.html,local10.com
2013-06-03,Man gets 2 life sentences in sex abuse of 10-year-old,http://www.tulsaworld.com/site/articlepath.aspx?articleid=20130306_14_0_Adistr887394&rss_lnk=1,tulsaworld.com
2013-03-06,Daily Kos: Cheers and Jeers: Wednesday,http://rss.dailykos.com/~r/dailykos/index/~3/BgvpaUurj3M/-Cheers-and-Jeers-Wednesday,dailykos.com
2013-03-06,Hugo Chavez Leaves a Legacy of Ruin,http://www.realclearpolitics.com/2013/03/06/hugo_chavez_leaves_a_legacy_of_ruin_303361.html,realclearpolitics.com
2013-03-06,Chavez’s death opens oil industry questions for Venezuela — RT Business,http://rt.com/business/chavez-venezuelan-death-oil-887/,rt.com
2013-03-06,Qui pour reprendre le flambeau de Hugo Chavez en Amérique latine?,http://www.rfi.fr/ameriques/20130306-reprendre-le-flambeau-hugo-chavez-amerique-latine,rfi.fr
2013-03-06,"Hugo Chavez widely mourned, but some hope change on way",http://www.sltrib.com/sltrib/world/55959731-68/chavez-president-venezuela-venezuelan.html.csp,sltrib.com
2013-03-06,"President Hugo Chavez and America's ""Backyard""",http://www.huffingtonpost.com/joseph-a-palermo/president-hugo-chavez-and_b_2815848.html?utm_hp_ref=world,huffingtonpost.com
2013-03-06,Chavez's death leaves many questions,http://www.local10.com/news/Chavez-s-death-leaves-many-questions/-/1717324/19197796/-/14ri5xfz/-/index.html,local10.com
2013-03-06,What Did the United States Do To Make Hugo Chavez So Mad?,http://feeds.slate.com/click.phdo?i=b8695137ba19e0e6cf2a98861049b1e5,slate.com
2013-03-06,EU lauds Hugo Chavez for social development,http://www.upi.com/Top_News/Special/2013/03/06/EU-notes-social-programs-under-Chavez/UPI-85541362581780/,upi.com
2013-03-06,Craig Murray on Hugo Chavez,http://feedproxy.google.com/~r/PoliticsInTheZeros/~3/_sFwt2jhrMM/,google.com
2013-03-06,"In Chavez’s death, Obama sees hope for ‘new chapter’",http://news.yahoo.com/blogs/ticket/chavez-death-obama-sees-hope-chapter-004942773--politics.html,yahoo.com
2013-03-06,Chavez 'demonization will grow in US' even after death — RT Op-Edge,http://rt.com/op-edge/venezuela-chavez-legacy-obama-889/,rt.com
2013-03-06,Students rekindle nighttime protest against tuition hikes,http://www.cbc.ca/news/canada/montreal/story/2013/03/06/montreal-student-protest-tuition-hike-parti-quebecois.html?cmp=rss,cbc.ca
2013-03-06,"Sean Penn, Oliver Stone mourn death of Hugo Chavez",http://www.foxnews.com/entertainment/2013/03/06/sean-penn-oliver-stone-mourn-death-hugo-chavez/,foxnews.com
2013-03-06,Henrique Capriles: Weston's Hope for Venezuela,http://blogs.browardpalmbeach.com/pulp/2013/03/henrique_capriles_westons_hope.php,browardpalmbeach.com
2013-03-06,Chavez's hand-picked successor takes command in Venezuela,http://feeds.foxnews.com/~r/foxnews/world/~3/OKw2KnUwe7Q/,foxnews.com
2013-03-06,Chavez's death not affecting oil — yet,http://feeds.bizjournals.com/~r/industry_5/~3/YKYaehXqLic/chavezs-death-not-affecting-oil---yet.html,bizjournals.com
2013-03-05,A look at Hugo Chavez's life,http://seattletimes.com/html/nationworld/2020490797_apltvenezuelahugochavezbiobox.html?syndication=rss,seattletimes.com
2013-03-06,Thank you Hugo Chavez,http://feedproxy.google.com/~r/LabourListLatestPosts/~3/9iMJenxWX5o/,google.com
2013-03-06,Little reaction in oil market to Chavez death,http://seattletimes.com/html/businesstechnology/2020492078_apoilprices.html?syndication=rss,seattletimes.com
2013-03-05,Key dates in Hugo Chavez's political life,http://seattletimes.com/html/nationworld/2020490798_apltvenezuelahugochavezchronologylong.html?syndication=rss,seattletimes.com
2013-03-06,"Hugo Chavez has died, Venezuela in mourning",http://blog.foreignpolicy.com/node/1423063,foreignpolicy.com
2013-06-03,"Sean Penn On Hugo Chavez's Death: ""I Lost A Friend"" (Barf Alert)",http://www.freerepublic.com/focus/f-news/2994018/posts,freerepublic.com
2013-03-06,Venezuelans In S. Florida Hope For Change With New Election,http://miami.cbslocal.com/2013/03/06/venezuelans-in-s-florida-hope-for-change-with-new-election/,cbslocal.com
2013-03-06,Democrats slammed for comments about Hugo Chavez,http://rssfeeds.usatoday.com/~r/UsatodaycomPolitics-TopStories/~3/nxYSf0UTsJA/,usatoday.com
2013-03-06,Home Depot quietly ends light-bulb-recycling program,http://www.cbc.ca/news/technology/story/2013/03/06/ottawa-home-depot-cfl-recycling-bulbs-program-stopped-end-finish.html?cmp=rss,cbc.ca
2013-03-06,Microsoft fined $752M by European Commission,http://www.cbc.ca/news/technology/story/2013/03/06/technology-microsoft-ec-fine-european.html?cmp=rss,cbc.ca
2013-06-03,"Blackwell firefighter, police officer accused of possessing unregistered AK-47 machine gun",http://www.tulsaworld.com/site/articlepath.aspx?articleid=20130306_12_0_OKLAHO435340&rss_lnk=1,tulsaworld.com
2013-06-03,Ryal Public School board suspends superintendent,http://www.tulsaworld.com/site/articlepath.aspx?articleid=20130306_19_0_HENRYE222460&rss_lnk=1,tulsaworld.com
2013-06-03,Young girl dies in crash near Ada,http://www.tulsaworld.com/site/articlepath.aspx?articleid=20130306_12_0_OLHMIY495675&rss_lnk=1,tulsaworld.com
2013-03-06,Venezuela: First Reactions to Hugo Chávez’s Death · Global Voices,http://globalvoicesonline.org/2013/03/06/venezuela-first-reactions-to-hugo-chavezs-death/,globalvoicesonline.org
2013-06-03,Chavez Death: Venezuelans In Us Hopeful Of Change,http://www.freerepublic.com/focus/f-news/2994009/posts,freerepublic.com
2013-03-06,5 embarrassingly bad rap videos that should have never been made,http://news.yahoo.com/5-embarrassingly-bad-rap-videos-never-made-085500678.html,yahoo.com
2013-03-05,Venezuelans pour into Plaza Bolivar to honor Chávez's socialist revolution (+video),http://rss.csmonitor.com/~r/feeds/world/~3/1tVI42hjc_w/Venezuelans-pour-into-Plaza-Bolivar-to-honor-Chavez-s-socialist-revolution-video,csmonitor.com
2013-03-06,Democrats slammed for comments about Hugo Chavez,http://rssfeeds.usatoday.com/~r/usatoday-NewsTopStories/~3/nxYSf0UTsJA/,usatoday.com
2013-03-06,"Morning Digest: March 6, 2013",http://www.politickernj.com/63755/morning-digest-march-6-2013,politickernj.com
2013-03-06,The presidency is not powerless,http://news.yahoo.com/presidency-not-powerless-065200383.html,yahoo.com
2013-03-06,"After Hugo Chavez, what's next for Venezuela (and the world)?",http://news.yahoo.com/hugo-chavez-whats-next-venezuela-world-064500284.html,yahoo.com
2013-03-06,"Hugo Chavez, Ken Livingstone and me",http://blogs.telegraph.co.uk/news/danhodges/100205661/hugo-chavez-ken-livingstone-and-me/,telegraph.co.uk
2013-06-03,Little reaction in oil market to Chavez death,http://www.dailyherald.com/article/20130306/business/703069892/,dailyherald.com
2013-03-05,Service dogs help military veterans cope with PTSD,http://www.cbc.ca/news/canada/manitoba/story/2013/03/05/mb-veterans-ptsd-service-dogs-manitoba.html?cmp=rss,cbc.ca
2013-03-06,"Babies, sick kids moved as fire hits Winnipeg hospital",http://www.cbc.ca/news/canada/manitoba/story/2013/03/06/mb-fire-childrens-hospital-winnipeg.html?cmp=rss,cbc.ca
2013-03-05,Community paramedic service coming to Winnipeg,http://www.cbc.ca/news/canada/manitoba/story/2013/03/05/mb-community-paramedics-winnipeg.html?cmp=rss,cbc.ca
2013-03-06,"Cabrera homers, has big night for Team Venezuela",http://feedproxy.google.com/~r/bostonherald/~3/X7PajjpPZHc/cabrera_homers_has_big_night_for_team_venezuela,google.com
2013-03-06,A.M. Roundup: Minimum wage bill clears Assembly,http://blog.timesunion.com/capitol/archives/180721/a-m-roundup-minimum-wage-bill-clears-assembly/,timesunion.com
2013-03-06,Venezuela's Chavez dies,http://www.signalscv.com/section/287/article/90727/,signalscv.com
2013-03-06,"Chavez Death Could Impact Trade, Diplomatic Ties With China",http://www.voanews.com/content/analysts-chavez-death-could-impact-trade-diplomatic-ties-with-china/1616121.html,voanews.com
2013-03-06,Global economic growth to remain very uneven in 2013,http://news.yahoo.com/global-economic-growth-remain-very-130000796.html,yahoo.com
2013-03-06,"S50::A thorn to US, a hero to socialists, a saint to Iran's leader, Chavez remembered around world",http://news.yahoo.com/thorn-us-hero-socialists-saint-irans-leader-chavez-132857530.html,yahoo.com
2013-03-06,China watching Venezuela in wake of Chavez's death,http://www.upi.com/Business_News/Energy-Resources/2013/03/06/China-wary-of-post-Chavez-pivot/UPI-30871362576928/,upi.com
2013-06-03,"Chavez death brings uncertainty, hope to oil patch",http://www.dailyherald.com/article/20130306/business/703069910/,dailyherald.com
2013-03-06,Chavez death: Venezuelans in US hopeful new elections will bring change,http://www.nola.com/politics/index.ssf/2013/03/chavez_death_venezuelans_in_us.html,nola.com
2013-03-06,Chavez death: Venezuelans in US hopeful of change,http://www.local10.com/news/Chavez-death-Venezuelans-in-US-hopeful-of-change/-/1717324/19200058/-/saavw4z/-/index.html,local10.com
2013-03-05,"The Roundup for March 5, 2013",http://feedproxy.google.com/~r/firedoglake/fdl/~3/BZkIchwNh8I/,google.com
2013-03-06,Venezuelans search for luxury overseas homes 'to flee Chavez socialism',http://telegraph.feedsportal.com/c/32726/f/568514/s/2943485d/l/0L0Stelegraph0O0Cproperty0Coverseasproperty0C99124940CVenezuelans0Esearch0Efor0Eluxury0Eoverseas0Ehomes0Eto0Eflee0EChavez0Esocialism0Bhtml/story01.htm,feedsportal.com
2013-03-06,Little reaction in oil market to Chavez death,http://seattletimes.nwsource.com/html/businesstechnology/2020492078_apoilprices.html?syndication=rss,nwsource.com
2013-03-06,Sean Penn on Chavez: 'I lost a friend',http://feeds.politico.com/click.phdo?i=06db8bc6708fbd58ea3abea851316582,politico.com
2013-03-06,"THE REAL ROGER AILES -- BILL GATES kicks off Playbook Cocktails -- Cronkite awards: POLITICO/ABC7, CNN, Jon Karl, Martha Raddatz -- Zeke Miller to TIME -- Bday: Greenspan, Webster, Bond",http://feeds.politico.com/click.phdo?i=dfbf738c27e48954826b788e55ddec2a,politico.com
2013-03-06,"Stone, Penn mourn death of Venezuelan President Hugo Chavez",http://www.upi.com/Entertainment_News/Movies/2013/03/06/Stone-Penn-mourn-death-of-Venezuelan-President-Hugo-Chavez/UPI-57901362575589/,upi.com
2013-03-06,Hollywood bids a fond farewell to Hugo Chavez,http://feeds.politico.com/click.phdo?i=81e33faa44593062ab0821d986061c8a,politico.com
2013-03-06,Latin America on brink of tough post-Chavez geopolitical battle — RT Op-Edge,http://rt.com/op-edge/latin-america--post-chavez-geopolitical-battle-882/,rt.com
2013-03-06,"A thorn to US, a hero to socialists, a saint to Iran's leader, Chavez remembered around world",http://www.startribune.com/world/195533391.html,startribune.com
2013-03-06,"Despite New Hopes, U.S. Treads Cautiously After Death of Venezuela's Chavez",http://www.nytimes.com/reuters/2013/03/06/world/americas/06reuters-venezuela-chavez-usa.html?partner=rss&emc=rss,nytimes.com
2013-03-06,Stunned Cuba Ponders Future Without Chavez,http://www.nytimes.com/reuters/2013/03/06/world/americas/06reuters-venezuela-chavez-cuba.html?partner=rss&emc=rss,nytimes.com
2013-03-06,U.N. Human Rights Council Holds Minute's Silence for Chavez,http://www.nytimes.com/reuters/2013/03/06/world/europe/06reuters-venezuela-chavez-un.html?partner=rss&emc=rss,nytimes.com
2013-03-05,Venezuelan President Hugo Chávez Has Died,http://www.npr.org/blogs/thetwo-way/2013/03/05/173559844/president-hugo-chavez-has-died-vice-president-says?ft=1&f=1001,npr.org
2013-03-06,Swaps bill comes back,http://feeds.politico.com/click.phdo?i=94af8f1da782751ff07c0d94236de734,politico.com
2013-03-06,Titcombe Park to be naturalized area of tall grass,http://www.cbc.ca/news/canada/windsor/story/2013/03/06/wdr-titcombe-park-windsor-province.html?cmp=rss,cbc.ca
2013-03-06,Are Will and Kate having a girl? Royal hint dropped,http://www.cbc.ca/news/canada/windsor/story/2013/03/06/kate-baby-girl.html?cmp=rss,cbc.ca
2013-03-06,"Pet therapy comes to University of Windsor, Hôtel-Dieu Grace",http://www.cbc.ca/news/canada/windsor/story/2013/03/06/wdr-pet-therapy-university-windsor.html?cmp=rss,cbc.ca
2013-03-06,"Chavez widely mourned, but some hope change on way",http://seattletimes.com/html/nationworld/2020492070_aphugochavezworldreactions.html?syndication=rss,seattletimes.com
2013-03-06,"Chavez widely mourned, but some hope change on way",http://seattletimes.nwsource.com/html/nationworld/2020492070_aphugochavezworldreactions.html?syndication=rss,nwsource.com
2013-03-06,10 Things to Know for Today,http://www.utsandiego.com/news/2013/mar/06/10-things-to-know-for-today/,utsandiego.com
2013-03-05,Hugo ChÃ¡vez Dead at 58: Good Riddance!,http://www.freerepublic.com/focus/f-news/2993972/posts,freerepublic.com
2013-03-06,The Chavez Record,http://www.realclearpolitics.com/articles/2013/03/06/venezuela_after_chavez_117303.html,realclearpolitics.com
2013-03-06,"Chavez widely mourned, but some hope change on way",http://www.morningjournal.com/articles/2013/03/06/news/doc513738b320d51418187561.txt,morningjournal.com
2013-03-06,Hugo Chavez dies: what happens next in Venezuela?,http://telegraph.feedsportal.com/c/32726/f/564430/s/29437a5b/l/0L0Stelegraph0O0Cnews0Cworldnews0Csouthamerica0Cvenezuela0C99123480CHugo0EChavez0Edies0Ewhat0Ehappens0Enext0Ein0EVenezuela0Bhtml/story01.htm,feedsportal.com
2013-03-06,Hugo Chavez ou le socialisme du 21e siècle,http://www.rfi.fr/ameriques/20130306-venezuela-chavez-socialisme-petrole-diplomatie,rfi.fr
2013-03-06,90 years of the BBC in Scotland,http://www.bbc.co.uk/news/uk-scotland-21684473#sa-ns_mchannel=rss&ns_source=PublicRSS20-sa,bbc.co.uk
2013-03-06,Israel Matzav: Chavez is dead,http://israelmatzav.blogspot.com/2013/03/chavez-is-dead.html,israelmatzav.blogspot.com
2013-03-06,The moment Syrians become refugees,http://www.bbc.co.uk/news/world-middle-east-21685103#sa-ns_mchannel=rss&ns_source=PublicRSS20-sa,bbc.co.uk
2013-06-03,Venezuelan President Hugo Chavez dies at 58,http://www.thereporter.com/news/ci_22728153/venezuelan-president-hugo-chavez-dies-at-58?source=rss,thereporter.com
2013-03-06,Chavez's death leaves many questions,http://www.wpbf.com/news/nationalnews/Chavez-s-death-leaves-many-questions/-/8788944/19197796/-/aap3vwz/-/index.html?absolute=true,wpbf.com
2013-03-06,Latin America forever changed by the ‘big guy’ Hugo Chavez,http://feeds.nydailynews.com/~r/nydnrss/news/politics/~3/cYshBXtM9AM/story01.htm,nydailynews.com
2013-03-06,6 March SWJ Roundup,http://smallwarsjournal.com/node/13853,smallwarsjournal.com
2013-03-06,Nation columnist: Chávez ‘wasn’t authoritarian enough’,http://washingtonexaminer.com/nation-columnist-chvez-wasnt-authoritarian-enough/article/2523394?custom_click=rss,washingtonexaminer.com
2013-03-06,Bluegrass Pundit: Sad: Hugo Chavez replacement wastes no time polishing his radical credentials,http://feedproxy.google.com/~r/bluegrasspundit/Nwhs/~3/IwDV9yqFUI0/sad-hugo-chavez-replacement-wastes-no.html,google.com
2013-03-06,Ex-US Rep. Joe Kennedy mourns death of Chavez,http://feeds.foxnews.com/~r/foxnews/politics/~3/m19DmzSJEPg/,foxnews.com
2013-03-06,"Even after death, Chavez gets choice of successor",http://www.troyrecord.com/articles/2013/03/06/news/doc513732c0f2b2b370067896.txt,troyrecord.com
2013-03-06,Steve Reich's Radiohead moment,http://www.bbc.co.uk/news/entertainment-arts-21682075#sa-ns_mchannel=rss&ns_source=PublicRSS20-sa,bbc.co.uk
2013-03-05,Stunned Cuba Ponders Future Without Chavez,http://www.newsmax.com/Headline/cuba-ponders-future-chavez/2013/03/05/id/493325,newsmax.com
2013-03-06,U.N. Human Rights Council Holds Minute's Silence for Chavez,http://www.newsmax.com/Headline/article/2013/03/06/id/493346,newsmax.com
2013-03-06,"Chavez's handpicked successor at helm, for time being",http://feeds.cbsnews.com/~r/CBSNewsMain/~3/lt45P4AAPbY/,cbsnews.com
2013-03-06,Venezuela announces death of President Chavez,http://morningjournal.com/articles/2013/03/06/news/doc513670b5725de933295332.txt,morningjournal.com
2013-03-05,Venezuelans pour into Plaza Bolivar to honor Chávez's socialist revolution (+video),http://www.csmonitor.com/World/Americas/Latin-America-Monitor/2013/0305/Venezuelans-pour-into-Plaza-Bolivar-to-honor-Chavez-s-socialist-revolution-video,csmonitor.com
2013-03-05,Jimmy Carter Wants Hugo Chavez Remembered for ÂGains Made for the Poor and VulnerableÂ,http://www.freerepublic.com/focus/f-news/2993962/posts,freerepublic.com
2013-03-06,"In post-Chavez era, don’t bet on better relations with Venezuela yet",http://feeds.bizjournals.com/~r/bizj_albany/~3/iSj5JKu2Snk/in-post-chavez-era-dont-bet-on.html,bizjournals.com
2013-03-06,Chavez death: Venezuelans in US hopeful of change,http://feedproxy.google.com/~r/bostonherald/~3/pcn6GJR_Pj8/chavez_death_venezuelans_in_us_hopeful_of_change_0,google.com
2013-03-05,Venezuelans in U.S. hopeful of change after Chavez death,http://feedproxy.google.com/~r/tbo/news/~3/eFQFWK1RgAk/,google.com
2013-03-06,"Even after death, Chavez gets choice of successor",http://seattletimes.com/html/nationworld/2020492039_apltvenezuelachavez.html?syndication=rss,seattletimes.com
2013-03-06,U.N. Human Rights Council holds minute's silence for Chavez,"http://feedproxy.google.com/~r/baltimoresun/news/nation/rss2/~3/mrqswaKGrmU/sns-rt-us-venezuela-chavez-unbre9250gh-20130306,0,3316753.story",google.com
2013-06-03,Shooting suspect arrested,http://www.tulsaworld.com/site/articlepath.aspx?articleid=20130306_298_0_TlaCut759054&rss_lnk=1,tulsaworld.com
2013-03-06,Orange County Register,http://hosted.ap.org/dynamic/stories/L/LT_VENEZUELA_CHAVEZ_PHOTO_GALLERY?SITE=CAANR&SECTION=HOME&TEMPLATE=DEFAULT,ap.org
2013-03-06,"Cuba, oil prices after Chavez's death",http://www.local10.com/news/Cuba-oil-prices-after-Chavez-s-death/-/1717324/19198816/-/kfby0hz/-/index.html,local10.com
2013-03-06,"Even after death, Chavez gets choice of successor",http://www.timesunion.com/news/world/article/Even-after-death-Chavez-gets-choice-of-successor-4331559.php,timesunion.com
2013-03-06,"Hugo Chavez loses battle with cancer, dies at the age of 58; Venezuelan president was reviled as a power-hungry dictator, but also loved as a champion of the poor",http://feeds.nydailynews.com/~r/nydnrss/news/politics/~3/CILMOWfT6dM/story01.htm,nydailynews.com
2013-03-06,U.N. Human Rights Council holds minute's silence for Chavez,http://news.yahoo.com/u-n-human-rights-council-holds-minutes-silence-113532801.html,yahoo.com
2013-03-06,<!-- document.write(partnertitle); // -->,http://hosted.ap.org/dynamic/stories/U/US_CHAVEZ_VENEZUELANS_IN_AMERICA_CTOL-?SITE=RIPRJ&SECTION=HOME&TEMPLATE=DEFAULT,ap.org
2013-03-06,"Even after death, Chavez gets choice of successor",http://seattletimes.nwsource.com/html/nationworld/2020492039_apltvenezuelachavez.html?syndication=rss,nwsource.com
2013-03-05,"Detroit Tigers' Miguel Cabrera homers, drives in four runs in first exhibition game with Team Venezuela",http://feedproxy.google.com/~r/detroit-tigers/~3/TvucpjuMPec/miguel_cabrera_starts_at_first.html,google.com
2013-03-05,Moment of deep pain': Venezuela erupts in emotion as interim president takes over,http://worldnews.nbcnews.com/_news/2013/03/05/17200203-moment-of-deep-pain-venezuela-erupts-in-emotion-as-interim-president-takes-over?lite,nbcnews.com
2013-03-05,World leaders pay tribute to Hugo Chavez as wave of grief washes over Latin America,http://worldnews.nbcnews.com/_news/2013/03/05/17199243-world-leaders-pay-tribute-to-hugo-chavez-as-wave-of-grief-washes-over-latin-america?lite,nbcnews.com
2013-03-06,What's next? Chavez's death leaves many questions,http://rss.cnn.com/~r/rss/cnn_mostpopular/~3/IEOsY37RCBg/index.html,cnn.com
2013-03-06,'A sorrow so big we cannot speak': Venezuela declares seven days of mourning as beloved leader Hugo Chavez dies at 58… and even in death his orders are STILL being followed,http://www.dailymail.co.uk/news/article-2288895/Hugo-Chavez-dead-Venezuela-declares-seven-days-mourning-beloved-leader-dies-58.html?ITO=1490&ns_mchannel=rss&ns_campaign=1490,dailymail.co.uk
2013-06-03,UN agency: Syrian refugee figure hits 1 million,http://www.tulsaworld.com/site/articlepath.aspx?articleid=20130306_13_0_BEIRUT388247&rss_lnk=1,tulsaworld.com
2013-06-03,"Winter snowstorm pummels Midwest, heads toward DC",http://www.tulsaworld.com/site/articlepath.aspx?articleid=20130306_13_0_HAGERS251251&rss_lnk=1,tulsaworld.com
