publish_date,title,url,media_name
2025-05-06,In Roemenië stond de gestolen helm van Cotofenesti op de voorkant van schoolboeken,https://www.nrc.nl/nieuws/2025/05/06/in-roemenie-stond-de-gestolen-helm-van-cotofenesti-op-de-voorkant-van-schoolboeken-a4892209,nrc.nl
2025-05-08,Moneda națională se depreciază pe fondul instabilității politice din România,https://www.euractiv.ro/economic/moneda-nationala-se-depreciaza-pe-fondul-instabilitatii-politice-din-romania-73010,euractiv.ro
2025-05-08,Motivul ascuns al demisiei lui Ciolacu,https://www.cotidianul.ro/motivul-ascuns-de-ce-ar-fi-demisionat-de-fapt-ciolacu/,cotidianul.ro
2025-05-08,Comunicat de presă – Corneliu Mureșan,https://ziarulunirea.ro/comunicat-de-presa-corneliu-muresan-scurt-bilant-al-guvernarii-social-democrate-masuri-concrete-de-sprijin-pentru-oameni-si-comunitati-locale-940601/,ziarulunirea.ro
2025-05-08,"„Nu îmi este rușine cu ceea ce am făcut”. Ciolacu, bilanțul",https://www.national.ro/politica/nu-imi-este-rusine-cu-ceea-ce-am-facut-ciolacu-prezinta-bilantul-psd-la-guvernare-in-primul-sau-mesaj-dupa-demisie-849685.html/,national.ro
2025-05-08,Ponta susÈine cÄ adevÄratul motiv pentru care Ciolacu a demisionat este cÄ nu mai sunt bani la Guvern,https://adevarul.ro/politica/ponta-sustine-ca-adevaratul-motiv-pentru-care-2441968.html,adevarul.ro
2025-05-08,Statul acceptă dobânzi record la un împrumut pe termen scurt,https://cursdeguvernare.ro/statul-accepta-dobanzi-record-la-un-imprumut-pe-termen-scurt.html,cursdeguvernare.ro
2025-05-08,"Romania’s political crisis heightens recession risks, employers say",https://kdal610.com/2025/05/08/romanias-political-crisis-heightens-recession-risks-employers-say/,kdal610.com
2025-05-08,"Romania’s political crisis heightens recession risks, employers say",https://wibqam.com/2025/05/08/romanias-political-crisis-heightens-recession-risks-employers-say/,wibqam.com
2025-05-08,"Romania’s political crisis heightens recession risks, employers say",https://740thefan.com/2025/05/08/romanias-political-crisis-heightens-recession-risks-employers-say/,740thefan.com
2025-05-08,Marcel Ciolacu își face bilanțul de la Guvern,https://jurnalul.ro/stiri/politica/ciolacu-bilant-guvern-997443.html,jurnalul.ro
2025-05-08,"Romania’s political crisis heightens recession risks, employers say",https://whbl.com/2025/05/08/romanias-political-crisis-heightens-recession-risks-employers-say/,whbl.com
2025-05-08,"Florin Călinescu: „Ca să fii PREȘEDINTE trebuie să parcurgi o cantitate de viață""",https://www.gandul.ro/ai-aflat/florin-calinescu-ca-sa-fii-presedinte-trebuie-sa-parcurgi-o-cantitate-de-viata-20511572,gandul.ro
2025-05-08,"Romania’s political crisis heightens recession risks, employers say",https://wiky.com/2025/05/08/romanias-political-crisis-heightens-recession-risks-employers-say/,wiky.com
2025-05-08,"Cum ar arăta Guvernul AUR-POT dacă Simion câștigă prezidențialele. Georgescu sau Gavrilă, premier. Lista miniștrilor",https://www.antena3.ro/politica/cum-ar-arata-guvernul-aur-pot-daca-simion-castiga-prezidentialele-georgescu-sau-gavrila-premier-lista-completa-a-ministrilor-745423.html,antena3.ro
2025-05-08,"Romania’s political crisis heightens recession risks, employers say",https://wmbdradio.com/2025/05/08/romanias-political-crisis-heightens-recession-risks-employers-say/,wmbdradio.com
2025-05-08,"Romania’s political crisis heightens recession risks, employers say",https://wsau.com/2025/05/08/romanias-political-crisis-heightens-recession-risks-employers-say/,wsau.com
2025-05-08,Un primar PSD și-a declarat susținerea pentru Nicușor Dan la alegerile prezidențiale: „Trebuie să alegem democrația”,https://www.libertatea.ro/stiri/primar-psd-buzau-sustinere-nicusor-dan-5298869,libertatea.ro
2025-05-08,"Romania’s political crisis heightens recession risks, employers say",https://kfgo.com/2025/05/08/romanias-political-crisis-heightens-recession-risks-employers-say/,kfgo.com
2025-05-08,"PSD, sponsorizat de gruparea Coldea - Dumbravă - Trăilă 500.000 de euro de la condamnatul Tufan",https://gazetadecluj.ro/psd-sponsorizat-de-gruparea-coldea-dumbrava-traila-500-000-de-euro-de-la-condamnatul-tufan/,gazetadecluj.ro
2025-05-08,"Marcel Ciolacu: „A fi premier nu este o meserie, ci o onoare supremă prin care îți poți servi țara și pe români”",https://www.monitorulcj.ro/politica-administratie/128671-marcel-ciolacu-a-fi-premier-nu-este-o-meserie-ci-o-onoare-suprema-prin-care-iti-poti-servi-tara-si-pe-romani,monitorulcj.ro
2025-05-08,"Avertisment de la BNR: „Dacă nu schimbăm direcția, Titanic scrie pe noi!”",https://www.libertatea.ro/stiri/avertisment-de-la-bnr-daca-nu-schimbam-directia-titanic-scrie-pe-noi-5298979,libertatea.ro
2025-05-08,Victor Ponta îl acuză pe Marcel Ciolacu că a demisionat din alt motiv decât cel oficial. „Adică băgăm și firmele în blocaj și faliment” / Ce le-a transmis lui George Simion și Nicușor Dan,https://hotnews.ro/victor-ponta-il-acuza-pe-marcel-ciolacu-ca-a-demisionat-din-alt-motiv-decat-cel-oficial-adica-bagam-si-firmele-in-blocaj-si-faliment-ce-le-a-transmis-lui-george-simion-si-nicusor-1968821,hotnews.ro
2025-05-08,Espainiako Estatuaren eta Israelen arteko harreman militarrak “inoiz baino estuagoak” izan dira 2023ko urriaz geroztik,https://www.argia.eus/albistea/espainiako-estatuaren-eta-israelen-arteko-harreman-militarrak-inoiz-baino-estuagoak-izan-dira-2023ko-urriaz-geroztik?mtm_campaign=HariaRSS,argia.eus
2025-05-08,Székely István Gergő: Simion hatalomra jutása esetén elszabadulhat a kisebbségellenes indulat – de ennél is nagyobb a gazdasági és a politikai veszély,https://maszol.ro/belfold/Szekely-Istvan-Gergo-Simion-hatalomra-jutasa-eseten-elszabadul-a-kisebbsegellenes-indulat-de-ennel-is-nagyobb-a-gazdasagi-veszely,maszol.ro
2025-05-08,Romanian Ex-Candidate Antonescu Says He Will Not Support Nicusor Dan in Presidential Run-Off,https://www.bta.bg/en/news/balkans/886079-romanian-ex-candidate-antonescu-says-he-will-not-support-nicusor-dan-in-presiden,bta.bg
2025-05-08,"Romania's political crisis heightens recession risks, employers say",https://www.reuters.com/markets/europe/romanias-political-crisis-heightens-recession-risks-employers-say-2025-05-08/,reuters.com
2025-05-08,"(video) Scandal în Parlament, pe Portul Giurgiulești. Voronin: Noi l-am construit, iar voi îl dați de pomană, trădare. Grosu: Cu mânuța matale l-ai dat",https://unimedia.info/ro/news/2874b0c1a2cdf81b/video-scandal-in-parlament-pe-portul-giurgiulesti-voronin-noi-l-am-construit-iar-voi-il-dati-de-pomana-tradare-grosu-cu-manuta-matale-l-ai-dat.html?utm_source=rss&utm_medium=rss&utm_campaign=rss,unimedia.info
2025-05-08,"Analiză și dezbatere marca BZI LIVE cu invitatul special Eugen Teodorovici, fost ministru al Finanțelor publice respectiv Fondurilor europene",https://www.bzi.ro/analiza-si-dezbatere-marca-bzi-live-cu-invitatul-special-eugen-teodorovici-fost-ministru-al-finantelor-publice-respectiv-fondurilor-europene-5251264,bzi.ro
2025-05-08,"Top talk-show săptămânal BZI LIVE alături de invitatul permanent Diana Șoșoacă, europarlamentar român și liderul S.O.S. România! De la Alegeri Prezidențiale, dezastru economic și apel către Comisia Europeană",https://www.bzi.ro/top-talk-show-saptamanal-bzi-live-alaturi-de-invitatul-permanent-diana-sosoaca-europarlamentar-roman-si-liderul-s-o-s-romania-de-la-alegeri-prezidentiale-dezastru-economic-si-apel-catre-comisia-eu-5251261,bzi.ro
2025-05-08,"Președintele interimar al PNL, Cătălin PREDOIU, a fost numit premier interimar al României pentru a doua oară!",https://jurnalgiurgiuvean.ro/presedintele-interimar-al-pnl-catalin-predoiu-a-fost-numit-premier-interimar-al-romaniei/,jurnalgiurgiuvean.ro
2025-05-08,"Romania could ""rerun ballot"" over Russia interference fears",https://www.newsweek.com/romania-russia-election-ballot-2069534,newsweek.com
2025-05-08,"Mesajul ministrului Economiei pentru mediul privat și investitorii străini: România e o țară stabilă, deschisă spre investiții străine",https://www.europafm.ro/mesaj-ministrul-economiei-mediu-privat-investitori-straini-romania-tara-stabila/,europafm.ro
2025-05-08,Euro Depășește Pragul de 5 Lei: Maxim Istoric Într-un Context Economic Fragil și Politic Exploziv – De Ce a Crescut Moneda Europeană?,https://www.thepoc.ro/cutremur-pe-piata-valutara-euro-atinge-la-8-mai-2025-un-maxim-istoric-de-5-1222-lei-de-ce-a-crescut-moneda-europeana/,thepoc.ro
2025-05-08,"Primar PSD: Toată conducerea PSD trebuie să demisioneze, în caz contrar vom coborî sub 10%",https://www.mediafax.ro/politic/primar-psd-toata-conducerea-psd-trebuie-sa-demisioneze-in-caz-contrar-vom-cobori-sub-10-23549471,mediafax.ro
2025-05-08,S-au mărit pensiile cu peste 70%. Anunțul anului pentru vârstnici: Act de dreptate făcut seniorilor!,https://www.capital.ro/s-au-marit-pensiile-cu-peste-70-anuntul-anului-pentru-varstnici-act-de-dreptate-facut-seniorilor.html,capital.ro
2025-05-08,Cum s-ar putea modifica PNRR. Marcel Boloș: Guvernul a aprobat continuarea procesului de renegociere a PNRR,https://www.capital.ro/cum-s-ar-putea-modifica-pnrr-marcel-bolos-guvernul-a-aprobat-continuarea-procesului-de-renegociere-a-pnrr.html,capital.ro
2025-05-08,Pánikba estek a befektetők: elmaradt kötvénykibocsátás és rekordmagas hozamok Magyarország szomszédjánál,https://www.portfolio.hu/gazdasag/20250508/panikba-estek-a-befektetok-elmaradt-kotvenykibocsatas-es-rekordmagas-hozamok-magyarorszag-szomszedjanal-759795,portfolio.hu
2025-05-08,Megvonta a PSD-kormányzás mérlegét Ciolacu: büszke és elégedett,https://maszol.ro/belfold/Megvonta-a-PSD-kormanyzas-merleget-Ciolacu-buszke-es-elegedett,maszol.ro
2025-05-08,Ellátja napi teendőit az ideiglenes kormány,https://maszol.ro/belfold/Ellatja-napi-teendoi-az-ideiglenes-kormany,maszol.ro
2025-05-08,Florin Barbu: ”Politica Agricolă Comună trebuie să rămână un pilon al securității alimentare și al coeziunii europene”,https://gazetaoltului.ro/nationale/florin-barbu-politica-agricola-comuna-trebuie-sa-ramana-un-pilon-al-securitatii-alimentare-si-al-coeziunii-europene/,gazetaoltului.ro
2025-05-08,"Radu Marinescu, despre justiție și calcule politice",https://www.cotidianul.ro/radu-marinescu-despre-justitie-si-calcule-politice/,cotidianul.ro
2025-05-08,"Ciolacu, în loc de adio. A fi premier e onoare",https://www.cotidianul.ro/ciolacu-in-loc-de-adio-a-fi-premier-e-onoare/,cotidianul.ro
2025-05-08,Marcel Ciolacu takes stock of the government,https://www.mediafax.ro/english/marcel-ciolacu-takes-stock-of-the-government-23549432,mediafax.ro
2025-05-08,Ministrul Economiei din Ungaria susține că electrificarea căii ferate este viitorul în domeniul transporturilor în economia verde europeană,https://www.bihon.ro/stirile-judetului-bihor/ministrul-economiei-din-ungaria-sustine-ca-electrificarea-caii-ferate-este-viitorul-in-domeniul-transporturilor-in-economia-verde-europeana-4915403/?utm_source=rss&utm_medium=referral&utm_campaign=hiraggregator,bihon.ro
2025-05-08,"Activitățile Guvernului interimar Predoiu, ținute departe de ochii publicului și comunicate ulterior",https://www.euractiv.ro/politic-intern/activitatile-guvernului-interimar-predoiu-tinute-departe-de-ochii-publicului-si-comunicate-ulterior-73004,euractiv.ro
2025-05-08,"""Mie nu îmi este rușine cu ceea ce am făcut"". Ciolacu a schițat un scurt bilanț de guvernare",https://www.euractiv.ro/politic-intern/mie-nu-imi-este-rusine-cu-ceea-ce-am-facut-.-ciolacu-a-schitat-un-scurt-bilant-de-guvernare-73008,euractiv.ro
2025-05-08,Marcel Ciolacu şi-a făcut bilanţul de premier: 'Nu îmi este ruşine cu ce am făcut la guvernare',https://cugetliber.ro/stiri-politica-administratie-marcel-ciolacu-si-a-facut-bilantul-de-premier-nu-imi-este-rusine-cu-ce-am-facut-la-guvernare-528701,cugetliber.ro
2025-05-08,"Guvernul interimar Predoiu și-a început discret mandatul, cu ușile închise",https://cugetliber.ro/stiri-politica-administratie-guvernul-interimar-predoiu-si-a-inceput-discret-mandatul-cu-usile-inchise-528706,cugetliber.ro
2025-05-08,"Igor Grosu Ã®i rÄspunde lui RareÈ Bogdan, indignat de scorul lui Antonescu Ã®n R. Moldova: Decizia suveranÄ a fiecÄrui alegÄtor",https://adevarul.ro/stiri-externe/republica-moldova/igor-grosu-ii-raspunde-lui-rares-bogdan-indignat-2441805.html,adevarul.ro
2025-05-08,RomÃ¢nia vrea renegocierea PNRR pentru a evita pierderea de fonduri europene,https://adevarul.ro/economie/romania-vrea-renegocierea-pnrr-pentru-a-evita-2441839.html,adevarul.ro
2025-05-08,âNu Ã®mi este ruÈine cu ceea ce am fÄcutâ. Ciolacu prezintÄ bilanÈul guvernÄrii PSD Ã®n primul mesaj dupÄ demisie,https://adevarul.ro/politica/nu-imi-este-rusine-cu-ceea-ce-am-facut-ciolacu-2441800.html,adevarul.ro
2025-05-08,"Guvernul a aprobat renegocierea PNRR. Marcel Boloș: Obiectivul principal este să absorbim granturi de 13,1 mld. euro fără penalități",https://cursdeguvernare.ro/guvernul-a-aprobat-renegocierea-pnrr-marcel-bolos-obiectivul-principal-este-sa-absorbim-granturi-de-131-mld-euro-fara-penalitati.html,cursdeguvernare.ro
2025-05-08,"Marcel Ciolacu, primul mesaj după demisie: „Nu îmi e rușine cu ce am făcut la guvernare”",https://www.libertatea.ro/stiri/ciolacu-psd-mesaj-demisie-bilant-psd-5298501,libertatea.ro
2025-05-08,Tổng thống Mỹ tuyên bố không nhượng bộ trong chính sách áp thuế cao với hàng hóa Trung Quốc,https://truyenhinhthanhhoa.vn/tong-thong-my-tuyen-bo-khong-nhuong-bo-trong-chinh-sach-ap-thue-cao-voi-hang-hoa-trung-quoc-180250508160007719.htm,truyenhinhthanhhoa.vn
2025-05-08,Nga thực hiện lệnh ngừng bắn 72 giờ nhân dịp Ngày Chiến thắng,https://truyenhinhthanhhoa.vn/nga-thuc-hien-lenh-ngung-ban-72-gio-nhan-dip-ngay-chien-thang-180250508154315803.htm,truyenhinhthanhhoa.vn
2025-05-08,Hàn Quốc: Triều Tiên phóng nhiều tên lửa đạn đạo tầm ngắn ra biển Nhật Bản,https://truyenhinhthanhhoa.vn/han-quoc-trieu-tien-phong-nhieu-ten-lua-dan-dao-tam-ngan-ra-bien-nhat-ban-180250508154506428.htm,truyenhinhthanhhoa.vn
2025-05-08,Primul mesaj al lui Marcel Ciolacu după demisie: „Nu mi-e rușine”,https://hotnews.ro/primul-mesaj-al-lui-marcel-ciolacu-dupa-demisie-nu-mi-e-rusine-1968513,hotnews.ro
2025-05-08,"Marcel Ciolacu: ""A fi premier nu este o meserie, ci o onoare supremÄ""",https://www.bursa.ro/marcel-ciolacu-a-fi-premier-nu-este-o-meserie-ci-o-onoare-suprema-69685558,bursa.ro
2025-05-08,"Marcel BoloÅ: ""Guvernul a aprobat continuarea procesului de renegociere a PNRR""",https://www.bursa.ro/marcel-bolos-guvernul-a-aprobat-continuarea-procesului-de-renegociere-a-pnrr-21785551,bursa.ro
2025-05-08,"România își limitează planul de împrumuturi, cererea fiind tot mai mică din cauza instabilității politice",https://cursdeguvernare.ro/romania-isi-limiteaza-planul-de-imprumuturi-cererea-fiind-tot-mai-mica-din-cauza-instabilitatii-politice.html,cursdeguvernare.ro
2025-05-08,"Un lider PSD îl susține pe Nicușor Dan: Spălatul pe mâini este, poate, cea mai toxică opțiune a politicienilor",https://spotmedia.ro/stiri/politica/un-lider-psd-il-sustine-pe-nicusor-dan-spalatul-pe-maini-este-poate-cea-mai-toxica-optiune-a-politicienilor,spotmedia.ro
2025-05-08,Marcel Ciolacu îşi face bilanţul de la Guvern,https://www.mediafax.ro/politic/marcel-ciolacu-isi-face-bilantul-de-la-guvern-23549343,mediafax.ro
2025-05-08,"Radu Marinescu, nemulțumit de Nicușor Dan: Justiția trebuie să rămână în afara oricărui calcul politic",https://www.capital.ro/radu-marinescu-nemultumit-de-nicusor-dan-justitia-trebuie-sa-ramana-in-afara-oricarui-calcul-politic.html,capital.ro
2025-05-08,Ce majorități sunt în Parlament pentru formarea unui nou Executiv,https://jurnalul.ro/stiri/politica/majoritati-parlament-formare-nou-executiv-997418.html,jurnalul.ro
2025-05-08,Marcel Ciolacu prezintă bilanțul PSD la guvernare: „Știu că vor exista multe critici și mi le asum”,https://www.gandul.ro/politica/marcel-ciolacu-prezinta-bilantul-psd-la-guvernare-stiu-ca-vor-exista-multe-critici-si-mi-le-asum-20511221,gandul.ro
2025-05-08,"Marcel Ciolacu şi-a făcut bilanţul de premier: ""Nu îmi este ruşine cu ce am făcut la guvernare""",https://www.antena3.ro/politica/marcel-ciolacu-si-a-facut-bilantul-de-premier-nu-imi-este-rusine-cu-ce-am-facut-la-guvernare-745378.html,antena3.ro
2025-05-08,Prima decizie a premierului Cătălin Predoiu. Ședința a avut acces limitat,https://www.cancan.ro/prima-decizie-a-premierului-catalin-predoiu-sedinta-a-avut-acces-limitat-21194275,cancan.ro
2025-05-08,Primele măsuri luate de guvernul interimar condus de Cătălin Predoiu: Schimbări privind accesul presei la ședințele de guvern / Explicațiile purtătorului de cuvânt al Guvernului,https://hotnews.ro/primele-masuri-luate-de-guvernul-interimar-condus-de-catalin-predoiu-schimbari-privind-accesul-presei-la-sedintele-de-guvern-1968370,hotnews.ro
2025-05-08,Primarul PSD care votează cu Nicușor Dan: „Discut cu o mulțime de colegi primari din România și îmi împărtășesc opiniile”,https://hotnews.ro/primarul-psd-care-voteaza-cu-nicusor-dan-discut-cu-o-multime-colegi-primari-din-romania-si-imi-impartasesc-opiniile-1968445,hotnews.ro
2025-05-08,"Radu Marinescu, despre declaraţiile lui Nicușor Dan:„Justiţia trebuie să rămână în afara oricărui calcul politic”",https://www.mediafax.ro/politic/radu-marinescu-despre-declaratiile-lui-nicusor-danjustitia-trebuie-sa-ramana-in-afara-oricarui-calcul-politic-23549309,mediafax.ro
2025-05-08,"Claudiu Târziu, europarlamentar și membru ECR, despre demisia lui Marcel Ciolacu: „ Gestul laș trebuie să ne readucă rapid cu picioarele pe pământ”",https://www.bzi.ro/claudiu-tarziu-europarlamentar-si-membru-ecr-despre-demisia-lui-marcel-ciolacu-gestul-las-trebuie-sa-ne-readuca-rapid-cu-picioarele-pe-pamant-5251118,bzi.ro
2025-05-08,Criză economică și criză electorală. Cine va fi la butoane?,https://www.bzi.ro/criza-economica-si-criza-electorala-cine-va-fi-la-butoane-5251111,bzi.ro
2025-05-08,"TransparenÈÄ redusÄ: jurnaliÈtii, excluÈi de la Ã®nceputul ÈedinÈelor de Guvern",https://adevarul.ro/politica/transparenta-redusa-jurnalistii-exclusi-de-la-2441761.html,adevarul.ro
2025-05-08,"Victor Negrescu, bilanț la final de mandat în funcția de consilier onorific al premierului",https://www.gandul.ro/politica/victor-negrescu-bilant-la-final-de-mandat-in-functia-de-consilier-onorific-al-premierului-20511089,gandul.ro
2025-05-08,"Radu Marinescu, despre declarațiile lui Nicușor Dan: ""Justiția trebuie să rămână în afara oricărui calcul politic""",https://www.gandul.ro/justitie/radu-marinescu-despre-declaratiile-lui-nicusor-dan-justitia-trebuie-sa-ramana-in-afara-oricarui-calcul-politic-20511106,gandul.ro
2025-05-08,"VIDEO Ce s-ar schimba în România condusă de George Simion? Dar în cea condusă de Nicușor Dan?Profesorul Ioan Stanomir, la HotSpot",https://hotnews.ro/ce-s-ar-schimba-in-romania-condusa-de-george-simion-dar-in-cea-condusa-de-nicusor-dan-profesorul-ioan-stanomir-live-de-la-ora-10-30-in-studioul-hotnews-1968271,hotnews.ro
2025-05-08,"Negrescu, bilanţ la final de mandat în funcţia de consilier onorific al premierului",https://www.mediafax.ro/politic/negrescu-bilant-la-final-de-mandat-in-functia-de-consilier-onorific-al-premierului-23549268,mediafax.ro
2025-05-07,"Roxana Mînzatu, vicepresidenta de la Comisión Europea: ""La UE debe combatir el extremismo y el populismo y ofrecer un escudo social fuerte""",https://www.eldiario.es/catalunya/economia/roxana-minzatu-europa-debe-combatir-extremismo-populismo-ofrecer-escudo-social-fuerte_128_12279631.html,eldiario.es
2025-05-08,Cătălin Predoiu a semnat. Victor Negrescu este eliberat din funcția de consilier onorific,https://www.capital.ro/catalin-predoiu-a-semnat-victor-negrescu-este-eliberat-din-functia-de-consilier-onorific.html,capital.ro
2025-05-08,"Prima ședință a premierului INTERIMAR, cu miniștrii lui Marcel Ciolacu",https://www.gandul.ro/actualitate/prima-sedinta-a-premierului-interimar-cu-ministrii-lui-marcel-ciolacu-20510986,gandul.ro
2025-05-08,Interimarul Cătălin Predoiu a luat primele decizii: fără presă la începutul ședinței de Guvern și fără declarații transmise LIVE,https://www.gandul.ro/politica/interimarul-catalin-predoiu-a-luat-primele-decizii-fara-presa-la-inceputul-sedintei-de-guvern-si-fara-declaratii-transmise-live-20510981,gandul.ro
2025-05-08,Jocurile setei (de putere). Cine e Setilă?,https://www.libertatea.ro/opinii/radu-soviani-jocurile-setei-de-putere-cine-e-setila-5298071,libertatea.ro
2025-05-08,Dependența de cașcavalul guvernării amână schimbarea la față a PSD. Ce lupte se dau în culisele partidului,https://www.libertatea.ro/opinii/radu-eremia-dependenta-de-cascavalul-guvernarii-amana-schimbarea-la-fata-a-psd-ce-lupte-se-dau-in-culisele-partidului-5296808,libertatea.ro
2025-05-08,Guvernul condus interimar de Cătălin Predoiu: decizie fără precedent. Presa nu va avea acces în ședință,https://www.libertatea.ro/stiri/prima-masura-luata-guvern-interimar-catalin-predoiu-presa-interzisa-sala-sedinte-jurnalisti-interzisi-5298142,libertatea.ro
2025-05-08,CrizÄ economicÄ Åi crizÄ electoralÄ. Cine va fi la butoane?,https://www.bursa.ro/criza-economica-si-criza-electorala-cine-va-fi-la-butoane-09385555,bursa.ro
2025-05-08,Victor Negrescu pleacă din funcție,https://www.cotidianul.ro/victor-negrescu-pleaca-din-functie/,cotidianul.ro
2025-05-08,"Erdélyi politikus: aki Bukarestben „szuverenista”, az magyarellenes",https://demokrata.hu/magyarorszag/erdelyi-politikus-aki-bukarestben-szuveranista-az-magyarellenes-989261/,demokrata.hu
2025-05-08,Romanian hard-right frontrunner Simion leads opinion poll,https://www.fbcnews.com.fj/world/romanian-hard-right-frontrunner-simion-leads-opinion-poll/,fbcnews.com.fj
2025-05-08,De ce nu se poate face majoritate fără PSD? Aritmetica din Parlament,https://www.gandul.ro/politica/analiza-exclusiv-cum-arata-aritmetica-din-parlament-de-ce-nu-se-poate-face-majoritate-fara-psd-andrei-taranu-exista-posbilitatea-unui-guvern-minoritar-20509905,gandul.ro
2025-05-08,Prima ședință a guvernului condus de premierul interimar Cătălin Predoiu: Aprobarea unui proiect de hotărâre privind bugetul de venituri și cheltuieli,https://www.gandul.ro/politica/prima-sedinta-a-guvernului-condus-de-premierul-interimar-catalin-predoiu-aprobarea-unui-proiect-de-hotarare-privind-bugetul-de-venituri-si-cheltuieli-20510884,gandul.ro
2025-05-08,ANALIZĂ GÂNDUL: Ce majorităţi sunt în Parlament pentru formarea unui nou Executiv,https://www.mediafax.ro/politic/analiza-gandul-ce-majoritati-sunt-in-parlament-pentru-formarea-unui-nou-executiv-23549218,mediafax.ro
2025-05-08,Călin Georgescu revine. Vestea cea mare dată chiar de George Simion,https://www.capital.ro/calin-georgescu-revine-vestea-cea-mare-data-chiar-de-george-simion.html,capital.ro
2025-05-08,"Cinci scenarii pentru România, după turul 2. Cum ar putea să scape George Simion de Călin Georgescu, dacă ajunge președinte",https://www.antena3.ro/politica/cinci-scenarii-pentru-romania-dupa-turul-2-cum-ar-putea-sa-scape-george-simion-de-calin-georgescu-daca-ajunge-presedinte-745269.html,antena3.ro
2025-05-08,"NicuÈor Dan, Ã®n faÈa unei duble provocÄri. Cum poate rÄsturna scorul din primul tur",https://adevarul.ro/alegeri-prezidentiale-2025/nicusor-dan-in-fata-unei-duble-provocari-cum-2441661.html,adevarul.ro
2025-05-08,Romania’s hard-right election front-runner Simion seeks to capitalize on voters’ discontent,https://www.newdelhitimes.com/romanias-hard-right-election-front-runner-simion-seeks-to-capitalize-on-voters-discontent/,newdelhitimes.com
2025-05-08,"Crin Antonescu: Eu am pierdut alegerile, nu partidele din Coaliție",https://romanialibera.ro/la-zi/crin-antonescu-intre-demagogi-de-joasa-speta-si-securistoizii-aceiasi-dl-nicusor-new-entry-am-propria-mea-alegere/,romanialibera.ro
2025-05-07,Romanian hard-right frontrunner Simion leads opinion poll before vote run-off,https://www.regionalmedianews.com/world/romanian-hard-right-frontrunner-simion-leads-opinion-poll-before-vote-run-off,regionalmedianews.com
2025-05-07,"PSD, Ã®n derivÄ Ã®nainte de alegerea preÈedintelui: fÄrÄ direcÈie Èi cu disensiuni interne. Ce Èanse are valul european din partid?",https://adevarul.ro/alegeri-prezidentiale-2025/psd-in-deriva-inainte-de-turul-ii-fara-directie-2441665.html,adevarul.ro
2025-05-07,A katolikusok imádták,https://www.ma.hu/webbulvar.hu/404734/A_katolikusok_imadtak__Trump_szerint_nincs_miert_bocsanatot_kernie_a_papas_AIkep_miatt?place=srss,ma.hu
2025-05-07,Életbe lépett a Putyin által javasolt tűzszünet,https://www.ma.hu/kulfold/404735/Eletbe_lepett_a_Putyin_altal_javasolt_tuzszunet__Kijev_elutasitja_a_bekeajanlatot?place=srss,ma.hu
2025-05-07,La cât ar putea ajunge cursul leu-euro. Cea mai mare bancă din SUA se așteaptă la o devalorizare de până la 15-20%,https://ziarulring.ro/la-cat-ar-putea-ajunge-cursul-leu-euro-cea-mai-mare-banca-din-sua-se-asteapta-la-o-devalorizare-de-pana-la-15-20/?utm_source=rss&utm_medium=rss&utm_campaign=la-cat-ar-putea-ajunge-cursul-leu-euro-cea-mai-mare-banca-din-sua-se-asteapta-la-o-devalorizare-de-pana-la-15-20,ziarulring.ro
2025-05-07,Vicepreședinte PSD: Va fi greu să mă hotărăsc care e răul mai mic la prezidențiale,https://jurnalul.ro/stiri/politica/pucheanu-alegeri-997350.html,jurnalul.ro
2025-05-07,CTP l-a făcut praf pe George Simion. Cum l-a caracterizat pe contracandidatul lui Nicușor Dan,https://www.libertatea.ro/stiri/cristian-tudor-popescu-ctp-george-simion-derbedeu-unsuros-nicusor-dan-5297854,libertatea.ro
