publish_date,title,url,media_name
2025-05-20,Grindeanu: Am primit un mandat flexibil pentru discuții cu Nicușor Dan și partidele. Curentul majoritar în PSD e de a fi în Opoziție,https://www.antena3.ro/politica/surse-liderii-psd-au-votat-pentru-un-mandat-deschis-pentru-negocierea-unei-coalitii-momentan-partidul-nu-intra-in-opozitie-746701.html,antena3.ro
2025-05-20,Ce a declarat Sorin Grindeanu referitor la funcția de președinte al PSD în urmă cu aproximativ doi ani,https://stirileprotv.ro/stiri/politic/ce-a-declarat-sorin-grindeanu-referitor-la-functia-de-presedinte-al-psd-in-urma-cu-aproximativ-doi-ani.html,stirileprotv.ro
2025-05-20,"Sorin Grindeanu preia conducerea interimară a PSD, după demisia lui Marcel Ciolacu",https://www.antena3.ro/politica/surse-marcel-ciolacu-si-a-dat-demisia-din-functia-de-presedinte-al-psd-746678.html,antena3.ro
2025-05-20,"PSD, victimă colaterală sau un simplu trișor care a încercat să joace la două capete?",https://informatia-zilei.ro/psd-victima-colaterala-sau-un-simplu-trisor-care-a-incercat-sa-joace-la-doua-capete/,informatia-zilei.ro
2025-05-20,"Remus Pricopie cere politicienilor să se concentreze pe noul guvern, nu pe bătălii interne: ""Deconturile interne de partid nu ajută""",https://www.antena3.ro/politica/remus-pricopie-cere-politicienilor-sa-se-concentreze-pe-noul-guvern-nu-pe-batalii-interne-deconturile-interne-de-partid-nu-ajuta-746673.html,antena3.ro
2025-05-20,La ultraderecha rumana no participará en las consultas para formar gobierno tras perder las presidenciales,https://www.europapress.es/internacional/noticia-ultraderecha-rumana-no-participara-consultas-formar-gobierno-perder-presidenciales-20250520144505.html,europapress.es
2025-05-20,"Grindeanu, președinte interimar al PSD. Băluță a pierdut",https://www.cotidianul.ro/sorin-grindeanu-presedinte-interimar-al-psd/,cotidianul.ro
2025-05-20,Romania: Grindeanu presidente ad interim del Partito socialdemocratico (Psd),https://www.agenzianova.com/a/682c78d9858105.35949102/6198125/2025-05-20/romania-grindeanu-presidente-ad-interim-del-partito-socialdemocratico-psd,agenzianova.com
2025-05-20,"Ciolacu a demisionat: ”Vă iubesc, vă rog aveți grijă unii de alții”",https://www.cotidianul.ro/marcel-ciolacu-a-demisionat/,cotidianul.ro
2025-05-20,"Marcel Ciolacu și-a dat demisia de la șefia PSD. Grindeanu, în cărţi pentru preluarea conducerii",https://renasterea.ro/marcel-ciolacu-si-a-dat-demisia-de-la-sefia-psd/,renasterea.ro
2025-05-20,"Sorin Grindeanu este noul președinte al PSD! A fost ales cu 67 de voturi, în timp ce Daniel Băluță a obținut doar 14 voturi",https://renasterea.ro/sorin-grindeanu-este-noul-presedinte-al-psd-a-fost-ales-cu-67-de-voturi-in-timp-ce-daniel-baluta-a-obtinut-doar-14-voturi/,renasterea.ro
2025-05-20,Marcel Ciolacu și-a depus demisia din funcția de președinte al PSD,https://www.monitorulcj.ro/politica-administratie/128987-marcel-ciolacu-si-a-depus-demisia-din-functia-de-presedinte-al-psd,monitorulcj.ro
2025-05-20,Sorin Grindeanu a fost ales preşedinte interimar al PSD,https://atitudinea.ro/sorin-grindeanu-a-fost-ales-presedinte-interimar-al-psd/,atitudinea.ro
2025-05-20,Marcel Ciolacu a demisionat de la șefia PSD,https://atitudinea.ro/marcel-ciolacu-a-demisionat-de-la-sefia-psd/,atitudinea.ro
2025-05-20,"Sorin Grindeanu, ales în funcția de președinte interimar al PSD",https://www.monitorulcj.ro/politica-administratie/128990-sorin-grindeanu-ales-in-functia-de-presedinte-interimar-al-psd,monitorulcj.ro
2025-05-20,Surse: Sorin Grindeanu a fost ales în funcția de președinte interimar al PSD,https://www.bihon.ro/stiri-internationale/romania/surse-sorin-grindeanu-a-fost-ales-in-functia-de-presedinte-interimar-al-psd-4929170/?utm_source=rss&utm_medium=referral&utm_campaign=hiraggregator,bihon.ro
2025-05-20,FRISSÍTVE: Lemondott Ciolacu a PSD elnöki tisztségéről,https://maszol.ro/belfold/Lemondott-Ciolacu-a-PSD-elnoki-tesztsegerol,maszol.ro
2025-05-20,"Sorin Grindeanu este noul lider interimar al PSD. Mesajul lui Marcel Ciolacu, după demisia de la conducerea partidului",https://alba24.ro/sorin-grindeanu-este-noul-lider-interimar-al-psd-mesajul-lui-marcel-ciolacu-dupa-demisia-de-la-conducerea-partidului-1082223.html,alba24.ro
2025-05-20,Radio Romania International,https://www.rri.ro/en/news-and-current-affairs/newsflash/may-20-2025-id889530.html,rri.ro
2025-05-20,"Marcel Ciolacu demisionează de la conducerea PSD: „Am ales să mă opresc aici, dar nu plec nicăieri. Rămân aici”",https://www.magazinsalajean.ro/politica/marcel-ciolacu-demisioneaza-de-la-conducerea-psd-am-ales-sa-ma-opresc-aici-dar-nu-plec-nicaieri-raman-aici,magazinsalajean.ro
2025-05-20,"Marcel Ciolacu și-a depus demisia din funcția de președinte al PSD: „Azi am făcut un pas dificil, dar necesar”",https://www.europafm.ro/marcel-ciolacu-a-demisionat-din-functia-de-presedinte-al-psd/,europafm.ro
2025-05-20,Sorin Grindeanu a fost ales preşedinte interimar al PSD,https://www.europafm.ro/sorin-grindeanu-a-fost-ales-presedinte-interimar-al-psd/,europafm.ro
2025-05-20,Cine ar putea prelua funcția de primar interimar al Capitalei după demisia lui Nicușor Dan,https://www.europafm.ro/primar-interimar-capitala/,europafm.ro
2025-05-20,Ionuț Pucheanu: „Fuga de răspundere mi se pare lipsă de bărbăție&quot;,https://jurnalul.ro/stiri/politica/pucheanu-psd-marcel-ciolacu-esec-998557.html,jurnalul.ro
2025-05-20,"Marcel Ciolacu: ""A fost o onoare să conduc partidul care a dus România în NATO/ PSD rămâne cel mai puternic brand politic românesc""",https://www.gandul.ro/politica/marcel-ciolacu-a-fost-o-onoare-sa-conduc-partidul-care-a-dus-romania-in-nato-psd-ramane-cel-mai-puternic-brand-politic-romanesc-20522630,gandul.ro
2025-05-20,Marcel Ciolacu pleacă de la conducerea PSD. Partidul a decis cine-l va înlocui,https://www.zdg.md/stiri/marcel-ciolacu-pleaca-de-la-conducerea-psd-partidul-a-decis-cine-l-va-inlocui/,zdg.md
2025-05-20,"Ciolacu, după demisia din fruntea PSD: Rămân aici. Dar nu pe scenă. Nu în frunte, ci în rând",https://jurnalul.ro/stiri/politica/marcel-ciolacu-vila-lac-demisia-998560.html,jurnalul.ro
2025-05-20,Sorin Grindeanu este noul președinte interimar al PSD după retragerea lui Marcel Ciolacu,https://www.capital.ro/sorin-grindeanu-este-noul-presedinte-interimar-al-psd-dupa-retragerea-lui-marcel-ciolacu.html,capital.ro
2025-05-20,Sorin Grindeanu este noul lider PSD,https://jurnalul.ro/stiri/politica/sorin-grindeanu-functie-presedinte-psd-998573.html,jurnalul.ro
2025-05-20,UPDATE. Marcel Ciolacu a demisionat din funcţia de preşedinte al PSD. Anunț oficial,https://www.capital.ro/marcel-ciolacu-a-demisionat-din-functia-de-presedinte-al-psd.html,capital.ro
2025-05-20,"Sorin Grindeanu a fost ales preşedinte interimar al PSD, după demisia lui Ciolacu",https://www.ziuadevest.ro/wp-content/cache/page_enhanced/www.ziuadevest.ro/sorin-grindeanu-a-fost-ales-presedinte-interimar-al-psd-dupa-demisia-lui-ciolacu/_index_slash.html_gzip,ziuadevest.ro
2025-05-20,"Olyan atompolitikai fordulat történt Németországban, amire egész Európa felfigyel",https://www.portfolio.hu/gazdasag/20250520/olyan-atompolitikai-fordulat-tortent-nemetorszagban-amire-egesz-europa-felfigyel-762469,portfolio.hu
2025-05-20,Sorin Grindeanu has been appointed as the new interim leader of PSD,https://www.mediafax.ro/english/sorin-grindeanu-has-been-appointed-as-the-new-interim-leader-of-psd-23555225,mediafax.ro
2025-05-20,Teljes konszenzussal elfogadta az EU a 17. szankciós csomagot,https://www.portfolio.hu/unios-forrasok/20250520/teljes-konszenzussal-elfogadta-az-eu-a-17-szankcios-csomagot-762473,portfolio.hu
2025-05-20,"Marcel Ciolacu și-a dat demisia de la șefia PSD. Sorin Grindeanu, noul președinte interimar al partidului",https://www.mediafax.ro/politic/marcel-ciolacu-si-a-dat-demisia-de-la-sefia-psd-sorin-grindeanu-noul-presedinte-interimar-al-partidului-23555145,mediafax.ro
2025-05-20,"Már Kína is népszerűbb, mint az USA",https://www.portfolio.hu/global/20250520/mar-kina-is-nepszerubb-mint-az-usa-igy-bojkottaljak-az-amerikai-termekeket-762395,portfolio.hu
2025-05-20,Botrány Amerikában: rendőrökkel verekedett össze Trump nagy riválisa,https://www.portfolio.hu/global/20250520/botrany-amerikaban-rendorokkel-verekedett-ossze-trump-nagy-rivalisa-762471,portfolio.hu
2025-05-20,Még soha nem volt ilyen rossz helyzetben a kínai költségvetés,https://www.portfolio.hu/gazdasag/20250520/meg-soha-nem-volt-ilyen-rossz-helyzetben-a-kinai-koltsegvetes-762481,portfolio.hu
2025-05-20,"Szokatlan hideg Magyarországon: elmondta a szakértő, meddig tart még a zord időjárás",https://www.portfolio.hu/gazdasag/20250520/szokatlan-hideg-magyarorszagon-elmondta-a-szakerto-meddig-tart-meg-a-zord-idojaras-762477,portfolio.hu
2025-05-20,Marcel Ciolacu și-a dat demisia de la șefia PSD. Sorin Grindeanu,https://www.euractiv.ro/politic-intern/marcel-ciolacu-si-a-dat-demisia-de-la-sefia-psd-73192,euractiv.ro
2025-05-20,Sorin Grindeanu este noul președinte al PSD,https://cugetliber.ro/stiri-politica-administratie-sorin-grindeanu-este-noul-presedinte-al-psd-529532,cugetliber.ro
2025-05-20,Marcel Ciolacu după demisie: „Rămân aici. Dar nu pe scenă”,https://www.observatorulph.ro/eveniment/2756113-marcel-ciolacu-dupa-demisie-raman-aici-dar-nu-pe-scena,observatorulph.ro
2025-05-20,Sorin Grindeanu este noul șef al Partidului Social Democrat,https://www.observatorulph.ro/eveniment/2756118-sorin-grindeanu-este-noul-sef-al-partidului-social-democrat,observatorulph.ro
2025-05-20,Marcel Ciolacu a demisionat de la șefia PSD,https://www.observatorulph.ro/eveniment/2756104-marcel-ciolacu-a-demisionat-de-la-sefia-psd,observatorulph.ro
2025-05-20,"Marcel Ciolacu a demisionat din funcția de președinte al PSD. 'Am ales să mă opresc aici, dar nu plec nicăieri'",https://cugetliber.ro/stiri-politica-administratie-marcel-ciolacu-a-demisionat-din-functia-de-presedinte-al-psd-am-ales-sa-ma-opresc-aici-dar-nu-plec-nicaieri-529526,cugetliber.ro
2025-05-20,"PSD, dovediți că v-ați învățat lecția! Sprijiniți-l pe Dan!",https://www.observatorulph.ro/voxpublica/2756110-psd-dovediti-ca-v-ati-invatat-lectia-sprijiniti-l-pe-dan,observatorulph.ro
2025-05-20,Surpriză totală în lista noului guvern! Ce declarat Nicușor Dan,https://www.bzi.ro/surpriza-totala-in-lista-noului-guvern-ce-declarat-nicusor-dan-5260508,bzi.ro
2025-05-20,"Sorin Grindeanu, președinte interimar al PSD",https://www.zi-de-zi.ro/2025/05/20/sorin-grindeanu-presedinte-interimar-al-psd/,zi-de-zi.ro
2025-05-20,Avertisment de la BNR. Mugur Isărescu anunță că vin scumpiri: “Nu va fi ușor”,https://cugetliber.ro/stiri-economie-avertisment-de-la-bnr-mugur-isarescu-anunta-ca-vin-scumpiri-nu-va-fi-usor-529528,cugetliber.ro
2025-05-20,"Sorin Grindeanu, noul președinte al PSD: Va asigura conducerea formațiunii până la un viitor congres",https://ziarulunirea.ro/sorin-grindeanu-noul-presedinte-al-psd-va-asigura-conducerea-formatiunii-pana-la-un-viitor-congres-942254/,ziarulunirea.ro
2025-05-20,"PERCHEZIȚII în Alba și alte județe din țară, într-un dosar de înșelăciune și fals. Prejudiciu de 1,8 milioane lei",https://ziarulunirea.ro/video-perchezitii-in-alba-si-alte-judete-din-tara-intr-un-dosar-de-inselaciune-si-fals-prejudiciu-de-18-milioane-lei-942225/,ziarulunirea.ro
2025-05-20,Marcel Ciolacu și-a dat demisia oficial din PSD. Covrigarul a avut un nou discurs ipocrit,https://www.bzi.ro/marcel-ciolacu-si-a-dat-demisia-oficial-din-psd-covrigarul-a-avut-un-nou-discurs-ipocrit-5260652,bzi.ro
2025-05-20,Marcel Ciolacu și-a dat demisia din funcția de președinte al PSD,https://atitudinea.ro/marcel-ciolacu-si-a-dat-demisia-din-functia-de-presedinte-al-psd/,atitudinea.ro
2025-05-20,"Ministrul Educației susținător al meditațiilor reglementate: ,,Dacă le ascundem se vor întâmpla oricum, prin mijloace pe care nu le controlăm.”",https://ziarulunirea.ro/ministrul-educatiei-sustinator-al-meditatiilor-reglementate-daca-le-ascundem-se-vor-intampla-oricum-prin-mijloace-pe-care-nu-le-controlam-942184/,ziarulunirea.ro
2025-05-20,"Prețurile la carburanți sunt într-o ușoară creștere: Cu 4 bani mai scumpă alimentarea astăzi, 20 mai 2025",https://ziarulunirea.ro/preturile-la-carburanti-sunt-intr-o-usoara-crestere-cu-4-bani-mai-scumpa-alimentarea-astazi-20-mai-2025-942221/,ziarulunirea.ro
2025-05-20,"Marcel Ciolacu demisioneazÄ de la conducerea PSD: ""Am ales sÄ mÄ opresc aici, dar nu plec nicÄieri. RÄmÃ¢n aici""",https://www.bursa.ro/marcel-ciolacu-demisioneaza-de-la-conducerea-psd-am-ales-sa-ma-opresc-aici-dar-nu-plec-nicaieri-raman-aici-65517558,bursa.ro
2025-05-20,Surse: Marcel Ciolacu a demisionat din fruntea PSD,https://atitudinea.ro/surse-marcel-ciolacu-a-demisionat-din-fruntea-psd/,atitudinea.ro
2025-05-20,"Sorin Grindeanu, ales preÅedinte interimar al PSD",https://www.bursa.ro/sorin-grindeanu-ales-presedinte-interimar-al-psd-49517552,bursa.ro
2025-05-20,"George Simion, liderul AUR, promite să conteste rezultatul alegerilor: „Sunt luptător, nu muiere”. Anunțul făcut pe rețelele de socializare",https://ziarulunirea.ro/george-simion-liderul-aur-promite-sa-conteste-rezultatul-alegerilor-sunt-luptator-nu-muiere-anuntul-facut-pe-retelele-de-socializare-942237/,ziarulunirea.ro
2025-05-20,"Eurodeputatul Grupului ECR și europarlamentarul Claudiu Târziu, despre noua guvernare: „Puterea va fi folosită pentru decizii împotriva interesului național”",https://www.bzi.ro/eurodeputatul-grupului-ecr-si-europarlamentarul-claudiu-tarziu-despre-noua-guvernare-puterea-va-fi-folosita-pentru-decizii-impotriva-interesului-national-5260478,bzi.ro
2025-05-20,Marcel Ciolacu a demisionat din funcÈia de preÈedinte al PSD. Cine ar putea sÄ-i ia locul,https://click.ro/actualitate/national/marcel-ciolacu-a-demisionat-din-functia-de-2444760.html,click.ro
2025-05-20,Marcel Ciolacu pleacÄ din vÃ¢rful PSD. Sorin Grindeanu preia conducerea interimarÄ,https://adevarul.ro/politica/marcel-ciolacu-pleaca-din-virful-psd-si-a-depus-2444758.html,adevarul.ro
2025-05-20,"Romania, inizio in salita per Nicușor Dan già alle prese con crisi e instabilità",https://www.quotidiano.net/esteri/romania-governo-dan-pkouhu64,quotidiano.net
2025-05-20,"Marcel Ciolacu a renunțat, marți, la conducerea Partidului Social Democrat",https://romanialibera.ro/la-zi/ciolacu-lasa-carma-psd-demisie-oficiala-si-doua-scenarii-pentru-succesiune/,romanialibera.ro
2025-05-20,Decizie crucială PSD: opoziție sau guvernare pro-europeană?,https://romanialibera.ro/la-zi/psd-la-rascruce-marcel-ciolacu-renunta-partidul-ezita-intre-reforma-si-opozitie/,romanialibera.ro
2025-05-20,ULTIMA ORĂ! Marcel Ciolacu a demisionat de la conducerea PSD; urmează alegerea unui președinte interimar,https://www.monitoruldevrancea.ro/2025/05/20/ultima-ora-marcel-ciolacu-a-demisionat-de-la-conducerea-psd-urmeaza-alegerea-unui-presedinte-interimar/,monitoruldevrancea.ro
2025-05-20,Marcel Ciolacu Åi-a depus demisia din funcÅ£ia de preÅedinte al PSD,https://www.bursa.ro/marcel-ciolacu-si-a-depus-demisia-din-functia-de-presedinte-al-psd-24417556,bursa.ro
2025-05-20,Romania: Marcel Ciolacu si è dimesso dalla carica di presidente del Partito socialdemocratio,https://www.agenzianova.com/a/682c5efd856154.21631140/6197328/2025-05-20/romania-marcel-ciolacu-si-e-dimesso-dalla-carica-di-presidente-del-partito-socialdemocratio,agenzianova.com
2025-05-19,Marcel Ciolacu a demisionmat din funcția de președinte al PSD,https://zcj.ro/politica/marcel-ciolacu-a-demisionat-din-functia-de-presedinte-al-psd--280278.html,zcj.ro
2025-05-20,"Marcel Ciolacu și-a dat demisia de la șefia PSD. Sorin Grindeanu, favorit la preluarea conducerii",https://www.mediafax.ro/politic/marcel-ciolacu-si-a-dat-demisia-de-la-sefia-psd-sorin-grindeanu-favorit-la-preluarea-conducerii-23555145,mediafax.ro
2025-05-20,La victoria del europeísta Dan no acaba con la incertidumbre política en Rumanía,https://www.abc.es/internacional/victoria-europeista-dan-acaba-incertidumbre-politica-rumania-20250520124157-nt.html,abc.es
2025-05-20,"Președintele ales, Nicușor Dan, interviu în direct la Observator Antena 1. Cum va arăta România în următorii 5 ani",https://a1.ro/news/politic/presedintele-ales-nicusor-dan-interviu-in-direct-la-observator-antena-1-cum-va-arata-romania-in-urmatorii-5-ani-id1136582.html,a1.ro
2025-05-20,Bătălia pentru șefia PSD: Trei membrii marcanți aspiră la fotoliul lui Ciolacu,https://www.oradesibiu.ro/2025/05/20/batalia-pentru-sefia-psd-trei-membrii-marcanti-aspira-la-fotoliul-lui-ciolacu/,oradesibiu.ro
2025-05-20,"OFICIAL Sorin Grindeanu este președintele interimar al PSD, după ce Marcel Ciolacu a demisionat",https://hotnews.ro/marcel-ciolacu-a-demisionat-psd-1981558,hotnews.ro
2025-05-20,Marcel Ciolacu a demisionat din funcţia de preşedinte al PSD,https://www.libertatea.ro/stiri/marcel-ciolacu-demisie-presedinte-psd-20-mai-2025-5314658,libertatea.ro
2025-05-20,Ciolacu a demisionat din funcția de președinte al PSD: „Nu plec nicăieri. Rămân un om de stânga”,https://spotmedia.ro/stiri/politica/la-guvernare-sau-in-opozitie-ciolacu-isi-anunta-demisia-psd-cauta-o-noua-directie,spotmedia.ro
2025-05-20,Ciolacu ar putea demisiona din fruntea PSD. Ședință tensionată pentru asigurarea interimatului,https://atitudinea.ro/ciolacu-ar-putea-demisiona-din-fruntea-psd-sedinta-tensionata-pentru-asigurarea-interimatului/,atitudinea.ro
2025-05-20,Pasul înapoi făcut de Ciolacu: PSD decide marți dacă intră la guvernare,https://www.mediafax.ro/stirile-zilei/pasul-inapoi-facut-de-ciolacu-psd-decide-marti-daca-intra-la-guvernare-23555090,mediafax.ro
2025-05-20,Marcel Ciolacu a ajuns la Vila Lac,https://www.mediafax.ro/politic/marcel-ciolacu-a-ajuns-la-vila-lac-23555123,mediafax.ro
2025-05-20,Ionuț Pucheanu: PSD are două opțiuni pentru urmașul lui Ciolacu. / Dacă pleacă Marcel ar trebui să plecăm toți,https://www.mediafax.ro/politic/ionut-pucheanu-psd-are-doua-optiuni-pentru-urmasul-lui-ciolacu-daca-pleaca-marcel-ar-trebui-sa-plecam-toti-23555114,mediafax.ro
2025-05-20,UPDATE Noul președinte al PSD. Cine îi ia locul lui Marcel Ciolacu în fruntea partidului,https://www.capital.ro/noul-presedinte-al-psd-cine-ii-ia-locul-lui-marcel-ciolacu-in-fruntea-partidului.html,capital.ro
2025-05-16,"Etxegabetzea burutu gabe joan da AMA Desokupa enpresa Amurriotik, “herri erantzunari esker”",https://www.argia.eus/albistea/etxegabetzea-burutu-gabe-joan-da-ama-desokupa-enpresa-amurriotik-herri-erantzunari-esker?mtm_campaign=HariaRSS,argia.eus
2025-05-20,"PSD ar urma să decidă astăzi o formulă de conducere care să participe la negocierile pentru formarea viitorului guvern. Marcel Ciolacu, așteptat să demisoneze de la șefia partidului",https://www.europafm.ro/psd-ar-urma-sa-decida-astazi-o-formula-de-conducere-care-sa-participe-la-negocierile-pentru-formarea-viitorului-guvern-marcel-ciolacu-asteptat-sa-demisoneze-de-la-sefia-partidului-audio/,europafm.ro
2025-05-20,"Marcel Ciolacu demisionează, iar PSD decide dacă rămâne la guvernare",https://www.tion.ro/romania/marcel-ciolacu-demisioneaza-iar-psd-decide-daca-ramane-la-guvernare-2068375/?utm_source=rss&utm_medium=referral&utm_campaign=hiraggregator,tion.ro
2025-05-20,Care sunt variantele de guvern. Instabilitatea periculoasă a PSD,https://spotmedia.ro/stiri/opinii-si-analize/care-sunt-variantele-de-guvern-instabilitatea-periculoasa-a-psd,spotmedia.ro
2025-05-20,Nicușor Dan promite desecretizarea rapoartelor CSAT,https://www.cotidianul.ro/nicusor-dan-promite-desecretizarea-rapoartelor-csat/,cotidianul.ro
2025-05-20,"PSD se reunește, Ciolacu trebuie să decidă",https://www.cotidianul.ro/psd-se-reuneste-ciolacu-trebuie-sa-decida/,cotidianul.ro
2025-05-20,PSD discută demisia lui Ciolacu și dacă intră sau nou într-o nouă guvernare,https://www.euractiv.ro/politic-intern/psd-discuta-demisia-lui-ciolacu-si-daca-intra-sau-nou-intr-o-noua-guvernare-73192,euractiv.ro
2025-05-20,Románia választott: a szakadék széléről lépett vissza,https://index.hu/velemeny/2025/05/20/romania-valasztas-szakadek-szele-nicusur-dan-george-simion/,index.hu
2025-05-20,"PSD decide dacă intră la guvernare și în ce condiții. ""Va trebui să dăm premierul. Să clarificăm cine sunt partenerii""",https://www.antena3.ro/politica/psd-decide-daca-intra-la-guvernare-si-in-ce-conditii-va-trebui-sa-dam-premierul-sa-clarificam-cine-sunt-partenerii-746624.html,antena3.ro
2025-05-20,"Sociolog: Cel puțin doi ani, PSD trebuie să treacă în opoziție, pe fasole și varză călită. Apoi, va câștiga cu 40% următoarele alegeri",https://www.antena3.ro/politica/sociolog-cel-putin-doi-ani-psd-trebuie-sa-treaca-in-opozitie-pe-fasole-si-varza-calita-apoi-va-castiga-cu-40-urmatoarele-alegeri-746650.html,antena3.ro
2025-05-18,Pro-EU Centrist Wins Romania’s Tense Presidential Race Over Hard-Right Nationalist,https://www.huffpost.com/entry/ap-eu-romania-election-george-simion-nicusor-dan_n_682a4804e4b0bccd40f52d29,huffpost.com
2025-05-20,Zi importantă pentru România în PE. Proiectele din PNRR ar putea fi prelungite,https://cugetliber.ro/stiri-actual-zi-importanta-pentru-romania-in-pe-proiectele-din-pnrr-ar-putea-fi-prelungite-529511,cugetliber.ro
2025-05-20,Consiliul Politic Național al PSD se reunește pentru analiză/Ciolacu urmează să demisioneze (surse),https://www.bihon.ro/stiri-internationale/romania/consiliul-politic-national-al-psd-se-reuneste-pentru-analiza-ciolacu-urmeaza-sa-demisioneze-surse-4928705/?utm_source=rss&utm_medium=referral&utm_campaign=hiraggregator,bihon.ro
2025-05-20,"Alfred Simonis: „Este prematur să discutăm acum” – Liderul CJ Timiș exclude o candidatură la șefia PSD, dar recunoaște: „Sunt o voce tânără în partid”",https://www.ziuadevest.ro/wp-content/cache/page_enhanced/www.ziuadevest.ro/alfred-simonis-este-prematur-sa-discutam-acum-liderul-cj-timis-exclude-o-candidatura-la-sefia-psd-dar-recunoaste-sunt-o-voce-tanara-in-partid/_index_slash.html_gzip,ziuadevest.ro
2025-05-20,Consiliul Politic Naţional al PSD se întruneşte marţi. Demisia lui Marcel Ciolacu,https://www.ziuaveche.ro/actualitate-interna/politica-interna/consiliul-politic-national-al-psd-se-intruneste-marti-demisia-lui-marcel-ciolacu-338569.html/,ziuaveche.ro
2025-05-20,Romania: la leadership del Psd si riunisce per discutere le dimissioni di Ciolacu,https://www.agenzianova.com/a/682c34ac1c0239.94721772/6196329/2025-05-20/romania-la-leadership-del-psd-si-riunisce-per-discutere-le-dimissioni-di-ciolacu,agenzianova.com
2025-05-20,"El socialismo en la UE, más tocado todavía: el fiasco luso y su 'mutis' electoral rumano y polaco dejan a Sánchez casi solo",https://www.20minutos.es/internacional/caida-socialista-portugal-las-turbulencias-rumania-dejan-sanchez-como-hombre-fuerte-izquierda-5713405/,20minutos.es
2025-05-20,Romania: leadership Psd si riunisce per decidere su dimissioni di Ciolacu e ingresso nel governo,https://www.agenzianova.com/a/682c3964594194.31818332/6196353/2025-05-20/romania-leadership-psd-si-riunisce-per-decidere-su-dimissioni-di-ciolacu-e-ingresso-nel-governo,agenzianova.com
2025-05-20,LuptÄ Ã®ntre Grindeanu Èi BÄluÈÄ pentru Èefia PSD. Cine e al treilea favorit. Azi se voteazÄ urmaÈul lui Ciolacu,https://adevarul.ro/politica/lupta-intre-grindeanu-si-baluta-pentru-sefia-psd-2444638.html,adevarul.ro
2025-05-20,Romania: leadership Psd si riunisce per decidere su dimissioni di Ciolacu e ingresso nel governo,https://www.agenzianova.com/a/682c370919ab39.61240238/6196353/2025-05-20/romania-leadership-psd-si-riunisce-per-decidere-su-dimissioni-di-ciolacu-e-ingresso-nel-governo,agenzianova.com
2025-05-20,Un nou favorit pentru funcÈia de preÈedinte PSD. Ce spune Simonis despre aceastÄ posibilitate,https://adevarul.ro/politica/un-nou-favorit-pentru-functia-de-presedinte-psd-2444658.html,adevarul.ro
2025-05-20,"PSD ar urma să decidă astăzi o formulă de conducere care să participe la negocierile pentru formarea viitorului guvern. Marcel Ciolacu, așteptat să demisoneze de la șefia partidului",https://atitudinea.ro/psd-ar-urma-sa-decida-astazi-o-formula-de-conducere-care-sa-participe-la-negocierile-pentru-formarea-viitorului-guvern-marcel-ciolacu-asteptat-sa-demisoneze-de-la-sefia-partidului-audio/,atitudinea.ro
2025-05-20,Romania: leadership Psd si riunisce per decidere su dimissioni di Ciolacu e ingresso nel governo,https://www.agenzianova.com/a/682c34ac1b16a5.30125681/6196353/2025-05-20/romania-leadership-psd-si-riunisce-per-decidere-su-dimissioni-di-ciolacu-e-ingresso-nel-governo,agenzianova.com
2025-05-20,Kedden lemond Ciolacu – megoszlanak a vélemények: kormányozzanak vagy vonuljanak ellenzékbe,https://maszol.ro/belfold/Kedden-lemond-Ciolacu-megoszlanak-a-velemenyek-kormanyozzanak-vagy-vonuljanak-ellenzekbe,maszol.ro
2025-05-20,"Válságban a PSD, párton belüli harcok jöhetnek",https://maszol.ro/belfold/Valsagban-a-PSD-parton-beluli-harcok-johetnek,maszol.ro
2025-05-20,Romania: leadership Psd si riunisce per decidere su dimissioni di Ciolacu e ingresso nel governo,https://www.agenzianova.com/a/682c3253535d22.36268157/6196353/2025-05-20/romania-leadership-psd-si-riunisce-per-decidere-su-dimissioni-di-ciolacu-e-ingresso-nel-governo,agenzianova.com
2025-05-20,"Marcel Ciolacu demisionează, iar PSD decide dacă rămâne la guvernare",https://www.aradon.ro/romania/marcel-ciolacu-demisioneaza-iar-psd-decide-daca-ramane-la-guvernare-2028075/?utm_source=rss&utm_medium=referral&utm_campaign=hiraggregator,aradon.ro
