publish_date,title,url,media_name
2025-05-30,Politicianul care depune plângere penală împotriva lui Marcel Ciolacu: „Este timpul ca cei care au distrus economia României să răspundă”,https://zcj.ro/politica/politicianul-care-depune-plangere-penala-impotriva-lui-marcel-ciolacu-este-timpul-ca-cei-care-au-distrus-economia-romaniei-sa-raspunda--282191.html,zcj.ro
2024-12-23,"Kelemen Hunor: kérdéses, hogy az RMDSZ részt vesz-e a kormányban",https://szabadsag.ro/article/kelemen-hunor-kerdeses-hogy-az-rmdsz-reszt-vesz-e-kormanyban,szabadsag.ro
2025-05-30,"Reforma Justiției, pariul cu miză uriașă al lui Nicușor Dan",https://www.dw.com/ro/reforma-justi%C8%9Biei-pariul-cu-miz%C4%83-uria%C8%99%C4%83-al-lui-nicu%C8%99or-dan/a-72739279?maca=rum-rss-rom-rom-3295-xml-mrss,dw.com
2025-05-29,"Cintruenigon, besoz beso mobilizatu dira Frente Obrero eta Vox",https://www.argia.eus/albistea/cintruenigon-besoz-beso-mobilizatu-dira-frente-obrero-eta-vox,argia.eus
2025-05-31,Marcel Ciolacu va avea o nouă funcție în viitoarea conducere PSD? Verdictul lui Sorin Grindeanu,https://www.capital.ro/marcel-ciolacu-va-avea-o-noua-functie-in-viitoarea-conducere-psd-verdictul-lui-sorin-grindeanu.html,capital.ro
2025-05-31,Sorin Grindeanu: Nu cred că vom avea colegi care să-l urmeze pe Ponta,https://www.gds.ro/politica/2025-05-31/sorin-grindeanu-nu-cred-ca-vom-avea-colegi-care-sa-l-urmeze-pe-ponta/,gds.ro
2025-05-31,Calendarul sărbătorilor legale din iunie 2025: Ce zile sunt LIBERE pentru salariați și elevi luna viitoare,https://ziarulunirea.ro/calendarul-sarbatorilor-legale-din-iunie-2025-ce-zile-sunt-libere-pentru-salariati-si-elevi-luna-viitoare-944042/,ziarulunirea.ro
2025-05-31,"Nem az a kérdés, hogy lesz-e adóemelés, hanem az, hogy mikortól és mekkora",https://maszol.ro/gazdasag/Nem-az-a-kerdes-hogy-lesz-e-adoemeles-hanem-az-hogy-mikortol-es-mekkora,maszol.ro
2025-05-31,Cărțile au fost date pe față. De ce au fost anulate alegerile din 2024: L-a făcut pe Ciolacu să îi dea voturi...,https://www.capital.ro/cartile-au-fost-date-pe-fata-de-ce-au-fost-anulate-alegerile-din-2024-l-a-facut-pe-ciolacu-sa-ii-dea-voturi.html,capital.ro
2025-05-31,Sorin Grindeanu îi închide ușa lui Victor Ponta pentru o posibilă întoarcere în PSD: „Probabilitatea e spre zero”,https://www.libertatea.ro/stiri/sorin-grindeanu-victor-ponta-posibila-intoarcere-psd-5327785,libertatea.ro
2025-05-31,"Grindeanu, întrebat dacă Ciolacu va mai ocupa vreo funcție în PSD sau în Guvern: „Eu nu cred că dorește”",https://www.gandul.ro/politica/grindeanu-intrebat-daca-ciolacu-va-mai-ocupa-vreo-functie-in-psd-sau-in-guvern-eu-nu-cred-ca-doreste-20533151,gandul.ro
2025-05-31,Cum a ajuns Ponta sÄ candideze la parlamentare pe listele PSD. Grindeanu: âMi s-a pÄrut cÄ ideea e okâ,https://adevarul.ro/politica/cum-a-ajuns-ponta-sa-candideze-la-parlamentare-pe-2447441.html,adevarul.ro
2025-05-31,"Reforma Justiției, pariul cu miză uriașă al lui Nicușor Dan",https://spotmedia.ro/stiri/opinii-si-analize/reforma-justitiei-pariul-cu-miza-uriasa-al-lui-nicusor-dan,spotmedia.ro
2025-05-31,"Ce ar însemna introducerea impozitării progresive, „resuscitată” de unii dintre liderii politici. Angajații care ar fi afectați. „Ar putea apărea o posibilă presiune”",https://ziare.com/impozit-progresiv/salarii-cota-unica-guvern-bani-buget-1944792,ziare.com
2025-05-30,"Reforma Justiției, pariul cu miză uriașă al lui Nicușor Dan",https://www.dw.com/ro/reforma-justi%C8%9Biei-pariul-cu-miz%C4%83-uria%C8%99%C4%83-al-lui-nicu%C8%99or-dan/a-72739279?maca=rum-rss-rom-societate-3298-xml-mrss,dw.com
2025-05-30,"Reforma Justiției, pariul cu miză uriașă al lui Nicușor Dan",https://www.dw.com/ro/reforma-justi%C8%9Biei-pariul-cu-miz%C4%83-uria%C8%99%C4%83-al-lui-nicu%C8%99or-dan/a-72739279?maca=rum-rss-rom-all-1493-rdf,dw.com
2025-05-30,Varianta de premier exclusă „aproape în totalitate” în discuțiile pentru formarea Guvernului. Este agreată doar de către PSD,https://stirileprotv.ro/stiri/politic/varianta-de-premier-exclusa-zaproape-in-totalitate-in-discutiile-pentru-formarea-guvernului-este-agreata-doar-de-catre-psd.html,stirileprotv.ro
2025-05-30,"„Nu este adevărat că Ilie Bolojan nu vrea să fie premier”. Ce au stabilit Nicușor Dan și șefii PSD, PNL, USR și UDMR",https://www.libertatea.ro/stiri/nicusor-dan-psd-pnl-usr-udmr-primul-dialog-formare-guvern-ilie-bolojan-premier-5327073,libertatea.ro
2025-05-30,"Sorin Grindeanu se întâlnește luni cu liderii confederațiilor sindicale/ ""Lipsește vocea unuia dintre cei mai importanți actori sociali""",https://www.gandul.ro/actualitate/sorin-grindeanu-se-intalneste-luni-cu-liderii-confederatiilor-sindicale-lipseste-vocea-unuia-dintre-cei-mai-importanti-actori-sociali-20532621,gandul.ro
2025-05-30,"Ei își apără „sărăkia”, și nevoile și neamurile.",https://www.libertatea.ro/opinii/ei-isi-apara-sarakia-si-nevoile-si-neamurile-5326951,libertatea.ro
2025-05-30,"Cum explică Emil Hurezeanu faptul că România nu este în Visa Waiver, deși Guvernul spunea că am îndeplinit condițiile",https://www.libertatea.ro/stiri/cum-explica-emil-hurezeanu-romania-exclusa-visa-waiver-sua-statul-roman-conditiile-indeplinite-5326855,libertatea.ro
2025-05-30,Incompetenții! Comisia Europeană a suspendat 869 milioane de EURO din PNRR pentru România,https://www.curentul.info/actualitate/incomptentii-comisia-europeana-a-suspendat-869-milioane-de-euro-din-pnrr/,curentul.info
2025-05-30,"Anunț de ultimă oră.Boloș:Trei jaloane din PNRR, suspendate",https://www.national.ro/news/anunt-de-ultima-ora-bolos-trei-jaloane-din-pnrr-sunt-suspendate-momentan-care-e-termenul-de-rezolvare-851297.html/,national.ro
2025-05-30,"Radu Burnete, numit consilier prezidențial",https://cursdeguvernare.ro/radu-burnete-consilier-prezidential.html,cursdeguvernare.ro
2025-05-30,"Scrisoarea BNS către Nicușor Dan: Dacă discuțiile se poartă exclusiv cu mediul de afaceri, este evident că propunerile vor fi în interesul capitalului",https://www.gandul.ro/actualitate/scrisoarea-bns-catre-nicusor-dan-daca-discutiile-se-poarta-exclusiv-cu-mediul-de-afaceri-este-evident-ca-propunerile-vor-fi-in-interesul-capitalului-20532107,gandul.ro
2025-05-30,De ce PSD la guvernare? Răspunsul unui senator social-democrat,https://monitorulneamt.ro/de-ce-psd-la-guvernare-raspunsul-unui-senator-social-democrat/,monitorulneamt.ro
2025-05-29,Guvernul tehnocrat - rețeta perfectă,https://www.national.ro/politica/guvernul-tehnocrat-reteta-perfecta-pentru-dezastru-851222.html/,national.ro
2025-05-29,"S-au înțeles că nu sunt de acord: PSD vrea premier „tehnocrat”, președintele Nicușor Dan vrea unul „cu autoritate”",https://stirileprotv.ro/stiri/politic/pe-cine-si-ar-dori-conducerea-psd-ca-premier-tehnocrat-motivul-pentru-care-nicusor-dan-respinge-propunerea.html,stirileprotv.ro
2025-05-29,Planul PSD pentru a reduce deficitul creat de guvernele Ciolacu și Ciucă. Domeniile în care ar vrea cheltuieli mai mici,https://stirileprotv.ro/stiri/politic/planul-psd-pentru-a-reduce-deficitul-creat-de-guvernele-ciolacu-domeniile-in-care-ar-vrea-cheltuieli-mai-mici-la-stat.html,stirileprotv.ro
2025-05-30,"Constantin Toma, Mayor of BuzÄu: ""Right now, the PSD is set on self-destruction""",https://www.bursa.ro/constantin-toma-mayor-of-buzau-right-now-the-psd-is-set-on-self-destruction-45138557,bursa.ro
2025-05-30,"Constantin Toma, primarul municipiului BuzÄu: ""Ãn momentul acesta, PSD este setat pe autodistrugere""",https://www.bursa.ro/constantin-toma-primarul-municipiului-buzau-in-momentul-acesta-psd-este-setat-pe-autodistrugere-24138556,bursa.ro
2025-05-29,"Reprezentanții partidelor din viitoarea coaliție guvernamentală au început pregătirea măsurilor pentru diminuarea deficitului bugetar/ Echipele PSD, PNL, USR, UDMR",https://cursdeguvernare.ro/partide-incep-pregatire-masuri-reducere-deficit-bugetar.html,cursdeguvernare.ro
2025-05-29,"Constantin Toma, primarul PSD din Buzău: E obligatoriu să intrăm la guvernare. Înhamă-te la treabă și oferă susținere pentru reformă!",https://www.gds.ro/politica/2025-05-29/constantin-toma-primarul-psd-din-buzau-e-obligatoriu-sa-intram-la-guvernare-inhama-te-la-treaba-si-ofera-sustinere-pentru-reforma/,gds.ro
2025-05-29,Cătălin Predoiu demontează speculații despre PNL: Îl susțin în totalitate pe Ilie Bolojan pentru funcția de premier,https://www.capital.ro/catalin-predoiu-demonteaza-speculatii-despre-pnl-il-sustin-in-totalitate-pe-ilie-bolojan-pentru-functia-de-premier.html,capital.ro
2025-05-29,USR vrea să prindă ciolanul guvernării- Ziarul National,https://www.national.ro/politica/dupa-ce-a-distrus-romania-cu-un-pnrr-otravit-usr-vrea-sa-prinda-ciolanul-guvernarii-851272.html/,national.ro
2025-05-29,"Directorul CT BUS, Sorin Țuțuianu, a demisionat",https://cugetliber.ro/stiri-social-directorul-ct-bus-sorin-tutuianu-a-demisionat-530186,cugetliber.ro
2025-05-29,Primarul BuzÄului cere schimbarea conducerii PSD: âPartidul e setat pe autodistrugere. Marcel Ciolacu nu mai are niciun viitor politicâ,https://adevarul.ro/politica/primarul-buzaului-cere-schimbarea-conducerii-psd-2446995.html,adevarul.ro
2025-05-29,Primarul Constantin Toma atacă conducerea PSD: 'Pe drumul autodistrugerii',https://romanialibera.ro/la-zi/primarul-buzaului-atac-dur-la-conducerea-psd-partidul-este-setat-pe-autodistrugere-ciolacu-nu-mai-are-viitor-politic/,romanialibera.ro
2025-05-29,"Sorin Grindeanu, președinte interimar al PSD: ""Nu știu dacă intrăm la guvernare/ Mai avem o soluție de rocadă""",https://www.gandul.ro/politica/sorin-grindeanu-presedinte-interimar-al-psd-nu-stiu-daca-intram-la-guvernare-mai-avem-o-solutie-de-rocada-20531093,gandul.ro
2025-05-29,"Burduja: Facturile după 1 iulie nu vor „exploda”, nu vor „bubui”",https://cugetliber.ro/stiri-economie-burduja-facturile-dupa-1-iulie-nu-vor-exploda-nu-vor-bubui-530170,cugetliber.ro
2025-05-29,"DATORIILE față de angajații sistemului judiciar sunt de 6,7 miliarde de lei, sunt diferențe mari între instanțe. Raportul Curții de Conturi la ICCJ",https://www.gandul.ro/actualitate/datoriile-fata-de-angajatii-sistemului-judiciar-sunt-de-67-miliarde-de-lei-sunt-diferente-mari-intre-instante-raportul-curtii-de-conturi-la-iccj-20531036,gandul.ro
2025-05-29,Oamenii de afaceri au mers la Nicușor Dan și i-au spus să nu crească taxele,https://cugetliber.ro/stiri-economie-oamenii-de-afaceri-au-mers-la-nicusor-dan-si-i-au-spus-sa-nu-creasca-taxele-530169,cugetliber.ro
2025-05-29,Clotilde Armand: România e ca o firmă la marginea falimentului,https://www.mediafax.ro/politic/clotilde-armand-compara-romania-cu-o-firma-la-marginea-falimentului-riscurile-de-criza-financiara-vor-deveni-inevitabile-23559566,mediafax.ro
2025-05-29,Un lider PSD crede că partidul este „setat pe autodistrugere” și consideră că „singura variantă de premier este Bolojan”,https://www.libertatea.ro/stiri/lider-psd-crede-ca-partidul-este-setat-autodistrugere-singura-varianta-premier-bolojan-5325305,libertatea.ro
2025-05-29,Primarul PSD din Buzău: E obligatoriu să intrăm la guvernare. Partidul e setat pe autodistrugere,https://hotnews.ro/primarul-psd-din-buzau-e-obligatoriu-sa-intram-la-guvernare-partidul-e-setat-pe-autodistrugere-1989396,hotnews.ro
2025-05-29,"Jocul lui Grindeanu: șef la Camera Deputaților, locul de unde Dragnea și Ciolacu au condus cu mână de fier partidul",https://www.libertatea.ro/opinii/radu-eremia-jocul-lui-grindeanu-sef-la-camera-deputatilor-locul-de-unde-dragnea-si-ciolacu-au-condus-cu-mana-de-fier-partidul-5325263,libertatea.ro
2025-05-29,Primarul PSD din Buzău: În momentul ăsta PSD este setat pe autodistrugere. Ciolacu nu mai are niciun viitor în politică,https://stirileprotv.ro/stiri/politic/primarul-psd-din-buzau-in-momentul-asta-psd-este-setat-pe-autodistrugere-ciolacu-nu-mai-are-niciun-viitor-in-politica.html,stirileprotv.ro
2025-05-29,"Cine face parte din „grupul tehnic” de la Cotroceni care va stabili măsurile fiscale. Ce oameni trimit PSD, PNL, UDMR și USR",https://hotnews.ro/cine-face-parte-din-grupul-tehnic-de-la-cotroceni-care-va-stabili-masurile-fiscale-ce-oameni-trimit-psd-pnl-udmr-si-usr-1989302,hotnews.ro
2025-05-29,Sorin Grindeanu renunță la Ministerul Transporturilor,https://www.gds.ro/politica/national/2025-05-29/sorin-grindeanu-renunta-la-ministerul-transporturilor/,gds.ro
2025-05-29,Nicușor Dan a luat o decizie care schimbă absolut tot. „Nu cred că putem evita...”,https://www.bzi.ro/nicusor-dan-a-luat-o-decizie-care-schimba-absolut-tot-nu-cred-ca-putem-evita-5269519,bzi.ro
2025-05-29,"Ciolacu, abandonat încet-încet",https://www.cotidianul.ro/ciolacu-atacat-de-un-primar-buzoian-niciun-viitor/,cotidianul.ro
2025-05-29,Primarul PSD al Buzăului: Partidul este setat pe autodistrugere. Marcel Ciolacu nu mai are niciun viitor în politică,https://www.antena3.ro/politica/primarul-psd-al-buzaului-partidul-este-setat-pe-autodistrugere-marcel-ciolacu-nu-mai-are-niciun-viitor-in-politica-747687.html,antena3.ro
2025-05-29,Grindeanu spune că nu va mai rămâne la Min. Transporturilor,https://www.national.ro/politica/grindeanu-spune-ca-nu-va-mai-ramane-la-ministerul-transporturilor-in-noul-guvern-in-niciun-caz-motivul-invocat-851207.html/,national.ro
2025-05-29,"Cintruenigon, besoz beso mobilizatu dira Frente Obrero eta Vox",https://www.argia.eus/albistea/cintruenigon-besoz-beso-mobilizatu-dira-frente-obrero-eta-vox?mtm_campaign=HariaRSS,argia.eus
2025-05-20,Ciolacu l-a lăsat moștenitor pe Sorin Grindeanu. Gruparea Nordis din PSD a câștigat,https://www.curentul.info/actualitate/ciolacu-l-a-lasat-mostenitor-pe-sorin-grindeanu-gruparea-nordis-din-psd-a-castigat/,curentul.info
2025-05-26,PSD vrea și cu dânsa-ntr-însa și cu sufletu-n rai,https://www.curentul.info/actualitate/psd-vrea-si-cu-dansa-n-transa-si-cu-sufletu-n-rai/,curentul.info
2025-05-22,Băsescu: Ciolacu şi Ciucă să răspundă penal pentru că au aruncat ţara într-o gravă criză bugetară,https://www.curentul.info/actualitate/basescu-ciolacu-si-ciuca-sa-raspunda-penal-pentru-ca-au-aruncat-tara-intr-o-grava-criza-bugetara/,curentul.info
2025-05-28,Concluziile consultărilor de la Cotroceni: Situația bugetului e gravă. Ce a decis Nicușor Dan,https://www.libertatea.ro/stiri/concluziile-consultarilor-de-la-cotroceni-situatia-bugetului-e-grava-si-trebuie-masuri-urgente-ce-a-decis-nicusor-dan-5324772,libertatea.ro
2025-05-28,"Love-story politic Ã®ntre senatoarea PSD Victoria Stoiciu Èi unul dintre cei mai cunoscuÈi milionari, recent divorÈat",https://adevarul.ro/showbiz/vedete/love-story-politic-intre-senatoarea-psd-victoria-2446853.html,adevarul.ro
2025-05-28,Sorin Grindeanu: „În niciun caz Sorin Grindeanu nu mai rămâne la Ministerul Transporturilor” în noul guvern,https://hotnews.ro/sorin-grindeanu-in-niciun-caz-sorin-grindeanu-nu-mai-ramane-la-ministerul-transporturilor-in-noul-guvern-1988837,hotnews.ro
2025-05-28,Újrarendeződnek a szélsőségesek,https://www.3szek.ro/load/cikk/173873/ujrarendezodnek-a-szelsosegesek,3szek.ro
2025-05-26,"Elezioni in Romania: sembrava una storia chiusa, invece non lo è",https://www.ghigliottina.info/2025/05/26/elezioni-in-romania-interferenze-estere/,ghigliottina.info
2025-05-16,"Etxegabetzea burutu gabe joan da AMA Desokupa enpresa Amurriotik, “herri erantzunari esker”",https://www.argia.eus/albistea/etxegabetzea-burutu-gabe-joan-da-ama-desokupa-enpresa-amurriotik-herri-erantzunari-esker,argia.eus
2025-05-28,Câteva capcane de evitat pe termen scurt de România,https://www.euractiv.ro/opinie/cateva-capcane-de-evitat-pe-termen-scurt-de-romania-73350,euractiv.ro
2025-05-28,Varianta alternativă de premier vânturată de PSD. Un nume greu din PNL nu agreează soluția Bolojan,https://www.libertatea.ro/stiri/trei-scenarii-pentru-viitorul-guvern-discutate-la-cotroceni-un-nume-greu-din-pnl-nu-agreeaza-solutia-bolojan-variantele-propuse-de-psd-5324502,libertatea.ro
2025-05-28,"Culisele discuțiilor de la Cotroceni. Ce le-a spus Nicușor Dan liderilor politici, cum a apărut ideea „rotativei” și a tehnocratului",https://www.antena3.ro/politica/culisele-discutiilor-de-la-cotroceni-ce-a-spus-nicusor-dan-liderilor-politici-cum-a-aparut-ideea-rotativei-si-a-tehnocratului-747589.html,antena3.ro
2025-05-27,"Dragoș Damian, CEO Terapia Cluj: „Nicușor Dan, pe lângă Ilie Bolojan, uite încă trei nume de Premier: Barna Tanczos, Hunor Kelemen, Marcel Ciolacu”",https://zcj.ro/opinie/dragos-damian-ceo-terapia-cluj-nicusor-dan-pe-langa-ilie-bolojan-uite-inca-trei-nume-de-premier-barna-tanczos-hunor-kelemen-marcel-ciolacu--280618.html,zcj.ro
2025-05-28,"Scenariu pentru noul Guvern: rotativÄ guvernamentalÄ PSD-PNL. Bolojan, varianta de premier din partea liberalilor",https://adevarul.ro/politica/scenariu-pentru-noul-guvern-rotativa-2446777.html,adevarul.ro
2025-05-28,Nicușor Dan confirmă discuția telefonică cu Donald Trump. Ce a spus Președintele României despre colaborarea cu SUA,https://www.libertatea.ro/stiri/nicusor-dan-confirma-discutie-telefonica-donald-trump-5324008,libertatea.ro
2025-05-28,"VIDEO. Ilie Bolojan, după consultările de la Cotroceni: „Este posibil să creștem taxele și impozitele""",https://www.tion.ro/romania/video-ilie-bolojan-dupa-consultarile-de-la-cotroceni-este-posibil-sa-crestem-taxele-si-impozitele-2073463/?utm_source=rss&utm_medium=referral&utm_campaign=hiraggregator,tion.ro
2025-05-28,"VIDEO Ilie Bolojan, după consultările de la Cotroceni: Este posibil să fim nevoiți să creștem taxe și impozite / Trebuie reduse cheltuielile statului, vor fi făcute disponibilizări",https://hotnews.ro/ilie-bolojan-dupa-consultarile-de-la-cotroceni-este-posibil-sa-fim-nevoiti-sa-crestem-taxe-si-impozite-trebuie-reduse-cheltuielile-statului-vor-fi-facute-disponibilizari-1988103,hotnews.ro
2025-05-28,Petrișor Peiu: Imaginea neputinței absolute a coaliției PNL-USR-PSD-UDMR,https://rgnpress.ro/2025/05/petrisor-peiu-imaginea-neputintei-absolute-a-coalitiei-pnl-usr-psd-udmr/,rgnpress.ro
2025-05-28,Sociologul care a anticipat că Crin Antonescu nu intră în turul doi al alegerilor prezidențiale vine cu o nouă analiză. Ce trebuie să facă PSD urgent,https://hotnews.ro/sociologul-care-a-anticipat-ca-crin-antonescu-nu-intra-in-turul-doi-si-avertiza-ca-psd-risca-sa-ajunga-la-10-prezinta-trei-masuri-pe-care-social-democratii-trebuie-sa-le-ia-urgent-1987980,hotnews.ro
2025-05-28,"Dominic Fritz, despre situaţia economică: 'Mult mai grav decât se aşteptau unii'",https://cugetliber.ro/stiri-economie-dominic-fritz-despre-situatia-economica-mult-mai-grav-decat-se-asteptau-unii-530066,cugetliber.ro
2025-05-28,Baronii PSD care au „asigurat” înfrângerile lui Ciolacu și Antonescu vor la guvernare,https://jurnalul.ro/special-jurnalul/lideri-psd-guvernare-usr-rezultate-prezidentiabili-999291.html,jurnalul.ro
2025-05-28,"PSD, împins la guvernare. Ce spun liderii din Neamţ",https://monitorulneamt.ro/psd-impins-la-guvernare-ce-spun-liderii-din-neamt/,monitorulneamt.ro
2025-05-28,"Consultări maraton, azi, la Cotroceni. Nicușor Dan se vede cu partidele parlamentare. Tema majoră de pe ordinea de zi / Ce spun liderii politici",https://hotnews.ro/consultari-maraton-azi-la-cotroceni-nicusor-dan-se-vede-cu-partidele-parlamentare-tema-majora-de-pe-ordinea-de-zi-ce-spun-liderii-politici-1987513,hotnews.ro
2025-05-27,"Ce a discutat Nicușor Dan cu Donald Trump la telefon. Președintele României, invitat la Washington",https://www.libertatea.ro/stiri/nicusor-dan-a-vorbit-la-telefon-cu-donald-trump-la-o-zi-dupa-ce-a-depus-juramantul-de-investitura-spune-fostul-ambasador-adrian-zuckerman-5323571,libertatea.ro
2025-05-19,Roumanie: soulagement du camp pro-européen mais pas d'état de grâce,https://www.martinique.franceantilles.fr/actualite/politique/roumanie-soulagement-du-camp-pro-europeen-mais-pas-detat-de-grace-1036450.php,franceantilles.fr
2025-05-27,L'addio alla politica del sovranista romeno Calin Georgescu,https://it.euronews.com/my-europe/2025/05/27/laddio-alla-politica-del-sovranista-romeno-calin-georgescu,euronews.com
2025-05-27,"Statul are dificultăți în a găsi bani pentru plata salariilor și pensiilor, recunoaște Tanczos Barna pentru prima dată",https://www.libertatea.ro/stiri/statul-dificultati-bani-plata-salariilor-pensiilor-recunoaste-tanczos-barna-prima-data-5323444,libertatea.ro
2025-05-27,"Tánczos Barna: Am reuşit să reducem risipa cu bunuri şi servicii, înregistrând chiar o uşoară scădere-3,9%",https://www.gandul.ro/actualitate/tanczos-barna-am-reusit-sa-reducem-risipa-cu-bunuri-si-servicii-inregistrand-chiar-o-usoara-scadere-39-20529253,gandul.ro
2025-05-27,Marius Tucă Show – Invitat: prof. univ. dr. Valentin Stan: „Alegerile ANTICIPATE devin inevitabile”,https://rgnpress.ro/2025/05/marius-tuca-show-invitat-prof-univ-dr-valentin-stan-alegerile-anticipate-devin-inevitabile/,rgnpress.ro
2025-05-27,"Kelemen Hunor, convins că se va forma un guvern majoritar: „Președintele trebuie să propună un premier, nu PSD”",https://www.gandul.ro/politica/kelemen-hunor-convins-ca-se-va-forma-un-guvern-majoritar-presedintele-trebuie-sa-propuna-un-premier-nu-psd-20528102,gandul.ro
2025-05-27,O femeie din Soroca a fost condamnată pentru „cumpărarea voturilor” la prezidențiale: S-a ales cu o amendă de 40 mii lei,https://unimedia.info/ro/news/c1e8ed8da331c88e/o-femeie-din-soroca-a-fost-condamnata-pentru-cumpararea-voturilor-la-prezidentiale-s-a-ales-cu-o-amenda-de-40-mii-lei.html?utm_source=rss&utm_medium=rss&utm_campaign=rss,unimedia.info
2025-05-27,"INTERVIU. Ce se va întâmpla cu PSD? „Singura soluție pentru a preveni victoria extremei drepte la următoarele alegeri este să se nască o alternativă de stânga adevărată”, spune un cercetător român de la Oxford, care avertizează că „nu e nimic de substanță în programul AUR”",https://hotnews.ro/interviu-ce-se-va-intampla-cu-psd-singura-solutie-pentru-a-preveni-victoria-extremei-drepte-la-urmatoarele-alegeri-este-sa-se-nasca-o-alternativa-de-stanga-adevarata-spune-un-cerc-1986497,hotnews.ro
2025-05-26,Președintele Nicușor Dan: Chem toate forțele politice să pună interesul național pe primul loc. Reformele nu mai pot fi amânate!,https://www.gandul.ro/politica/presedintele-nicusor-dan-chem-toate-fortele-politice-sa-puna-interesul-national-pe-primul-loc-reformele-nu-mai-pot-fi-amanate-20528099,gandul.ro
2025-05-26,"Avem președinte ales, avem dispute în partide",https://www.gazetademaramures.ro/avem-presedinte-ales-avem-dispute-in-partide-28326,gazetademaramures.ro
2025-05-26,Habemus președinte! Nicușor Dan este noul șef al statului,https://www.gazetademaramures.ro/habemus-presedinte-nicusor-dan-este-noul-sef-al-statului-28329,gazetademaramures.ro
2025-05-26,"Valentin Stan: „Când ai o astfel de invalidare populară, alegerile anticipate devin inevitabile”",https://www.gandul.ro/emisiuni/marius-tuca-show/valentin-stan-cand-ai-o-astfel-de-invalidare-populara-alegerile-anticipate-devin-inevitabile-20528068,gandul.ro
2025-05-26,"Nicusor Dan, pro-européen et fervent soutien de l'Ukraine, investi président de la Roumanie",https://www.lopinion.fr/international/nicusor-dan-pro-europeen-et-fervent-soutien-de-lukraine-investi-president-de-la-roumanie,lopinion.fr
2025-05-26,Direcția PSD se decide la congres. Sorin Grindeanu: Dacă țipi cel mai tare și fără argument nu înseamnă că ai dreptate,https://www.gandul.ro/politica/directia-psd-se-decide-la-congres-sorin-grindeanu-daca-tipi-cel-mai-tare-si-fara-argument-nu-inseamna-ca-ai-dreptate-20528083,gandul.ro
2025-05-26,Cum i s-a părut lui Marcel Ciolacu discursul lui Nicușor Dan din Parlament și planul fostului premier și președinte PSD,https://www.libertatea.ro/stiri/cum-i-s-a-parut-lui-marcel-ciolacu-discursul-lui-nicusor-dan-din-parlament-fostul-premier-si-presedinte-psd-are-un-plan-5321993,libertatea.ro
2025-05-26,"Marcel Ciolacu, după discursul lui Nicușor Dan din Parlament: Un mesaj foarte bun",https://www.euractiv.ro/politic-intern/marcel-ciolacu-dupa-discursul-lui-nicusor-dan-din-parlament-un-mesaj-foarte-bun-73304,euractiv.ro
2025-05-26,"Dezvrăjirea: Președintele Nicușor Dan a aruncat mănușa, într-un discurs cu dublă miză",https://spotmedia.ro/stiri/opinii-si-analize/dezvrajirea-presedintele-nicusor-dan-a-aruncat-manusa-intr-un-discurs-cu-dubla-miza,spotmedia.ro
2025-05-26,"Ciolacu neagă ""apocalipsa"": ""O să detaliem toate deciziile""",https://www.cotidianul.ro/ciolacu-neaga-apocalipsa-o-sa-detaliem-toate-deciziile/,cotidianul.ro
2025-05-26,Nicușor Dan a depus jurământul de președinte: „Statul român are nevoie de o schimbare fundamentală”. „Cer partidelor politice să acționeze în interesul național”,https://www.europafm.ro/nicusor-dan-depune-juramantul-de-presedinte-in-plenul-comun-al-parlamentului-live-text/,europafm.ro
2025-05-26,"RecepÈia de la Cotroceni, fÄrÄ Ciolacu Èi Grindeanu. Cine sunt social-democraÈii invitaÈi de NicuÈor Dan",https://adevarul.ro/politica/receptia-de-la-cotroceni-fara-ciolacu-si-2446177.html,adevarul.ro
2025-05-26,Marcel Ciolacu laudÄ discursul lui NicuÅor Dan Ã®n plenul Parlamentului: âAr trebui cu toÅ£ii sÄ punem umÄrulâ,https://adevarul.ro/politica/marcel-ciolacu-lauda-discursul-lui-nicusor-dan-in-2446175.html,adevarul.ro
2025-05-26,Sorin Grindeanu spune că PSD vrea discuţii cu preşedintele,https://www.libertatea.ro/stiri/sorin-grindeanu-psd-discutii-presedinte-5321459,libertatea.ro
