publish_date,title,url,media_name
2024-10-28,Israel presses Gaza and Lebanon assaults as Egypt touts truce plan,https://www.fox28spokane.com/israel-presses-gaza-and-lebanon-assaults-as-egypt-touts-truce-plan/,fox28spokane.com
2024-10-28,"Why Are Oil Stocks Falling After Israel's Strikes On Iran - Occidental Petroleum (NYSE:OXY), Chevron (NYSE:CVX)",https://www.benzinga.com/news/24/10/41571526/exxon-shell-warren-buffett-backed-occidental-petroleum-and-other-oil-stocks-tumble-in-premarket-afte,benzinga.com
2024-10-26,India calls for dialogue and diplomacy as tensions mount in Middle East after Israeli strikes on Iran,https://www.theweek.in/news/india/2024/10/26/india-calls-for-dialogue-and-diplomacy-as-tensions-mount-in-middle-east-after-israeli-strikes-on-iran.html,theweek.in
2024-10-28,Nation and world news in brief for October 28,https://www.westhawaiitoday.com/2024/10/28/nation-world-news/nation-and-world-news-in-brief-for-october-28/,westhawaiitoday.com
2024-10-28,Israel presses Gaza and Lebanon assaults as Egypt touts truce plan,https://www.insidenova.com/news/national/israel-presses-gaza-and-lebanon-assaults-as-egypt-touts-truce-plan/article_be409f1f-6a33-5038-89aa-6fde0d7eca2e.html,insidenova.com
2024-10-28,Forbes Daily: The $250 Billion Influencer Economy Is Booming,https://www.forbes.com/sites/daniellechemtob/2024/10/28/forbes-daily-the-250-billion-influencer-economy-is-booming/,forbes.com
2024-10-28,Oil prices plunge as Israel's retaliatory strike against Iran spares crude facilities,https://finance.yahoo.com/news/oil-prices-plunge-as-israels-retaliatory-strike-against-iran-spares-crude-facilities-115908552.html,yahoo.com
2024-10-28,Israel pulls punches in retaliatory strike against Iran but claims to have inflicted severe damage,https://www.washingtonexaminer.com/policy/defense/3205386/israel-pulls-punches-retaliatory-strike-iran-still-claims-inflicted-severe-damage/,washingtonexaminer.com
2024-10-28,Diplomacy: Securing Gains or Mitigating Losses?,https://www.al-binaa.com/archives/417281,al-binaa.com
2024-10-28,"Global stocks diverge, oil prices tumble as Iran fears ease",https://tribune.net.ph/2024/10/28/global-stocks-diverge-oil-prices-tumble-as-iran-fears-ease,tribune.net.ph
2024-10-28,"Khamenei Cautions Against Exaggerating or Downplaying the Assault, Urges Leadership to Convey a Message of Strength / Burns in Doha Seeking an Impossible ‘Win-Win’ Solution for Gaza and Lebanon After Military Setbacks",https://www.al-binaa.com/archives/417278,al-binaa.com
2024-10-28,Social platform X blocks new account for Iranian leader,https://thewest.com.au/politics/social-platform-x-blocks-new-account-for-iranian-leader-c-16555506,thewest.com.au
2024-10-27,"Israel’s targeted response against Iran sends new warnings to regime about IDF's capabilities, experts say",https://www.foxnews.com/world/israels-targeted-response-against-iran-sends-new-warnings-regime-about-idfs-capabilities-experts-say,foxnews.com
2024-10-28,Lebanon officials say five killed in Israeli airstrike,https://www.rte.ie/news/2024/1028/1477800-lebanon-middle-east/,rte.ie
2024-10-28,"Israel’s targeted response against Iran sends new warnings to regime about IDF's capabilities, experts say",https://foxwilmington.com/israels-targeted-response-against-iran-sends-new-warnings-to-regime-about-idfs-capabilities-experts-say/?utm_source=rss&utm_medium=rss&utm_campaign=israels-targeted-response-against-iran-sends-new-warnings-to-regime-about-idfs-capabilities-experts-say,foxwilmington.com
2024-10-28,Gaza cease-fire proposed,https://dailyprogress.com/gaza-cease-fire-proposed/article_018a2fb5-30fa-5be4-92ad-ac9ad8a0b5b2.html,dailyprogress.com
2024-10-28,Stocks rise ahead of action-packed week; oil dives,https://www.channelnewsasia.com/business/stocks-rise-ahead-action-packed-week-oil-dives-4706511,channelnewsasia.com
2024-10-28,Impunity has emboldened Zionists: Iran FM Spox,https://en.irna.ir/news/85641969/Impunity-has-emboldened-Zionists-Iran-FM-Spox,irna.ir
2024-10-28,Ayatollah Khamenei's new X account suspended,https://www.newsweek.com/x-twitter-ayatollah-ali-khamenei-iran-supreme-leader-1975772,newsweek.com
2024-10-28,"Gaza war: More than 43K Palestinians killed, health ministry says",https://www.ctvnews.ca/world/key-mediator-egypt-proposes-a-2-day-gaza-ceasefire-and-the-release-of-4-hostages-1.7088989,ctvnews.ca
2024-10-28,Israel presses Gaza and Lebanon assaults as Egypt touts truce plan,https://www.digitaljournal.com/world/israel-presses-gaza-and-lebanon-assaults-as-egypt-touts-truce-plan/article,digitaljournal.com
2024-10-28,"X suspends Iranian supreme leader’s Hebrew account, claims it violated rules",https://scroll.in/latest/1074989/x-suspends-iranian-supreme-leaders-hebrew-account-claims-it-violated-rules?utm_source=rss&utm_medium=public,scroll.in
2024-10-28,It’s War! Iranian Leaders Vow Revenge With “No Limits” After Israel Bombs Iran,https://freerepublic.com/focus/f-bloggers/4273939/posts,freerepublic.com
2024-10-28,Iraq Complains UN Over Israel Using Its Airspace To Attack Iran,https://www.ndtv.com/world-news/iraq-complains-un-over-israel-using-its-airspace-to-attack-iran-6891454#publisher=newsstand,ndtv.com
2024-10-28,Iran will &#8216;use all available tools&#8217; to respond to Israel&#8217;s attack,https://cyprus-mail.com/2024/10/28/iran-will-use-all-available-tools-to-respond-to-israels-attack/,cyprus-mail.com
2024-10-28,Iran says it will ‘use all available tools’ to respond to Israel’s attack,https://www.irishtimes.com/world/middle-east/2024/10/28/israel-lebanon-iran-hizbullah-gaza-hamas-middle-east-crisis-latest-news/,irishtimes.com
2024-10-28,Middle East latest: Social platform X suspends new account on behalf of Iran's supreme leader,https://www.news4jax.com/news/2024/10/28/middle-east-latest-social-platform-x-suspends-new-account-on-behalf-of-irans-supreme-leader/,news4jax.com
2024-10-28,EGYPT PROPOSES GAZA CEASE-FIRE,https://oanow.com/egypt-proposes-gaza-cease-fire/article_a2e82062-df9e-574f-b36d-73fd4c24a355.html,oanow.com
2024-10-28,Social platform X suspends new account on behalf of Iran’s Supreme Leader,https://www.breakingnews.ie/world/social-platform-x-suspends-new-account-on-behalf-of-irans-supreme-leader-1688267.html,breakingnews.ie
2024-10-28,Middle East latest: Social platform X suspends new account on behalf of Iran's supreme leader,https://www.clickondetroit.com/news/2024/10/28/middle-east-latest-social-platform-x-suspends-new-account-on-behalf-of-irans-supreme-leader/,clickondetroit.com
2024-10-28,Iraq lodges UN complaint over Israel using its airspace to attack Iran,https://timesofindia.indiatimes.com/world/middle-east/iraq-lodges-un-complaint-over-israel-using-its-airspace-to-attack-iran/articleshow/114691099.cms,indiatimes.com
2024-10-28,Iran's air defense successfully confronts Israeli aggression,https://en.mehrnews.com/news/223665/Iran-s-air-defense-successfully-confronts-Israeli-aggression,mehrnews.com
2024-10-28,Middle East Latest: Social Platform X Suspends New Account On Behalf Of Iran’s Supreme Leader,https://www.kurv.com/middle-east-latest-social-platform-x-suspends-new-account-on-behalf-of-irans-supreme-leader/?utm_source=rss&utm_medium=rss&utm_campaign=middle-east-latest-social-platform-x-suspends-new-account-on-behalf-of-irans-supreme-leader,kurv.com
2024-10-28,Middle East latest: Social platform X suspends new account on behalf of Iran's supreme leader,https://www.inquirer.com/wires/ap/middle-east-latest-social-platform-x-suspends-new-account-behalf-irans-supreme-leader-20241028.html,inquirer.com
2024-10-28,Everything about israel lebanon news,https://trevorsubqq.ttblogs.com/10338185/everything-about-israel-lebanon-news,ttblogs.com
2024-10-28,Elon Musk's X Suspends New Account of Iran's Ayatollah Ali Khamenei,https://www.news18.com/tech/elon-musks-x-suspends-new-account-of-irans-ayatollah-ali-khamenei-9101313.html,news18.com
2024-10-28,Daily Briefing: Who is going to win the election?,https://www.yahoo.com/news/going-win-election-102628826.html,yahoo.com
2024-10-28,Iran supreme leader Khamenei’s X account suspended,https://www.thehindu.com/news/international/iran-supreme-leader-khameneis-x-account-suspended/article68806048.ece,thehindu.com
2024-10-28,Saudi Arabia must decide if a relationship with Israel is worth its while,https://www.jpost.com/opinion/article-826358,jpost.com
2024-10-28,Iran says it will ‘use all available tools’ to respond to Israel’s attack,https://www.gmanetwork.com/news/topstories/world/925191/iran-says-it-will-use-all-available-tools-to-respond-to-israel-s-attack/story/,gmanetwork.com
2024-10-28,Israel Presses Gaza And Lebanon Assaults As Egypt Touts Truce Plan,https://www.ibtimes.com/israel-presses-gaza-lebanon-assaults-egypt-touts-truce-plan-3748439,ibtimes.com
2024-10-28,Iran says it will ‘use all available tools’ to respond to Israel’s attack,https://thefrontierpost.com/iran-says-it-will-use-all-available-tools-to-respond-to-israels-attack/,thefrontierpost.com
2024-10-27,Khamenei warns against exaggerating or underestimating the impact of Israel's airstrike on Iran,https://www.saudigazette.com.sa/article/646553/World/Khamenei-warns-against-exaggerating-or-underestimating-the-impact-of-Israels-airstrike-on-Iran?ref=rss&format=simple&link=link,saudigazette.com.sa
2024-10-28,US and Israel — Two Governments Linked by Lies and Bloodshed. Philip Giraldi,https://www.globalresearch.ca/us-israel-two-governments-lies-bloodshed/5871184,globalresearch.ca
2024-10-27,"Neither Be Exaggerated Nor...': Iran's Khamenei Downplays Israel Attack, Vows Strong Response",https://www.news18.com/world/irans-khamenei-says-israel-attack-should-neither-be-exaggerated-nor-minimised-9100876.html,news18.com
2024-10-28,"Secret Iranian Military Bases Damaged in Israeli Attack, Show Satellite Images",https://www.news18.com/world/secret-iranian-military-bases-damaged-in-israeli-attack-show-satellite-images-9101553.html,news18.com
2024-10-27,UNSC Emergency Meet Set For Monday At Iran's Request Amid Middle East Escalation,https://www.news18.com/world/un-security-council-emergency-meeting-monday-after-iran-request-9101087.html,news18.com
2024-10-28,Iraq approaches UN over Israel's use of airspace to hit Iran,https://www.dw.com/en/iraq-approaches-un-over-israels-use-of-airspace-to-hit-iran/live-70616807?maca=en-rss-en-all-1573-rdf,dw.com
2024-10-28,Израелското армейско радио: Унищожихме всички ПВО батареи на Иран с голям обсег (ВИДЕО),https://www.actualno.com/asia/izraelskoto-armejsko-radio-unishtojihme-vsichki-pvo-batarei-na-iran-s-goljam-obseg-video-news_2328056.html,actualno.com
2024-10-27,"Key mediator Egypt proposes a 2-day Gaza cease-fire, the release of 4 hostages",https://baynews9.com/fl/tampa/international/2024/10/27/egypt-cease-fire-gaza-israel-hostages,baynews9.com
2024-10-27,"Israeli strikes on Gaza kill 33, while truck ramming near Tel Aviv kills one",https://www.mprnews.org/story/2024/10/27/npr-israel-strikes-northern-gaza,mprnews.org
2024-10-27,‘Tools Iran Couldn’t Produce Hit…’ What Israel Achieved Or Didn’t With Its ‘Limited’ Attack On Iran,https://www.news18.com/videos/world/tools-iran-couldn-t-produce-hit-what-israel-achieved-or-didn-t-with-its-limited-attack-on-iran-9101180.html,news18.com
2024-10-28,We Don't Seek War But...': Iran's President Warns of 'Appropriate Response' To Israeli Attack,https://www.news18.com/world/iran-president-masoud-pezeshkian-warns-of-appropriate-response-to-israeli-attack-middle-east-crisis-9101760.html,news18.com
2024-10-28,Russia doing everything to prevent major war in Middle East — senior diplomat,https://www.independent.co.ug/russia-doing-everything-to-prevent-major-war-in-middle-east-senior-diplomat/,independent.co.ug
2024-10-28,Social platform X suspends new account on behalf of Iran's supreme leader,https://www.manilatimes.net/2024/10/28/world/social-platform-x-suspends-new-account-on-behalf-of-irans-supreme-leader/1992301,manilatimes.net
2024-10-28,"Israeli strikes should not be magnified, nor downplayed, Iran's supreme leader says",https://www.egyptindependent.com/israeli-strikes-should-not-be-magnified-nor-downplayed-irans-supreme-leader-says/,egyptindependent.com
2024-10-28,"Israel To Face ""Bitter Consequences"", Says Iran Guards Chief After Attack",https://www.ndtv.com/world-news/israel-to-face-bitter-consequences-says-iran-guards-chief-after-attack-6891555,ndtv.com
2024-10-27,Iran's leaders discuss response to Israeli attacks that killed 4,https://www.dailysabah.com/world/mid-east/irans-leaders-discuss-response-to-israeli-attacks-that-killed-4,dailysabah.com
2024-10-28,"Iran says not seeking war with Israel, promises response to strikes",https://www.nation.com.pk/28-Oct-2024/iran-says-not-seeking-war-with-israel-promises-response-to-strikes,nation.com.pk
2024-10-28,Israel to face 'bitter consequences' for attack: Iran Guards chief,https://www.dailysabah.com/world/mid-east/israel-to-face-bitter-consequences-for-attack-iran-guards-chief,dailysabah.com
2024-10-28,Oil prices plunge as Israel spares Iran's oil facilities in attack,https://www.euronews.com/business/2024/10/28/oil-prices-plunge-as-israel-spares-irans-oil-facilities-in-retaliatory-attack,euronews.com
2024-10-28,Iraq approaches UN over Israel's use of airspace to hit Iran,https://www.dw.com/en/iraq-approaches-un-over-israels-use-of-airspace-to-hit-iran/live-70616807?maca=en-rss-en-top-1022-rdf,dw.com
2024-10-28,Social platform X suspends new account on behalf of Iran’s Supreme Leader,https://jerseyeveningpost.com/uncategorised/2024/10/28/social-platform-x-suspends-new-account-on-behalf-of-irans-supreme-leader/,jerseyeveningpost.com
2024-10-28,UN Security Council to discuss Israeli attack on Iran,https://www.voanews.com/a/un-security-council-to-discuss-israeli-attack-on-iran/7841578.html,voanews.com
2024-10-27,Iran’s Khamenei says Israeli attack must ‘neither be exaggerated nor underestimated’,https://www.nation.com.pk/27-Oct-2024/iran-s-khamenei-says-israeli-attack-must-neither-be-exaggerated-nor-underestimated,nation.com.pk
2024-10-28,Gold dips as Israel’s limited strike on Iran curbs haven demand; oil slumps,https://www.straitstimes.com/business/gold-dips-as-israels-limited-strike-on-iran-curbs-haven-demand-oil-slumps,straitstimes.com
2024-10-24,Former National Security Adviser Robert O’Brien: Ukraine’s NATO bid risks ‘World War III’,https://www.foxnews.com/politics/former-national-security-adviser-robert-obrien-ukraines-nato-bid-risks-world-war-iii,foxnews.com
2024-10-28,Middle East latest: Social platform X suspends new account on behalf of Iran's supreme leader,https://www.newsday.com/news/nation/israel-hamas-hezbollah-mideast-latest-28-october-2024-v59817,newsday.com
2024-10-28,Oil prices fell dramatically after Israel's limited strikes on Iran,https://www.lportepilot.ca/oil-prices-fell-dramatically-after-israels-limited-strikes-on-iran/,lportepilot.ca
2024-10-28,Stocks rise ahead of action-packed week; Japan election sparks turmoil,https://www.channelnewsasia.com/business/stocks-rise-ahead-action-packed-week-japan-election-sparks-turmoil-4706511,channelnewsasia.com
2024-10-28,Oil prices plunge 5% after limited Israeli retaliatory attack on Iran,https://www.channelnewsasia.com/business/oil-prices-plunge-5-after-limited-israeli-retaliatory-attack-iran-4706331,channelnewsasia.com
2024-10-27,"Israeli strikes on Gaza kill 22, officials say",https://stlucia.loopnews.com/content/israeli-strikes-gaza-kill-22-officials-say-4,loopnews.com
2024-10-28,"Oil prices tumble as Iran fears ease, yen weakens after Japan polls",https://www.businesstimes.com.sg/companies-markets/capital-markets-currencies/oil-prices-tumble-iran-fears-ease-yen-weakens-after-japan-polls,businesstimes.com.sg
2024-10-27,Iran mulls response as Israel says it hit Iran hard,https://news.rthk.hk/rthk/en/component/k2/1776444-20241028.htm,rthk.hk
2024-10-28,Netanyahu is Determined to Win,https://tjvnews.com/2024/10/netanyahu-is-determined-to-win/,tjvnews.com
2024-10-28,"The Intelligence: After Israel’s missile strike on Iran, what next?",https://biztoc.com/x/1519351b9c710daa?ref=rss,biztoc.com
2024-10-28,Iraq protests to UN over Israel’s use of airspace to attack Iran,https://www.aa.com.tr/en/middle-east/iraq-protests-to-un-over-israel-s-use-of-airspace-to-attack-iran/3376820,aa.com.tr
2024-10-28,Why X suspended Iran Supreme Leader Ayatollah Ali Khamenei's new account,https://www.hindustantimes.com/world-news/why-x-suspended-iran-supreme-leader-ayatollah-ali-khameneis-new-account-101730103056956.html,hindustantimes.com
2024-10-27,Egypt proposes two-day Gaza ceasefire and release of four hostages,https://www.irishexaminer.com/world/arid-41504666.html,irishexaminer.com
2024-10-28,Hurt us—and we will hurt them: Israeli PM Benjamin Netanyahu,https://www.dnaindia.com/world/report-hurt-us-and-we-will-hurt-them-israeli-pm-benjamin-netanyahu-3115370,dnaindia.com
2024-10-28,EGYPT PROPOSES GAZA CEASE-FIRE,https://chippewa.com/egypt-proposes-gaza-cease-fire/article_67df3307-2702-5e8f-9265-f173087bb2d4.html,chippewa.com
2024-10-28,Iran says it will ‘use all available tools’ to respond to Israel’s attack,https://www.regionalmedianews.com/world/iran-says-it-will-use-all-available-tools-to-respond-to-israels-attack,regionalmedianews.com
2024-10-28,Iran says it will 'use all available tools' to respond to Israel's attack,https://gazette.com/news/us-world/iran-says-it-will-use-all-available-tools-to-respond-to-israels-attack/article_08346a03-8cec-5c0e-903a-1318a3d02b1b.html,gazette.com
2024-10-28,Israeli estimates: Iran may launch hundreds of ballistic missiles,https://en.ammonnews.net/article/75916,ammonnews.net
2024-10-28,Oil prices plunge 5% after limited Israeli retaliatory attack on Iran,https://www.brecorder.com/news/40329359/oil-prices-plunge-5-after-limited-israeli-retaliatory-attack-on-iran,brecorder.com
2024-10-28,Iran says it will ‘use all available tools’ to respond to Israel’s attack,https://www.brecorder.com/news/40329377/iran-says-it-will-use-all-available-tools-to-respond-to-israels-attack,brecorder.com
2024-10-28,Middle East crisis live: Iranian military chief warns Israel of ‘bitter consequences’ over weekend’s airstrikes,https://www.theguardian.com/world/live/2024/oct/28/israel-iran-gaza-lebanon-unrwa-middle-east-crisis-news,theguardian.com
2024-10-28,Oil price falls 5% after Israel’s attack on Iran; UK business confidence hits four-month low ahead of budget – business live,https://www.theguardian.com/business/live/2024/oct/28/oil-price-falls-israel-attack-iran-uk-budget-business-live-news,theguardian.com
2024-10-27,"Israeli strikes on Gaza kill 22, officials say",https://barbados.loopnews.com/content/israeli-strikes-gaza-kill-22-officials-say-3,loopnews.com
2024-10-28,Iran says it will ‘use all available tools’ to respond to Israel’s attack,https://www.timesofearth.com/2024/10/28/iran-says-it-will-use-all-available-tools-to-respond-to-israels-attack/,timesofearth.com
2024-10-27,Israel launched strikes on Iran in a retaliatory attack. Here’s what we know,https://cbs58.com/news/israel-launched-strikes-on-iran-in-a-retaliatory-attack-here-s-what-we-know,cbs58.com
2024-10-28,How US President Joe Biden pushed Israel to calibrate its strikes on Iran,https://thelinkpaper.ca/how-us-president-joe-biden-pushed-israel-to-calibrate-its-strikes-on-iran/,thelinkpaper.ca
2024-10-28,Iran’s supreme leader Khamenei’s Hebrew X account suspended,https://www.siasat.com/irans-supreme-leader-khameneis-hebrew-x-account-suspended-3121387/,siasat.com
2024-10-28,Netanyahu stalling Middle East settlement due to US election – CNN,https://www.rt.com/news/606603-netanyahu-stalling-middle-east-settlement-us-election/?utm_source=rss&utm_medium=rss&utm_campaign=RSS,rt.com
2024-10-27,Israel Chooses Trump Over Harris in 2024 Election,https://theblacksphere.net/2024/10/israel-chooses-trump-over-harris-2024/,theblacksphere.net
2024-10-28,Iran says it will ‘use all available tools’ to respond to Israel’s attack,https://kdal610.com/2024/10/28/iran-says-it-will-use-all-available-tools-to-respond-to-israels-attack/,kdal610.com
2024-10-27,A Stunning De-Capitation? The Netanyahu 'Madness',https://www.unz.com/article/a-stunning-de-capitation-the-netanyahu-madness/,unz.com
2024-10-27,Lying Western Press Scramble To Frame Israel’s Attack On Iran As Self-Defense,https://thefreethoughtproject.com/information-war/lying-western-press-scramble-to-frame-israels-attack-on-iran-as-self-defense,thefreethoughtproject.com
2024-10-27,Satellite Images Show Damage From Israeli Attack at 2 Secretive Iranian Military Bases,https://vinnews.com/2024/10/27/satellite-images-show-damage-from-israeli-attack-at-2-secretive-iranian-military-bases/,vinnews.com
2024-10-28,Middle East latest: Social platform X suspends new account on behalf of Iran's supreme leader,https://www.local10.com/news/2024/10/28/middle-east-latest-social-platform-x-suspends-new-account-on-behalf-of-irans-supreme-leader/,local10.com
2024-10-28,Middle East latest: Social platform X suspends new account on behalf of Iran's supreme leader,https://www.clickorlando.com/news/2024/10/28/middle-east-latest-social-platform-x-suspends-new-account-on-behalf-of-irans-supreme-leader/,clickorlando.com
2024-10-28,Oil slumps more than 4% after Iran downplays Israeli strikes,https://www.emirates247.com/business/economy-finance/oil-slumps-more-than-4-after-iran-downplays-israeli-strikes-2024-10-28-1.734849,emirates247.com
2024-10-27,"Israel's Attack on Iran Affected Country's Self-Defense, Missile Production",https://sputnikglobe.com/20241027/israels-attack-on-iran-affected-countrys-self-defense-missile-production---netanyahu-1120692564.html,sputnikglobe.com
2024-10-27,Watch Webinar - Israel Strikes Back,https://jinsa.org/israel-strikes-back/,jinsa.org
2024-10-27,Iranian Officials: Tehran 'Deeply Concerned' Over Vulnerable Economic Assets In Conflict With Israel,https://vinnews.com/2024/10/27/iranian-officials-tehran-deeply-concerned-over-vulnerable-economic-assets-in-conflict-with-israel/,vinnews.com
2024-10-27,Middle East: Egypt proposes two-day cease-fire in Gaza,https://www.dw.com/en/middle-east-egypt-proposes-two-day-cease-fire-in-gaza/live-70611771?maca=en-rss-en-all-1573-xml-atom,dw.com
2024-10-28,Social Network X Blocks Hebrew Account of Iranian Supreme Leader,https://sputnikglobe.com/20241028/social-network-x-blocks-hebrew-account-of-iranian-supreme-leader-1120700870.html,sputnikglobe.com
2024-10-28,Oil ETFs Plunge Premarket After Israel's Strikes On Iran,https://www.benzinga.com/news/24/10/41567809/oil-etfs-plunge-premarket-after-israels-strikes-on-iran,benzinga.com
2024-10-28,Iran says it will 'use all available tools' to respond to Israel's attack,https://economictimes.indiatimes.com/news/defence/iran-says-it-will-use-all-available-tools-to-respond-to-israels-attack/articleshow/114686544.cms,indiatimes.com
2024-10-28,"Oil prices tumble as Iran fears ease, yen weakens after Japan polls",https://www.the-messenger.com/news/national/article_41e90d27-fd92-570e-a138-9f73757cc239.html,the-messenger.com
2024-10-28,Iran says it will ‘use all available tools’ to respond to Israel’s attack,https://wibqam.com/2024/10/28/iran-says-it-will-use-all-available-tools-to-respond-to-israels-attack/,wibqam.com
2024-10-28,Oil slumps more than 4% after Iran downplays Israeli strikes,https://en.ammonnews.net/article/75914,ammonnews.net
2024-10-28,The best Side of israel lebanon war,https://israel-lebanon63063.ttblogs.com/10336718/the-best-side-of-israel-lebanon-war,ttblogs.com
2024-10-28,Iran says it will ‘use all available tools’ to respond to Israel’s attack,https://wsau.com/2024/10/28/iran-says-it-will-use-all-available-tools-to-respond-to-israels-attack/,wsau.com
2024-10-28,A Review Of Sophisticated,https://xtzejns.ttblogs.com/10336717/a-review-of-sophisticated,ttblogs.com
2024-10-28,Iran says it will ‘use all available tools’ to respond to Israel’s attack,https://whbl.com/2024/10/28/iran-says-it-will-use-all-available-tools-to-respond-to-israels-attack/,whbl.com
2024-10-28,Egypt proposes two-day Gaza truce in hope of full ceasefire,https://www.the-messenger.com/news/national/article_be6fcc30-5cdc-5ccc-8e4b-acdb51ba7675.html,the-messenger.com
2024-10-28,Oil slumps more than 4% after Iran downplays Israeli strikes,https://www.zawya.com/en/markets/commodities/oil-slumps-more-than-4-after-iran-downplays-israeli-strikes-hq1bsoxt,zawya.com
2024-10-28,Middle East latest: Social platform X suspends new account on behalf of Iran's supreme leader,https://www.yahoo.com/news/middle-east-latest-social-platform-025149295.html,yahoo.com
2024-10-27,Israel expects counterattack after hitting Iranian missile production sites,https://www.jpost.com/middle-east/iran-news/article-826289,jpost.com
2024-10-27,Middle East latest: Social platform X suspends new account on behalf of Iran's supreme leader,"http://www.morningsun.net//stories/middle-east-latest-social-platform-x-suspends-new-account-on-behalf-of-irans-supreme-leader,159833",morningsun.net
2024-10-28,Netanyahu Sets Date To Sack Gallant After Iran Attacks; 'Fumes' At Warning On War Goals,https://timesofindia.indiatimes.com/videos/international/netanyahu-sets-date-to-sack-gallant-after-iran-attacks-fumes-at-warning-on-war-goals-report/videoshow/114685110.cms,indiatimes.com
2024-10-28,Ayatollah Khamenei's Hebrew language X account suspended over threatening post against Israel,https://www.indiatvnews.com/news/world/ayatollah-khamenei-iran-hebrew-language-x-account-suspended-over-threatening-post-against-israel-2024-10-28-959227,indiatvnews.com
