publish_date,title,url,media_name
2024-01-23,London Breed Refuses To Sign Gaza Ceasefire Resolution,https://brokeassstuart.com/p/london-breed-refuses-to-sign-gaza-ceasefire-resolution,brokeassstuart.com
2023-10-18,My Advice to President Biden,https://loneconservative.com/2023/10/18/my-advice-to-president-biden/,loneconservative.com
2023-11-27,The Iran conflict matters more for inflation than growth,https://www.memeorandum.com/260302/p100#a260302p100,memeorandum.com
2023-11-23,Palestinian-Israeli conflict critical for BRICS,https://moderndiplomacy.eu/2023/11/23/palestinian-israeli-conflict-critical-for-brics/#comment-20005,moderndiplomacy.eu
2023-11-07,BREAKING: Israel and Hamas Reach Deal To Release 50 Hostages from Gaza,https://beheardproject.com/israel/breaking-israel-and-hamas-reach-deal-to-release-50-hostages,beheardproject.com
2023-10-12,ACLJ Representing Gaza Hostage Families on Capitol Hill,https://beheardproject.com/israel/aclj-representing-gaza-hostage-families-on-capitol-hill,beheardproject.com
2024-01-03,‘Our support is a gigantic green light for I...,https://www.commonsnews.org/issue/746/74640_brook,commonsnews.org
2023-11-22,"Panelists share grief, anger and expectations for the Israel-Hamas war...",https://www.cityweekly.net/news/panelists-share-grief-anger-and-expectations-for-the-israel-hamas-war-at-jewish-community-center-event-20754374,cityweekly.net
2023-12-13,Feedback from December 7 and Beyond,https://www.cityweekly.net/news/feedback-from-december-7-and-beyond-20842366,cityweekly.net
2023-12-06,"Nobel winner Henry Kissinger, honored mass murderer of millions, is fi...",https://www.cityweekly.net/news/nobel-winner-henry-kissinger-honored-mass-murderer-of-millions-is-finally-dead-20808674,cityweekly.net
2023-11-12,Hundreds of Utahns march for a “Free Palestine” in downtown Salt Lake ...,https://www.cityweekly.net/news/hundreds-of-utahns-march-for-a-free-palestine-in-downtown-salt-lake-city-20713308,cityweekly.net
2023-12-27,Oversimplified and catch-all adjectives don't capture the horrors of t...,https://www.cityweekly.net/news/oversimplified-and-catch-all-adjectives-dont-capture-the-horrors-of-the-israel-hamas-war-20901103,cityweekly.net
2024-02-21,Utah's problems won't be solved by showering with our neighbors,https://www.cityweekly.net/news/utahs-problems-wont-be-solved-by-showering-with-our-neighbors-21146366,cityweekly.net
2024-03-13,"Brothers, sisters and children die while the U.S. participates in thei...",https://www.cityweekly.net/news/brothers-sisters-and-children-die-while-the-us-participates-in-their-destruction-21237562,cityweekly.net
2024-03-20,"U.S. undermining Israel, Blinken inserts Qatar over Jerusalem's objections",https://www.israelandstuff.com/u-s-undermining-israel-blinken-inserts-qatar-over-jerusalems-objections,israelandstuff.com
2023-11-16,Calls for an immediate cease-fire. Why peace in the Middle East could ...,https://www.dallasexaminer.com/perspectives/israel-hamas-ceasefire-267153,dallasexaminer.com
2023-12-01,President Joe Biden is not getting the credit he deserves on foreign p...,https://www.dallasexaminer.com/perspectives/joe-biden-democracy-defense-267384,dallasexaminer.com
2023-11-13,Watch: Understanding the Depraved Growing Kahanist Ideology Within the Netanyahu Govt,https://www.wrongkindofgreen.org/2023/11/13/watch-understanding-the-depraved-growing-kahanist-ideology-within-the-netanyahu-govt/,wrongkindofgreen.org
2023-11-16,The Importance of the Al-Aqsa Mosque in the War on Palestine,https://www.wrongkindofgreen.org/2023/11/16/the-importance-of-the-al-aqsa-mosque-in-the-war-on-palestinian/,wrongkindofgreen.org
2023-10-25,Fiala: Czechia Is Ready To Provide Support To Israel,https://praguemonitor.com/czechia/25/10/2023/fiala-czechia-is-ready-to-provide-support-to-israel/,praguemonitor.com
2023-12-15,"El Vaticano pide paz, pero nadie lo escucha",https://www.cronica.com.ar/edicionimpresa/El-Vaticano-pide-paz-pero-nadie-lo-escucha-20171210-0061.html,cronica.com.ar
2023-12-15,La ONU no banca la decisión yanqui,https://www.cronica.com.ar/edicionimpresa/La-ONU-no-banca-la-decision-yanqui-20171221-0148.html,cronica.com.ar
2023-12-15,La ONU no banca la decisión yanqui,https://www.cronica.com.ar/edicionimpresa/La-ONU-no-banca-la-decision-yanqui-20171221-0139.html,cronica.com.ar
2024-03-11,The David Pakman Show,https://davidpakman.libsyn.com/31124-sotu-response-collapses-trump-hits-new-low-biden-fundraising-explodes,libsyn.com
2023-10-12,The David Pakman Show,https://davidpakman.libsyn.com/101223-trump-turns-on-netanyahu-republicans-might-expel-george-santos,libsyn.com
2023-10-12,Gaza War,https://shows.acast.com/political-gabfest/episodes/6965690875c092ac4e1340ae,acast.com
2023-10-08,Israel: Inlett omfattande operation på Västbanken,https://www.svd.se/a/dwel81/senaste-nytt-om-konflikterna-i-mellanostern?pinnedEntry=67279,svd.se
2023-10-08,Utrikesministern: Inga svenska vapen i Sudan,https://www.svd.se/a/dwel81/senaste-nytt-om-konflikterna-i-mellanostern?pinnedEntry=66413,svd.se
2023-10-08,Kvarlevor överlämnade till Röda korset,https://www.svd.se/a/dwel81/senaste-nytt-om-konflikterna-i-mellanostern?pinnedEntry=66228,svd.se
2023-10-08,Hamas: Ska lämna över tre kroppar,https://www.svd.se/a/dwel81/senaste-nytt-om-konflikterna-i-mellanostern?pinnedEntry=66222,svd.se
2023-10-08,IDF: Har riktat flyganfall mot Gaza,https://www.svd.se/a/dwel81/senaste-nytt-om-konflikterna-i-mellanostern?pinnedEntry=65933,svd.se
2023-10-27,Trump e outros líderes mundiais assinam acordo de cessar-fogo em Gaza,https://ajn1.com.br/mundo/trump-e-outros-lideres-mundiais-assinam-acordo-de-cessar-fogo-em-gaza/,ajn1.com.br
2023-10-27,Trump discursa no Parlamento de Israel e fala do ‘fim da era do terror’ no Oriente Médio,https://ajn1.com.br/mundo/trump-discursa-no-parlamento-de-israel-e-fala-do-fim-da-era-do-terror-no-oriente-medio/,ajn1.com.br
2023-10-27,Reféns israelenses são libertados pelo Hamas após 738 dias em cativeiro na Faixa de Gaza,https://ajn1.com.br/urbano/refens-israelenses-sao-libertados-pelo-hamas-apos-738-dias-em-cativeiro-na-faixa-de-gaza/,ajn1.com.br
2023-10-27,Armas e governo em Gaza são questões em aberto no acordo de paz,https://ajn1.com.br/sem-categoria/armas-e-governo-em-gaza-sao-questoes-em-aberto-no-acordo-de-paz/,ajn1.com.br
2023-10-08,Witkoff och Kusher deltar i Netanyahus regeringsmöte,https://www.svd.se/a/dwel81/senaste-nytt-om-konflikterna-i-mellanostern?pinnedEntry=65260,svd.se
2023-10-27,O que você precisa saber sobre o acordo de cessar-fogo em Gaza,https://ajn1.com.br/urbano/israel-e-hamas-assinam-acordo-de-paz-para-primeira-fase-de-cessar-fogo-na-faixa-de-gaza/,ajn1.com.br
2023-10-27,Hamas diz que lista de reféns foi trocada com Israel,https://ajn1.com.br/urbano/hamas-diz-que-lista-de-refens-foi-trocada-com-israel/,ajn1.com.br
2023-10-08,Medier: Indirekta samtal pågår i Egypten om Gazaplanen,https://www.svd.se/a/dwel81/senaste-nytt-om-konflikterna-i-mellanostern?pinnedEntry=65114,svd.se
2023-10-08,Utrikesministern : ”Om det stämmer är det mycket allvarligt”,https://www.svd.se/a/dwel81/senaste-nytt-om-konflikterna-i-mellanostern?pinnedEntry=65077,svd.se
2023-10-08,Norska UD: Våra medborgare deporteras snart,https://www.svd.se/a/dwel81/senaste-nytt-om-konflikterna-i-mellanostern?pinnedEntry=65076,svd.se
2023-10-07,"Qatar holds Israel responsible for escalation in occupied territories, others urge restraint",https://www.ansarpress.com/EN/27548,ansarpress.com
2023-11-02,Israeli strike near UN school in Jabaliya kills dozens after hospital carnage,https://www.ansarpress.com/EN/28211,ansarpress.com
2023-12-10,"With Netanyahu Struggling in Gaza Quagmire, Gaps Deepen inside His Cabinet",https://www.ansarpress.com/EN/28912,ansarpress.com
2024-01-12,Israel cites ’already debunked lies’ as ICJ Gaza genocide hearing ends,https://www.ansarpress.com/EN/29555,ansarpress.com
2023-10-30,Firebrand Spanish minister emerges as strong voice against Israel’s Gaza genocide,https://www.ansarpress.com/EN/28149,ansarpress.com
2023-12-28,Retired Israeli general: I respect resilience of Hamas,https://www.ansarpress.com/EN/29274,ansarpress.com
2023-12-17,What’s behind Netanyahu Declaring War on Palestinian Authority?,https://www.ansarpress.com/EN/29057,ansarpress.com
2023-11-17,Congresswoman Omar unveils resolution to block US arms sale to Israel,https://www.ansarpress.com/EN/28520,ansarpress.com
2024-01-05,Biden can’t write blank check for Israel to kill in Gaza: Sen. Warren,https://www.ansarpress.com/EN/29430,ansarpress.com
2023-12-02,"Israel pulls back negotiating team from Qatar, as truce talks hit ‘dead end’",https://www.ansarpress.com/EN/28797,ansarpress.com
2023-12-24,Israeli military bans reporting on 8 subjects amid war on Gaza: Leaked docs,https://www.ansarpress.com/EN/29197,ansarpress.com
2023-12-08,US blocks UN Security Council demand for ceasefire in Israel’s genocidal war,https://www.ansarpress.com/EN/28888,ansarpress.com
2023-12-21,Spain follows US interests of arming Israeli genocide in Gaza: Exminister,https://www.ansarpress.com/EN/29142,ansarpress.com
2023-12-29,Israel intensifies Gaza strikes as Hamas in Cairo for ceasefire talks,https://www.ansarpress.com/EN/29287,ansarpress.com
2023-10-29,Spanish minister urges Europe to cut ties with Israel to end Gaza genocide,https://www.ansarpress.com/EN/28123,ansarpress.com
2023-10-23,‘Stop Israeli genocide’: Mass rallies held in US cities in support of Palestine,https://www.ansarpress.com/EN/27977,ansarpress.com
2024-01-27,UNSC to meet to discuss ICJ ruling on Israeli genocide in Gaza,https://www.ansarpress.com/EN/29854,ansarpress.com
2023-10-11,Iranian foreign minister: Israel is accountable for Gaza humanitarian crisis,https://www.ansarpress.com/EN/27660,ansarpress.com
2023-11-06,Why is Netanyahu invoking ‘Amalek’ rhetoric to justify genocide of Palestinians,https://www.ansarpress.com/EN/28299,ansarpress.com
2024-01-14,"Marking 100 days of death and destruction, UN says Israel war on Gaza ’staining humanity’",https://www.ansarpress.com/EN/29584,ansarpress.com
2023-12-15,US promises to support Israel in prolonged Gaza war,https://www.ansarpress.com/EN/29007,ansarpress.com
2023-12-20,Bent on genocide: Netanyahu rules out ceasefire in Gaza,https://www.ansarpress.com/EN/29117,ansarpress.com
2023-12-02,"Erdogan says Netanyahu, ’the butcher of Gaza’, must be tried in ICC",https://www.ansarpress.com/EN/28794,ansarpress.com
2023-10-15,Adviser to Netanyahu’s wife calls for torture of Gazans to death amid heavy blow from Hamas,https://www.ansarpress.com/EN/27768,ansarpress.com
2023-10-15,US sending second aircraft carrier to Mediterranean to back Israeli onslaught on Gaza,https://www.ansarpress.com/EN/27767,ansarpress.com
2023-10-29,’Israel will get a lot bigger’: US congressman urges Israel to reoccupy Gaza,https://www.ansarpress.com/EN/28124,ansarpress.com
2023-10-18,Biden in Tel Aviv for support after 500 killed in strike on Gaza hospital,https://www.ansarpress.com/EN/27862,ansarpress.com
2023-11-04,"Turkey ’crossed out’ Netanyahu, will bring Israel’s war crimes to ICC: Erdogan",https://www.ansarpress.com/EN/28252,ansarpress.com
2023-12-21,Threat to assassinate Hamas leaders exposes Israel’s frustration: Hamas official,https://www.ansarpress.com/EN/29136,ansarpress.com
2023-10-29,Rift deepens in Israeli war cabinet over Netanyahu’s comments,https://www.ansarpress.com/EN/28125,ansarpress.com
2023-10-13,"Saudi Arabia puts normalization with Israel ‘on ice’, engages with Iran amid Gaza war: Report",https://www.ansarpress.com/EN/27721,ansarpress.com
2023-10-28,Hamas: Resistance on course to score ’heroic epic’ in Gaza,https://www.ansarpress.com/EN/28075,ansarpress.com
2023-10-29,UN chief renews ceasefire calls to end ‘nightmare’ in Gaza,https://www.ansarpress.com/EN/28127,ansarpress.com
2024-01-15,Yemen strikes another nail in Biden’s coffin for Muslim voters: US media,https://www.ansarpress.com/EN/29621,ansarpress.com
2023-11-19,Israeli regime should stand trial at ICC: Turkish president,https://www.ansarpress.com/EN/28549,ansarpress.com
2023-10-08,Israel targets two residential buildings in Gaza in fresh air strikes,https://www.ansarpress.com/EN/27571,ansarpress.com
2023-10-08,Netanyahu declares ’long’ war on Gaza as Israeli death toll tops 700,https://www.ansarpress.com/EN/27580,ansarpress.com
2023-10-18,"From Kunduz to Gaza, how US and Israel have normalized hospital bombings",https://www.ansarpress.com/EN/27853,ansarpress.com
2023-11-01,Hamas leader Haniyeh says Israel massacring Palestinians to cover up defeats,https://www.ansarpress.com/EN/28187,ansarpress.com
2023-11-10,Report: US support for Israel provoking Arab outrage,https://www.ansarpress.com/EN/28382,ansarpress.com
2023-10-27,Delegações de vários países abandonam salão da ONU em protesto ao primeiro-ministro de Israel; confira principais declarações de Netanyahu,https://ajn1.com.br/mundo/delegacoes-de-varios-paises-abandonam-salao-da-onu-em-protesto-ao-primeiro-ministro-de-israel-confira-principais-declaracoes-de-netanyahu/,ajn1.com.br
2023-10-27,Trump diz que Israel e Hamas estão ‘perto’ de acordo sobre a Faixa de Gaza,https://ajn1.com.br/urbano/trump-diz-que-israel-e-hamas-estao-perto-de-acordo-sobre-a-faixa-de-gaza/,ajn1.com.br
2023-10-27,Reino Unido e Austrália se juntam ao Canadá e reconhecem formalmente Estado palestino,https://ajn1.com.br/mundo/reino-unido-e-australia-se-juntam-ao-canada-e-reconhecem-formalmente-estado-palestino/,ajn1.com.br
2023-10-27,Assembleia Geral da ONU deve expor contrastes entre Lula e Trump,https://ajn1.com.br/mundo/assembleia-geral-da-onu-deve-expor-contrastes-entre-lula-e-trump/,ajn1.com.br
2023-10-08,USA lägger in veto mot vapenvila i Gaza,https://www.svd.se/a/dwel81/senaste-nytt-om-konflikterna-i-mellanostern?pinnedEntry=64407,svd.se
2023-10-27,"Assembleia-Geral da ONU apoia criação de um Estado palestino, mas rejeita participação do Hamas",https://ajn1.com.br/mundo/assembleia-geral-da-onu-apoia-criacao-de-um-estado-palestino-mas-rejeita-participacao-do-hamas/,ajn1.com.br
2023-10-08,Israel har attackerat Jemens huvudstad,https://www.svd.se/a/dwel81/senaste-nytt-om-konflikterna-i-mellanostern?pinnedEntry=64083,svd.se
2023-10-27,"Saiba o que significa ‘Tempestade de Furacão’, que Israel promete executar em Gaza",https://ajn1.com.br/mundo/saiba-o-que-significa-tempestade-de-furacao-que-israel-promete-executar-em-gaza/,ajn1.com.br
2023-10-08,Hamas tar på sig terrordådet i Jerusalem,https://www.svd.se/a/dwel81/senaste-nytt-om-konflikterna-i-mellanostern?pinnedEntry=64024,svd.se
2023-10-27,Ataque a tiros em Jerusalém deixa 6 mortos,https://ajn1.com.br/urbano/ataque-a-tiros-em-jerusalem-deixa-6-mortos/,ajn1.com.br
2023-10-27,"Plano pós-guerra prevê que os EUA administrarão Gaza por ao menos uma década, diz Washington Post",https://ajn1.com.br/urbano/plano-pos-guerra-preve-que-os-eua-administrarao-gaza-por-ao-menos-uma-decada-diz-washington-post/,ajn1.com.br
2023-10-08,Huthirebeller stormade FN-kontor i Jemen,https://www.svd.se/a/dwel81/senaste-nytt-om-konflikterna-i-mellanostern?pinnedEntry=63680,svd.se
2023-10-08,Huthierna: Premiärministern dödad i israeliskt anfall,https://www.svd.se/a/dwel81/senaste-nytt-om-konflikterna-i-mellanostern?pinnedEntry=63650,svd.se
2023-10-08,SR:s medarbetare skadad i sjukhusattacken,https://www.svd.se/a/dwel81/senaste-nytt-om-konflikterna-i-mellanostern?pinnedEntry=63454,svd.se
2023-10-27,Saiba quais são os países que reconhecem o Estado Palestino até o momento e o significado para sua possível criação,https://ajn1.com.br/mundo/saiba-quais-sao-os-paises-que-reconhecem-o-estado-palestino-ate-o-momento-e-o-significado-para-sua-possivel-criacao/,ajn1.com.br
2023-10-27,"Mais de 500 mil pessoas estão passando fome em Gaza, diz monitor global",https://ajn1.com.br/urbano/mais-de-500-mil-pessoas-estao-passando-fome-em-gaza-diz-monitor-global/,ajn1.com.br
2023-10-27,Israel inicia ofensiva militar para ocupar Cidade de Gaza,https://ajn1.com.br/mundo/israel-inicia-ofensiva-militar-para-ocupar-cidade-de-gaza/,ajn1.com.br
2023-10-07,Israel und Gaza: News und Entwicklungen im Nahostkonflikt,https://www.nzz.ch/international/krieg-in-nahost-die-neuesten-entwicklungen-ld.1759794,nzz.ch
2023-10-27,Hamas diz concordar com proposta de cessar-fogo em Gaza,https://ajn1.com.br/mundo/hamas-diz-concordar-com-proposta-de-cessar-fogo-em-gaza/,ajn1.com.br
2023-10-08,Egypten: Arbetar för 60-dagars vapenvila i Gaza,https://www.svd.se/a/dwel81/senaste-nytt-om-konflikterna-i-mellanostern?pinnedEntry=62925,svd.se
2023-10-08,Journalist dödad i Gaza,https://www.svd.se/a/dwel81/senaste-nytt-om-konflikterna-i-mellanostern?pinnedEntry=62852,svd.se
2023-10-08,Netanyahu: Vårt mål är att befria Gaza,https://www.svd.se/a/dwel81/senaste-nytt-om-konflikterna-i-mellanostern?pinnedEntry=62848,svd.se
2023-10-27,Primeiro-ministro de Israel afirma que país pretende assumir o controle total da Faixa de Gaza,https://ajn1.com.br/mundo/primeiro-ministro-de-israel-afirma-que-pais-pretende-assumir-o-controle-total-da-faixa-de-gaza/,ajn1.com.br
2023-10-08,FN kräver att planerna stoppas omedelbart,https://www.svd.se/a/dwel81/senaste-nytt-om-konflikterna-i-mellanostern?pinnedEntry=62792,svd.se
2023-10-08,FN kräver att planerna stoppas omedelbart,https://www.svd.se/a/dwel81/senaste-nytt-om-konflikterna-i-mellanostern?pinnedEntry=62784,svd.se
2023-10-08,Netanyahu: Vill ta kontroll över hela Gaza,https://www.svd.se/a/dwel81/senaste-nytt-om-konflikterna-i-mellanostern?pinnedEntry=62765,svd.se
2023-10-08,Källor: Israel redo att godkänna ockupation,https://www.svd.se/a/dwel81/senaste-nytt-om-konflikterna-i-mellanostern?pinnedEntry=62715,svd.se
2023-10-07,Conflit israélo-palestinien,https://www.lessentiel.lu/fr/story/conflit-au-proche-orient-netanyahu-prepare-des-instructions-pour-poursuivre-la-guerre-832644009510,lessentiel.lu
2023-10-07,Les otages israéliens «mangent» comme la population de Gaza,https://www.lessentiel.lu/fr/story/conflit-au-proche-orient-les-otages-israeliens-mangent-comme-la-population-de-gaza-832644009510,lessentiel.lu
2023-10-07,de nouvelles images d’otages israéliens,https://www.lessentiel.lu/fr/story/conflit-au-proche-orient-videos-d-otages-israeliens-a-gaza-des-images-effroyables-832644009510,lessentiel.lu
2024-01-16,Gaza: le Hamas publie une vidéo d'un otage israélien,https://www.20min.ch/fr/story/conflit-au-moyen-orient-le-hamas-publie-une-video-d-un-otage-israelien-103021430,20min.ch
2023-11-07,Israel says its forces operating in 'heart of Gaza City',https://www.reuters.com/world/middle-east/israel-says-it-is-open-gaza-fighting-pauses-aid-hostages-2023-11-07/,reuters.com
2024-01-16,ONU: Le Portugal envisage de reconnaître l’État de Palestine,https://www.20min.ch/fr/story/conflit-au-moyen-orient-le-portugal-envisage-de-reconnaitre-l-etat-de-palestine-103021430,20min.ch
2023-10-08,Storbritannien: Då erkänner vi Palestina,https://www.svd.se/a/dwel81/senaste-nytt-om-konflikterna-i-mellanostern?pinnedEntry=62433,svd.se
2023-10-27,Trump diz que discorda de Israel sobre não haver fome em Gaza e que ‘um cessar-fogo é possível’,https://ajn1.com.br/politica/trump-diz-que-discorda-de-israel-sobre-nao-haver-fome-em-gaza-e-que-um-cessar-fogo-e-possivel/,ajn1.com.br
2023-10-08,Källor: IDF har inga bevis på att Hamas stulit mat,https://www.svd.se/a/dwel81/senaste-nytt-om-konflikterna-i-mellanostern?pinnedEntry=62319,svd.se
2023-10-27,Papa Leão XIV pede fim da “barbárie da guerra” após ataque à igreja em Gaza,https://ajn1.com.br/urbano/papa-leao-xiv-pede-fim-da-barbarie-da-guerra-apos-ataque-a-igreja-em-gaza/,ajn1.com.br
2023-10-08,Netanyahu: God chans till vapenvila,https://www.svd.se/a/dwel81/senaste-nytt-om-konflikterna-i-mellanostern?pinnedEntry=61617,svd.se
2023-10-08,Israel skickar förhandlare till Qatar,https://www.svd.se/a/dwel81/senaste-nytt-om-konflikterna-i-mellanostern?pinnedEntry=61453,svd.se
2023-10-27,Hamas analisa proposta de cessar-fogo em Gaza; Trump pressiona acordo e diz que Israel teria aceitado,https://ajn1.com.br/mundo/hamas-analisa-proposta-de-cessar-fogo-em-gaza-trump-pressiona-acordo-e-diz-que-israel-teria-aceitado/,ajn1.com.br
2023-10-08,Netanyahu slipper vittnesbåset,https://www.svd.se/a/dwel81/senaste-nytt-om-konflikterna-i-mellanostern?pinnedEntry=61146,svd.se
2023-10-08,WHO har levererat medicinsk hjälp till Gaza,https://www.svd.se/a/dwel81/senaste-nytt-om-konflikterna-i-mellanostern?pinnedEntry=61038,svd.se
2023-10-08,Minst 20 döda i Gaza efter kulor och granateld,https://www.svd.se/a/dwel81/senaste-nytt-om-konflikterna-i-mellanostern?pinnedEntry=60970,svd.se
2023-10-07,Israel und Gaza: News und Entwicklungen im Nahostkonflikt,https://www.nzz.ch/international/krieg-in-nahost-der-us-angriff-soll-weniger-erfolgreich-gewesen-sein-als-behauptet-trump-spricht-von-fake-news-ld.1759794,nzz.ch
2023-10-27,Irã canta ‘vitória’ e diz que Israel foi forçado a aceitar cessar-fogo,https://ajn1.com.br/mundo/ira-canta-vitoria-e-diz-que-israel-foi-forcado-a-aceitar-cessar-fogo/,ajn1.com.br
2023-10-08,"Israel ""generat"" över Trumps utspel",https://www.svd.se/a/dwel81/senaste-nytt-om-konflikterna-i-mellanostern?pinnedEntry=60948,svd.se
2023-10-08,Trump visar upp hyllnings-sms från Rutte,https://www.svd.se/a/dwel81/senaste-nytt-om-konflikterna-i-mellanostern?pinnedEntry=60931,svd.se
2023-10-27,"Trump afirma que instalações nucleares iranianas foram destruídas e ameaça novos ataques, caso não seja decretada paz",https://ajn1.com.br/mundo/retaliacoes-avassaladoras-adverte-eua-caso-ira-ataque-bases-do-pais-no-oriente-medio/,ajn1.com.br
2023-10-27,EUA entram na guerra e atacam 3 instalações nucleares do Irã,https://ajn1.com.br/mundo/eua-entram-na-guerra-e-atacam-3-instalacoes-nucleares-do-ira/,ajn1.com.br
2023-10-07,Israel und Gaza: News und Entwicklungen im Nahostkonflikt,https://www.nzz.ch/international/krieg-in-nahost-solange-die-angriffe-israels-andauern-werden-wir-mit-keiner-partei-verhandeln-sagt-irans-aussenminister-nach-den-gespraechen-in-genf-ld.1759794,nzz.ch
2023-10-27,Primeiro-ministro de Israel promete intensificar ataques após Irã atingir hospital com míssil,https://ajn1.com.br/mundo/primeiro-ministro-de-israel-promete-intensificar-ataques-apos-ira-atingir-hospital-com-missil/,ajn1.com.br
2023-10-27,Saiba quais são os países com maior produção de urânio no mundo,https://ajn1.com.br/mundo/saiba-quais-sao-os-paises-com-maior-producao-de-uranio-no-mundo/,ajn1.com.br
2024-03-26,Krieg in Nahost: Alle Entwicklungen im Ticker,https://www.tagblatt.ch/international/nahost-newsblog-moeglicher-kriegseintritt-trump-will-innert-zwei-wochen-entscheiden-verhandlungen-zu-irans-atomprogramm-in-genf-ld.2599191,tagblatt.ch
2024-03-26,Krieg in Nahost: Alle Entwicklungen im Ticker,https://www.luzernerzeitung.ch/international/nahost-newsblog-moeglicher-kriegseintritt-trump-will-innert-zwei-wochen-entscheiden-verhandlungen-zu-irans-atomprogramm-in-genf-ld.2599191,luzernerzeitung.ch
2024-03-26,Krieg in Nahost: Alle Entwicklungen im Ticker,https://www.tagblatt.ch/international/nahost-newsblog-flugzeugtraeger-uss-ford-macht-sich-auf-den-weg-nach-europa-schweizer-botschafterin-in-teheran-einbestellt-ld.2599191,tagblatt.ch
2023-10-08,Irans statliga tv-sändning hackad,https://www.svd.se/a/dwel81/senaste-nytt-om-konflikterna-i-mellanostern?pinnedEntry=60662,svd.se
2024-03-26,Krieg in Nahost: Alle Entwicklungen im Ticker,https://www.luzernerzeitung.ch/international/nahost-newsblog-israel-meldet-neuen-raketenangriff-aus-dem-iran-trump-blockt-frage-zu-sorge-vor-us-einsatz-gegen-iran-ab-ld.2599191,luzernerzeitung.ch
2023-10-08,Ayatollan: Enormt misstag av Israel,https://www.svd.se/a/dwel81/senaste-nytt-om-konflikterna-i-mellanostern?pinnedEntry=60637,svd.se
2023-10-08,Iran utförde robotattack mot södra Israel,https://www.svd.se/a/dwel81/senaste-nytt-om-konflikterna-i-mellanostern?pinnedEntry=60605,svd.se
2023-10-08,Iran utförde robotattack mot södra Israel,https://www.svd.se/a/dwel81/senaste-nytt-om-konflikterna-i-mellanostern?pinnedEntry=60593,svd.se
2023-10-07,Israel und Gaza: News und Entwicklungen im Nahostkonflikt,https://www.nzz.ch/international/krieg-in-nahost-iran-hat-rund-30-raketen-auf-israel-gefeuert-israel-meldet-tod-von-hochrangigem-iranischen-militaer-ld.1759794,nzz.ch
2023-10-07,Israel und Gaza: News und Entwicklungen im Nahostkonflikt,https://www.nzz.ch/international/krieg-in-nahost-g7-einigen-sich-auf-erklaerung-iran-israel-ld.1759794,nzz.ch
2023-10-27,Trump admite possibilidade de envolvimento dos EUA no conflito entre Israel e Irã,https://ajn1.com.br/mundo/trump-admite-possibilidade-de-envolvimento-dos-eua-no-conflito-entre-israel-e-ira/,ajn1.com.br
2023-10-08,Dödstalen stiger i Gaza – närmare 40 döda,https://www.svd.se/a/dwel81/senaste-nytt-om-konflikterna-i-mellanostern?pinnedEntry=60536,svd.se
2023-10-08,Dödstalen stiger i Gaza – närmare 40 döda,https://www.svd.se/a/dwel81/senaste-nytt-om-konflikterna-i-mellanostern?pinnedEntry=60533,svd.se
2023-10-08,Human Rights Activists: Över 400 dödade i Iran,https://www.svd.se/a/dwel81/senaste-nytt-om-konflikterna-i-mellanostern?pinnedEntry=60471,svd.se
2023-10-27,Entenda as origens do conflito entre Israel e Irã,https://ajn1.com.br/mundo/entenda-as-origens-do-conflito-entre-israel-e-ira/,ajn1.com.br
2023-10-08,Israel varnar invånare i Iran att evakuera,https://www.svd.se/a/dwel81/senaste-nytt-om-konflikterna-i-mellanostern?pinnedEntry=60449,svd.se
2023-10-08,Storbritannien flyttar styrkor till Mellanöstern,https://www.svd.se/a/dwel81/senaste-nytt-om-konflikterna-i-mellanostern?pinnedEntry=60445,svd.se
