publish_date,title,url,media_name
2024-03-31,Netanyahu será submetido a uma cirurgia de hérnia neste domingo,https://istoe.com.br/netanyahu-sera-submetido-a-uma-cirurgia-de-hernia-neste-domingo/,istoe.com.br
2024-03-31,"Biểu tình ở Israel, thân nhân con tin Dải Gaza hết kiên nhẫn",https://tuoitre.vn/bieu-tinh-o-israel-than-nhan-con-tin-dai-gaza-het-kien-nhan-20240331193206393.htm,tuoitre.vn
2024-03-31,Israelis stage largest protest since war began to increase pressure on Netanyahu,https://www.seattletimes.com/seattle-news/health/an-israeli-airstrike-on-a-hospital-tent-camp-in-gaza-kills-2-palestinians/?utm_source=RSS&utm_medium=Referral&utm_campaign=RSS_all,seattletimes.com
2024-03-31,Israel-Hamas war: Airstrike hits Gaza hospital tent camp,https://www.watoday.com.au/world/middle-east/israeli-airstrike-hits-gaza-hospital-tent-camp-20240401-p5fgf6.html?ref=rss&utm_medium=rss&utm_source=rss_feed,watoday.com.au
2024-03-31,Strikes hit Gaza as Egyptian TV says truce talks to resume,https://www.zawya.com/en/world/middle-east/strikes-hit-gaza-as-egyptian-tv-says-truce-talks-to-resume-iwru9v03,zawya.com
2024-03-31,"Israel Hamas: Life in Gaza is dire and getting worse, say Australians on the ground",https://www.watoday.com.au/politics/federal/like-lying-in-a-coffin-australians-in-gaza-describe-utter-annihilation-20240325-p5ff2d.html?ref=rss&utm_medium=rss&utm_source=rss_feed,watoday.com.au
2024-03-31,Gaza ceasefire talks to resume in Cairo: Egyptian media,https://www.zawya.com/en/world/middle-east/gaza-ceasefire-talks-to-resume-in-cairo-egyptian-media-r7fryqb4,zawya.com
2024-03-31,Deadly chaos at Gaza aid distribution as WHO renews hospital warning,https://www.zawya.com/en/world/middle-east/deadly-chaos-at-gaza-aid-distribution-as-who-renews-hospital-warning-juksjm5p,zawya.com
2024-03-31,"France, Jordan, Egypt FMs call for 'permanent' Gaza ceasefire",https://www.zawya.com/en/world/middle-east/france-jordan-egypt-fms-call-for-permanent-gaza-ceasefire-dhibg58v,zawya.com
2024-03-31,"Netanyahu in ‘excellent’ health after hernia surgery, hospital says",https://ktvz.com/news/national-world/cnn-world/2024/03/31/netanyahu-to-have-hernia-surgery-under-full-anesthesia-deputy-pm-to-temporarily-step-in/,ktvz.com
2024-03-31,Israelis stage largest protest since war began to increase pressure on Netanyahu,https://richmond.com/news/nation-world/israel-palestinians-gaza-benjamin-netanyahu-protests-cease-fire-hostage-freedom-deal/article_835f042b-1ffa-5da2-b822-f723f2fa2afe.html,richmond.com
2024-03-31,Israel PM to undergo hernia surgery as pressure rises over Gaza war,https://www.the-messenger.com/news/national/article_1f9bac98-03d3-5879-9a13-ffb01af436b9.html,the-messenger.com
2024-03-31,Kritiserar kriget i Gaza: ”Marscherar mot förlust”,https://www.expressen.se/nyheter/varlden/kritiserar-kriget-i-gaza-marscherar-mot-forlust/,expressen.se
2024-03-31,Israelis stage largest protest since war began to increase pressure on Netanyahu,https://www.niagarafallsreview.ca/news/world/israelis-stage-largest-protest-since-war-began-to-increase-pressure-on-netanyahu/article_4dcc1b7e-b905-5a6b-a2c1-25b915449234.html,niagarafallsreview.ca
2024-03-31,Uppgifter: Fredssamtal om Gaza återupptas,https://www.expressen.se/nyheter/varlden/nu-aterupptas-fredssamtalen-om-gaza/,expressen.se
2024-03-31,Israelis stage largest anti-government protest since war in Gaza began,https://www.voanews.com/a/israelis-stage-largest-anti-government-protest-since-war-in-gaza-began/7550981.html,voanews.com
2024-03-31,"Israel strikes major Gaza hospital killing 4, wounding 17",https://www.voanews.com/a/israeli-strikes-hit-gaza-as-cease-fire-talks-set-to-resume-/7550719.html,voanews.com
2024-03-31,Eks Menteri Kehakiman Israel Blak-blakan Negaranya Terjebak Dalam Konflik Gaza,https://www.viva.co.id/berita/dunia/1701674-eks-menteri-kehakiman-israel-blak-blakan-negaranya-terjebak-dalam-konflik-gaza,viva.co.id
2024-03-31,"Ratusan Demonstran Turun ke Kota-kota di Israel, Tuntut Netanyahu Turun dan Hentikan Perang",https://www.viva.co.id/berita/dunia/1701667-ratusan-demonstran-turun-ke-kota-kota-di-israel-tuntut-netanyahu-turun-dan-hentikan-perang,viva.co.id
2024-03-31,Israel: Benjamin Netanyahu passará por cirurgia de hérnia neste domingo,https://www.bemparana.com.br/noticias/mundo/israel-benjamin-netanyahu-passara-por-cirurgia-de-hernia-neste-domingo/,bemparana.com.br
2024-03-31,Atos em Israel pedem saída de Netanyahu e libertação de reféns em Gaza,https://odocumento.com.br/atos-em-israel-pedem-saida-de-netanyahu-e-libertacao-de-refens-em-gaza/,odocumento.com.br
2024-03-31,Benjamin Netanyahu passará por cirurgia de hérnia neste domingo,https://odocumento.com.br/benjamin-netanyahu-passara-por-cirurgia-de-hernia-neste-domingo/,odocumento.com.br
2024-03-31,"Israeli PM, Netanyahu, to undergo hernia surgery",https://tribuneonlineng.com/israeli-pm-netanyahu-to-undergo-hernia-surgery/,tribuneonlineng.com
2024-03-31,Nya gisslanförhandlingar mellan Israel och Hamas,https://sverigesradio.se/artikel/nya-gisslanforhandlingar-mellan-israel-och-hamas,sverigesradio.se
2024-03-31,"""Vada a casa"": a Gerusalemme esplode la rabbia contro Netanyahu",https://www.ilgiornale.it/news/guerra/netanyahu-casa-e-accordo-su-ostaggi-cosa-chiedono-i-2303662.html,ilgiornale.it
2024-03-31,Israelis stage largest protest since war began to increase pressure on Netanyahu,https://www.wellandtribune.ca/news/world/israelis-stage-largest-protest-since-war-began-to-increase-pressure-on-netanyahu/article_712e6e0f-4653-5a03-8c8c-ff877f3eea4c.html,wellandtribune.ca
2024-03-31,Miles de personas se manifiestan en Jerusalén contra el gobierno de Netanyahu,https://www.elesquiu.com/internacionales/2024/3/31/miles-de-personas-se-manifiestan-en-jerusalen-contra-el-gobierno-de-netanyahu-509704.html,elesquiu.com
2024-03-31,Deadly chaos at Gaza aid distribution as WHO renews hospital warning,https://www.philstar.com/world/2024/03/31/2344256/deadly-chaos-gaza-aid-distribution-who-renews-hospital-warning,philstar.com
2024-03-31,Miles de israelíes desplegaron la mayor protesta contra el gobierno desde que comenzó la guerra en Gaza,https://tn.com.ar/internacional/2024/03/31/miles-de-israelies-desplegaron-la-mayor-protesta-contra-el-gobierno-desde-que-comenzo-la-guerra-en-gaza/,tn.com.ar
2024-03-31,"Gaza ceasefire talks to resume in Cairo, says Egyptian media",https://www.scmp.com/news/world/middle-east/article/3257373/israel-gaza-ceasefire-talks-resume-cairo-egyptian-media?utm_source=rss_feed,scmp.com
2024-03-31,‘Excuses are over’: pressure mounts on Netanyahu as Gaza hostage protests widen,https://www.scmp.com/news/world/middle-east/article/3257356/pressure-mounts-israels-netanyahu-gaza-hostage-protests-widen-bring-them-home-now?utm_source=rss_feed,scmp.com
2024-03-31,"Hamas, le news del 31 marzo Hamas: “Posizioni troppo distanti per negoziare”. Netanyahu prima dell’operazione all’ernia: “Niente fermerà l’operazione a Rafah”",https://www.repubblica.it/esteri/2024/03/31/diretta/israele_hamas_gaza_news_guerra_oggi-422401619/,repubblica.it
2024-03-31,Tenistas colombianas conocen sus rivales en la Copa Colsanitas Zurich 2024,https://www.eltiempo.com/deportes/tenis/tenistas-colombianas-conocen-sus-rivales-en-la-copa-colsanitas-zurich-2024-3329275,eltiempo.com
2024-03-31,"Hombre aceptó que estranguló al perro de su pareja sentimental en Paipa, Boyacá",https://www.eltiempo.com/justicia/delitos/hombre-acepto-que-estrangulo-al-perro-de-su-pareja-sentimental-en-paipa-boyaca-3329228,eltiempo.com
2024-03-31,"Cayó alias Jirafa, del 'clan del Golfo' y uno de los hombres más buscados en el Meta",https://www.eltiempo.com/justicia/delitos/cayo-alias-jirafa-del-clan-del-golfo-y-uno-de-los-hombres-mas-buscados-en-el-meta-3329243,eltiempo.com
2024-03-31,OPS advierte que se espera la peor temporada de dengue en la historia en América Latina,https://www.eltiempo.com/salud/ops-advierte-que-se-espera-la-peor-temporada-de-dengue-en-la-historia-en-america-latina-3329213,eltiempo.com
2024-03-30,Periodismo e inteligencia artificial: ¿tropezaremos con la misma piedra? / Análisis del Editor Multimedia,https://www.eltiempo.com/tecnosfera/novedades-tecnologia/periodismo-e-inteligencia-artificial-tropezaremos-con-la-misma-piedra-analisis-del-editor-multimedia-3329143,eltiempo.com
2024-03-30,Sexo y religión / Columna de Esther Balac,https://www.eltiempo.com/salud/sexo-y-religion-columna-de-esther-balac-3329172,eltiempo.com
2024-03-30,Conozca algunos mitos y verdades sobre la vitamina D,https://www.eltiempo.com/salud/conozca-algunos-mitos-y-verdades-sobre-la-vitamina-d-3328603,eltiempo.com
2024-03-30,Cayó juez en Bucaramanga señalado de pedir $600 millones para torcer un proceso,https://www.eltiempo.com/justicia/delitos/cayo-juez-en-bucaramanga-senalado-de-pedir-600-millones-para-torcer-un-proceso-3329154,eltiempo.com
2024-03-30,Masacre en Bogotá: autoridades identificaron entre las víctimas a una madre y su hija,https://www.eltiempo.com/justicia/delitos/masacre-en-bogota-autoridades-identificaron-entre-las-victimas-a-una-madre-y-su-hija-3329159,eltiempo.com
2024-03-30,Extorsión: las ‘vacunas’ que están asfixiando la economía en las regiones de Colombia,https://www.eltiempo.com/justicia/delitos/extorsion-las-vacunas-que-estan-asfixiando-la-economia-en-las-regiones-de-colombia-3329135,eltiempo.com
2024-03-30,"Torturas, homicidios y otros horrores en La Modelo por los que condenaron a ‘exparas'",https://www.eltiempo.com/justicia/delitos/torturas-homicidios-y-otros-horrores-en-la-modelo-por-los-que-condenaron-a-exparas-3329149,eltiempo.com
2024-03-30,‘Nos estamos preparando para la demanda por el galeón San José’: Camargo,https://www.eltiempo.com/justicia/investigacion/nos-estamos-preparando-para-la-demanda-por-el-galeon-san-jose-camargo-3329140,eltiempo.com
2024-03-30,Vigilia Pascual: el papa recuerda a los pueblos destruidos por el mal y la injusticia,https://www.eltiempo.com/vida/religion/el-papa-presidio-la-vigilia-y-recordo-a-los-pueblos-destruidos-por-el-mal-y-la-injusticia-3329137,eltiempo.com
2024-03-30,Domingo Santo: esta es la oración para el último día de la Semana Santa,https://www.eltiempo.com/vida/religion/domingo-santo-esta-es-la-oracion-que-conmemora-la-resurreccion-de-jesus-3328690,eltiempo.com
2024-03-31,Procuraduría abre indagación en Ungrd por nuevo caso de presuntas fallas en contratos,https://www.eltiempo.com/justicia/investigacion/procuraduria-abre-indagacion-en-ungrd-por-nuevo-caso-de-presuntas-fallas-en-contratos-3329251,eltiempo.com
2024-03-31,"Astrofísicos, sorprendidos: James Webb confirma expansión irregular del cosmos",https://www.eltiempo.com/vida/ciencia/astrofisicos-sorprendidos-james-webb-confirma-expansion-irregular-del-cosmos-3329211,eltiempo.com
2024-03-31,Calendario astronómico de abril 2024: eclipse solar total y paso de cometas,https://www.eltiempo.com/vida/ciencia/calendario-astronomico-de-abril-2024-eclipse-solar-total-y-paso-de-cometas-3329232,eltiempo.com
2024-03-31,Semana Santa 2024: esta es la oración para el Domingo de Resurrección,https://www.eltiempo.com/vida/religion/semana-santa-2024-esta-es-la-oracion-para-el-domingo-de-resurreccion-3329245,eltiempo.com
2024-03-30,Reformas educativas se enfrentan a una carrera contrarreloj en el Congreso,https://www.eltiempo.com/vida/educacion/reformas-educativas-se-enfrentan-a-una-carrera-contrarreloj-3329134,eltiempo.com
2024-03-30,"Praia do Sancho, la llamada ‘mejor playa del mundo’",https://www.eltiempo.com/vida/viajar/praia-do-sancho-la-llamada-mejor-playa-del-mundo-3328621,eltiempo.com
2024-03-30,Sector turismo estima una mejor Semana Santa frente a la de 2023,https://www.eltiempo.com/vida/viajar/sector-turismo-estima-una-mejor-semana-santa-frente-a-la-de-2023-3329130,eltiempo.com
2024-03-30,"Petro mostró balance de delitos en 2024: así va el país en secuestro, terrorismo, extorsión y homicidio",https://www.eltiempo.com/politica/gobierno/petro-mostro-balance-de-delitos-en-2024-asi-va-el-pais-en-secuestro-terrorismo-extorsion-y-homicidio-3329160,eltiempo.com
2024-03-30,"Los días cruciales para las reformas sociales de Petro, que se juegan la vida en Senado",https://www.eltiempo.com/politica/congreso/los-dias-cruciales-para-las-reformas-sociales-de-petro-que-se-juegan-la-vida-en-senado-3329087,eltiempo.com
2024-03-30,‘Las necesidades son tantas que no se puede descartar el aporte de la ciudadanía’: gobernador de Antioquia,https://www.eltiempo.com/politica/partidos-politicos/las-necesidades-son-tantas-que-no-se-puede-descartar-el-aporte-de-la-ciudadania-gobernador-de-antioquia-3329163,eltiempo.com
2024-03-30,Las tensiones regionales que desnudó la ‘vaca’ por Antioquia,https://www.eltiempo.com/politica/partidos-politicos/las-tensiones-regionales-que-desnudo-la-vaca-por-antioquia-3329167,eltiempo.com
2024-03-30,¿De qué hablará el presidente Petro con los alcaldes de las capitales? / En secreto,https://www.eltiempo.com/politica/gobierno/de-que-hablara-el-presidente-petro-con-los-alcaldes-de-las-capitales-en-secreto-3329081,eltiempo.com
2024-03-30,Crisis Colombia-Argentina: la ‘diplomacia del micrófono’ pasa factura,https://www.eltiempo.com/politica/gobierno/crisis-colombia-argentina-la-diplomacia-del-microfono-pasa-factura-3329096,eltiempo.com
2024-03-30,"'Relaciones diplomáticas con Argentina no están en su mejor momento, pero no están rotas': canciller (e) Murillo",https://www.eltiempo.com/politica/gobierno/no-permitiremos-que-se-insulte-con-palabras-desobligantes-y-de-irrespeto-al-presidente-petro-canciller-e-murillo-3329145,eltiempo.com
2024-03-31,Denuncian a cinco partidos ante el CNE por recibir presunta financiación extranjera en año electoral,https://www.eltiempo.com/politica/partidos-politicos/denuncian-a-cinco-partidos-ante-el-cne-por-recibir-presunta-financiacion-extranjera-en-ano-electoral-3329218,eltiempo.com
2024-03-31,Expresidente Uribe sobre gobierno del presidente Gustavo Petro: ‘La Constitución no es el problema’,https://www.eltiempo.com/politica/partidos-politicos/expresidente-uribe-sobre-gobierno-del-presidente-gustavo-petro-la-constitucion-no-es-el-problema-3329204,eltiempo.com
2024-03-31,Voces de paz en tiempos de conflicto: el llamado del papa en la Pascua,https://www.eltiempo.com/vida/religion/voces-de-paz-en-tiempos-de-conflicto-el-llamado-del-papa-en-la-pascua-3329209,eltiempo.com
2024-03-31,"Astronautas de Artemis III llevarán plantas a la Luna, ¿para qué?",https://www.eltiempo.com/vida/ciencia/astronautas-de-artemis-iii-llevaran-plantas-a-la-luna-para-que-3329216,eltiempo.com
2024-03-30,Cómo salvar el tratado pandémico,https://www.eltiempo.com/opinion/columnistas/como-salvar-el-tratado-pandemico-3329162,eltiempo.com
2024-03-30,Columna de Germán Vargas Lleras: ¿Para dónde van?,https://www.eltiempo.com/opinion/columnistas/para-donde-van-3329158,eltiempo.com
2024-03-30,Referentes incómodos,https://www.eltiempo.com/opinion/columnistas/referentes-incomodos-3329181,eltiempo.com
2024-03-30,Un gobierno mataempleos,https://www.eltiempo.com/opinion/columnistas/un-gobierno-mataempleos-3329157,eltiempo.com
2024-03-30,La ‘vaca’ de Antioquia,https://www.eltiempo.com/opinion/editorial/la-vaca-de-antioquia-3329156,eltiempo.com
2024-03-30,Foro del lector de EL TIEMPO del 31 de marzo de 2024,https://www.eltiempo.com/opinion/cartas/una-burla-electoral-3329189,eltiempo.com
2024-03-31,Más de 100.000 israelíes protestan en Jerusalén contra Netanyahu para pedir elecciones,https://www.eltiempo.com/mundo/medio-oriente/mas-de-100-000-israelies-protestan-en-jerusalen-contra-netanyahu-para-pedir-elecciones-3329259,eltiempo.com
2024-03-31,El Seguro Social le reclamó US$15.000 y enfrentó esta consecuencia,https://www.eltiempo.com/mundo/eeuu-y-canada/el-seguro-social-le-reclamo-us-15-000-y-enfrento-esta-consecuencia-3325721,eltiempo.com
2024-03-31,Florida: le diagnosticaron un tumor cerebral gracias a una 'selfie' que se tomó,https://www.eltiempo.com/mundo/eeuu-y-canada/florida-le-diagnosticaron-un-tumor-cerebral-gracias-a-una-selfie-que-se-tomo-3325711,eltiempo.com
2024-03-31,"Pensaron que su hija tenía solo fiebre en EE. UU., resultó ser una enfermedad mortal",https://www.eltiempo.com/mundo/eeuu-y-canada/pensaron-que-su-hija-tenia-solo-fiebre-en-ee-uu-resulto-ser-una-enfermedad-mortal-3326080,eltiempo.com
2024-03-31,Sube número de migrantes que cruzaron selva del Darién en Panamá,https://www.eltiempo.com/mundo/latinoamerica/sube-numero-de-migrantes-que-cruzaron-selva-del-darien-en-panama-3329286,eltiempo.com
2024-03-31,‘Brasil nos abre la puerta con la Presidencia del G20’,https://www.eltiempo.com/mundo/latinoamerica/brasil-nos-abre-la-puerta-con-la-presidencia-del-g20-3329274,eltiempo.com
2024-03-31,Boluarte pide a fiscalía de Perú que le tome declaración el por caso de relojes Rolex,https://www.eltiempo.com/mundo/latinoamerica/boluarte-pide-a-fiscalia-de-peru-que-le-tome-declaracion-el-por-caso-de-relojes-rolex-3329248,eltiempo.com
2024-03-31,"Video: barcaza choca contra puente en el río Arkansas, Estados Unidos",https://www.eltiempo.com/mundo/eeuu-y-canada/video-barcaza-choca-contra-puente-en-el-rio-arkansas-estados-unidos-3329249,eltiempo.com
2024-03-31,"Cony Camelo denunció malos tratos a colombianos en México: sin celular, extorsiones y abortos",https://www.eltiempo.com/mundo/cony-camelo-denuncio-malos-tratos-a-colombianos-en-mexico-sin-celular-extorsiones-y-abortos-3329212,eltiempo.com
2024-03-31,California: el inesperado fenómeno que ocurrió en el empleo por el aumento de salario,https://www.eltiempo.com/mundo/eeuu-y-canada/california-el-inesperado-fenomeno-que-ocurrio-en-el-empleo-por-el-aumento-de-salario-3327820,eltiempo.com
2024-03-31,El rey Carlos III reaparece en público por primera vez desde su diagnóstico de cáncer,https://www.eltiempo.com/mundo/europa/el-rey-carlos-iii-reaparece-en-publico-por-primera-vez-desde-su-diagnostico-de-cancer-3329215,eltiempo.com
2024-03-31,"Ganó el Powerball, pero solo se llevó el 40% del premio a casa por esta razón",https://www.eltiempo.com/mundo/eeuu-y-canada/gano-el-powerball-pero-solo-se-llevo-el-40-del-premio-a-casa-por-esta-razon-3328101,eltiempo.com
2024-03-31,Nueva York: el dramático video en el que una latina salvó a su hija de un secuestro,https://www.eltiempo.com/mundo/eeuu-y-canada/nueva-york-el-dramatico-video-del-momento-en-el-que-una-latina-salvo-a-su-hija-de-un-s-3327812,eltiempo.com
2024-03-31,¿Qué se sabe de la operación a la que será sometido el primer ministro de Israel?,https://www.eltiempo.com/mundo/medio-oriente/que-se-sabe-de-la-operacion-a-la-que-sera-sometido-el-primer-ministro-de-israel-3329223,eltiempo.com
2024-03-31,Probó la teoría de 'sin carrito' en una tienda de segunda mano y halló un tesoro,https://www.eltiempo.com/mundo/eeuu-y-canada/probo-la-teoria-de-sin-carrito-en-una-tienda-de-segunda-mano-y-hallo-un-tesoro-3325704,eltiempo.com
2024-03-31,Rusia: ¿por qué Vladimir Putin no asistió a homenaje de víctimas del atentado en Moscú?,https://www.eltiempo.com/mundo/europa/rusia-por-que-vladimir-putin-no-asistio-a-homenaje-de-victimas-del-atentado-en-moscu-3329235,eltiempo.com
2024-03-31,Una encuesta detectó a qué candidato apoyan los latinos de Texas: le sorprenderá,https://www.eltiempo.com/mundo/eeuu-y-canada/una-encuesta-detecto-a-que-candidato-apoyan-los-latinos-de-texas-le-sorprendera-3326469,eltiempo.com
2024-03-31,"Ataque armado en Guayaquil, Ecuador, deja como salgo al menos 8 muertos y 8 heridos",https://www.eltiempo.com/mundo/latinoamerica/ataque-armado-en-guayaquil-ecuador-deja-como-salgo-al-menos-8-muertos-y-8-heridos-3329196,eltiempo.com
2024-03-31,La Fiscalía de Perú niega haber allanado de forma ilegítima el domicilio de Dina Boluarte,https://www.eltiempo.com/mundo/latinoamerica/la-fiscalia-de-peru-niega-haber-allanado-de-forma-ilegitima-el-domicilio-de-boluarte-3329195,eltiempo.com
2024-03-31,Al menos ocho muertos por la explosión de una bomba en un mercado de Siria,https://www.eltiempo.com/mundo/medio-oriente/al-menos-ocho-muertos-por-la-explosion-de-una-bomba-en-un-mercado-en-el-noroeste-de-siria-3329197,eltiempo.com
2024-03-31,Ecuador vive un violento fin de semana con tres masacres en dos días,https://www.eltiempo.com/mundo/latinoamerica/ecuador-vive-un-violento-fin-de-semana-con-tres-masacres-en-dos-dias-3329278,eltiempo.com
2024-03-31,El restaurante de Tampa que fue nombrado como uno de los mejores para hacer barbacoa,https://www.eltiempo.com/mundo/eeuu-y-canada/el-restaurante-de-tampa-que-fue-nombrado-como-uno-de-los-mejores-para-hacer-barbacoa-3326068,eltiempo.com
2024-03-31,Camila Gómez: esta es la identidad de los hombres linchados por el feminicidio que indigna a México,https://www.eltiempo.com/mundo/mexico/revelan-identidad-de-los-hombres-que-fueron-linchados-en-mexico-por-asesinato-de-camila-3329198,eltiempo.com
2024-03-31,La playa de California donde está prohibido acampar porque hay 'desechos humanos',https://www.eltiempo.com/mundo/eeuu-y-canada/la-playa-de-california-donde-esta-prohibido-acampar-porque-hay-desechos-humanos-3325703,eltiempo.com
2024-03-31,Encontró un tesoro en una tienda de rebajas de EE. UU. e hizo algo inédito con él,https://www.eltiempo.com/mundo/eeuu-y-canada/encontro-un-tesoro-en-una-tienda-de-rebajas-de-ee-uu-e-hizo-algo-inedito-con-el-3326103,eltiempo.com
2024-03-31,El tratamiento que Galilea Montijo usa para verse más joven: todos los detalles,https://www.eltiempo.com/mundo/eeuu-y-canada/el-tratamiento-que-galilea-montijo-usa-para-verse-mas-joven-todos-los-detalles-3325712,eltiempo.com
2024-03-31,Latina en EE. UU. dice cuál es la frase con la que los hispanos 'sobreviven' al trabajo,https://www.eltiempo.com/mundo/eeuu-y-canada/latina-en-ee-uu-dice-cual-es-la-frase-con-la-que-los-hispanos-sobreviven-al-trabajo-3326011,eltiempo.com
2024-03-31,Se fue de Texas y compró un pueblo fantasma en California; ahora vive allí,https://www.eltiempo.com/mundo/eeuu-y-canada/se-fue-de-texas-y-compro-un-pueblo-fantasma-en-california-ahora-vive-alli-3328075,eltiempo.com
2024-03-31,Texas: las repercusiones que la ley SB4 traería para los comerciantes,https://www.eltiempo.com/mundo/eeuu-y-canada/texas-las-repercusiones-que-la-ley-sb4-traeria-para-los-comerciantes-3327811,eltiempo.com
2024-03-30,"Gallego y Moreno, los dos colombianos de los que puede depender el control del Senado en Estados Unidos",https://www.eltiempo.com/mundo/eeuu-y-canada/gallego-y-moreno-los-dos-colombianos-de-los-que-puede-depender-el-control-del-senado-en-estados-unidos-3329151,eltiempo.com
2024-03-30,¿Cómo recibió Argentina la noticia de la expulsión de sus diplomáticos en Colombia?,https://www.eltiempo.com/mundo/latinoamerica/como-recibio-argentina-la-noticia-de-la-expulsion-de-sus-diplomaticos-en-colombia-3329152,eltiempo.com
2024-03-30,¿Qué puede pasar con el futuro de Boluarte tras el escándalo del 'caso Rolex' en Perú?,https://www.eltiempo.com/mundo/latinoamerica/que-puede-pasar-con-el-futuro-de-boluarte-tras-el-escandalo-del-caso-rolex-en-peru-3329153,eltiempo.com
2024-03-30,Los riesgos que puede desatar una crisis regional por las elecciones en Venezuela,https://www.eltiempo.com/mundo/venezuela/los-riesgos-que-pueden-desatar-una-crisis-regional-por-las-elecciones-en-venezuela-3329148,eltiempo.com
2024-03-31,Ceremonia religiosa terminó en trágico accidente en Ocaña: hay 13 personas heridas,https://www.eltiempo.com/colombia/otras-ciudades/procesion-religiosa-termino-en-tragedia-13-personas-fueron-electrocutadas-en-ocana-3329256,eltiempo.com
2024-03-31,un hombre muerto y una mujer herida deja violento accidente en Juan Mina,https://www.eltiempo.com/colombia/barranquilla/barranquilla-un-hombre-muerto-y-una-mujer-herida-deja-violento-accidente-en-juan-mina-3329242,eltiempo.com
2024-03-31,Hablan familiares de fallecido en accidente de conductora ebria en Armenia: 'Pedimos justicia',https://www.eltiempo.com/colombia/otras-ciudades/hablan-familiares-de-fallecido-en-accidente-de-conductora-ebria-en-armenia-pedimos-justicia-3329257,eltiempo.com
2024-03-31,"Volvió a temblar este Domingo de Resurrección, esta vez en La Mesa de los Santos",https://www.eltiempo.com/colombia/volvio-a-temblar-este-domingo-de-resurreccion-en-colombia-epicentro-magnitud-y-profundidad-3329260,eltiempo.com
2024-03-31,'Es ridículo': Fico sobre cierre temporal de lujoso hotel por explotación sexual,https://www.eltiempo.com/colombia/medellin/alcalde-de-medellin-pide-extincion-de-dominio-a-lugares-donde-haya-explotacion-sexual-3329266,eltiempo.com
2024-03-31,Esta es la historia de Tobías Suárez: el agente (R) de la Policía que cumplió 100 años,https://www.eltiempo.com/colombia/cali/asi-fue-el-cumpleanos-100-del-agente-suarez-el-mas-longevo-de-la-policia-de-colombia-3329264,eltiempo.com
2024-03-31,Manchester City y Arsenal empataron: Liverpool es líder de la Liga Premier,https://www.eltiempo.com/deportes/futbol-internacional/manchester-city-y-arsenal-empataron-liverpool-es-lider-de-la-liga-premier-3329250,eltiempo.com
2024-03-31,"Luis Díaz, presente: vea los goles del juego Liverpool vs. Brighton",https://www.eltiempo.com/deportes/futbol-internacional/luis-diaz-golazo-vea-los-tantos-del-juego-liverpool-vs-brighton-3329207,eltiempo.com
2024-03-31,Se confirma el otro partido amistoso que tendría Colombia antes de la Copa América,https://www.eltiempo.com/deportes/futbol-internacional/se-confirma-el-otro-partido-amistoso-que-tendra-colombia-antes-de-la-copa-america-3329262,eltiempo.com
2024-03-31,"Manchester City vs. Arsenal: en juego el liderato de la Liga Premier, EN VIVO",https://www.eltiempo.com/deportes/futbol-internacional/manchester-city-vs-arsenal-en-juego-liderato-de-la-luga-premier-en-vivo-3329210,eltiempo.com
