publish_date,title,url,media_name
2024-01-04,"Heavy destruction at Shifa Hospital, Gaza's largest, as Israeli troops end a 2-week raid",https://www.newswest9.com/article/news/nation-world/israel-hamas-conflict/israeli-troops-withdraw-from-shifa-hospital-in-gaza/507-348c2162-ecef-49a9-bb7c-9d7cc27bf0b6,newswest9.com
2024-01-04,"Heavy destruction at Shifa Hospital, Gaza's largest, as Israeli troops end a 2-week raid",https://www.12newsnow.com/article/news/nation-world/israel-hamas-conflict/israeli-troops-withdraw-from-shifa-hospital-in-gaza/507-348c2162-ecef-49a9-bb7c-9d7cc27bf0b6,12newsnow.com
2024-01-04,"Heavy destruction at Shifa Hospital, Gaza's largest, as Israeli troops end a 2-week raid",https://www.cbs19.tv/article/news/nation-world/israel-hamas-conflict/israeli-troops-withdraw-from-shifa-hospital-in-gaza/507-348c2162-ecef-49a9-bb7c-9d7cc27bf0b6,cbs19.tv
2024-01-04,"Heavy destruction at Shifa Hospital, Gaza's largest, as Israeli troops end a 2-week raid",https://www.abc10.com/article/news/nation-world/israel-hamas-conflict/israeli-troops-withdraw-from-shifa-hospital-in-gaza/507-348c2162-ecef-49a9-bb7c-9d7cc27bf0b6,abc10.com
2024-01-04,"Heavy destruction at Shifa Hospital, Gaza's largest, as Israeli troops end a 2-week raid",https://www.kagstv.com/article/news/nation-world/israel-hamas-conflict/israeli-troops-withdraw-from-shifa-hospital-in-gaza/507-348c2162-ecef-49a9-bb7c-9d7cc27bf0b6,kagstv.com
2024-01-04,"Heavy destruction at Shifa Hospital, Gaza's largest, as Israeli troops end a 2-week raid",https://www.cbs8.com/article/news/nation-world/israel-hamas-conflict/israeli-troops-withdraw-from-shifa-hospital-in-gaza/507-348c2162-ecef-49a9-bb7c-9d7cc27bf0b6,cbs8.com
2024-01-04,"Heavy destruction at Shifa Hospital, Gaza's largest, as Israeli troops end a 2-week raid",https://www.kcentv.com/article/news/nation-world/israel-hamas-conflict/israeli-troops-withdraw-from-shifa-hospital-in-gaza/507-348c2162-ecef-49a9-bb7c-9d7cc27bf0b6,kcentv.com
2024-03-31,Registra Jerusalén la mayor manifestación contra el gobierno de Netanyahu,https://laopcion.com.mx/nacional/registra-jerusalen-la-mayor-manifestacion-contra-el-gobierno-de-netanyahu-20240331-459258.html,laopcion.com.mx
2024-03-30,Israel's high court says the government must stop funding seminaries. Could that topple Netanyahu?,https://mynews13.com/fl/orlando/ap-top-news/2024/03/30/israels-high-court-says-the-government-must-stop-funding-seminaries-could-that-topple-netanyahu,mynews13.com
2024-03-31,Israelis march against Netanyahu in mass protest,https://www.insidenova.com/news/national/israelis-march-against-netanyahu-in-mass-protest/article_da0570ea-6a97-5ba5-88d4-cdaab9b69daa.html,insidenova.com
2024-03-31,Israel PM to undergo hernia surgery as pressure rises over Gaza war,https://www.insidenova.com/news/national/israel-pm-to-undergo-hernia-surgery-as-pressure-rises-over-gaza-war/article_50122a97-9a5f-5c2d-b7ea-944767d3b1b5.html,insidenova.com
2024-03-30,Caitlin Clark looks to break all-division scoring record,https://www.ctvnews.ca/sports/iowa-s-caitlin-clark-enters-game-vs-lsu-at-no-6-on-all-division-list-1.6828013,ctvnews.ca
2024-03-31,Ramy Youssef says 'Free Palestine' in SNL monologue,https://www.ctvnews.ca/entertainment/ramy-youssef-references-israel-hamas-war-in-saturday-night-live-monologue-1.6828605,ctvnews.ca
2024-03-31,"Gaza medical officials say Israeli strike kills 4 foreign aid workers, driver after delivering food",https://kvia.com/news/ap-national/2024/03/31/palestinians-say-israeli-troops-have-withdrawn-from-gazas-main-hospital-after-2-week-raid/,kvia.com
2024-03-31,Israel: Netanyahu in 'excellent' health after hernia surgery,https://www.ctvnews.ca/world/israeli-pm-benjamin-netanyahu-in-excellent-health-after-hernia-surgery-hospital-says-1.6828433,ctvnews.ca
2024-03-31,Man pays off lunch debt for 20 schools to honour late wife,https://www.ctvnews.ca/lifestyle/oklahoma-man-pays-off-thousands-in-students-lunch-debt-to-honour-late-wife-1.6828506,ctvnews.ca
2024-03-31,Israelis hold largest anti-government protest since war in Gaza began,https://abcnews.go.com/International/wireStory/israeli-airstrike-hospital-tent-camp-gaza-kills-2-108690884,abcnews.go.com
2024-01-04,"Heavy destruction at Shifa Hospital, Gaza's largest, as Israeli troops end a 2-week raid",https://www.13wmaz.com/article/news/nation-world/israel-hamas-conflict/israeli-troops-withdraw-from-shifa-hospital-in-gaza/507-348c2162-ecef-49a9-bb7c-9d7cc27bf0b6,13wmaz.com
2024-03-31,"Cel mai mare miting în sprijinul alegerilor anticipate, de la începutul războiului din Gaza, a avut loc la Ierusalim",https://adevarul.ro/stiri-externe/in-lume/cel-mai-mare-miting-in-sprijinul-alegerilor-2351414.html,adevarul.ro
2024-03-31,"Israeli troops withdraw from Shifa Hospital, Gaza's largest, after 2-week raid",https://vancouver.citynews.ca/2024/03/31/palestinians-say-israeli-troops-have-withdrawn-from-gazas-main-hospital-after-2-week-raid/,citynews.ca
2024-03-31,"Gaza medical officials say Israeli strike kills 4 foreign aid workers, driver after delivering food",https://ktvz.com/news/ap-national-news/2024/03/31/palestinians-say-israeli-troops-have-withdrawn-from-gazas-main-hospital-after-2-week-raid/,ktvz.com
2024-03-31,Israelis march against Netanyahu in mass protest,https://www.the-messenger.com/news/national/article_eae130cb-2ab5-55a5-b7ef-be366dee3715.html,the-messenger.com
2024-03-31,"Gaza medical officials say Israeli strike kills 4 foreign aid workers, driver after delivering food",https://keyt.com/news/2024/03/31/palestinians-say-israeli-troops-have-withdrawn-from-gazas-main-hospital-after-2-week-raid/,keyt.com
2024-03-31,"Gaza medical officials say Israeli strike kills 4 foreign aid workers, driver after delivering food",https://krdo.com/news/2024/03/31/palestinians-say-israeli-troops-have-withdrawn-from-gazas-main-hospital-after-2-week-raid/,krdo.com
2024-03-31,Netanyahu undergoes hernia surgery as his deputy covers for him,https://thehill.com/policy/international/4566786-netanyahu-undergoes-hernia-surgery-as-his-deputy-covers-for-him/,thehill.com
2024-03-31,Israel central bank says ultra-Orthodox need to join military to help economy,https://www.yahoo.com/news/israel-central-bank-says-ultra-091001493.html,yahoo.com
2024-03-31,Changing Your Mind Shows How Thoughtful You Are,https://www.forbes.com/sites/teddymcdarrah/2024/03/31/changing-your-mind-shows-how-thoughtful-you-are/,forbes.com
2024-03-31,Atos em Israel pedem saída de Netanyahu e libertação de reféns em Gaza,https://ultimosegundo.ig.com.br/mundo/2024-03-31/atos-em-israel-pedem-saida-de-netanyahu-e-libertacao-de-refens-em-gaza.html,ig.com.br
2024-03-31,Israel: Benjamin Netanyahu protests put political divides back on show,https://www.bbc.co.uk/news/world-middle-east-68705643,bbc.co.uk
2024-03-31,Benjamin Netanyahu fue operado exitosamente de una hernia,https://www.infobae.com/america/mundo/2024/03/31/benjamin-netanyahu-fue-operado-exitosamente-de-una-hernia/,infobae.com
2024-03-31,Tens of thousands of Israelis rally against Netanyahu's government,https://www.yahoo.com/news/tens-thousands-israelis-rally-against-191532057.html,yahoo.com
2024-03-31,Multi-day storm threatens travel woes across Ontario,https://ca.news.yahoo.com/multi-day-storm-threatens-travel-235740589.html,yahoo.com
2024-03-31,"Milei defende Israel, diz que governo não comete 'excessos' e critica Lula",https://noticias.uol.com.br/internacional/ultimas-noticias/2024/03/31/milei-critica-lula-israel.htm,uol.com.br
2024-03-31,"This Easter, Palestinian Christians Will Be Praying for Palestine’s Resurrection",https://truthout.org/articles/this-easter-palestinian-christians-will-be-praying-for-palestines-resurrection/,truthout.org
2024-03-30,Intervalo da Notícias: Moraes nega devolução de passaporte a Bolsonaro,https://intervalodanoticias.blogspot.com/2024/03/moraes-nega-devolucao-de-passaporte.html,intervalodanoticias.blogspot.com
2024-03-31,US not providing some weapons that Israel is requesting against Hamas,https://endtimeheadlines.org/2024/03/us-not-providing-some-weapons-that-israel-is-requesting-against-hamas/,endtimeheadlines.org
2024-03-30,"Gaza 'feels like a coffin for children,' some adolescents are 'wanting to die': UNICEF",https://www.wkhm.com/2024/03/30/gaza-feels-like-a-coffin-for-children-some-adolescents-are-wanting-to-die-unicef/,wkhm.com
2024-03-31,Biden Has Changed His Tune On Gaza ‘Ceasefire’ As Activist Pressure Mounts — And Election Draws Near,https://libertyunyielding.com/2024/03/31/biden-has-changed-his-tune-on-gaza-ceasefire-as-activist-pressure-mounts-and-election-draws-near/,libertyunyielding.com
2024-03-30,"Egito sediará negociações entre Israel e Hamas neste domingo (31), diz mídia estatal",https://juruaonline.com.br/egito-sediara-negociacoes-entre-israel-e-hamas-neste-domingo-31-diz-midia-estatal-cnn-brasil/,juruaonline.com.br
2024-03-31,Biden softens stance on Gaza. Could it decide who wins NC in 2024 election?,https://www.wral.com/story/biden-softens-stance-on-gaza-could-it-decide-who-wins-nc-in-2024-election/21353691/,wral.com
2024-03-31,Israelis march in largest anti-government protest since start of Israel-Hamas war,https://www.pbs.org/newshour/world/israeli-airstrike-hits-crowded-gaza-hospital-tent-camp-killing-2-palestinians,pbs.org
2024-03-31,Israeli police arrest 16 people in Tel Aviv during anti-government protests,https://www.egyptindependent.com/israeli-police-arrest-16-people-in-tel-aviv-during-anti-government-protests/,egyptindependent.com
2024-03-31,"Israel and Hamas truce talks resume in Cairo, Egyptian media report",https://www.egyptindependent.com/israel-and-hamas-truce-talks-resume-in-cairo-egyptian-media-report/,egyptindependent.com
2024-03-30,Regimkritiska protester i Israel – polis använde tårgas,https://www.tv4.se/artikel/5G2I8yEFln7nOtPO5aYCiy/valdsamt-vid-regimkritiska-protester-i-israel,tv4.se
2024-03-31,Here's what Trump and Biden said in their Easter messages,https://www.memeorandum.com/240331/p15,memeorandum.com
2024-03-31,"US to send more bombs, warplanes to Israel",https://pakobserver.net/us-to-send-more-bombs-warplanes-to-israel/,pakobserver.net
2024-03-30,"Una estampida y disparos durante un reparto de comida en Gaza, devastada por la guerra",https://www.tribunadesanluis.com.mx/mundo/una-estampida-y-disparos-durante-un-reparto-de-comida-en-gaza-devastada-por-la-guerra-11679401.html,tribunadesanluis.com.mx
2024-03-31,"Netanyahu se someterá a una operación, en medio de protesta para exigir elecciones en Israel",https://www.tribunadesanluis.com.mx/mundo/netanyahu-se-sometera-a-una-operacion-11682438.html,tribunadesanluis.com.mx
2024-03-31,"Israele, in 100mila davanti alla Knesset per chiedere nuove elezioni",https://quotidianodibari.it/israele-in-100mila-davanti-alla-knesset-per-chiedere-nuove-elezioni/,quotidianodibari.it
2024-03-31,"Ostaggi Hamas, Netanyahu al centro delle proteste: ""Si dimetta""",https://quotidianodibari.it/ostaggi-hamas-netanyahu-al-centro-delle-proteste-si-dimetta/,quotidianodibari.it
2024-03-31,Israelis rally in their largest anti-government protest since the war in Gaza began,https://dailyjournal.net/2024/03/31/israelis-rally-in-their-largest-anti-government-protest-since-the-war-in-gaza-began/,dailyjournal.net
2024-03-31,Nuevos bombardeos israelíes en Gaza a la espera de que se reanuden las negociaciones,https://www.tvn-2.com/mundo/nuevos-bombardeos-israelies-gaza-espera_1_2125856.html,tvn-2.com
2024-03-31,An Israeli airstrike on a hospital tent camp in Gaza kills 2 Palestinians,https://www.sunjournal.com/2024/03/31/an-israeli-airstrike-on-a-hospital-tent-camp-in-gaza-kills-2-palestinians/,sunjournal.com
2024-03-30,"Hundreds rally in Portland, calling for immediate and permanent cease-fire in Gaza",https://www.sunjournal.com/2024/03/30/hundreds-rally-in-portland-to-show-solidarity-with-palestine-seek-gaza-cease-fire/,sunjournal.com
2024-03-31,"Ostaggi Hamas, Netanyahu al centro delle proteste: ''Si dimetta''",https://www.notizienazionali.it/notizie/dal-mondo/60646/ostaggi-hamas-netanyahu-al-centro-delle-proteste-si-dimetta,notizienazionali.it
2024-03-31,"Israele, in 100mila davanti alla Knesset per chiedere nuove elezioni",https://www.notizienazionali.it/notizie/dal-mondo/60673/israele-in-100mila-davanti-alla-knesset-per-chiedere-nuove-elezioni,notizienazionali.it
2024-03-31,Tens of thousands rally against Netanyahu government in Jerusalem,https://wsau.com/2024/03/31/tens-of-thousands-rally-against-netanyahu-government-in-jerusalem/,wsau.com
2024-03-31,"Netanyahu se someterá a una operación, en medio de protesta para exigir elecciones en Israel",https://www.elsoldetulancingo.com.mx/mundo/netanyahu-se-sometera-a-una-operacion-11682438.html,elsoldetulancingo.com.mx
2024-03-30,"Una estampida y disparos durante un reparto de comida en Gaza, devastada por la guerra",https://www.elsoldetulancingo.com.mx/mundo/una-estampida-y-disparos-durante-un-reparto-de-comida-en-gaza-devastada-por-la-guerra-11679401.html,elsoldetulancingo.com.mx
2024-03-31,Media: «12 morti in un raid su persone in attesa aiuti». Oggi al Cairo riprendono i negoziati per la tregua,https://www.corriere.it/esteri/diretta-live/24_marzo_31/israele-hamas-guerra-notizie-oggi-media-12-morti-un-raid-persone-attesa-aiuti-oggi-cairo-riprendono-negoziati-la-tregua-6d9ff4fe-eeb6-11ee-990f-f81d5ab8cdcb.shtml,corriere.it
2024-03-31,Nazareth’s disappearing Christian population,https://allisrael.com/nazareth-s-disappearing-christian-population-crime-and-increasing-islamic-presence-push-christians-out-of-jesus-hometown,allisrael.com
2024-03-30,"New York congressman: ‘Disgusting’ that Biden, Schumer play politics with Israel in election year",https://www.5tjt.com/new-york-congressman-disgusting-that-biden-schumer-play-politics-with-israel-in-election-year/,5tjt.com
2024-03-31,"Why Ireland is the most pro-Palestinian nation in Europe By Niamh Kennedy and Eoin McSweeney, CNN",http://drhabibsiddiqui.blogspot.com/2024/03/why-ireland-is-most-pro-palestinian.html,drhabibsiddiqui.blogspot.com
2024-03-31,Passaporte de Bolsonaro Continua Retido: Pedido de Viagem a Israel é Negado por Alexandre de Moraes,https://www.tribunadobrasil.com/2024/03/passaporte-de-bolsonaro-continua-retido.html,tribunadobrasil.com
2024-03-31,Gaza Ceasefire Talks to Resume in Cairo: Egyptian Media,https://khybernews.tv/gaza-ceasefire-talks-to-resume-in-cairo-egyptian-media/,khybernews.tv
2024-03-30,Families accuse Netanyahu of foiling hostage release . Vow to remove him from power,https://yalibnan.com/2024/03/30/families-accuse-netanyahu-of-foiling-hostage-release-vow-to-remove-him-from-power/?utm_source=rss&utm_medium=rss&utm_campaign=families-accuse-netanyahu-of-foiling-hostage-release-vow-to-remove-him-from-power,yalibnan.com
2024-03-31,"Gaza ceasefire talks set to resume, as thousands protest against Netanyahu in Israel",https://yalibnan.com/2024/03/31/gaza-ceasefire-talks-set-to-resume-as-thousands-protest-against-netanyahu-in-israel/?utm_source=rss&utm_medium=rss&utm_campaign=gaza-ceasefire-talks-set-to-resume-as-thousands-protest-against-netanyahu-in-israel,yalibnan.com
2024-03-31,"Više od 100.000 ljudi pred izraelskim parlamentom poručilo: Netanyahu ne laži, odlazi",https://www.klix.ba/vijesti/svijet/vise-od-100-000-ljudi-pred-izraelskim-parlamentom-porucilo-netanyahu-ne-lazi-odlazi/240331079,klix.ba
2024-03-31,Commonsense & Wonder: Europe is the end goal for the Islamists,http://commonsensewonder.blogspot.com/2024/03/europe-is-end-goal-for-islamists.html,commonsensewonder.blogspot.com
2024-03-31,"US Rep. Jamaal Bowman Calls for ""Maniac"" Netanyahu's Removal From Office",https://www.thewrap.com/jamaal-bowman-netanyahu-maniac/,thewrap.com
2024-03-30,Israel: protesto reúne milhares nas proximidades da casa de Netanyahu (VÍDEO),https://sputniknewsbr.com.br/20240330/israel-protesto-reune-milhares-nas-proximidades-da-casa-de-netanyahu-video-33838710.html,sputniknewsbr.com.br
2024-03-31,Netanyahu fará cirurgia de hérnia depois de ter recebido um marca-passo,https://correiodaamazonia.com/denunciado-por-genocidio-netanyahu-fara-cirurgia-de-hernia-depois-de-ter-recebido-um-marca-passo/,correiodaamazonia.com
2024-03-31,"Israele, in 100mila davanti alla Knesset per chiedere nuove elezioni",https://www.sardegnareporter.it/2024/03/israele-in-100mila-davanti-alla-knesset-per-chiedere-nuove-elezioni/602127/,sardegnareporter.it
2024-03-31,"Ostaggi Hamas, Netanyahu al centro delle proteste: ""Si dimetta""",https://www.sardegnareporter.it/2024/03/ostaggi-hamas-netanyahu-al-centro-delle-proteste-si-dimetta/602062/,sardegnareporter.it
2024-03-31,Atos em Israel pedem saída de Netanyahu e libertação de reféns em Gaza,https://fanoticias.com.br/atos-em-israel-pedem-saida-de-netanyahu-e-libertacao-de-refens-em-gaza/,fanoticias.com.br
2024-03-31,Netanyahu se someterá este domingo a una operación por una hernia,https://ensegundos.do/2024/03/31/netanyahu-se-sometera-este-domingo-a-una-operacion-por-una-hernia/?utm_source=rss&utm_medium=rss&utm_campaign=netanyahu-se-sometera-este-domingo-a-una-operacion-por-una-hernia,ensegundos.do
2024-03-31,"Netanyahu ‘continues to essentially give the finger’ to Biden over Gaza, Sen. Van Hollen says",https://southernillinoisnow.com/2024/03/31/netanyahu-continues-to-essentially-give-the-finger-to-biden-over-gaza-sen-van-hollen-says/,southernillinoisnow.com
2024-03-31,Benjamin Netanyahu passará por cirurgia de hérnia neste domingo,https://fanoticias.com.br/benjamin-netanyahu-passara-por-cirurgia-de-hernia-neste-domingo/,fanoticias.com.br
2024-03-31,Strikes Hit Gaza As Egyptian TV Says Truce Talks To Resume,https://www.ibtimes.com/strikes-hit-gaza-egyptian-tv-says-truce-talks-resume-3728557,ibtimes.com
2024-03-31,Israelis March Against Netanyahu In Mass Protest,https://www.ibtimes.com/israelis-march-against-netanyahu-mass-protest-3728572,ibtimes.com
2024-03-31,AP News Summary at 12:03 a.m. EDT,https://www.wvnews.com/newsfeed/us/ap-news-summary-at-12-03-a-m-edt/article_323e90cb-a5fc-570c-9179-48b66fdc0497.html,wvnews.com
2024-03-31,An Israeli airstrike on a hospital tent camp in Gaza kills 2 Palestinians,https://www.wvnews.com/newsfeed/world/an-israeli-airstrike-on-a-hospital-tent-camp-in-gaza-kills-2-palestinians/article_13267a4f-ea40-5073-a6f0-ffa1b5414a79.html,wvnews.com
2024-03-31,Gaza ceasefire talks to resume in Cairo,https://dailytrust.com/gaza-ceasefire-talks-to-resume-in-cairo/,dailytrust.com
2024-03-31,Netanyahu approves new Gaza ceasefire talks,https://dailytrust.com/netanyahu-approves-new-gaza-ceasefire-talks/,dailytrust.com
2024-03-31,"In Jerusalem, Israelis stage largest protest since war began",https://www.wapt.com/article/israelis-largest-protest-since-war-began-increase-pressure-on-netanyahu/60352652,wapt.com
2024-03-31,An Israeli airstrike on a hospital tent camp in Gaza kills 2 Palestinians,https://www.mymcmurray.com/2024/03/31/an-israeli-airstrike-on-a-hospital-tent-camp-in-gaza-kills-2-palestinians/,mymcmurray.com
2024-03-31,Netanyahu será submetido a uma cirurgia de hérnia neste domingo,https://www.otempo.com.br/mundo/netanyahu-sera-submetido-a-uma-cirurgia-de-hernia-neste-domingo-1.3358001,otempo.com.br
2024-03-31,Novo protesto pela queda de Netanyahu e libertação de reféns tem 16 presos,https://www.otempo.com.br/mundo/novo-protesto-pela-queda-de-netanyahu-e-libertacao-de-refens-tem-16-presos-1.3358005,otempo.com.br
2024-03-30,AP News in Brief at 12:04 a.m. EDT,https://www.mymcmurray.com/2024/03/30/ap-news-in-brief-at-1204-a-m-edt-1262/,mymcmurray.com
2024-03-31,"Netanyahu se someterá a una operación, en medio de protesta para exigir elecciones en Israel",https://www.elsoldehermosillo.com.mx/mundo/netanyahu-se-sometera-a-una-operacion-11682438.html,elsoldehermosillo.com.mx
2024-03-31,Primeiro-ministro israelense é operado com sucesso,https://www.otempo.com.br/mundo/primeiro-ministro-israelense-e-operado-com-sucesso-1.3358176,otempo.com.br
2024-03-31,Israel volta a bombardear Gaza antes do reinício das negociações,https://www.otempo.com.br/mundo/israel-volta-a-bombardear-gaza-antes-do-reinicio-das-negociacoes-1.3357985,otempo.com.br
2024-03-31,Israelis stage largest protest since war began to increase pressure on Netanyahu,https://www.newsday.com/news/nation/israel-hamas-war-news-03-31-2024-e55418,newsday.com
2024-03-31,Tens of thousands rally against Netanyahu government in Jerusalem,https://wibqam.com/2024/03/31/tens-of-thousands-rally-against-netanyahu-government-in-jerusalem/,wibqam.com
2024-03-31,"Israel, Hamas truce talks to restart in Cairo in 'resumption of negotiations' over Gaza",https://www.news24.com/news24/world/news/israel-hamas-truce-talks-to-restart-in-cairo-in-resumption-of-negotiations-over-gaza-20240331,news24.com
2024-03-31,Israelis stage largest protest since war began to increase pressure on Netanyahu,https://www.wdio.com/front-page/world-national/israelis-stage-largest-protest-since-war-began-to-increase-pressure-on-netanyahu/,wdio.com
2024-03-31,"An Israeli airstrike hits a Gaza hospital tent camp, killing 2 Palestinians and hurting journalists",https://www.nbcnews.com/news/world/israeli-airstrike-hits-gaza-hospital-tent-camp-killing-2-palestinians-rcna145768,nbcnews.com
2024-03-31,A Dramatic Decision By Israel's High Court Could Spell Political Trouble For Netanyahu,https://www.huffpost.com/entry/israel-military-draft-explainer_n_6608d568e4b03e016eb4c651,huffpost.com
2024-03-31,Israelis stage largest protest since war began to increase pressure on Netanyahu,https://kvia.com/news/ap-national/2024/03/31/an-israeli-airstrike-on-a-hospital-tent-camp-in-gaza-kills-2-palestinians/,kvia.com
2024-03-31,"Israele, in migliaia in piazza per chiedere nuove elezioni",https://www.adnkronos.com/internazionale/esteri/israele-in-100mila-davanti-alla-knesset-per-chiedere-nuove-elezioni_3qiXv0MeF4Zd3wDhLEAttq,adnkronos.com
2024-03-31,"Gaza, news guerra oggi 31 marzo 2024",https://www.adnkronos.com/internazionale/esteri/gaza-tregua-e-ostaggi-nuovo-round-negoziati-israele-hamas-al-cairo_5eFcAFxrkJIOBjLbfgbHtq,adnkronos.com
2024-03-31,"Ostaggi ancora in mano ad Hamas, Netanyahu nella bufera",https://www.adnkronos.com/internazionale/esteri/ostaggi-hamas-netanyahu-al-centro-delle-proteste-si-dimetta_4mTQJ6pBnEhbiVeYGDUx3C,adnkronos.com
2024-03-31,"France to advance UNSC resolution calling for Gaza ceasefire, two states",https://www.timesofisrael.com/france-to-advance-unsc-resolution-calling-for-gaza-ceasefire-two-states/,timesofisrael.com
2024-03-30,"Una estampida y disparos durante un reparto de comida en Gaza, devastada por la guerra",https://www.elsoldeorizaba.com.mx/mundo/una-estampida-y-disparos-durante-un-reparto-de-comida-en-gaza-devastada-por-la-guerra-11679401.html,elsoldeorizaba.com.mx
2024-03-31,"Netanyahu se someterá a una operación, en medio de protesta para exigir elecciones en Israel",https://www.elsoldeorizaba.com.mx/mundo/netanyahu-se-sometera-a-una-operacion-11682438.html,elsoldeorizaba.com.mx
2024-03-31,Nahost-Liveblog: ++ Israel meldet Tötung von Hisbollah-Kommandeur ++,https://www.tagesschau.de/newsticker/liveblog-nahost-sonntag-124.html,tagesschau.de
2024-03-31,Netanyahu asegura que EEUU no es la causa del aplazamiento de la ofensiva sobre Rafah,https://www.latercera.com/mundo/noticia/netanyahu-asegura-que-eeuu-no-es-la-causa-del-aplazamiento-de-la-ofensiva-sobre-rafah/NWMIWC75C5A2ZOVG34LABC5DQA/,latercera.com
2024-03-31,Nya stora demonstrationer mot Netanyahu,https://www.svd.se/a/JQPQ0R/israel-storsta-protesterna-sedan-kriget-borjade,svd.se
2024-03-31,Netanyahu pressad: ”Inte varit mycket värre”,https://www.svd.se/a/4onB1e/demonstrationer-i-israel-netanyahu-kommer-markera,svd.se
2024-03-31,Benjamin Netanyahu será operado este domingo de una hernia,https://lapagina.com.sv/internacionales/benjamin-netanyahu-sera-operado-este-domingo-de-una-hernia/?utm_source=rss&utm_medium=rss&utm_campaign=benjamin-netanyahu-sera-operado-este-domingo-de-una-hernia,lapagina.com.sv
2024-03-31,Top diplomats warn of disaster and repercussions if Israel expands offensive,https://www.africanews.com/2024/03/31/top-diplomats-warn-of-disaster-and-repercussions-if-israel-expands-offensive/,africanews.com
2024-03-31,"Ostaggi Hamas, Netanyahu al centro delle proteste: ""Si dimetta",https://www.ilmonito.it/ostaggi-hamas-netanyahu-al-centro-delle-proteste-si-dimetta/,ilmonito.it
2024-03-31,"Israele, in 100mila davanti alla Knesset per chiedere nuove elezioni",https://www.ilmonito.it/israele-in-100mila-davanti-alla-knesset-per-chiedere-nuove-elezioni/,ilmonito.it
2024-03-31,Israel imeshambulia tena Gaza,https://www.voaswahili.com/a/israel-imeshambulia-tena-gaza-/7550943.html,voaswahili.com
2024-03-31,"USA har godkjent våpen verdt 2,5 milliarder dollar til Israel",https://steigan.no/2024/03/usa-har-godkjent-godkjenner-vapen-verdt-25-milliard-er-dollar-til-israel/?utm_source=rss&utm_medium=rss&utm_campaign=usa-har-godkjent-godkjenner-vapen-verdt-25-milliard-er-dollar-til-israel,steigan.no
2024-03-31,"Felle discussies bij Israëlisch filmfestival in Amsterdam, maar ‘niet elk protest is antisemitisch’",https://www.nrc.nl/nieuws/2024/03/31/joodse-nederlanders-voelen-zich-bij-filmfestival-in-amsterdam-geintimideerd-door-anti-israelisch-protest-a4194730,nrc.nl
2024-03-31,Netanyahu va fi operat din nou,https://spotmedia.ro/stiri/eveniment/netanyahu-va-fi-operat-sub-anestezie-generala,spotmedia.ro
2024-03-31,"Netanyahu se someterá a una operación, en medio de protesta para exigir elecciones en Israel",https://www.elsoldedurango.com.mx/mundo/netanyahu-se-sometera-a-una-operacion-11682438.html,elsoldedurango.com.mx
2024-03-31,Israelis stage largest protest since war began to increase pressure on Netanyahu,https://www.news4jax.com/news/world/2024/03/31/an-israeli-airstrike-on-a-hospital-tent-camp-in-gaza-kills-2-palestinians/,news4jax.com
