publish_date,title,url,media_name
2024-01-07,"Israel orders Palestinians to flee Khan Younis, signaling likely new assault on southern Gaza city",https://www.abc10.com/article/news/nation-world/israel-hamas-conflict/israel-orders-palestinians-to-flee-khan-younis/507-9e9df10e-ad3b-4543-9910-cec47a907bea,abc10.com
2024-01-07,"Israel orders Palestinians to flee Khan Younis, signaling likely new assault on southern Gaza city",https://www.ksdk.com/article/news/nation-world/israel-hamas-conflict/israel-orders-palestinians-to-flee-khan-younis/507-9e9df10e-ad3b-4543-9910-cec47a907bea,ksdk.com
2024-01-07,"Israel orders Palestinians to flee Khan Younis, signaling likely new assault on southern Gaza city",https://www.newscentermaine.com/article/news/nation-world/israel-hamas-conflict/israel-orders-palestinians-to-flee-khan-younis/507-9e9df10e-ad3b-4543-9910-cec47a907bea,newscentermaine.com
2024-01-07,"Israel orders Palestinians to flee Khan Younis, signaling likely new assault on southern Gaza city",https://www.wzzm13.com/article/news/nation-world/israel-hamas-conflict/israel-orders-palestinians-to-flee-khan-younis/507-9e9df10e-ad3b-4543-9910-cec47a907bea,wzzm13.com
2024-01-07,"Israel orders Palestinians to flee Khan Younis, signaling likely new assault on southern Gaza city",https://www.wgrz.com/article/news/nation-world/israel-hamas-conflict/israel-orders-palestinians-to-flee-khan-younis/507-9e9df10e-ad3b-4543-9910-cec47a907bea,wgrz.com
2024-01-07,"Israel orders Palestinians to flee Khan Younis, signaling likely new assault on southern Gaza city",https://www.wusa9.com/article/news/nation-world/israel-hamas-conflict/israel-orders-palestinians-to-flee-khan-younis/507-9e9df10e-ad3b-4543-9910-cec47a907bea,wusa9.com
2024-02-29,ICC Decision on Arrest Warrants For Israeli Officials Delayed By UK,https://whatreallyhappened.com/NEW/stories/icc-decision-arrest-warrants-israeli-officials-delayed-uk,whatreallyhappened.com
2024-02-29,"Netanyahu Tells US Delegation Iran Seeks To Topple Saudi Arabia, Jordan",https://whatreallyhappened.com/NEW/stories/netanyahu-tells-us-delegation-iran-seeks-topple-saudi-arabia-jordan,whatreallyhappened.com
2024-03-22,A look inside Israel,https://mytjnow.com/2024/03/22/a-look-inside-israel/,mytjnow.com
2024-03-09,Newly released photos from FBI's Mar-a-Lago search show Trump keepsakes alongside sensitive records,https://www.memeorandum.com/240625/p53#a240625p53,memeorandum.com
2024-02-29,Submarine affair inquiry finds Netanyahus decisions compromised national security,https://whatreallyhappened.com/NEW/stories/submarine-affair-inquiry-finds-netanyahus-decisions-compromised-national-security,whatreallyhappened.com
2024-02-29,Netanyahu Rejects Any Deal That Leads to Permanent End to War on Gaza,https://whatreallyhappened.com/NEW/stories/netanyahu-rejects-any-deal-leads-permanent-end-war-gaza,whatreallyhappened.com
2024-03-23,US Gaza ceasefire vote,https://www.spreaker.com/episode/us-gaza-ceasefire-vote-why-did-it-fail--59138171,spreaker.com
2024-02-29,400 arms shipments arrived in 'Israel' since war began: Israeli media,https://whatreallyhappened.com/NEW/stories/400-arms-shipments-arrived-israel-war-began-israeli-media,whatreallyhappened.com
2024-02-29,US No Longer Fast-Tracking Weapons to Israel,https://whatreallyhappened.com/NEW/stories/us-no-longer-fast-tracking-weapons-israel,whatreallyhappened.com
2024-03-16,The Wars That Divide Washington,https://www.theatlantic.com/national/archive/2024/03/israel-gaza-russia-putin-trump-biden-washington-week/677769/?utm_source=feed,theatlantic.com
2024-03-22,"Yes, Israel Is Now a Partisan Issue",https://www.realclearpolitics.com/articles/2024/03/22/yes_israel_is_now_a_partisan_issue_150688.html,realclearpolitics.com
2024-03-22,"Left, Right & Center",https://play.prx.org/listen?ge=prx_241_a5123d63-3668-48d0-9ff4-67dca0ee6e63&uf=https%3A%2F%2Fleftrightandcenter-feed.kcrw.com%2F,prx.org
2024-03-20,Between Exclusion and Exploitation,https://jewishcurrents.org/palestinian-workers-israel-far-right,jewishcurrents.org
2024-02-29,White House Scraps US-Israel Meeting After Netanyahu Slams Washington,https://whatreallyhappened.com/NEW/stories/white-house-scraps-us-israel-meeting-after-netanyahu-slams-washington,whatreallyhappened.com
2024-03-20,Chuck Schumer ;s Tired Vanity Act Needs a Rest,https://www.realclearpolitics.com/articles/2024/03/20/chuck_schumers_tired_vanity_act_needs_a_rest_150671.html,realclearpolitics.com
2024-02-29,"White House Fuming, Cancels Meeting With Israelis, After Netanyahu's Public Scolding",https://whatreallyhappened.com/NEW/stories/white-house-fuming-cancels-meeting-israelis-after-netanyahus-public-scolding,whatreallyhappened.com
2024-02-29,"Preaching unity, Netanyahu slams loud, sometimes violent anti-government protesters",https://whatreallyhappened.com/NEW/stories/preaching-unity-netanyahu-slams-loud-sometimes-violent-anti-government-protesters,whatreallyhappened.com
2024-03-19,Israel as 'A Pariah' Among the Nations,https://www.realclearpolitics.com/articles/2024/03/19/israel_as_a_pariah_among_the_nations_150666.html,realclearpolitics.com
2024-02-29,"Analysis | Amid the Fighting in Gaza, the Bitter War Between Netanyahu and Israel's Generals Is Intensifying",https://whatreallyhappened.com/NEW/stories/analysis-amid-fighting-gaza-bitter-war-between-netanyahu-and-israels-generals-intensifying,whatreallyhappened.com
2024-03-19,What Schumer and Biden Got Right About Netanyahu,https://www.nytimes.com/2024/03/19/opinion/chuck-schumer-israel.html,nytimes.com
2023-10-08,Netanyahu upplöser krigskabinettet,https://www.svd.se/a/dwel81/senaste-nytt-om-israel-palestina-konflikten?pinnedEntry=38863,svd.se
2024-02-29,Biden Says There Will Be No Gaza Ceasefire Deal Soon,https://whatreallyhappened.com/NEW/stories/biden-says-there-will-be-no-gaza-ceasefire-deal-soon,whatreallyhappened.com
2024-03-26,"Sin acuerdo, los ataques en Gaza continuarán sin objetivo y el norte podría caer en una guerra total – Nueva Sion",https://nuevasion.org/archivos/40525,nuevasion.org
2024-03-11,HUDDLE WITH HAMAS? Biden Admin Discussed Negotiating With Terrorist Group for U.S. Hostages; Report,https://hannity.com/media-room/huddle-with-hamas-biden-admin-discussed-negotiating-with-terrorist-group-for-u-s-hostages-report/,hannity.com
2023-10-19,Disputes among G7 nations may prevent consensus on a path to peace in Gaza: experts,https://www.cbc.ca/news/politics/g7-gaza-hamas-israel-netanyahu-biden-1.7228940?cmp=rss,cbc.ca
2024-03-26,Krieg in Nahost: Alle Entwicklungen im Ticker,https://www.tagblatt.ch/international/nahost-newsblog-elf-verletzte-bei-drohnenangriff-auf-ort-im-norden-israels-waffenstillstand-druck-auf-die-hamas-waechst-ld.2599191,tagblatt.ch
2024-03-26,Krieg in Nahost: Alle Entwicklungen im Ticker,https://www.luzernerzeitung.ch/international/nahost-newsblog-elf-verletzte-bei-drohnenangriff-auf-ort-im-norden-israels-waffenstillstand-druck-auf-die-hamas-waechst-ld.2599191,luzernerzeitung.ch
2024-03-26,El Ejército de Israel rescató con vida a cuatro rehenes en la Franja de Gaza,https://www.redesdenoticias.com.ar/el-ejercito-de-israel-rescato-con-vida-a-cuatro-rehenes-en-la-franja-de-gaza/,redesdenoticias.com.ar
2024-03-26,Krieg in Nahost: Alle Entwicklungen im Ticker,https://www.aargauerzeitung.ch/international/nahost-newsblog-elf-verletzte-bei-drohnenangriff-auf-ort-im-norden-israels-waffenstillstand-druck-auf-die-hamas-waechst-ld.2599191,aargauerzeitung.ch
2023-10-07,Minst 210 palestinere skal være drept i angrep i det sentrale Gaza,https://www.bt.no/nyheter/direkte/i/15Jn6q/siste-nytt-om-krigen-i-midtosten?pinnedEntry=289019,bt.no
2024-02-29,Netanyahu Address to Congress Set for July 24th,https://whatreallyhappened.com/NEW/stories/netanyahu-address-congress-set-july-24th,whatreallyhappened.com
2023-12-10,Israel’s Netanyahu to address US Congress on July 24,https://thefrontierpost.com/israels-netanyahu-to-address-us-congress-on-july-24/,thefrontierpost.com
2024-03-26,Watching movies at UQAM’s now-dismantled pro-Palestinian encampment leads McGill student Ben Wexler to reflect on the protesters’ success—and the message for Jews,https://jewishpostandnews.ca/rss/watching-movies-at-uqams-now-dismantled-pro-palestinian-encampment-leads-mcgill-student-ben-wexler-to-reflect-on-the-protesters-success-and-the-message-for-jews/,jewishpostandnews.ca
2024-03-26,"Biden Admin Continues Pushing Gaza Ceasefire Proposal Despite Hamas Rejection, Israeli Reservations",https://jewishpostandnews.ca/rss/biden-admin-continues-pushing-gaza-ceasefire-proposal-despite-hamas-rejection-israeli-reservations/,jewishpostandnews.ca
2024-03-26,US Congressional Progressive Caucus PAC Rescinds Endorsement of Pro-Israel Democrat,https://jewishpostandnews.ca/rss/us-congressional-progressive-caucus-pac-rescinds-endorsement-of-pro-israel-democrat/,jewishpostandnews.ca
2024-03-26,Oregon Teachers’ Union Under Fire for Promoting Anti-Israel Lesson Plans,https://jewishpostandnews.ca/rss/oregon-teachers-union-under-fire-for-promoting-anti-israel-lesson-plans/,jewishpostandnews.ca
2024-03-26,‘Absolute Lies’: Israeli Minister Denounces New York Times Article,https://jewishpostandnews.ca/rss/absolute-lies-israeli-minister-denounces-new-york-times-article/,jewishpostandnews.ca
2024-03-26,Stanford University Bars Anti-Zionist Rioters From Graduation,https://jewishpostandnews.ca/rss/stanford-university-bars-anti-zionist-rioters-from-graduation/,jewishpostandnews.ca
2024-03-05,Claims of Mass Rape by Hamas Unravel Upon Investigation,https://www.yesmagazine.org/social-justice/2024/03/05/israel-hamas-oct7-report-gaza,yesmagazine.org
2024-02-29,Netanyahu: Israel Prepared for Very Intense War With Lebanon,https://whatreallyhappened.com/NEW/stories/netanyahu-israel-prepared-very-intense-war-lebanon,whatreallyhappened.com
2024-03-26,Joe Biden presiona a Israel y a Hamas para que negocien una tregua,https://www.redesdenoticias.com.ar/joe-biden-presiona-a-israel-y-a-hamas-para-que-negocien-una-tregua/,redesdenoticias.com.ar
2024-03-05,Harvard’s Response to Subpoenas Is Called ‘Useless’ by House Committee,https://www.nytimes.com/2024/03/05/us/harvard-subpoena-antisemitism.html,nytimes.com
2024-02-29,Netanyahu Says Bidens Ceasefire Proposal Is Incomplete,https://whatreallyhappened.com/NEW/stories/netanyahu-says-bidens-ceasefire-proposal-incomplete,whatreallyhappened.com
2024-01-06,Israel describes a permanent cease-fire in Gaza as a 'nonstarter',https://www.abc10.com/article/news/nation-world/israel-hamas-conflict/israel-describes-a-permanent-cease-fire-in-gaza-as-a-nonstarter-undermining-bidens-proposal-hamas/507-eeffc4ee-217d-422b-9a62-7080e029fda6,abc10.com
2024-03-03,Yahadout HaTorah soutiendra tout accord qui ramènera les otages – chef du parti,https://fr.timesofisrael.com/yahadout-hatorah-soutiendra-tout-accord-qui-ramenera-les-otages-chef-du-parti/,timesofisrael.com
2024-01-06,Israel describes a permanent cease-fire in Gaza as a 'nonstarter',https://www.kagstv.com/article/news/nation-world/israel-hamas-conflict/israel-describes-a-permanent-cease-fire-in-gaza-as-a-nonstarter-undermining-bidens-proposal-hamas/507-eeffc4ee-217d-422b-9a62-7080e029fda6,kagstv.com
2024-02-06,Israeli Prime Minister Benjamin Netanyahu accepts invitation to address joint meeting of US Congress,https://freerepublic.com/focus/f-news/4241834/posts,freerepublic.com
2024-02-06,Jabalia’s Mass Graves Are a Lesson in Horror,https://jacobin.com/2024/06/jabalia-mass-graves-gaza-war-crimes/,jacobin.com
2024-03-03,Reconciling Israeli and US Plans for ;The Day After ; in Gaza,https://www.realclearpolitics.com/articles/2024/03/03/reconciling_israeli_and_us_plans_for_the_day_after_in_gaza_150589.html,realclearpolitics.com
2024-02-06,Israel rechaza el alto el fuego en Gaza esbozado por el presidente de Estados Unidos,https://www.larepublica.co/globoeconomia/israel-rechaza-el-alto-el-fuego-en-gaza-esbozado-por-el-presidente-de-estados-unidos-3873567,larepublica.co
2024-02-06,"NEGRO SOBRE BLANCO: Marcha histórica en Mallorca por el derecho a la vivienda y contra la masificación turística… En Eivissa, más de 1.000 personas viven en caravanas y, en Menorca, “qui estima l’il-la no la destrueix”.",http://smfdiario.blogspot.com/2024/06/marcha-historica-en-mallorca-por-el.html,smfdiario.blogspot.com
2024-01-06,Israel describes a permanent cease-fire in Gaza as a 'nonstarter',https://www.firstcoastnews.com/article/news/nation-world/israel-hamas-conflict/israel-describes-a-permanent-cease-fire-in-gaza-as-a-nonstarter-undermining-bidens-proposal-hamas/507-eeffc4ee-217d-422b-9a62-7080e029fda6,firstcoastnews.com
2024-02-06,Trump receives thunderous applause at UFC fight,https://www.godlikeproductions.com/forum1/message5727939/pg1,godlikeproductions.com
2024-01-06,Israel describes a permanent cease-fire in Gaza as a 'nonstarter',https://www.13wmaz.com/article/news/nation-world/israel-hamas-conflict/israel-describes-a-permanent-cease-fire-in-gaza-as-a-nonstarter-undermining-bidens-proposal-hamas/507-eeffc4ee-217d-422b-9a62-7080e029fda6,13wmaz.com
2024-02-06,Israel begrudgingly accepts Biden’s Gaza deal: ‘Not a good plan’,https://freerepublic.com/focus/f-news/4241699/posts,freerepublic.com
2024-01-06,Israel describes a permanent cease-fire in Gaza as a 'nonstarter',https://www.13newsnow.com/article/news/nation-world/israel-hamas-conflict/israel-describes-a-permanent-cease-fire-in-gaza-as-a-nonstarter-undermining-bidens-proposal-hamas/507-eeffc4ee-217d-422b-9a62-7080e029fda6,13newsnow.com
2024-01-06,Israel describes a permanent cease-fire in Gaza as a 'nonstarter',https://www.king5.com/article/news/nation-world/israel-hamas-conflict/israel-describes-a-permanent-cease-fire-in-gaza-as-a-nonstarter-undermining-bidens-proposal-hamas/507-eeffc4ee-217d-422b-9a62-7080e029fda6,king5.com
2024-02-06,Confirmed: Biden lied about Israeli 'proposal; Right-wing ministers threaten to quit (+Obama tweeted proposal was Biden's),https://freerepublic.com/focus/f-news/4241658/posts,freerepublic.com
2024-01-06,Israel describes a permanent cease-fire in Gaza as a 'nonstarter',https://www.12news.com/article/news/nation-world/israel-hamas-conflict/israel-describes-a-permanent-cease-fire-in-gaza-as-a-nonstarter-undermining-bidens-proposal-hamas/507-eeffc4ee-217d-422b-9a62-7080e029fda6,12news.com
2024-01-06,Israel describes a permanent cease-fire in Gaza as a 'nonstarter',https://www.ksdk.com/article/news/nation-world/israel-hamas-conflict/israel-describes-a-permanent-cease-fire-in-gaza-as-a-nonstarter-undermining-bidens-proposal-hamas/507-eeffc4ee-217d-422b-9a62-7080e029fda6,ksdk.com
2024-01-06,Israel describes a permanent cease-fire in Gaza as a 'nonstarter',https://www.wfaa.com/article/news/nation-world/israel-hamas-conflict/israel-describes-a-permanent-cease-fire-in-gaza-as-a-nonstarter-undermining-bidens-proposal-hamas/507-eeffc4ee-217d-422b-9a62-7080e029fda6,wfaa.com
2024-01-06,Calling Israel Critics Antisemites Won’t Solve Antisemitism,https://jacobin.com/2024/06/antisemitism-gaza-israel-germany-hate/,jacobin.com
2024-01-06,Israel describes a permanent cease-fire in Gaza as a 'nonstarter',https://www.kcentv.com/article/news/nation-world/israel-hamas-conflict/israel-describes-a-permanent-cease-fire-in-gaza-as-a-nonstarter-undermining-bidens-proposal-hamas/507-eeffc4ee-217d-422b-9a62-7080e029fda6,kcentv.com
2024-01-06,‘Non-starter’: Netanyahu says no permanent Gaza ceasefire until Hamas destroyed,https://freerepublic.com/focus/f-news/4241638/posts,freerepublic.com
2024-01-06,Confirmed: Biden Lied About Israeli ‘Proposal’; Right-wing Ministers Threaten to Quit,https://freerepublic.com/focus/f-news/4241612/posts,freerepublic.com
2024-01-06,Israeli Prime Minister Benjamin Netanyahu Invited to Speak Before Congress,https://freerepublic.com/focus/f-news/4241604/posts,freerepublic.com
2024-03-26,Krieg in Nahost: Alle Entwicklungen im Ticker,https://www.tagblatt.ch/international/nahost-newsblog-trotz-kritik-israelische-armee-weiter-in-rafah-im-einsatz-hamas-will-umfassende-einigung-mit-israel-aber-erst-bei-kriegsende-ld.2599191,tagblatt.ch
2024-03-26,Krieg in Nahost: Alle Entwicklungen im Ticker,https://www.luzernerzeitung.ch/international/nahost-newsblog-trotz-kritik-israelische-armee-weiter-in-rafah-im-einsatz-hamas-will-umfassende-einigung-mit-israel-aber-erst-bei-kriegsende-ld.2599191,luzernerzeitung.ch
2024-03-26,Krieg in Nahost: Alle Entwicklungen im Ticker,https://www.aargauerzeitung.ch/international/nahost-newsblog-trotz-kritik-israelische-armee-weiter-in-rafah-im-einsatz-hamas-will-umfassende-einigung-mit-israel-aber-erst-bei-kriegsende-ld.2599191,aargauerzeitung.ch
2024-01-06,Netanyahu on Biden ‘Proposal’: Hamas Must Be Destroyed,https://freerepublic.com/focus/f-news/4241542/posts,freerepublic.com
2024-01-06,Poll: Half of Jewish Israelis say Israel should run Gaza after the war; 0% say Hamas,https://freerepublic.com/focus/f-news/4241470/posts,freerepublic.com
2024-01-05,Rhetoric is not enough,https://africasacountry.com/2024/05/rhetoric-is-not-enough/,africasacountry.com
2024-03-20,Qué está pasando en Rafah – La Prensa de Minnesota,https://laprensademn.com/que-esta-pasando-en-rafah/,laprensademn.com
2023-11-11,Le Likud rejette le projet de loi de dissolution de la Knesset de HaMahane HaMamlahti,https://fr.timesofisrael.com/le-parti-de-gantz-hamahane-hamamlahti-depose-un-projet-de-loi-pour-dissoudre-la-knesset/,timesofisrael.com
2024-03-03,"La reconnaissance de la Palestine est, d’après la Norvège, une mesure « anti-Hamas »",https://fr.timesofisrael.com/la-reconnaissance-de-la-palestine-est-dapres-la-norvege-une-mesure-anti-hamas/,timesofisrael.com
2023-12-12,Les Saoudiens accusent Israël de « massacres génocidaires continus » à Gaza,https://fr.timesofisrael.com/les-saoudiens-accusent-israel-de-massacres-genocidaires-continus-a-gaza/,timesofisrael.com
2024-01-05,"Israel - Gaza: Qué es el corredor Filadelfia, la zona desmilitarizada junto a la frontera con Egipto atacada por Israel",https://www.bbc.com/mundo/articles/cv2jd775m1ro,bbc.com
2024-02-29,US Appears To Justify Israels Rafah Massacre That Killed 45 Palestinians,https://whatreallyhappened.com/NEW/stories/us-appears-justify-israels-rafah-massacre-killed-45-palestinians,whatreallyhappened.com
2024-03-29,London Knights win first game at Memorial Cup,https://london.ctvnews.ca/knights-stay-unbeaten-at-memorial-cup-after-win-over-moose-jaw-1.6822757,ctvnews.ca
2024-02-26,"Israel May Delay Rafah Operation, Social Media SCOTUS Case, Another Shutdown Looms",https://www.npr.org/2024/02/26/1198910876/israel-may-delays-rafah-operation-social-media-scotus-case-another-shutdown-loom,npr.org
2023-12-23,Gallant accuse Gantz de torpiller le compromis sur la conscription militaire des haredim,https://fr.timesofisrael.com/gallant-accuse-gantz-de-torpiller-le-compromis-sur-la-conscription-militaire-des-haredim/,timesofisrael.com
2024-02-25,Israel ;s Reasonable War Aims and Strategy,https://www.realclearpolitics.com/articles/2024/02/25/israels_reasonable_war_aims_and_strategy_150550.html,realclearpolitics.com
2023-10-07,Israel und Gaza: News und Entwicklungen im Nahostkonflikt,https://www.nzz.ch/international/krieg-in-nahost-erneut-massenproteste-in-israel-gegen-netanyahu-regierung-anlegestelle-fuer-gaza-hilfe-durch-hohen-seegang-beschaedigt-ld.1759794,nzz.ch
2023-11-11,Gantz propose la formation d’une commission d’enquête sur le 7 octobre et sur la guerre à Gaza,https://fr.timesofisrael.com/gantz-propose-la-formation-dune-commission-denquete-sur-le-7-octobre-et-sur-la-guerre-a-gaza/,timesofisrael.com
2024-03-26,Krieg in Nahost: Alle Entwicklungen im Ticker,https://www.aargauerzeitung.ch/international/nahost-newsblog-un-gericht-entscheidet-ueber-forderung-nach-rueckzug-israels-aus-rafah-israel-geisel-verhandlungen-fortsetzen-ld.2599191,aargauerzeitung.ch
2024-03-12,"Avec l’Irak en tête, David Petraeus évoque un moyen de remporter la victoire à Gaza",https://fr.timesofisrael.com/avec-lirak-en-tete-david-petraeus-evoque-un-moyen-de-remporter-la-victoire-a-gaza/,timesofisrael.com
2023-10-07,Israel und Gaza: News und Entwicklungen im Nahostkonflikt,https://www.nzz.ch/international/krieg-in-nahost-israel-pocht-auf-recht-auf-selbstverteidigung-internationaler-gerichtshof-ordnet-an-dass-israel-die-rafah-offensive-stoppen-muss-ld.1759794,nzz.ch
2024-03-26,Krieg in Nahost: Alle Entwicklungen im Ticker,https://www.tagblatt.ch/international/nahost-newsblog-un-gericht-entscheidet-ueber-forderung-nach-rueckzug-israels-aus-rafah-israel-geisel-verhandlungen-fortsetzen-ld.2599191,tagblatt.ch
2024-03-26,Krieg in Nahost: Alle Entwicklungen im Ticker,https://www.luzernerzeitung.ch/international/nahost-newsblog-un-gericht-entscheidet-ueber-forderung-nach-rueckzug-israels-aus-rafah-israel-geisel-verhandlungen-fortsetzen-ld.2599191,luzernerzeitung.ch
2024-02-29,"How does this end? With Hamas holding firm and fighting back in Gaza, Israel faces only bad options",https://whatreallyhappened.com/NEW/stories/how-does-end-hamas-holding-firm-and-fighting-back-gaza-israel-faces-only-bad-options,whatreallyhappened.com
2024-02-02,"Les chefs de la CIA, du Mossad et le Premier ministre qatari vont relancer les négociations sur les otages",https://fr.timesofisrael.com/les-chefs-de-la-cia-du-mossad-et-le-premier-ministre-qatari-vont-relancer-les-negociations-sur-les-otages/,timesofisrael.com
2024-03-20,ONU suspende distribución de alimentos en Rafah debido a la inseguridad – La Prensa de Minnesota,https://laprensademn.com/onu-suspende-distribucion-de-alimentos-en-rafah-debido-a-la-inseguridad/,laprensademn.com
2023-10-12,"Evakuering från Israel, flaggbråk, burgarkris och EU:s fattigaste och rikaste land",https://shows.acast.com/nyhetsshowen/episodes/65279902b774f7001150a766,acast.com
2023-10-30,"Vi minns Matthew Perry, mobb på flygplats i Dagestan och Isabell Schierenbeck om Benjamin Netanyahu",https://shows.acast.com/nyhetsshowen/episodes/653f6662968d75001188d689,acast.com
2023-10-16,"Val i Billdal, Val i Polen, Helena Lindholm om Israel-Hamas kriget och Per Andersson om allt möjligt",https://shows.acast.com/nyhetsshowen/episodes/652cdfa0bf84120012a5b981,acast.com
2024-01-15,"Nytt vulkanutbrott på Island, explosionen i Majorna och Strawberry nationalarena",https://shows.acast.com/nyhetsshowen/episodes/65a4e65b00f34f001725a86e,acast.com
2023-10-19,"Veckans viktigare uppdateringar, kabelstrul i Östersjön och Tillsammans 99",https://shows.acast.com/nyhetsshowen/episodes/6530d714a7d8f5001157f18f,acast.com
2023-10-27,"Kalle Berg: tågreporter, han petas från Musikhjälpen och fredagsquiz!",https://shows.acast.com/nyhetsshowen/episodes/653b5e4747dd4d0013e70a2d,acast.com
2024-03-19,"Greta Thunberg på SAS-möte, sexförberedelserna inför OS i Paris och förhandlingar om vapenvila mellan Israel och Hamas",https://shows.acast.com/nyhetsshowen/episodes/65f94522fa04820015c6d79d,acast.com
2024-01-30,"Arne Hegerfors är död, Kristerssons hälsning till Macron och svenska artister kräver att Israel portas i ESC",https://shows.acast.com/nyhetsshowen/episodes/65b8ae02f03f2800178adc00,acast.com
2024-01-16,"Guldbaggegalan, fuskmisstankar mot Fröken Snusk och Nooshi Dadgostar vill porta Israel från ESC",https://shows.acast.com/nyhetsshowen/episodes/65a63675f8bfbc00176471d6,acast.com
2023-10-10,"Israel-Palestina konflikten, SRPiEViANM23 och Ida Johansson om Novo Nordisk och bantningmedicin",https://shows.acast.com/nyhetsshowen/episodes/6524fd76c8044000130052da,acast.com
2024-01-11,"EU vill ha hjälp av Taylor Swift, allt fler får sepsis och snart får Danmark en ny kung",https://shows.acast.com/nyhetsshowen/episodes/659fa00e7b4c4b0016ed9e47,acast.com
2023-10-13,"Vändning i Tove-fallet, engelska flottan har siktats, fredagsquiz och Peter Apelgren om Ucklum och På spåret",https://shows.acast.com/nyhetsshowen/episodes/6528eb4fc0e0c90012b7c6ec,acast.com
2023-10-11,"Svenskt bistånd till Palestina dras in, gasutsläpp i Östersjön och rektor Linnea Lindquist om tuffa tider i skolan",https://shows.acast.com/nyhetsshowen/episodes/652647651a58c9001208daee,acast.com
2023-12-12,"158 elever saknas i Göteborg, Musikhjälpens nya sopp-besked och hur länge kan kriget pågå i Gaza?",https://shows.acast.com/nyhetsshowen/episodes/657815384453180012072d4e,acast.com
2024-01-31,"Sverige pausar Palestina-stöd, EU:s smutsigaste luft och snöbollskriget",https://shows.acast.com/nyhetsshowen/episodes/65b9fcc6db1718001521206c,acast.com
2023-10-09,"Konflikten Israel-Palestina, Alingsås i sorg, och Ola Serneke om Karlatornet",https://shows.acast.com/nyhetsshowen/episodes/6523a6f5c62cfa0012aa8872,acast.com
2024-02-15,"Uppgifter om ryska planer på kärnvapen i rymden, Billströms om Israel och rekordmycket antidepressiva skrivs ut",https://shows.acast.com/nyhetsshowen/episodes/65cdc71af7b2590016877885,acast.com
2023-12-04,"Razzior mot hbtq-rörelsen i Ryssland, snuthatets dag och gettolagen i Danmark",https://shows.acast.com/nyhetsshowen/episodes/656d87463a2d810012a2fbc2,acast.com
2024-03-26,"FN:s säkerhetsråd röstade ja till vapenvila i Gaza, softgirl-debatten och hur botar man en stalker?",https://shows.acast.com/nyhetsshowen/episodes/660281c460b633001685b0ad,acast.com
2024-01-25,"Miljontals lösenord läckta, Island kritiserar Israel i ESC och Kalles phishing-avslöjande",https://shows.acast.com/nyhetsshowen/episodes/65b2128ed57dee0017deabca,acast.com
2024-02-13,The recognition of a Palestinian state: Exploring the impact,https://www.dw.com/en/the-recognition-of-a-palestinian-state-exploring-the-impact/a-68243644?maca=en-rss-en-all-1573-xml-atom,dw.com
2024-02-13,The recognition of a Palestinian state: Exploring the impact,https://www.dw.com/en/the-recognition-of-a-palestinian-state-exploring-the-impact/a-68243644?maca=en-rss-en-top-1022-xml-atom,dw.com
