publish_date,title,media_name
2013-07-10,Nelson Mandela foundation wants volunteer work done on former president's 95th birthday,startribune.com
2013-07-10,Nelson Mandela foundation wants volunteer work done on former president's 95th birthday,startribune.com
2013-07-10,Mandela foundation wants volunteers on 95th b-day,sacbee.com
2013-07-10,Nelson Mandela foundation wants volunteer work done on former president's 95th birthday,startribune.com
2013-07-10,Mandela foundation wants volunteers on 95th b-day,kansascity.com
2013-07-10,JOHANNESBURG: Mandela foundation wants volunteers on 95th b-day,miamiherald.com
2013-07-10,Nelson Mandela foundation wants volunteer work done on former president's 95th birthday,foxnews.com
2013-07-11,Idris Elba discusses 'Pacific Rim' and starring as Nelson Mandela in a new biopic,csmonitor.com
2013-07-11,Idris Elba discusses 'Pacific Rim' and starring as Nelson Mandela in a new biopic,csmonitor.com
2013-07-11,Nelson Mandela remains in critical condition after a month in Pretoria hospital,washingtonpost.com
2013-07-12,Man City Fans Get Chance to Sign Nelson Mandela's Giant Birthday Card,ibtimes.com
2013-07-11,The raid that saw Mandela jailed for life -- Liliesleaf 50 years on,cnn.com
2013-07-11,Mandela 'continues to respond to treatment',foxnews.com
2013-07-11,Nelson Mandela's friends lament his decline,seattletimes.com
2013-07-11,Nelson Mandela's friends lament his decline,kansascity.com
2013-07-11,"Mandela remains in critical but stable condition after 5 weeks in hospital, presidency says",foxnews.com
2013-07-11,"Mandela remains in critical but stable condition after 5 weeks in hospital, presidency says",startribune.com
2013-07-11,"Mandela remains in critical but stable condition after 5 weeks in hospital, presidency says",startribune.com
2013-07-11,"JOHANNESBURG: Mandela remains critical but stable, president",miamiherald.com
2013-07-11,"Mandela remains critical but stable, president",sacbee.com
2013-07-11,"Mandela remains in critical but stable condition after 5 weeks in hospital, presidency says",startribune.com
2013-07-10,South Africa's Mandela remains critical but stable: Zuma,reuters.com
2013-07-10,South Africa's Mandela remains critical but stable: Zuma,reuters.com
2013-07-11,MI5 and CIA 'Spied on Nelson Mandela before 1964 Incarceration',ibtimes.com
2013-07-12,Mandela’s Kin Face Gray Area on End of Life,nytimes.com
2013-07-12,Jacob Zuma calls on South Africans to shower Mandela 'with love',upi.com
2013-07-12,Mandela's wife says now 'less anxious' about his health,foxnews.com
2013-07-11,Idris Elba discusses 'Pacific Rim' and starring as Nelson Mandela in a new biopic,csmonitor.com
2013-07-12,Traditional beliefs pin Mandela's health to family dispute,cnn.com
2013-07-12,Traditional beliefs pin Mandela's health to family dispute,cnn.com
2013-07-12,Mandela’s fellow anti-apartheid crusader and pal shaken up by hospital visit,nydailynews.com
2013-07-13,Mandela's long hospitalization sparks end-of-life discussions in South Africa,startribune.com
2013-07-13,Mandela's long hospitalization sparks end-of-life discussions in South Africa,startribune.com
2013-07-13,Mandela situation sparks end-of-life discussions,sacbee.com
2013-07-13,Mandela situation sparks end-of-life discussions,kansascity.com
2013-07-13,Mandela's long hospitalization sparks end-of-life discussions in South Africa,startribune.com
2013-07-13,JOHANNESBURG: Mandela situation sparks end-of-life discussions,miamiherald.com
2013-07-13,Mandela's long hospitalization sparks end-of-life discussions in South Africa,startribune.com
2013-07-13,Nelson Mandela remains in critical condition at hospital,foxnews.com
2013-07-13,JOHANNESBURG: South Africa: Mandela remains critical,miamiherald.com
2013-07-13,South Africa: Nelson Mandela remains in critical but stable condition in a hospital,startribune.com
2013-07-13,South Africa: Nelson Mandela remains in critical but stable condition in a hospital,foxnews.com
2013-07-13,South Africa: Nelson Mandela remains in critical but stable condition in a hospital,startribune.com
2013-07-13,South Africa: Nelson Mandela remains in critical but stable condition in a hospital,startribune.com
2013-07-13,South Africa: Mandela remains critical,sacbee.com
2013-07-13,South Africa: Nelson Mandela remains in critical but stable condition in a hospital,startribune.com
2013-07-13,South Africa: Mandela remains critical,kansascity.com
2013-07-14,Thabo Mbeki: Mandela will pull through,cnn.com
2013-07-14,Ailing Nelson Mandela Is Reportedly Improving,npr.org
2013-07-14,UNI professor reflects on Mandela's legacy,sacbee.com
2013-07-14,"Mandela, in hospital for a month with lung infection, may go home soon",upi.com
2013-07-14,"CEDAR FALLS, Iowa: UNI professor reflects on Mandela's legacy",miamiherald.com
2013-07-14,"Nelson Mandela hospital discharge: Could soon be out to recover at home, says former president of South Africa Thabo Mbeki",nydailynews.com
2013-07-14,"Mandela could soon be discharged, says ex-president",cbsnews.com
2013-07-14,"Mandela could soon be discharged, Mbeki says",seattletimes.com
2013-07-14,"Mandela could soon be discharged, Mbeki says",kansascity.com
2013-07-14,"Mandela could soon be discharged, Mbeki says",sacbee.com
2013-07-14,"JOHANNESBURG: Mandela could soon be discharged, Mbeki says",miamiherald.com
2013-07-14,Nelson Mandela could go home,politico.com
2013-07-14,"Mandela could soon be discharged, Mbeki says",sacbee.com
2013-07-14,"Mandela could soon be discharged, Mbeki says",kansascity.com
2013-07-14,"Mandela could be discharged from hospital to recuperate at home, former president says",startribune.com
2013-07-14,"Mandela Could Soon Be Discharged, Mbeki Says",abcnews.go.com
2013-07-14,"Nelson Mandela could soon be discharged, former South African president says",foxnews.com
2013-07-14,"Mandela could be discharged from hospital to recuperate at home, former president says",foxnews.com
2013-07-14,"JOHANNESBURG: Mandela could soon be discharged, Mbeki says",miamiherald.com
2013-07-14,Mandela's hospital stay sparks end-of-life discussions in South Africa,denverpost.com
2013-07-15,Mandela Inspires Nation as Birthday Nears,abcnews.go.com
2013-07-14,"Mandela could soon be discharged, Mbeki says",usatoday.com
2013-07-14,Thabo Mbeki: Mandela will pull through,cnn.com
2013-07-16,Woods recalls unforgettable aura of Nelson Mandela,foxnews.com
2013-07-16,Few dare to criticise ailing Mandela,foxnews.com
2013-07-17,"Mandela makes 'dramatic' progress, says daughter",seattletimes.com
2013-07-17,"Mandela makes 'dramatic' progress, says daughter",denverpost.com
2013-07-17,Mandela to mark 95th birthday in hospital,foxnews.com
2013-07-17,Ndileka Mandela upset by family dispute made public,upi.com
2013-07-17,South Africans prepare to mark Nelson Mandela's 95th birthday with acts of giving,foxnews.com
2013-07-17,South Africans Prepare for Mandela's Birthday,abcnews.go.com
2013-07-17,South Africans prepare for Mandela's birthday,sacbee.com
2013-07-17,South Africans prepare to mark Nelson Mandela's 95th birthday with acts of giving,startribune.com
2013-07-17,JOHANNESBURG: South Africans prepare for Mandela's birthday,miamiherald.com
2013-07-17,South Africans prepare for Mandela's birthday,kansascity.com
2013-07-18,South Africans celebrate Mandela's 95th birthday,cbsnews.com
2013-07-18,Joyful crowds celebrate Nelson Mandela's 95th birthday,latimes.com
2013-07-18,Congress honors ailing Mandela's 95th birthday,cbsnews.com
2013-07-18,Mandela's 95th birthday honored at UN,twincities.com
2013-07-18,"As Nelson Mandela Turns 95, South Africa Celebrates",npr.org
2013-07-18,GAME CHANGE: RUBIO DROPS MMIGRATION PUSH AS HIS POLLS FALL AMONG REPUBLICANS: ‘What’s there to advocate for?’ – ‘OBAMA’S LAST CAMPAIGN’: Selling Obamacare – NELSON MANDELA is 95 – OLIVIER KNOX b’day,politico.com
2013-07-18,Mandela's 95th Birthday Honored at UN,abcnews.go.com
2013-07-18,Mandela's 95th birthday honored at UN,sacbee.com
2013-07-18,Mandela Day celebrations around the world,sacbee.com
2013-07-18,"Congress, diplomats celebrate Nelson Mandela’s 95th birthday",kansascity.com
2013-07-18,Mandela meets the press: Monitor coverage after his prison years,csmonitor.com
2013-07-18,Nelson Mandela: 10 quotes on his birthday,csmonitor.com
2013-07-18,Sharing A 'Profound' Mandela Encounter With Morehouse Men,npr.org
2013-07-17,Mandela on kids and family: Top quotes,csmonitor.com
2013-07-18,Congress celebrates Nelson Mandela's 95th birthday,cbsnews.com
2013-07-18,Mandela Day celebrations around the world,kansascity.com
2013-07-18,The Obamas wish Nelson Mandela a happy 95th birthday,politico.com
2013-07-18,"On Mandela's birthday, questions about 'voluntourists' in Africa",csmonitor.com
2013-07-18,World pays tribute as 'improving' Mandela turns 95,chicagotribune.com
2013-07-18,Nelson Mandela Day celebrations around the world and in space,startribune.com
2013-07-18,Milwaukee library's Mandela birthday event kicks off at noon,jsonline.com
2013-07-18,Joyful crowds celebrate Nelson Mandela's 95th birthday,latimes.com
2013-07-18,Sharing A 'Profound' Mandela Encounter With Morehouse Men,npr.org
2013-07-18,In Mandela's honor -- 67 minutes of help for others,cnn.com
2013-07-18,WASHINGTON: Lawmakers celebrate Mandela's life on birthday,miamiherald.com
2013-07-18,South Africans cheer Mandela's birthday,washingtonpost.com
2013-07-03,"Nelson Mandela’s health ""improving"" on 95th birthday",reuters.com
2013-07-18,World pays tribute as 'improving' Mandela turns 95,denverpost.com
2013-07-18,In Mandela's honor -- 67 minutes of help for others,cnn.com
2013-07-18,Joyful crowds celebrate Nelson Mandela's 95th birthday,latimes.com
2013-07-18,Joyful crowds celebrate Nelson Mandela's 95th birthday,latimes.com
2013-07-19,Nelson Mandela Turns 95: Why Do African Leaders Live So Long?,ibtimes.com
2013-07-18,Nelson Mandela's Birthday and Trayvon Martin's Loss,newyorker.com
2013-07-18,Joyful crowds celebrate Nelson Mandela's 95th birthday,latimes.com
2013-07-18,Joyful crowds celebrate Nelson Mandela's 95th birthday,latimes.com
2013-07-18,Mandela posters mark 95th birthday,cnn.com
2013-07-18,Perez barely clears 60-vote hurdle – Corker calls B.S. over filibuster deal – KLOBUCHAR TO IOWA – Senate strikes student loan deal – DeFazio poised to grab Nat. Resources gavel – Hill honors Mandela,politico.com
2013-07-18,"As Nelson Mandela Turns 95, South Africa Celebrates",npr.org
2013-07-18,Nelson Mandela turns 95 on 41st day in hospital,cbsnews.com
2013-07-18,South Africans cheer Mandela's birthday,washingtonpost.com
2013-07-18,Artists celebrate Mandela with paintings,twincities.com
2013-07-18,"As Nelson Mandela’s health improves, a celebration of his life set for today at Fair Park",dallasnews.com
2013-07-18,Nelson Mandela Celebrates 95 Years,forbes.com
2013-07-18,Nelson Mandela's birthday: 'Steadily improving',politico.com
2013-07-18,South Africa honors Nelson Mandela on his 95th birthday,upi.com
2013-07-18,Nelson Mandela 'steadily improving' as the ailing anti-apartheid leader celebrates 95th birthday with entire nation,nydailynews.com
2013-07-18,WATCH: South Africa Celebrates Mandela's 95th Birthday,npr.org
2013-07-18,Nelson Mandela 'steadily improving' as the ailing anti-apartheid leader celebrates 95th birthday with entire nation,nydailynews.com
2013-07-18,"Mandela 'steadily improving' on 95th birthday, UN declares today 'Nelson Mandela International Day'",nypost.com
2013-07-18,Mandela and much-loved wife mark wedding anniversary,foxnews.com
2013-07-18,Artists celebrate Mandela with paintings,denverpost.com
2013-07-18,Artists celebrate Mandela with paintings,denverpost.com
2013-07-18,South African artists celebrate the life of Nelson Mandela as he turns 95,startribune.com
2013-07-18,Mandela posters mark 95th birthday,cnn.com
2013-07-18,'Improving' Mandela marks 95th birthday in hospital,foxnews.com
2013-07-18,Nelson Mandela turns 95 on 41st day in hospital,cbsnews.com
2013-07-18,"It is happy birthday for Nelson Mandela, 95, whose condition is 'steadily improving'",syracuse.com
2013-07-18,Artists celebrate Mandela with paintings,kansascity.com
2013-07-18,Artists celebrate Mandela with paintings,kansascity.com
2013-07-18,Artists celebrate Mandela with paintings,sacbee.com
2013-07-18,JOHANNESBURG: Artists celebrate Mandela with paintings,miamiherald.com
2013-07-18,JOHANNESBURG: Artists celebrate Mandela with paintings,miamiherald.com
2013-07-18,Artists celebrate Mandela with paintings,sacbee.com
2013-07-18,David Flores To Paint Mandela Mural in Venice Beach for International Mandela Day,monstersandcritics.com
2013-07-18,"As Nelson Mandela Turns 95, South Africa Celebrates",npr.org
2013-07-18,Nelson Mandela to Leave Hospital ‘Anytime Soon’ As He Celebrates 95th Birthday,ibtimes.com
2013-07-18,Mandela 'steadily improving' on 95th birthday,denverpost.com
2013-07-18,Mandela's condition improves as South Africa celebrates icon's 95th birthday,nbcnews.com
2013-07-17,"As Nelson Mandela Turns 95, South Africa Celebrates",npr.org
2013-07-18,Mandela 'steadily improving' on 95th birthday,denverpost.com
2013-07-13,Nelson Mandela turns 95,reuters.com
2013-07-17,'Steadily improving' Mandela celebrates 95th birthday,reuters.com
2013-07-18,'Steadily Improving' Mandela Celebrates 95th Birthday,ibtimes.com
2013-07-18,South Africans mark ailing Mandela's 95th birthday,cnn.com
2013-07-19,Mandela Said to Be ‘Steadily Improving’ on 95th Birthday,nytimes.com
2013-07-18,Nelson Mandela 'steadily improving' as he marks his 95th birthday,startribune.com
2013-07-18,Mandela 'steadily improving' on 95th birthday,kansascity.com
2013-07-18,JOHANNESBURG: Mandela 'steadily improving' on 95th birthday,miamiherald.com
2013-07-17,Mandela 'steadily improving' on 95th birthday,sacbee.com
2013-07-18,South Africans mark ailing Mandela's 95th birthday,cnn.com
2013-07-18,Nelson Mandela 'steadily improving' as he marks his 95th birthday,foxnews.com
2013-07-18,South Africans mark ailing Mandela's 95th birthday,cnn.com
2013-07-18,Nelson Mandela turns 95 as he recovers from lung infection,nydailynews.com
2013-07-17,Nelson Mandela still in hospital but condition improving: South African presidency,reuters.com
2013-07-18,Nelson Mandela turns 95 as he recovers from lung infection,nydailynews.com
2013-07-17,Obamas salute Nelson Mandela’s 95th birthday,politico.com
2013-07-17,Mandela is honored in Minneapolis,startribune.com
2013-07-17,Obama honors Mandela on 95th birthday,cbsnews.com
2013-07-17,"Nelson Mandela's health dramatically improved, daughter says",latimes.com
2013-07-17,"Nelson Mandela Is Improving, Says Daughter",buzzfeed.com
2013-07-17,Obama Honors Mandela on 95th Birthday,abcnews.go.com
2013-07-17,Obama honors Mandela on 95th birthday,sacbee.com
2013-07-17,WASHINGTON: Obama honors Mandela on 95th birthday,miamiherald.com
2013-07-17,"Mandela's health dramatically improved, daughter says",chicagotribune.com
2013-07-17,"On eve of 95th birthday, Mandela makes dramatic improvement",startribune.com
2013-07-17,"Obama, first lady mark Mandela's 95th birthday, urge others to follow his example",startribune.com
2013-07-17,"Obama, first lady mark Mandela's 95th birthday, urge others to follow his example",startribune.com
2013-07-19,Trailer is released for Idris Elba's eerily timely 'Mandela',latimes.com
2013-07-19,Mandela and Africa in the American imagination (+video),csmonitor.com
2013-07-19,Tutu pays tribute to Mandela after hospital visit,foxnews.com
2013-07-19,Mandela and Africa in the American imagination (+video),csmonitor.com
2013-07-19,Watch: Idris Elba stars in Nelson Mandela biopic,cbsnews.com
2013-07-19,School Year: South African students join countrymen in volunteering to honor Mandela,pri.org
2013-07-19,Mandela and Africa in the American imagination,csmonitor.com
2013-07-19,Mandela and Africa in the American imagination,csmonitor.com
2013-07-18,Celebrating Mandela's 95th,baltimoresun.com
2013-07-19,Nelson Mandela Grave-Digging Row: Grandson Mandla Wants Exhumed Bodies Back,ibtimes.com
2013-07-18,Mandela meets the press: Monitor coverage after his prison years,csmonitor.com
2013-07-18,"On Mandela's birthday, questions about 'voluntourists' in Africa",csmonitor.com
2013-07-18,South Africans cheer Mandela's birthday,washingtonpost.com
2013-07-18,Nelson Mandela: 10 quotes on his birthday,csmonitor.com
2013-07-19,Milestones in Nelson Mandela's Life (Slideshow),ibtimes.com
2013-07-18,Mandela's 95th birthday honored at UN,kansascity.com
2013-07-19,"Sports world sends birthday wishes to Mandela, 95",denverpost.com
2013-07-19,Nelson Mandela fans celebrate his 95th birthday as he recovers in hospital,nydailynews.com
2013-07-18,Upbeat health report for Mandela on 95th birthday,seattletimes.com
2013-07-19,Nelson Mandela fans celebrate his 95th birthday as he recovers in hospital,nydailynews.com
2013-07-19,Mandela ‘responsive’ to hospital visitors,nypost.com
2013-07-18,Celebrating Mandela's 95th,baltimoresun.com
2013-07-18,Celebrating Mandela's 95th,baltimoresun.com
2013-07-18,Celebrating Mandela's 95th,baltimoresun.com
2013-07-18,Readers send messages of love and support to Nelson Mandela,washingtonpost.com
2013-07-19,South Africa celebrates as Nelson Mandela turns 95,nydailynews.com
2013-07-19,South Africa celebrates as Nelson Mandela turns 95,nydailynews.com
2013-07-18,Mandela begins 7th week in hospital,foxnews.com
2013-07-18,Tributes and Celebrations for Mandela,nytimes.com
2013-07-18,"Congress, diplomats celebrate Nelson Mandela’s 95th birthday",sacbee.com
2013-07-18,Celebrating Mandela's 95th,baltimoresun.com
2013-07-18,Worry turns to song for Mandela on 95th birthday,twincities.com
2013-07-18,"On his 95th birthday, upbeat news on Mandela",startribune.com
2013-07-18,'Legacy of Hope Foundation' Partners With Socialite for Nelson Mandela's Official North American Birthday in NYC,newsblaze.com
2013-07-18,Mandela's 95th birthday honored at UN,seattletimes.com
2013-07-18,Celebrating Mandela's 95th,baltimoresun.com
2013-07-18,Celebrating Mandela's 95th,baltimoresun.com
2013-07-18,Celebrating Mandela's 95th,baltimoresun.com
2013-07-18,Photos: Global tributes to Nelson Mandela,cnn.com
2013-07-18,Celebrating Mandela's 95th,baltimoresun.com
2013-07-18,Celebrating Mandela's 95th,baltimoresun.com
2013-07-18,Celebrating Mandela's 95th,baltimoresun.com
2013-07-18,Photos: Global tributes to Nelson Mandela,cnn.com
2013-07-19,"Mandela Turns 95, Parallels Public Life of Gandhi, Martin Luther King Jr.",ibtimes.com
2013-07-18,Happy Birthday Mr. Mandela and Get Well!,cnn.com
2013-07-20,Mandela continues hospital stay,foxnews.com
2013-07-19,Archbishop Tutu visits Mandela in hospital,sacbee.com
2013-07-19,Desmond Tutu on Mandela: He's very peaceful looking,cbsnews.com
2013-07-19,Archbishop Desmond Tutu visits Mandela in hospital,cbsnews.com
2013-07-19,Archbishop Tutu visits Mandela in hospital,kansascity.com
2013-07-17,Mandela on kids and family: Top quotes,csmonitor.com
2013-07-21,Mandela's Moral Leap,townhall.com
2013-07-21,Dan Morain: How 'The Duke' helped Mandela,sacbee.com
2013-07-22,S. African President Jacob Zuma says Nelson Mandela improving,upi.com
2013-07-22,South Africa: Mandela Shows Sustained Improvement,abcnews.go.com
2013-07-22,South Africa: Mandela shows sustained improvement,seattletimes.com
2013-07-22,"Mandela showing 'sustained improvement,' Zuma's office says",cnn.com
2013-07-22,"Mandela showing 'sustained improvement,' Zuma's office says",cnn.com
2013-07-22,South Africa: Mandela shows sustained improvement,kansascity.com
2013-07-22,South Africa: Mandela shows sustained improvement,sacbee.com
2013-07-22,South African president says Nelson Mandela is showing sustained improvement,startribune.com
2013-07-22,South African president says Nelson Mandela is showing sustained improvement,foxnews.com
2013-07-22,"Mandela shows 'sustained improvement,' South Africa president's office says",foxnews.com
2013-07-22,JOHANNESBURG: South Africa: Mandela shows sustained improvement,miamiherald.com
2013-07-22,South African president says Nelson Mandela is showing sustained improvement,startribune.com
2013-07-22,South African president says Nelson Mandela is showing sustained improvement,startribune.com
2013-07-22,Top Stories: Royal Baby Wait; Mandela Improving,npr.org
2013-07-22,Mandela 'getting stronger and stronger',foxnews.com
2013-07-23,"Nelson Mandela continues to fight, defy expectations",csmonitor.com
2013-07-23,"Nelson Mandela continues to fight, defy expectations",csmonitor.com
2013-07-23,"Nelson Mandela continues to fight, defy expectations",csmonitor.com
2013-07-24,Mandela's old street in Soweto now scene of new South Africa,csmonitor.com
2013-07-24,Mandela's old street in Soweto now scene of new South Africa,csmonitor.com
2013-07-24,Mandela's old street in Soweto now scene of new South Africa,csmonitor.com
2013-07-24,Mandela family got free legal aid meant for poor,sacbee.com
2013-07-24,JOHANNESBURG: Mandela family got free legal aid meant for poor,miamiherald.com
2013-07-24,South Africa: Mandela family got free legal aid meant for poor to help in case of burial site,startribune.com
2013-07-24,Mandela family got free legal aid meant for poor,kansascity.com
2013-07-24,South Africa: Mandela family got free legal aid meant for poor to help in case of burial site,foxnews.com
2013-07-23,"St. Louis event celebrates Nelson Mandela's birthday, legacy and values",stltoday.com
2013-07-25,South Africans Ponder A Nation Without Mandela,npr.org
2013-07-25,South Africans Ponder A Nation Without Mandela,npr.org
2013-07-25,South Africans Ponder A Nation Without Mandela,npr.org
2013-07-24,Nelson Mandela's family got legal aid meant for poor South Africans,sacbee.com
2013-07-27,A Jewish Pathbreaker Inspired by Her Countryman Mandela,nytimes.com
2013-07-26,"Religious leaders, community members celebrate Nelson Mandela's legacy in interfaith service",syracuse.com
2013-07-28,"Nelson Mandela, Robert Mugabe And The Countries They Shaped",npr.org
2013-07-27,Nelson Mandela in the hospital for 50 days,cbsnews.com
2013-07-29,Court case of Nelson Mandela's investment companies delayed,upi.com
2013-07-29,Legal case brought by Mandela daughters delayed,kansascity.com
2013-07-29,End-Of-Life Lessons For Nelson Mandela's Family -- And Yours,forbes.com
2013-07-29,Law firm: South Africa court won't hold hearing this week in dispute over Mandela companies,foxnews.com
2013-07-29,Law firm: South Africa court won't hold hearing this week in dispute over Mandela companies,startribune.com
2013-07-29,JOHANNESBURG: Legal case brought by Mandela daughters delayed,miamiherald.com
2013-07-29,Q : South African CSUS professor discusses Mandela's legacy,sacbee.com
2013-07-29,Zimbabwean exiles stage Mandela statue freedom protest,reuters.com
2013-07-29,Zimbabwean exiles stage Mandela statue 'freedom' protest,reuters.com
2013-07-29,Zimbabwean exiles stage Mandela statue 'freedom' protest,reuters.com
2013-07-30,Mandela remains in critical but stable condition,kansascity.com
2013-07-30,South African president urges people to contribute to Mandela fund,upi.com
2013-07-29,"Insight: In the shadow of Mandela, Zimbabwe's Mugabe fights on",reuters.com
2013-07-30,Mandela Remains in Critical but Stable Condition,abcnews.go.com
2013-08-01,"Selling Mandela: From t-shirts to TV shows, how Madiba became a brand",cnn.com
2013-08-01,"Selling Mandela: From t-shirts to TV shows, how Madiba became a brand",cnn.com
2013-08-01,Mandela's freedom spirit punched onto Chinese wall,foxnews.com
2013-08-03,"In Mandela Legacy, a Place for Winnie?",nytimes.com
2013-08-05,Nelson Mandela mistakenly given non-payment notice,nbcnews.com
2013-08-05,City mistakenly gives Mandela non-payment bill,cbsnews.com
2013-08-05,Johannesburg city apologizes for incorrectly sending notice for unpaid bill to Mandela home,startribune.com
2013-08-05,Johannesburg city apologizes for incorrectly sending notice for unpaid bill to Mandela home,startribune.com
2013-08-05,Johannesburg city apologizes for incorrectly sending notice for unpaid bill to Mandela home,foxnews.com
2013-08-05,Johannesburg apologizes to Mandela for billing blunder,chicagotribune.com
2013-08-05,Nelson Mandela mistakenly given non-payment notice,nbcnews.com
2013-07-18,Johannesburg apologizes to Mandela for billing blunder,reuters.com
2013-08-05,Nelson Mandela residence receives debt notice in council blunder,theguardian.com
2013-08-07,A play about MLK reminds South Africans of Nelson Mandela,washingtonpost.com
2013-08-07,A play about MLK reminds South Africans of Nelson Mandela,washingtonpost.com
2013-08-08,Watch: Mandela's ex-wife gets emotional former leader,cbsnews.com
2013-08-08,"Mandela Chose to Quit, While Mugabe Stays Put",abcnews.go.com
2013-08-08,"When leaders quit: Mandela stepped down, while Zimbabwe's Mugabe heads for 38 years at helm",startribune.com
2013-08-08,"Mandela chose to quit, while Mugabe stays put",kansascity.com
2013-08-08,"When leaders quit: Mandela stepped down, while Zimbabwe's Mugabe heads for 38 years at helm",foxnews.com
2013-08-08,"Mandela chose to quit, while Mugabe stays put",sacbee.com
2013-08-08,"When leaders quit: Mandela stepped down, while Zimbabwe's Mugabe heads for 38 years at helm",startribune.com
2013-08-08,"When leaders quit: Mandela stepped down, while Zimbabwe's Mugabe heads for 38 years at helm",startribune.com
2013-08-08,Clinton on lessons from Mandela,reuters.com
2013-08-07,A play about MLK reminds South Africans of Nelson Mandela,washingtonpost.com
2013-07-18,Clinton on lessons from Mandela,reuters.com
2013-07-18,Clinton on lessons from Mandela,reuters.com
2013-08-10,"My South African Adventure: Paarl, The Town Where Nelson Mandela Walked to Freedom when Apartheid Died [BLOG]",ibtimes.com
2013-08-10,Nelson Mandela’s daughter says former South African leader’s health is improving by the day,nydailynews.com
2013-08-11,Nelson Mandela is on the mend but is still critical and in the hospital,nydailynews.com
