publish_date,title,media_name
2010-02-01,Men Defend Historic Mandela Site ... From Rabbits,nytimes.com
2010-01-31,Historic land where Mandela imprisoned now overrun by rabbits,cleveland.com
2010-05-02,Mandela toasts milestone,denverpost.com
2010-02-18,Jackson: Still much to learn from Nelson Mandela,denverpost.com
2010-02-28,Actor destined to play Mandela,dispatch.com
2010-03-10,Criticism of Mandela by ex-wife in British newspaper interview prompts outrage in South Africa,startribune.com
2010-03-10,"Mandela Agreed to a 'Bad Deal for Blacks,' Ex-Wife Says",foxnews.com
2010-03-11,Ex-wife criticizes Nelson Mandela – and many South Africans agree,csmonitor.com
2010-03-10,Ex-wife criticizes Mandela to UK newspaper,sfgate.com
2010-03-12,Mandela’s Ex-Wife Says Interview Didn’t Happen,nytimes.com
2010-03-31,Nelson Mandela and the 2010 World Cup: South Africa at a crossroads,csmonitor.com
2010-03-31,Nelson Mandela and the 2010 World Cup: South Africa at a crossroads,csmonitor.com
2010-04-03,"Guardians of the free Republics looked to Gandhi, King, and Mandela",csmonitor.com
2010-04-04,"Time Mag Chief Stengel: Obama a Mandela for the 21st Century, Mandela’s ‘True Successor’",newsbusters.org
2010-04-05,Book Review: Mandela's Way,wsj.com
2010-04-06,Time Editor Elaborates on Obama to Mandela Comparisons on Hardball,newsbusters.org
2010-04-20,Sharing 'Mandela's Way' In Fifteen Lessons,npr.org
2010-04-20,Sharing 'Mandela's Way' In Fifteen Lessons,npr.org
2010-04-21,Murder Threatens Mandela's Dream,thedailybeast.com
2010-04-23,FIFA President Still Hopes Mandela Opens World Cup,nytimes.com
2010-05-06,FIFA brings Nelson Mandela the World Cup after its arrival in South Africa,nydailynews.com
2010-05-06,FIFA brings Nelson Mandela the World Cup after its arrival in South Africa,nydailynews.com
2010-05-06,Mandela Reunited With World Cup Trophy,nytimes.com
2010-05-16,Winnie Mandela no fan of planned biopic starring Jennifer Hudson,latimes.com
2010-05-16,Winnie Mandela no fan of planned biopic starring Jennifer Hudson,latimes.com
2010-05-18,"Hudson, Howard to play Mandelas",nypost.com
2010-06-01,Mandela's Daughter Visits Brazilian Team,nytimes.com
2010-06-04,Mandela Meets Bafana Bafana Ahead Of World Cup,nytimes.com
2010-06-04,Mandela to attend Cup opener and final,sfgate.com
2010-06-05,The Nelson Mandela World Cup,nytimes.com
2010-06-05,The Nelson Mandela World Cup,nytimes.com
2010-06-08,Mandela Could Make Brief Appearance At First Game,nytimes.com
2010-06-09,Mandela: World Cup a Top Event in Africa's History,nytimes.com
2010-06-08,Grandson: Mandela will make brief appearance,tampabay.com
2010-09-06,World Cup: South Africa side hopes to gain edge on Mexico with 'Mandela Magic',mercurynews.com
2010-06-10,Mandela Intends to Appear At World Cup Opener,nytimes.com
2010-06-09,South Africa waves the 'Mandela Magic' wand,latimes.com
2010-09-06,World Cup: South Africa side hopes to gain edge on Mexico with 'Mandela Magic',mercurynews.com
2010-06-09,Obama to Write Foreword for Mandela Book,nytimes.com
2010-06-11,Mandela relative killed after World Cup concert,sfgate.com
2010-06-11,Mandela's great-granddaughter killed after World Cup concert,washingtonpost.com
2010-11-06,Fergie shares a flirty moment with Nelson Mandela,twincities.com
2010-06-11,Mandela pulls out of World Cup opening ceremony after grandaughter’s death,nypost.com
2010-06-11,Nelson Mandela can't make World Cup but sends welcome message,csmonitor.com
2010-06-11,Mandela Great-Grandchild Killed in Crash,thedailybeast.com
2010-06-11,Fergie Shares a Flirty Moment With Nelson Mandela,newsmax.com
2010-06-11,Car crash kills great-granddaughter of South Africa's Nelson Mandela on eve of World Cup opening,cleveland.com
2010-06-11,Mandela to miss World Cup opening ceremony,upi.com
2010-06-11,Mandela pulls out of World Cup opening ceremony after grandaughter’s death,nypost.com
2010-06-10,Nelson Mandela's great-granddaughter Zenani killed in crash; driver charged with drunk-driving,nydailynews.com
2010-06-11,Mandela to Miss World Cup Opening Match After Grandchild Dies,wsj.com
2010-06-11,Mandela to Miss World Cup Opener,nytimes.com
2010-06-11,Mandela Relative Killed After World Cup Concert,foxnews.com
2010-06-10,Ronaldo Hands Portugal Shirt to Nelson Mandela,nytimes.com
2010-06-12,Relative driving in crash that killed Mandela's great-granddaughter after World Cup concert,foxnews.com
2010-06-12,Grandkid tragedy casts pall on Mandela triumph,nypost.com
2010-06-12,Mandela's great-granddaughter killed after World Cup concert,post-gazette.com
2010-06-12,"As World Cup begins, Nelson Mandela gathers family to grieve after great-granddaughter's death",nydailynews.com
2010-12-06,Mandela misses World Cup opening ceremony after great-granddaughter is killed,denverpost.com
2010-12-06,South Africans mourn crash death of Mandela's great-granddaughter,twincities.com
2010-06-12,Grandkid tragedy casts pall on Mandela triumph,nypost.com
2010-06-11,Mandela's great-granddaughter killed after World Cup concert,washingtonpost.com
2010-06-12,"John Travolta, wife Kelly Preston donate to Nelson Mandela Children's Fund in SAfrica visit",foxnews.com
2010-06-13,Mandela Foundation says family friend drove in crash that killed Mandela's great granddaughter,foxnews.com
2010-06-14,South Africa: Court Date in Death of Mandela Relative,nytimes.com
2010-06-17,Frail Mandela attends great-grandchild's funeral,latimes.com
2010-06-17,Nelson Mandela attends funeral of great-granddaughter,nypost.com
2010-06-17,Mandela Attends Great-Granddaughter’s Funeral,nytimes.com
2010-06-17,Mandela at Great-Granddaughter’s Funeral,nytimes.com
2010-06-17,Nelson Mandela attends funeral of great-granddaughter,nypost.com
2010-06-17,Nelson Mandela makes first public appearance during World Cup,latimes.com
2010-06-17,Frail Mandela attends great-grandchild's funeral,latimes.com
2010-06-18,Briefing: Mandela attends great-granddaughter's funeral,twincities.com
2010-06-17,Frail Mandela attends great-grandchild's funeral,latimes.com
2010-06-17,Frail Mandela attends great-grandchild's funeral,latimes.com
2010-06-17,Frail Mandela attends great-grandchild's funeral,latimes.com
2010-06-17,Frail Mandela attends great-grandchild's funeral,latimes.com
2010-06-17,Frail Mandela attends great-grandchild's funeral,latimes.com
2010-06-17,Frail Mandela attends great-grandchild's funeral,latimes.com
2010-06-17,Frail Mandela attends great-grandchild's funeral,latimes.com
2010-06-24,Former US President Clinton meets with Nelson Mandela in South Africa,foxnews.com
2010-06-25,Supreme Court should remember Mandela,sfgate.com
2010-06-29,Police Chief Not Ruling Out Mandela Appearance,nytimes.com
2010-07-02,Mandela Sends Message of Support to Ghana Team,nytimes.com
2010-07-03,Mandela Meets Ghana Team After Cup Defeat,nytimes.com
2010-07-08,Mandela may award World Cup trophy,stltoday.com
2010-08-07,Nelson Mandela Smells So Damn Good!,gawker.com
2010-07-10,African National Congress condemns Yiull Damaso's painting of dead Nelson Mandela undergoing autopsy,nydailynews.com
2010-07-11,"FIFA pressuring Nelson Mandela to attend World Cup final, family says",nypost.com
2010-07-11,"Mandela to Greet Fans, but Will Watch Game at Home",nytimes.com
2010-07-11,Mandela Appears at Soccer City Before Final,nytimes.com
2010-07-11,Mandela Wows Fans Ahead Of World Cup Final,nytimes.com
2010-07-11,"Mandela Under Pressure by FIFA, Grandson Says",nytimes.com
2010-07-11,"FIFA pressuring Nelson Mandela to attend World Cup final, family says",nypost.com
2010-07-11,Mandela appears at closing ceremony,tampabay.com
2010-07-11,Nelson Mandela gets a rousing ovation at World Cup's closing ceremony,latimes.com
2010-07-11,Mandela appears at Soccer City before final,arkansasonline.com
2010-07-11,Nelson Mandela appears at closing ceremony at World Cup,foxnews.com
2010-07-18,Obama wishes Nelson Mandela a happy birthday,cnn.com
2010-07-18,South Africans celebrate Mandela Day,mercurynews.com
2010-07-19,Daily Kos: Overnight News Digest: Happy Mandela Day!,dailykos.com
2010-07-18,"Nelson Mandela's 92nd birthday marked with service, soccer",cleveland.com
2010-07-18,South Africans celebrate Mandela Day,mercurynews.com
2010-07-18,Nelson Mandela is 92. Happy Birthday,suntimes.com
2010-07-21,Reader recommendation: Mandela's Way,csmonitor.com
2010-07-24,Nelson Mandela's Grandchildren Robbed: South Africa's Tragedy,thedailybeast.com
2010-08-05,Nelson Mandela charity says it didn't receive diamonds Naomi Campbell said she gave ex-head,foxnews.com
2010-08-05,"Naomi Campbell, Mia Farrow, Nelson Mandela Charles Taylor",nationalreview.com
2010-08-06,Former Mandela Fund Official Says Model Gave Him Diamonds,nytimes.com
2010-08-06,Mandela’s Alleged Daughter Gets a Response,thedailybeast.com
2010-08-06,A New Safari Camp Has Ties to Mandela,nytimes.com
2010-08-06,A New Safari Camp Has Ties to Mandela,nytimes.com
2010-08-17,Daily Kos: What do Orly Taitz and Nelson Mandela have in common?,dailykos.com
2010-08-17,Daily Kos: What do Orly Taitz and Nelson Mandela have in common?,dailykos.com
2010-08-19,Mandela Aide Quits Over Diamonds,nytimes.com
2010-08-19,South African Mandela charity ex-chief cuts ties over supermodel and warlord diamond scandal,foxnews.com
2010-08-19,Nelson Mandela charity board member Jeremy Ratcliffe quits over 'Blood Diamonds' uproar,nydailynews.com
2010-08-18,Mandela charity official resigns amid blood diamond outcry,nypost.com
2010-08-18,Mandela charity official resigns amid blood diamond outcry,nypost.com
2010-08-22,The Muslim World Needs a Mandela,realclearpolitics.com
2010-10-01,Mandela charity ex-chief faces criminal charges,foxnews.com
2010-10-11,"Mandela book endorsed by anti-apartheid icon offers personal portrait, with faults, frailties",startribune.com
2010-10-11,A Glimpse Inside Nelson Mandela's Memoirs,cbsnews.com
2010-10-10,New Mandela book offers personal portrait,foxnews.com
2010-10-16,Conversations with Myself by Nelson Mandela: Review,thedailybeast.com
2010-10-20,The mundane and the moral: Mandela's 'Conversations With Myself',latimes.com
2010-06-11,"Review: Mandela as seen through his interviews, speeches, notes and other writings",mercurynews.com
2010-11-12,Mandela's fame draws tourists to an otherwise unremarkable village,csmonitor.com
2010-12-20,"Mandela son-in-law granted bail, may be extradited",kansascity.com
2011-01-07,"The Buzz: Norquist cites wisdom of Mandela, Brulte",sacbee.com
2011-06-01,Capitol Alert: Grover Norquist cites Nelson Mandela in warning against taxes,sacbee.com
2011-01-27,Nelson Mandela Hospitalized for Lung Infection,cbsnews.com
2011-01-27,"Mandela, 92, hospitalized for tests, current S. African president calls on media to back off",startribune.com
2011-01-27,A.M. national and world links: Mandela admitted to hospital; another winter storm in northeast; historic Kennedy hat is missing,cleveland.com
2011-01-27,"Mandela, 92, hospitalized for tests, current S. African president calls on media to back off",chicagotribune.com
2011-01-27,"Mandela, 92, hospitalized for tests in S. Africa",ajc.com
2011-01-27,Nelson Mandela Hospitalization Raises Worries,cbsnews.com
2011-01-27,"Mandela, 92, hospitalized for tests in S. Africa",foxnews.com
2011-01-27,Speculation Over Mandela’s Hospitalization,nytimes.com
2011-01-27,Nelson Mandela Hospitalization Raises Worries,cbsnews.com
2011-01-26,Mandela hospitalization raises concern over health,reuters.com
2011-01-27,Mandela hospitalized for tests in South Africa,arkansasonline.com
2011-01-27,"Mandela, 92, hospitalized for tests in S. Africa",miamiherald.com
2011-01-28,Africa: Nelson Mandela home from hospital,salon.com
2011-01-28,Mandela leaves hospital after treatment,chicagotribune.com
2011-01-28,"Mandela, 92, home from S. African hospital",foxnews.com
2011-01-28,"Nelson Mandela, 92, home from South African hospital",twincities.com
2011-01-28,South Africans relieved as Mandela heads home,latimes.com
2011-01-28,South Africans relieved as Mandela heads home,latimes.com
2011-01-28,Nelson Mandela Released from Hospital,cbsnews.com
2011-01-28,South Africans relieved as Mandela heads home,latimes.com
2011-01-28,Mandela Leaves Hospital after Treatment,newsmax.com
2011-01-27,"Mandela, 92, home from S. African hospital",kansascity.com
2011-01-28,"Mandela, 92, home from S. African hospital",kansascity.com
2011-01-28,South Africans relieved as Mandela heads home,latimes.com
2011-01-28,"Nelson Mandela, 92, remains hospitalized; rumors swirl in South Africa",latimes.com
2011-01-28,South Africans relieved as Mandela heads home,latimes.com
2011-01-28,"Nelson Mandela, 92, remains hospitalized; rumors swirl in South Africa",latimes.com
2011-01-28,South Africans relieved as Mandela heads home,latimes.com
2011-01-28,Mandela discharged from hospital,upi.com
2011-01-27,Mandela leaves hospital after treatment,reuters.com
2011-01-28,Mandela Returns Home From Hospital,nytimes.com
2011-01-28,Mandela leaves hospital after treatment,courant.com
2011-01-28,"Nelson Mandela, 92, remains hospitalized; rumors swirl in South Africa",latimes.com
2011-01-28,South Africans relieved as Mandela heads home,latimes.com
2011-01-28,Mandela Discharged from Hospital,thedailybeast.com
2011-01-28,"Mandela, 92, home from S. African hospital - Sacramento News - Local and Breaking Sacramento News",sacbee.com
2011-01-28,Nelson Mandela discharged from South African hospital,nypost.com
2011-01-28,Mandela suffers collapsed lung,nypost.com
2011-01-28,Mandela to be discharged from hospital,upi.com
2011-01-28,"No ""Panic"" as Mandela Discharged from Hospital",cbsnews.com
2011-01-28,"Nelson Mandela, 92, remains hospitalized; rumors swirl in South Africa",latimes.com
2011-01-28,Nelson Mandela discharged from South African hospital,nypost.com
2011-01-28,A.M. national and world news links: Turmoil in the Middle East; Mandela remains in hospital; a long wait for lotto jackpot,cleveland.com
2011-01-27,Mandela recovering after lung scare,reuters.com
2011-01-28,Mandela suffers collapsed lung,nypost.com
2011-01-28,SAfrica says 'no need to panic' over Mandela,ajc.com
2011-01-28,"Nelson Mandela, 92, remains hospitalized; rumors swirl in South Africa",latimes.com
2011-01-27,SAfrica says 'no need to panic' over Mandela - Sacramento News - Local and Breaking Sacramento News,sacbee.com
2011-01-28,"Nelson Mandela, 92, remains hospitalized; rumors swirl in South Africa",latimes.com
2011-01-27,"Nelson Mandela, 92, remains hospitalized in South Africa",chron.com
2011-01-21,"In Hospital, Mandela Draws a Crowd",wsj.com
2011-01-27,Mandela Hospitalized for Tests,thedailybeast.com
2011-01-29,South African official: Nelson Mandela doing well,ajc.com
2011-01-29,South African official: Nelson Mandela doing well,miamiherald.com
2011-01-29,S. Africans to light candles in support of Mandela,foxnews.com
2011-01-29,South Africa relieved as Mandela hospitalization ends,latimes.com
2011-01-29,South Africa relieved as Mandela hospitalization ends,latimes.com
2011-01-29,Nelson Mandela sent home from hospital,dispatch.com
2011-01-29,"Mandela, 92, leaves hospital for care at home",denverpost.com
2011-01-29,South Africa relieved as Mandela hospitalization ends,latimes.com
2011-01-29,South Africa relieved as Mandela hospitalization ends,latimes.com
2011-01-29,South Africa relieved as Mandela hospitalization ends,latimes.com
2011-01-29,South Africa relieved as Mandela hospitalization ends,latimes.com
2011-01-28,South Africans relieved as Mandela heads home,latimes.com
2011-01-30,Spokesman says Mandela is faring well,denverpost.com
2011-01-29,South African official: Nelson Mandela doing well,kansascity.com
2011-01-29,South African official: Nelson Mandela doing well,arkansasonline.com
2011-01-29,South African official: Nelson Mandela doing well - Sacramento News - Local and Breaking Sacramento News,sacbee.com
2011-01-30,"Mandela recovering well, but visitor rush a concern",reuters.com
2011-02-01,South African president visits Mandela at home,miamiherald.com
2011-02-01,South African president visits Mandela at home,kansascity.com
2011-02-01,South African president visits Mandela at home - Sacramento News - Local and Breaking Sacramento News,sacbee.com
2011-02-01,South Africa: Mandela Responds to Treatment for Respiratory Infection,nytimes.com
2011-02-01,South African president visits Mandela at home,foxnews.com
2011-02-04,"A Week in History: The Beatles Arrive, Mandela Freed, Deep Blue Wins",usnews.com
2011-02-10,"Mandela's health OK, South Africa president says - Sacramento News - Local and Breaking Sacramento News",sacbee.com
2011-02-11,Mandela's daughter says he is doing well,upi.com
2011-02-10,South Africa court will not extradite Mandela son-in-law to U.S.,reuters.com
2011-02-10,"Mandela's health OK, South Africa president says",kansascity.com
2010-11-19,"Pacquiao fan Nelson Mandela now fully recovered, says daughter",reuters.com
2011-02-11,"Winnie Mandela, cop dispute traffic row",upi.com
2011-03-03,Nelson Mandela and the Unveiling of Celebrity,cnn.com
2011-03-08,"Google to give $1.25M to Nelson Mandela Foundation - Sacramento Business, Housing Market News",sacbee.com
2011-08-03,Google to give $1.25M to Nelson Mandela Foundation,mercurynews.com
2011-03-08,Google to give $1.25m to Nelson Mandela Foundation,arkansasonline.com
2011-03-09,Mandela Foundation launching international fashion clothing line in South Africa,startribune.com
2011-03-08,Google to Give $1.25m to Nelson Mandela Foundation,foxnews.com
2011-03-09,Google to publish Nelson Mandela documents,sfgate.com
2011-03-08,Google to publish Nelson Mandela documents,sfgate.com
2011-03-08,Google grants $2.5 million to Nelson Mandela Foundation and Desmond Tutu Peace Center,latimes.com
2011-03-08,Google to give $1.25M to Nelson Mandela Foundation,miamiherald.com
2011-03-08,Google to give $1.25M to Nelson Mandela Foundation,stltoday.com
2011-08-03,Google to give $1.25M to Nelson Mandela Foundation,mercurynews.com
2011-03-08,Google grants $2.5 million to Nelson Mandela Foundation and Desmond Tutu Peace Center,latimes.com
2011-02-21,Google to Help Mandela Put Memorabilia Online,wsj.com
2011-03-08,Mandela,cnn.com
2011-03-08,Mandela,cnn.com
2011-03-08,I thought Mandela was going to be shot,cnn.com
2011-03-09,Mandela Foundation launching international fashion clothing line in South Africa,washingtonpost.com
2011-03-17,Search under way for historic Mandela gun,upi.com
2011-03-24,"Mandela foundation to release book of more than 2,000 quotes by the international icon",washingtonpost.com
2011-03-24,Mandela foundation to release book of quotes,foxnews.com
2011-03-28,"Mandela’s foundation launches Twitter account, reaches out to a younger generation online",washingtonpost.com
2011-04-27,New opera tells Winnie Madikizela-Mandela's story,miamiherald.com
2011-04-27,"New opera tells story of Winnie Madikizela-Mandela’s rise, fall and re-ascension",washingtonpost.com
2011-04-27,New opera tells Winnie Madikizela-Mandela's story,stltoday.com
2011-04-27,"New opera tells story of Winnie Madikizela-Mandela's rise, fall and re-ascension",startribune.com
2011-04-27,New opera tells Winnie Madikizela-Mandela's story,kansascity.com
2011-04-27,New opera tells Winnie Madikizela-Mandela's story,sacbee.com
2011-05-04,City officials in South Africa’s economic hub save Nelson Mandela’s historic law offices,washingtonpost.com
2011-05-04,Like and Unlike Mandela,nationalreview.com
2011-05-04,Johannesburg saves Mandela's old law offices,miamiherald.com
2011-05-04,Johannesburg saves Mandela's old law offices,kansascity.com
2011-05-04,Johannesburg saves Mandela's old law offices,sacbee.com
2011-05-16,South Africa's Mandela votes early in local polls,foxnews.com
2011-05-16,"Mandela votes early; election official says former leader is 'healthy, handsome'",startribune.com
2011-04-26,Recovering Nelson Mandela votes in South Africa election,reuters.com
2011-05-16,South Africa's Mandela votes early in local polls,miamiherald.com
2011-05-16,South Africa's Mandela votes early in local polls,ajc.com
2011-05-16,"South Africa’s Mandela votes early; election official says former pres ‘healthy, handsome’",washingtonpost.com
2011-05-16,South Africa's Mandela votes early in local polls,sacbee.com
2011-05-16,"Mandela votes early; election official says former leader is ‘healthy, handsome’",washingtonpost.com
2011-05-23,Mandela resting in his South African home village on first trip since his hospitalization,washingtonpost.com
2011-05-23,Mandela asks to go home to Qunu,upi.com
2011-05-23,Mandela resting in his South African home village,miamiherald.com
2011-05-23,Mandela resting in his South African home village on first trip since his hospitalization,washingtonpost.com
2011-05-23,Mandela resting in his South African home village,kansascity.com
2011-05-25,"Arthur Goldreich, who helped shelter Mandela in S. Africa, dies",washingtonpost.com
2011-06-02,"Anti-apartheid veteran Albertina Sisulu, widow of Mandela’s mentor, dies at 92",washingtonpost.com
2011-06-15,"In Africa, Michelle Obama to honor Nelson Mandela",sacbee.com
2011-06-15,South Africa: Mandela charity’s ex-chief innocent in diamond case linked to Charles Taylor,washingtonpost.com
2011-06-15,South Africa: Mandela charity’s ex-chief innocent in diamond case linked to Charles Taylor,washingtonpost.com
2011-06-15,South Africa: Mandela charity’s ex-chief innocent in diamond case linked to Charles Taylor,washingtonpost.com
2011-06-15,"In Africa, Michelle Obama to honor Nelson Mandela",ajc.com
2011-06-15,South Africa: Mandela charity’s ex-chief innocent in diamond case linked to Charles Taylor,washingtonpost.com
2011-06-15,"In Africa, Michelle Obama to honor Nelson Mandela",kansascity.com
2011-06-15,South Africa: Mandela charity’s ex-chief innocent in diamond case linked to Charles Taylor,washingtonpost.com
2011-06-15,South Africa: Mandela charity’s ex-chief innocent in diamond case linked to Charles Taylor,washingtonpost.com
2011-06-15,"In Africa, Michelle Obama to honor Nelson Mandela",miamiherald.com
2011-06-15,Mandela Charity Ex-Chief Innocent in Diamond Case,nytimes.com
2011-06-21,Michelle Obama meets Nelson Mandela in South Africa,suntimes.com
2011-06-21,"Michelle Obama begins six-day tour of South Africa, meets with Nelson Mandela",nydailynews.com
2011-06-21,Michelle Obama meets with Nelson Mandela as she begins Africa tour [Updated],latimes.com
2011-06-21,"Michelle Obama, family, meets with Nelson Mandela",denverpost.com
2011-06-21,"Michelle Obama, family, meets with Nelson Mandela",miamiherald.com
2011-06-21,Michelle Obama meets Nelson Mandela,upi.com
2011-06-21,Michelle Obama meets with Nelson Mandela as she begins Africa tour [Updated],latimes.com
2011-06-21,Michelle Obama meets with Nelson Mandela in stop at his foundation to view his papers,startribune.com
2011-06-21,Michelle Obama meets with Nelson Mandela as she begins Africa tour [Updated],latimes.com
2011-06-21,Michelle Obama meets with Nelson Mandela as she begins Africa tour [Updated],latimes.com
2011-06-21,"Michelle Obama, family, meets with Nelson Mandela",kansascity.com
2011-06-21,Michelle Obama Meets Nelson Mandela,wsj.com
2011-06-21,Michelle Obama meets with Nelson Mandela as she begins Africa tour,chicagotribune.com
2011-06-21,"Michelle Obama, family, meets with Nelson Mandela",denverpost.com
2011-06-21,Michelle Obama meets with Nelson Mandela in stop at his foundation to view his papers,washingtonpost.com
2011-06-17,Michelle Obama meets Nelson Mandela in South Africa,reuters.com
2011-06-21,"Michelle Obama, family, meets with Nelson Mandela",sacbee.com
2011-06-22,"Michelle Obama calls meeting with Mandela ‘very surreal,’ says she’s trying to process it",washingtonpost.com
2011-06-17,"Michelle Obama: Mandela looked strong, good, happy",reuters.com
2011-06-22,"Michelle Obama: Meeting Mandela ""surreal""",cbsnews.com
2011-06-22,"In South Africa, Obama Family Meets Nelson Mandela",newsmax.com
2011-06-22,Michelle Obama to Mandela meeting: 'Very surreal',miamiherald.com
2011-06-22,Michelle Obama to Mandela meeting: 'Very surreal',ajc.com
2011-06-22,Michelle Obama meets with Nelson Mandela on trip to South Africa,cleveland.com
2011-06-22,Michelle & Mandela,nypost.com
2011-06-22,Obama girls meet Nelson Mandela,postandcourier.com
2011-06-21,"Michelle Obama begins six-day tour of South Africa, meets with Nelson Mandela",nydailynews.com
2011-06-21,South Africa: A Visit to Mandela,nytimes.com
2011-06-21,"In South Africa, Obama family meets Nelson Mandela",ajc.com
2011-06-23,Michelle Obama tours Cape Town museum after trip to Mandela’s island prison cell canceled,washingtonpost.com
2011-06-23,Michelle Obama tours Cape Town museum after trip to Mandela's island prison cell canceled,chicagotribune.com
2011-06-23,Michelle Obama cancels trip to island where Mandela was imprisoned,washingtonpost.com
2011-06-23,Michelle Obama cancels trip to island where Mandela was imprisoned,washingtonpost.com
2011-06-23,Michelle Obama's trip to Mandela cell canceled,azcentral.com
2011-06-27,Editors of a new book want to ensure world gets Nelson Mandela’s words right,washingtonpost.com
2011-06-27,Book of Nelson Mandela quotations released,sacbee.com
2011-06-27,Editors of a new book want to ensure world gets Nelson Mandela’s words right,washingtonpost.com
2011-06-27,Book of Nelson Mandela quotations released,stltoday.com
2011-06-27,Book of Nelson Mandela quotations released,miamiherald.com
2011-07-04,It’s a bird! It’s a plane! It’s ... Nelson Mandela! South African Airways unveils Mandela logo,washingtonpost.com
2011-07-04,It’s a bird! It’s a plane! It’s ... Nelson Mandela! South African Airways unveils Mandela logo,washingtonpost.com
2011-07-17,Obama honors Mandela on eve of 93rd birthday,miamiherald.com
2011-07-18,Nelson Mandela celebrates 93rd birthday in SAfrica,ajc.com
2011-07-19,Nelson Mandela's 93rd birthday inspires South Africa,latimes.com
2011-07-18,Nelson Mandela celebrates 93rd birthday in SAfrica,kansascity.com
