publish_date,title,media_name
2013-12-05,South African President Zuma says that Nelson Mandela has died,reuters.com
2013-06-10,Nelson Mandela's ex-wife visits him at hospital,reuters.com
2013-07-18,Mandela turns 95,reuters.com
2013-12-06,South Africans mourn the passing of Nelson Mandela,reuters.com
2013-12-05,"Prince William hails Mandela as ""extraordinary, inspiring...",reuters.com
2013-12-06,"World leaders remember Mandela for legacy of peace, courage",reuters.com
2013-07-04,Remains of Mandela children reburied in Qunu,reuters.com
2013-12-05,Crowd gathers outside Mandela's house,reuters.com
2013-07-03,Mandela grandson in grave inquiry,reuters.com
2013-06-25,Mandela's grandson thanks well-wishers,reuters.com
2013-12-11,Mandela's body lies in state in Pretoria,reuters.com
2013-12-15,South Africa buries Mandela,reuters.com
2013-11-12,Nelson Mandela's daughter gives update on her father's...,reuters.com
2013-12-13,Jesse Jackson pays his respects at Nelson Mandela viewing,reuters.com
2013-10-03,London exhibition shows the love for Mandela,reuters.com
2013-12-10,Reuters Today: Mandela farewell & Europe nears banking deal,reuters.com
2013-12-11,South Africa hunts for mystery Mandela mimer,reuters.com
2013-12-10,World leaders in Mandela memorial,reuters.com
2013-06-10,Nelson Mandela in hospital for third day,reuters.com
2013-12-08,Cautious optimism as Afrikaners face future without Mandela,reuters.com
2013-12-15,Military escorts Mandela's coffin across Qunu,reuters.com
2013-12-06,World leaders react to Mandela's death,reuters.com
2013-12-07,"Gabriel, Prince Charles remember Mandela",reuters.com
2013-12-06,South Africans celebrate the life of Nelson Mandela,reuters.com
2013-07-18,Nelson Mandela turns 95,reuters.com
2013-12-08,"Poet, diplomat reflect on Mandela's life and legacy",reuters.com
2013-12-06,Flags lowered at the U.N. for Mandela's passing,reuters.com
2013-08-08,Clinton on lessons from Mandela,reuters.com
2013-06-30,Obama peers out Nelson Mandela's jail cell window,reuters.com
2013-12-10,"Zuma booed, jeered at Mandela memorial",reuters.com
2013-12-07,NYC's Empire State Building lit in Mandela's honor,reuters.com
2013-07-05,South Africans pray for Mandela,reuters.com
2013-12-06,Harlem remembers Mandela's historic visit,reuters.com
2013-06-30,Obamas tour Mandela's Robben Island prison cell,reuters.com
2013-06-29,"Obama meets with Mandela family, praises former leader",reuters.com
2013-12-15,"Prince Charles, Oprah Winfrey, other celebrities attend Mandela...",reuters.com
2013-12-07,Visitors sign embassy condolence book for Mandela,reuters.com
2013-12-10,Obama: Mandela 'moved a nation toward justice',reuters.com
2013-12-06,"With song and dance, a farewell to Mandela in Soweto",reuters.com
2013-06-16,Zuma says Mandela serious but improving,reuters.com
2013-12-06,Myanmar's Suu Kyi says Mandela raised the standard of humanity,reuters.com
2013-12-15,Mandela buried in ancestral homeland,reuters.com
2013-12-10,Crowds brave rain for Mandela's memorial,reuters.com
2013-12-12,Thousands line up to say goodbye to Mandela,reuters.com
2013-12-12,Sustainability leaders can learn valuable lessons from Nelson Mandela,theguardian.com
2013-12-11,Chinese paper rejects comparison between Mandela and Nobel laureate Liu,reuters.com
2013-12-11,China Chides Comparisons Between Nobel Laureates Nelson Mandela and Liu Xiaobo,time.com
2013-11-27,Review: Nelson Mandela's involving 'Long Walk to Freedom',latimes.com
2013-06-24,Mandela’s Condition Is Reported to Deteriorate to ‘Critical’,nytimes.com
2013-06-28,Mandela's Graceful Departure A Hallmark Of His Presidency,npr.org
2013-12-16,AFP PODCAST: Mandela’s Jewish Influence,americanfreepress.net
2013-12-08,AUDIO INTERVIEW: The Real Mandela,americanfreepress.net
2013-12-07,"As We Memorialize Mandela, Remember Those Who Stood With Him",npr.org
2013-12-05,Nelson Mandela obituary,theguardian.com
2013-12-15,"Nelson Mandela funeral: a gun salute, then still, silent calm, and it was over",theguardian.com
2013-09-08,Mandela: Long Walk to Freedom: Toronto 2013,theguardian.com
2013-07-06,"Where Mandela Kept Hope, Guide Tells Their Shared Saga",nytimes.com
2013-12-06,Nelson Mandela quotes: 'Real leaders must be ready to sacrifice all for the freedom of their people',theguardian.com
2013-12-15,South Africa holds state funeral for Mandela,latimes.com
2013-12-05,"Nelson Mandela, former South African president and global icon, dies at age 95",cbsnews.com
2013-12-15,Nelson Mandela has been laid to rest – but his legacy must not be,theguardian.com
2013-12-05,Nelson Mandela worked to dismantle apartheid,cnn.com
2013-12-06,"As South Africa mourns Mandela’s death, the nation struggles to fulfill his dreams",washingtonpost.com
2013-12-05,Nelson Mandela quotes: A collection of memorable words from former South African president,cbsnews.com
2013-12-06,"Nelson Mandela, South Africa’s Liberator as Prisoner and President, Dies at 95",nytimes.com
2013-12-07,Why Nelson Mandela was on a terrorism watch list in 2008,washingtonpost.com
2013-12-05,"Nelson Mandela, 1964: 'I am prepared to die'",theguardian.com
2013-06-09,South Africans pray as Nelson Mandela battles lung infection,latimes.com
2013-12-07,I Worked For Nelson Mandela,talkingpointsmemo.com
2013-12-06,Muhammad Ali Pays Tribute To Mandela: 'He Is Now Forever Free',talkingpointsmemo.com
2013-12-09,"Israel's President, Prime Minister Won't Attend Mandela's Funeral",talkingpointsmemo.com
2013-12-05,The Life of Nelson Mandela In Photos,talkingpointsmemo.com
2013-12-08,Gingrich Defends His Praise Of Mandela,talkingpointsmemo.com
2013-12-10,Obama: Nelson Mandela 'Makes Me Want To Be Better',talkingpointsmemo.com
2013-12-15,South Africa Buries Mandela,talkingpointsmemo.com
2013-12-05,"Nelson Mandela, 20th Century Colossus, Dies At 95",talkingpointsmemo.com
2013-12-10,WATCH Live: Nelson Mandela's Memorial Service,talkingpointsmemo.com
2013-12-04,Mandela Not 'Doing Well' But Putting Up A 'Courageous Fight',talkingpointsmemo.com
2013-12-06,DC Mayor Compares His City's Struggles To Mandela's Under Apartheid,talkingpointsmemo.com
2013-12-05,Report: Obama Expected To Attend Mandela's Funeral In South Africa,talkingpointsmemo.com
2013-12-05,Nelson Mandela Dies At Age 95,talkingpointsmemo.com
2013-12-09,Obamas To Depart For Mandela Funeral Today,talkingpointsmemo.com
2013-12-06,Hillary Clinton On Mandela: We've Lost 'A Giant Among Us',talkingpointsmemo.com
2013-12-10,Obamas Greeted By 'Deafening Roar' At Mandela Memorial (VIDEO),talkingpointsmemo.com
2013-12-06,South Carolina Sheriff Refuses To Lower Flag For Mandela,talkingpointsmemo.com
2013-12-09,South Carolina Sheriff Deletes Facebook Post About Refusing To Lower Flags For Mandela,talkingpointsmemo.com
2013-12-06,Politicians Tweet Tributes To Nelson Mandela,talkingpointsmemo.com
2013-12-09,Obama To Speak At Nelson Mandela Memorial Service,talkingpointsmemo.com
2013-12-08,Few Heirs Apparent To Mandela's Symbol Of Freedom,talkingpointsmemo.com
2013-12-06,'A Nation's Healer Is Dead': U.S. Newspapers React To Mandela's Passing (PHOTOS),talkingpointsmemo.com
2013-12-05,Next Issue Of The New Yorker Will Feature Special Mandela Cover,talkingpointsmemo.com
2013-12-16,Relative: Mandela Signer Was In Group That Burned Men,talkingpointsmemo.com
2013-12-06,WND Polls Readers On Whether Mandela Should Have Been Released From Prison,talkingpointsmemo.com
2013-12-11,GOP Rep. On Mandela: U.S. Should Only Lower Flags For Americans,talkingpointsmemo.com
2013-12-11,Reports: Ted Cruz Walked Out Of Mandela Memorial During Castro Speech,talkingpointsmemo.com
2013-12-11,Sheriff Joe Arpaio Disputes Report He Refused To Lower Flags For Mandela,talkingpointsmemo.com
2013-12-06,Limbaugh Uses Mandela's Death To Slam U.S. Civil Rights Leaders,talkingpointsmemo.com
2013-12-09,Biden To Honor Mandela At National Cathedral,talkingpointsmemo.com
2013-12-11,Hillary Clinton Urges Ukraine To Follow Mandela's Example,talkingpointsmemo.com
2013-12-11,"Conservatives Complain That Obama Paid Tribute To Mandela, But Snubbed Thatcher",talkingpointsmemo.com
2013-12-05,U.S. Ambassador To South Africa 'Heavy Hearted' On Mandela's Death,talkingpointsmemo.com
2013-12-05,Obama: Nelson Mandela 'Belongs To The Ages',talkingpointsmemo.com
2013-12-06,Richard Branson: Mandela Tried To Stop The Iraq War,talkingpointsmemo.com
2013-12-10,CBS Picks Toto's 'Africa' Instead Of South African Music To Remember Mandela (VIDEO),talkingpointsmemo.com
2013-12-11,Desmond Tutu's Home Was Robbed While He Was At Mandela Memorial,talkingpointsmemo.com
2013-12-15,SNL Parodies Obama And Mandela Memorial (VIDEO),talkingpointsmemo.com
2013-12-10,Obama: Mandela 'The Last Great Liberator Of The 20th Century',talkingpointsmemo.com
2013-12-08,South Africans Of All Faiths Pray For Mandela,talkingpointsmemo.com
2013-12-06,Gossip Blogger Remembers Mandela For Inspiring Movie That Has 'Awards Buzz',talkingpointsmemo.com
2013-12-08,Obamas To Attend Tuesday Service For Mandela,talkingpointsmemo.com
2013-12-06,My Meetings With Nelson Mandela,realclearpolitics.com
2013-12-05,The Character of Nelson Mandela,realclearpolitics.com
2013-12-06,Nelson Mandela: Remembering an Icon,realclearpolitics.com
2013-12-10,How Mandela Came to Embrace Free Markets,realclearpolitics.com
2013-12-05,"Mandela, Rest in Honorable Peace",nationalreview.com
2013-12-10,Obama Calls for World Leaders to Follow Mandela's Example: 'Our Work Is Not Yet Done',nationalreview.com
2013-12-11,The Problem with President Obama's Remarks on Nelson Mandela,nationalreview.com
2013-12-09,British Man Arrested for Making Nelson Mandela Joke,nationalreview.com
2013-12-06,Thoughts on Post-Mandela South Africa,nationalreview.com
2013-12-06,"Praising Mandela, with Gratitude and Guilt",nationalreview.com
2013-12-10,Cruz Walks Out on Castro Speech at Memorial Service for Mandela,nationalreview.com
2013-12-11,Some Follow-Up on the 'Fake' Interpreter at the Mandela Memorial Service,nationalreview.com
2013-12-21,Mandela: Long Walk to Freedom,nationalreview.com
2013-12-09,Mandela Funeral Brings Foreign Rivals Together,nationalmemo.com
2013-12-06,You Have To See What Ted Cruz's Fans Have To Say About Nelson Mandela,nationalmemo.com
2013-12-10,"WATCH: Obama Eulogizes Mandela, 'It Took A Man Like Madiba To Free Not Just The Prisoner, But The Jailer As Well'",nationalmemo.com
2013-12-14,Gingrich's Praise Of Mandela Rips Open Issue Of Race,nationalmemo.com
2013-12-06,Obama: Mandela Bent History Towards Justice,nationalmemo.com
2013-12-05,Anti-Apartheid Hero Nelson Mandela Dies Aged 95,nationalmemo.com
2013-12-06,"Mandela, The Man Once Branded A 'Terrorist' By The U.S.",nationalmemo.com
2013-07-01,Mandela Still 'Critical But Stable',nationalmemo.com
2013-12-10,"In U.S., Parallels Seen Between Mandela And Martin Luther King",nationalmemo.com
2013-12-09,Mandela Loomed Large For U.S. Presidents,nationalmemo.com
2013-07-18,Improving' Mandela Marks 95th Birthday In Hospital,nationalmemo.com
2013-12-09,Forgiveness At Heart Of Mandela Legacy,nationalmemo.com
2013-06-28,Obama's 'Hero' Mandela Hangs On,nationalmemo.com
2013-12-09,Official: Obama To Attend Mandela Memorial Tuesday,nationalmemo.com
2013-12-10,Obama Shakes Hands With Cuba's Castro At Mandela Memorial,nationalmemo.com
2013-12-12,Mandela's Crucial Lesson For America,nationalmemo.com
2013-09-18,From Stringer Bell To Anti-Apartheid: Actor Idris Elba Takes On Mandela Role (VIDEO),mintpressnews.com
2013-12-16,Why Benjamin Netanyahu Didn’t Go To Mandela’s Funeral,mintpressnews.com
2013-12-09,"World Mourns Mandela, But Fight To End Apartheid In Israel Continues",mintpressnews.com
2013-12-06,Looking Back At Mandela's CIA Assisted 1962 Arrest,mintpressnews.com
2013-06-24,Nelson Mandela Remains In Critical Condition,mintpressnews.com
2013-12-05,Glance At Nelson Mandela's co-Defendants In Rivonia Trial,mintpressnews.com
2013-06-29,Obama meets with Mandela's family,marketwatch.com
2013-12-05,Nelson Mandela dies aged 95,marketwatch.com
2013-12-05,Nelson Mandela dies aged 95,marketwatch.com
2013-12-05,"Nelson Mandela, a look back in pictures",marketwatch.com
2013-06-08,"Mandela, 94, hospitalized again for lung infection",marketwatch.com
2013-12-05,"Mandela, iconic South African leader, dies at 95",marketwatch.com
2013-12-06,Obama to visit South Africa to honor Mandela,marketwatch.com
2013-12-14,Mandela's body flown to hometown for burial,marketwatch.com
2013-12-10,Mandela remembered in rain-soaked stadium ceremony,marketwatch.com
2013-12-06,Nelson Mandela’s imperfect legacy,marketwatch.com
2013-06-27,Zuma cancels official trip after visit to Mandela,marketwatch.com
2013-09-01,Mandela leaves hospital but health still serious,marketwatch.com
2013-12-14,Mandela's body flown to hometown for burial,marketwatch.com
2013-12-10,"Obama, Castro shake hands at Mandela ceremony",marketwatch.com
2013-12-10,Mandela remembered as ‘giant of history’ by Obama,marketwatch.com
2013-07-06,Mandela still critical as grandson to lodge complaint,foxnews.com
2013-12-14,Mandela's remains transferred to air base for ANC goodbye and flight to Eastern Cape funeral,foxnews.com
2013-07-19,Archbishop Desmond Tutu visits Mandela in Pretoria hospital,foxnews.com
2013-08-24,"South African president says Nelson Mandela still critical, condition sometimes unstable",foxnews.com
2013-07-05,"Mandela's health: Government denies he is in ""vegetative"" state, visitor says he is conscious",foxnews.com
2013-07-18,Nelson Mandela Day celebrations around the world and in space,foxnews.com
2013-08-20,Mandela social network aims to spread Madiba inspiration,foxnews.com
2013-07-03,Mandela's health 'perilous': leaked court papers,foxnews.com
2013-06-09,Nelson Mandela remains in hospital with recurring lung infection,foxnews.com
2013-07-18,"On 95th birthday, Nelson Mandela honored at UN; 'A giant among men'",foxnews.com
2013-09-01,Nelson Mandela discharged from hospital,foxnews.com
2013-07-05,Mandela mulled death in unseen video,foxnews.com
2013-07-05,South African government denies Mandela is in 'vegetative' state,foxnews.com
2013-07-30,"South African president says Nelson Mandela still in critical condition, but improving",foxnews.com
2013-09-01,"Nelson Mandela discharged from hospital, to return home; condition still critical",foxnews.com
2013-06-25,"As South Africa watches, Mandela still in critical condition",foxnews.com
2013-07-02,"Springboks, Bafana to honour Mandela",foxnews.com
2013-07-04,"Mandela kept alive by breathing machine, faces ‘impending death,’ court documents say",foxnews.com
2013-07-28,Mandela still 'critical' after reported operation,foxnews.com
2013-07-30,Mandela 'continues to show improvement': presidency,foxnews.com
2013-12-07,Is ‘Mandela: Long Walk to Freedom’ a good way to learn about the life of Nelson Mandela?,foxnews.com
2013-08-24,Mandela at times 'unstable' but resilient: presidency,foxnews.com
2013-12-05,Nelson Mandela through the years,foxnews.com
2013-12-10,Cruz Attends Mandela Memorial Service,newsmax.com
2013-12-05,5 Key Moments in Nelson Mandela's Life,newsmax.com
2013-09-10,Naomie Harris: Mandela Film Was Intimidating; She Plays Winnie,newsmax.com
2013-12-05,"Once Frightening, Mandela Became Father to Nation",newsmax.com
2013-12-23,Document: Israeli Spy Agency Trained Young Nelson Mandela,newsmax.com
2013-12-09,Nelson Mandela: Sheriff Rick Clark Refuses to Lower Flag for Non-American,newsmax.com
2013-12-06,Obamas to Attend Mandela Memorial,newsmax.com
2013-12-10,Ted Cruz Walks Out on Castro's Speech at Mandela Memorial,newsmax.com
2013-12-05,"Nelson Mandela, a Hero for Our Times",newsmax.com
2013-12-05,"Nelson Mandela's Life, Legacy in Photographs",newsmax.com
2013-12-05,"Nelson Mandela Inspired Art: Music, Movies, Poems",newsmax.com
2013-12-10,Newt Gingrich Surprised He's Scorned for Praising Mandela,newsmax.com
2013-12-15,Fake Mandela Interpreter Part of Mob that Burned 2 People to Death,newsmax.com
2013-12-08,Gingrich Takes Heat for Praising Mandela,newsmax.com
2013-12-09,"More Than 70 Leaders Expected for Mandela Memorial, Funeral",newsmax.com
2013-12-05,Bill Clinton: Mandela 'Champion for Human Dignity and Freedom',newsmax.com
2013-12-12,'Today' Show Apologizes for Mandela Deaf Interpreter Spoof (Video),newsmax.com
2013-12-05,"Mandela: Teacher to His Jailmates, 'Father' to His Jailers",newsmax.com
2013-12-10,"World Leaders, South Africans Remember Mandela",newsmax.com
2013-12-11,UK's Cameron Defends 'Selfie' at Mandela Service,newsmax.com
2013-06-28,"Nelson Mandela, Barack Obama Not Scheduled To Meet – So Far",newsmax.com
2013-12-05,Nelson Mandela Dies: Internet Mourns Beloved South African Leader,newsmax.com
2013-12-09,Netanyahu Skips Mandela Memorial Because of Expense,newsmax.com
2013-10-29,"Nelson Mandela Attempted Assassin, Supremacist Sentenced to 35 Years",newsmax.com
2013-12-06,Rick Santorum: Obamacare a 'Great Injustice' Like Mandela's Apartheid,newsmax.com
2013-12-19,India Mandela Billboard: Morgan Freeman Photo Goes up Instead of Leader,newsmax.com
2013-06-27,"Nelson Mandela Worsens on Thursday, Reportedly Put on Life Support",newsmax.com
2013-12-23,Document: Israeli Spy Agency Trained Young Nelson Mandela,newsmax.com
2013-12-07,Ted Cruz Takes Heat on Facebook for Praising Mandela,newsmax.com
2013-12-05,Mandela in His Own Words: 7 Great Quotes From the Beloved Icon,newsmax.com
2013-07-04,"Mandela on Life Support, Faces 'Impending Death'",newsmax.com
2013-12-06,CNN Has Obama Nominee Connect Mandela to Obama -- Without Disclosing He's an Obama Nominee,newsbusters.org
2013-12-18,"PBS Star Gwen Ifill Complains of 'Non-stories' from Mandela Funeral, But She Spread 'Cheney Parka-gate'",newsbusters.org
2013-12-11,David Cameron and Danish PM brush off criticism of Mandela memorial selfie,theguardian.com
2013-12-10,South African President Zuma humiliated at Nelson Mandela memorial,latimes.com
2013-12-07,Tragedy dogged the triumphant Nelson Mandela,latimes.com
2013-12-12,Nelson Mandela Videos at ABC News Video Archive at abcnews.com,abcnews.go.com
2013-12-08,Nelson Mandela: a shining lesson that politics can be a tremendous force for good,theguardian.com
2013-12-06,Nelson Mandela 1918-2013,cbsnews.com
2013-12-05,Nelson Mandela: a life in pictures,theguardian.com
2013-12-10,Indiana’s Richard Lugar helped Mandela’s anti-apartheid cause,indystar.com
2013-12-07,Nelson Mandela: the freedom fighter who embraced his enemies,theguardian.com
2013-12-06,When I Saw Nelson Mandela At The Los Angeles Coliseum With My Dad,buzzfeed.com
2013-12-06,"Nelson Mandela, South Africa’s Liberator as Prisoner and President, Dies at 95",nytimes.com
2013-12-06,Nelson Mandela Praised by Congressmen Who Opposed Anti-Apartheid Act,usnews.com
2013-12-06,"Nelson Mandela, South Africa's first black president, dies aged 95",theguardian.com
2013-12-23,Document: Israeli Mossad spy agency trained young Mandela,washingtonpost.com
2013-12-13,Interpreter at Mandela Service Says He Is Schizophrenic and Saw Angels Descend,nytimes.com
2013-12-05,World leaders honor Mandela as champion of freedom and reconciliation,reuters.com
2013-12-09,"Nelson Mandela memorial: Snipers, troops stand guard",cnn.com
2013-12-12,Thousands Turned Away as Mourners Bid Farewell to Mandela,bloomberg.com
2013-12-06,Mandela’s Death Leaves South Africa Without Its Moral Center,nytimes.com
2013-12-11,'Fake' Sign Language Interpreter Marred Mandela Memorial,npr.org
2013-12-10,Nelson Mandela's memorial service: as it happened,theguardian.com
2013-11-21,"Hillary Clinton, John McCain, Colin Powell Cross Political Divide for ‘Mandela: Long Walk to Freedom’",variety.com
2013-07-10,"Mandela critical but responding to treatment, Zuma says",cnn.com
2013-06-12,"Santorum ties Obamacare, Mandela",politico.com
2013-12-06,Conservatives have a Mandela problem,salon.com
2013-12-11,"Behind eulogies, US deeply conflicted on Mandela",seattletimes.com
2013-12-10,"Obama, world leaders praise 'giant of history' at Mandela memorial",cnn.com
2013-05-24,"Financial, family woes of Winnie Mandela, 'Mother of the Nation'",cnn.com
2013-12-12,'Fake' Interpreter at Mandela's Memorial: I Was Hallucinating Angels,mashable.com
2013-12-20,This Indian Billboard Is A Memorial To Morgan Freeman Instead Of Nelson Mandela,businessinsider.com
2013-12-05,Nelson Mandela: An Indispensable Life in Pictures,time.com
2013-07-04,"After Nelson Mandela, what next for South Africa?",theguardian.com
2013-12-10,Here Is Barack Obama's Powerful Tribute To Nelson Mandela [FULL TEXT],businessinsider.com
2013-12-06,"From the archive, 12 February 1990: Nelson Mandela: A man whose time has come at last",theguardian.com
2013-12-06,Walsh: Obama Models Mandela; 'Turns Other Cheek Too Much',breitbart.com
2013-12-05,"When Mandela’s, and the world’s, fate changed at historic Rivonia Trial",washingtonpost.com
2013-12-08,'This Week' Transcript: Remembering Nelson Mandela,abcnews.go.com
2013-12-05,"Nelson Mandela, ex-president of South Africa, dies at 95",washingtonpost.com
2013-12-06,9 questions about Nelson Mandela you were too embarrassed to ask,washingtonpost.com
2013-12-05,"Nelson Mandela, Led South Africa Past Apartheid, Dies",bloomberg.com
2013-12-06,Mandela’s Death Leaves South Africa Without Its Moral Center,nytimes.com
2013-12-09,How Mandela Shifted Views On Freedom Of Markets,nytimes.com
2013-12-10,You know Ubuntu as an operating system. Mandela knew it as his life’s mission.,washingtonpost.com
2013-06-09,Mandela Hospitalized Second Day With Lung Infection,bloomberg.com
2013-12-12,Thousands Turned Away as Mourners Bid Farewell to Mandela,bloomberg.com
2013-06-16,"Mandela’s Improvement Sustained as Family Visits, Zuma Says",bloomberg.com
2013-12-06,Mandela Dies With Rainbow Nation Dream Still Work in Progress,bloomberg.com
2013-12-05,"The Day Mandela Was Arrested, With A Little Help From the CIA",newsweek.com
2013-12-10,Smize! Obama and European Leaders Snap a Selfie at Mandela Memorial,time.com
2013-02-11,How Many Kids Does Nelson Mandela Have?,newsone.com
2013-03-28,Nelson Mandela through the years,usatoday.com
2013-03-28,Nelson Mandela through the years,azcentral.com
2013-03-28,Nelson Mandela through the years,usatoday.com
2013-12-14,Mandela funeral selfie adds to image problem for Denmark's prime minister,theguardian.com
2013-12-05,Inside The Tiny Prison Cell That Held Nelson Mandela For Nearly 20 Years,businessinsider.com
2013-11-08,Mandela: Long Walk to Freedom,variety.com
2013-12-06,Nelson Mandela Was Undeniably Great But He Doesnt Need a Halo,thedailybeast.com
2013-12-10,‘The last great liberator’: Why Mandela made and stayed friends with dictators,washingtonpost.com
2013-12-12,South Africa admits error over 'schizophrenic' Mandela signer,reuters.com
2013-12-09,Nelson Mandela: Ted Cruz Is Only Senator In U.S. Delegation To Attend Late Leader's Memorial Service,foxnews.com
2013-12-12,Mandela memorial interpreter says he has history of violent behaviour,theguardian.com
2013-12-10,Obama shakes hand of Cuba's Raul Castro at Mandela memorial,reuters.com
2013-07-01,"CNN exclusive: George W. Bush on AIDS Mandela, Snowden and his legacy",cnn.com
2013-12-05,Members of Congress recall power of Mandela's presence,usatoday.com
2013-09-05,'Winnie' fails to capture the essence of Mrs. Mandela,usatoday.com
2013-12-08,Mandela trip dominates Obama's schedule,usatoday.com
2013-12-06,How music helped introduce Mandela to mainstream,usatoday.com
2013-07-13,Wife: Mandela is responding to treatment,usatoday.com
2013-06-27,Mandela remains critical as a nation shows concern,usatoday.com
2013-12-09,Massive crowds expected at the stadium for Mandela,usatoday.com
2013-12-10,Quotes from the Nelson Mandela service,usatoday.com
2013-12-10,"George H.W. Bush joins Twitter, praises Mandela",usatoday.com
2013-06-23,Nelson Mandela now in critical condition,usatoday.com
2013-12-11,"Thousands wait, weep at Mandela's casket",usatoday.com
2013-07-17,"Mandela makes 'dramatic' progress, says daughter",usatoday.com
2013-12-05,Obama: Mandela 'belongs to the ages',usatoday.com
2013-07-18,Obamas salute Mandela on his 95th birthday,usatoday.com
2013-07-10,South Africa: Mandela responding to treatment,usatoday.com
2013-12-07,Crowds pay tribute to Mandela in S. Africa,usatoday.com
2013-07-11,Nelson Mandela's friends lament his decline,usatoday.com
2013-12-08,South Africans praise Mandela on national day of prayer,usatoday.com
2013-12-05,15 of Nelson Mandela's best quotes,usatoday.com
2013-12-06,Why Nelson Mandela is called Madiba,usatoday.com
2013-12-06,Nelson Mandela's roads,csmonitor.com
2013-12-10,President Obama Speaks at Memorial for Nelson Mandela,time.com
2013-12-06,"Mandela’s Jailer: ‘He Was My Prisoner, But He Was My Father’",time.com
2013-12-07,Things Fall Apart: Mandela’s Sad Legacy of Successors,time.com
2013-12-06,Nelson Mandela Funeral Set For Dec. 15,time.com
2013-12-05,Paul Kagame on Nelson Mandela: a Politician Capable of the Remarkable,time.com
2013-06-12,"As Mandela’s Condition Improves, South Africa’s Anxiety Remains",time.com
2013-12-09,Israeli Leader Cancels Plans To Attend Nelson Mandela Memorial Service,time.com
2013-12-14,Fire and Forgiveness: How Apartheid Left Its Mark on Winnie and Nelson Mandela,time.com
2013-12-05,Robben Island: Nelson Mandela's Prison Home,time.com
2013-12-13,"Opinion: Nelson Mandela, a true believer in sanctions",newsday.com
2013-12-09,Obama's eulogy for Mandela echoes his own agenda,sandiegouniontribune.com
2013-12-10,"Obama: ‘Mandela taught us the power of action, but also ideas’",washingtonpost.com
2013-07-06,"Where Mandela Kept Hope, Guide Tells Their Shared Saga",nytimes.com
2013-12-08,Mandela trip dominates Obama's schedule,usatoday.com
2013-07-17,10 ways to celebrate Mandela Day,usatoday.com
2013-06-09,South Africa: Nelson Mandela remains in hospital,usatoday.com
2013-06-12,"Mandela 'responding better,' says South Africa's president",usatoday.com
2013-10-21,'Mandela' trailer features new U2 song,usatoday.com
