publish_date,title,media_name
2013-06-10,South African presidency: Nelson Mandela's condition in hospital remains serious but stable,startribune.com
2013-06-10,Mandela's condition remains 'serious but stable',baltimoresun.com
2013-06-10,Mandela's condition remains 'serious but stable',baltimoresun.com
2013-06-10,Nelson Mandela's condition 'unchanged',cnn.com
2013-06-10,Nelson Mandela's condition 'unchanged',cnn.com
2013-06-10,Nelson Mandela's condition 'unchanged',cnn.com
2013-06-10,Nelson Mandela: ‘It’s Time to Let Him Go’ Friend Says,ibtimes.com
2013-06-10,Nelson Mandela spends third day in South African hospital; no status update from government,foxnews.com
2013-06-10,South Africa says Nelson Mandela remains in hospital,foxnews.com
2013-06-09,Nelson Mandela remains in hospital for lung infection,cbsnews.com
2013-06-11,Mandela daughters visit ill father in hospital,cbsnews.com
2013-06-11,Security boosted outside ailing Mandela's hospital,nbcnews.com
2013-06-10,Nelson Mandela's Condition Unchanged After Signs Death Was Near,usnews.com
2013-11-06,Mandela still in 'serious but stable' condition,denverpost.com
2013-06-11,S. African gov't says Mandela's condition unchanged,cbsnews.com
2013-06-11,"Mandela remains in serious condition, gov't says",kansascity.com
2013-06-12,Nelson Mandela Grasped the Power of Sports,nytimes.com
2013-06-11,"JOHANNESBURG: Mandela remains in serious condition, gov't says",miamiherald.com
2013-06-11,South African presidency says Nelson Mandela remains in serious but stable condition,startribune.com
2013-06-11,Mandela spends fourth day in hospital,seattletimes.com
2013-06-11,Nelson Mandela: Is South Africa Heading for a Zimbabwe-style Meltdown?,ibtimes.com
2013-06-11,Nelson Mandela remains in serious but stable condition in hospital,upi.com
2013-06-12,Mandela Remains in Intensive Care,nytimes.com
2013-06-11,Security increases at hospital where Mandela lies,cnn.com
2013-06-11,Security increases at hospital where Mandela lies,cnn.com
2013-06-11,Security increases at hospital where Mandela lies,cnn.com
2013-06-11,Nelson Mandela spends fourth day in a South African hospital for recurring lung infection,startribune.com
2013-06-11,Security increases at hospital where Mandela lies,cnn.com
2013-06-11,Nelson Mandela spends fourth day in a South African hospital for recurring lung infection,startribune.com
2013-06-11,Nelson Mandela spends fourth day in a South African hospital for recurring lung infection,startribune.com
2013-06-11,Nelson Mandela spends fourth day in hospital for lung infection,foxnews.com
2013-06-11,Nelson Mandela spends fourth day in a South African hospital for recurring lung infection,foxnews.com
2013-06-11,Nelson Mandela spends fourth day in a South African hospital for recurring lung infection,startribune.com
2013-06-10,Mandela in 'Serious But Stable' Condition,wsj.com
2013-06-11,"Nelson Mandela Still in “Serious but Stable Condition”, South Africans Ready to Let Him Go",ibtimes.com
2013-06-10,Worry grows as Mandela's condition unchanged in hospital,dallasnews.com
2013-06-10,Source: Nelson Mandela was resuscitated before hospitalization,cbsnews.com
2013-06-10,"Mandela responding to treatment, S.Africa's Zuma says",reuters.com
2013-06-10,"Mandela responding to treatment, S.Africa's Zuma says",reuters.com
2013-06-12,"Mandela responding to treatment, S. Africa gov't says",cbsnews.com
2013-06-12,"Mandela 'responding better to treatment,' South African president says",cnn.com
2013-06-12,JOHANNESBURG: SAfrica: Mandela 'responding better to treatment',miamiherald.com
2013-06-12,SAfrica: Mandela 'responding better to treatment',kansascity.com
2013-06-11,SAfrica: Mandela 'responding better to treatment',sacbee.com
2013-06-12,SAfrica: Mandela 'responding better to treatment',sacbee.com
2013-06-12,Nelson Mandela 'Responding to Treatment' After Hospital Scare,ibtimes.com
2013-06-12,"Mandela 'responding better to treatment,' South African president says",cnn.com
2013-06-12,South African president says Nelson Mandela is 'responding better' to treatment in hospital,startribune.com
2013-06-12,South African president says Nelson Mandela is 'responding better' to treatment in hospital,startribune.com
2013-06-12,Well-wishers gather at churches to pray for Nelson Mandela,upi.com
2013-06-12,"Nelson Mandela responding to medical treatment, sources say",nbcnews.com
2013-06-12,South African president says Nelson Mandela is 'responding better' to treatment in hospital,startribune.com
2013-06-12,"Mandela's unusual tributes: bird, nuclear particle named after him",cnn.com
2013-06-12,Nelson Mandela remains in the hospital for a fifth day in 'very serious' condition,foxnews.com
2013-06-12,Mandela remains in hospital for a 5th day; president calls situation 'very serious',startribune.com
2013-06-12,Mandela remains in hospital for a 5th day; president calls situation 'very serious',startribune.com
2013-06-12,Mandela remains in hospital for a 5th day; president calls situation 'very serious',startribune.com
2013-06-13,Mandela Remains in Serious Condition,nytimes.com
2013-06-12,Are South Africans ready to let Mandela go?,cbsnews.com
2013-06-12,Mandela remains in hospital for a 5th day; president calls situation 'very serious',foxnews.com
2013-06-12,Mandela remains in hospital for a 5th day; president calls situation 'very serious',startribune.com
2013-06-12,"Bird, flowers, nuclear particle named after Mandela",cnn.com
2013-06-12,More family members visit Nelson Mandela as leaders send the ailing hero well-wishes,nydailynews.com
2013-06-11,"Nelson Mandela's condition, serious but stable",cbsnews.com
2013-06-11,S. Africa considers the unthinkable as Mandela remains in hospital,startribune.com
2013-06-13,South Africa's Mandela spends 6th day in hospital,seattletimes.com
2013-06-13,South Africa's Mandela spends 6th day in hospital,kansascity.com
2013-06-13,South Africa's Mandela spends 6th day in hospital,sacbee.com
2013-06-13,JOHANNESBURG: South Africa's Mandela spends 6th day in hospital,miamiherald.com
2013-06-12,Mandela responding better to treatment: South Africa's Zuma,reuters.com
2013-06-13,Mandela Spends 6th Day in Hospital,abcnews.go.com
2013-06-13,South Africa's Mandela spends 6th day in hospital after report of progress,foxnews.com
2013-06-13,South Africa's Nelson Mandela spends 6th day in hospital following report of health progress,foxnews.com
2013-06-13,South Africa's Nelson Mandela spends 6th day in hospital following report of health progress,startribune.com
2013-06-13,South Africa's Nelson Mandela spends 6th day in hospital following report of health progress,startribune.com
2013-06-13,South Africa's Nelson Mandela spends 6th day in hospital following report of health progress,startribune.com
2013-06-13,Nelson Mandela responding better to treatment for lung infection,denverpost.com
2013-06-13,Nelson Mandela’s Family Member Deeply Touched by Prayers around the World,ibtimes.com
2013-06-12,We are grateful': Nelson Mandela's family speaks as he responds to treatment,nbcnews.com
2013-06-14,Mandela's visible legacy: South Africa's interracial couples no longer need to hide,nbcnews.com
2013-06-14,A white South African's memories of Mandela,cnn.com
2013-06-13,South Africa: Mandela's health is improving,cbsnews.com
2013-06-14,South African President Visits Mandela,nytimes.com
2013-06-10,Zuma pays tribute to Mandela,reuters.com
2013-06-15,"Mandela's former bodyguard: ""Set him free""",cbsnews.com
2013-06-15,"Mandela remains in hospital, visited by family",cbsnews.com
2013-06-15,Mandela's grandson says he is 'recovering very well and looks good',csmonitor.com
2013-06-14,A white South African's memories of Mandela,cnn.com
2013-06-15,Mandela's grandson says he is 'recovering very well and looks good',csmonitor.com
2013-06-15,Mandela's grandson says he is 'recovering very well and looks good',csmonitor.com
2013-06-15,South Africans fret about post-Mandela civil strife,nbcnews.com
2013-06-16,"Mandela Is Recovering, His Grandson Reports",nytimes.com
2013-06-15,"Mandela's condition improving, grandson says",cnn.com
2013-06-15,"Mandela's condition improving, grandson says",cnn.com
2013-06-15,"Mandela's condition improving, grandson says",cnn.com
2013-06-15,Mandela remains in South African hospital,seattletimes.com
2013-06-15,South Africa: Relatives visit Nelson Mandela on his 8th day in a hospital for lung infection,foxnews.com
2013-06-15,South Africa: Relatives visit Nelson Mandela on his 8th day in a hospital for lung infection,startribune.com
2013-06-15,South Africa: Relatives visit Nelson Mandela on his 8th day in a hospital for lung infection,startribune.com
2013-06-15,Mandela remains in South African hospital,sacbee.com
2013-06-15,JOHANNESBURG: Mandela remains in South African hospital,miamiherald.com
2013-06-15,Mandela remains in South African hospital,kansascity.com
2013-06-15,South Africa: Relatives visit Nelson Mandela on his 8th day in a hospital for lung infection,startribune.com
2013-06-16,Mandela getting better but remains 'serious',chicagotribune.com
2013-06-16,"Mandela's condition improving though still serious, doctors say",csmonitor.com
2013-06-16,"Mandela's condition improving though still serious, doctors say",csmonitor.com
2013-06-16,Mandela Seeing Sustained Improvement,abcnews.go.com
2013-06-16,Mandela getting better but remains 'serious',chicagotribune.com
2013-06-10,Mandela said to be serious but recovering,reuters.com
2013-06-12,Zuma says Mandela serious but improving,reuters.com
2013-06-16,Former South African President Nelson Mandela seeing sustained improvement in health,nydailynews.com
2013-06-16,Former South African President Nelson Mandela seeing sustained improvement in health,nydailynews.com
2013-06-16,South Africa: Nelson Mandela improving,politico.com
2013-06-16,Mandela Seeing Sustained Improvement in Health,abcnews.go.com
2013-06-16,JOHANNESBURG: Mandela seeing sustained improvement in health,miamiherald.com
2013-06-16,Mandela seeing sustained improvement in health,kansascity.com
2013-06-16,SA president: Nelson Mandela on the mend,cbsnews.com
2013-06-16,Mandela seeing sustained improvement in health,seattletimes.com
2013-06-16,"Mandela making 'sustained' improvement in hospital, Zuma says",nbcnews.com
2013-06-16,"Nelson Mandela seeing sustained improvement in health, South Africa president says",startribune.com
2013-06-16,"Nelson Mandela seeing sustained improvement in health, South Africa president says",foxnews.com
2013-06-15,Mandela getting better but remains 'serious',reuters.com
2013-06-16,"Nelson Mandela seeing sustained improvement in health, South Africa president says",startribune.com
2013-06-16,"Nelson Mandela seeing sustained improvement in health, South Africa president says",startribune.com
2013-06-15,"Mandela getting better, South Africa's Zuma says",reuters.com
2013-06-15,Web Extra: Former bodyguard says Nelson Mandela is lonely,cbsnews.com
2013-06-14,A white South African's memories of Mandela,cnn.com
2013-06-17,South Africa's Mandela 'doing very well': daughter,chicagotribune.com
2013-06-17,Imagining South Africa Without Mandela,usnews.com
2013-06-17,Mandela praise singer recalls travels with him,kansascity.com
2013-06-17,"Mandela's wife thanks world for 'love, generosity'",kansascity.com
2013-06-17,"Mandela's wife thanks world for 'love, generosity'",sacbee.com
2013-06-17,"JOHANNESBURG: Mandela's wife thanks world for 'love, generosity'",miamiherald.com
2013-06-17,"Mandela praise singer who spent 13 years with him recalls leader as humble, great storyteller",startribune.com
2013-06-17,"Mandela praise singer who spent 13 years with him recalls leader as humble, great storyteller",startribune.com
2013-06-17,Mandela praise singer recalls travels with him,sacbee.com
2013-06-17,Imagining South Africa Without Mandela,usnews.com
2013-06-17,"Mandela praise singer who spent 13 years with him recalls leader as humble, great storyteller",startribune.com
2013-06-17,Mandela praise singer recalls travels with him,seattletimes.com
2013-06-17,JOHANNESBURG: Mandela praise singer recalls travels with him,miamiherald.com
2013-06-16,"Mandela's condition improving though still serious, doctors say",csmonitor.com
2013-06-17,"Nelson Mandela's wife thanks world for 'love, generosity'",nydailynews.com
2013-06-17,"Nelson Mandela's wife thanks world for 'love, generosity'",nydailynews.com
2013-06-17,"Mandela's wife thanks world for 'love, generosity'",seattletimes.com
2013-06-17,Nelson Mandela's wife stirred by global support for ailing husband,cnn.com
2013-06-17,Nelson Mandela's wife stirred by global support for ailing husband,cnn.com
2013-06-17,Nelson Mandela's wife stirred by global support for ailing husband,cnn.com
2013-06-16,"Mandela's wife thanks world for 'love, generosity'",sacbee.com
2013-06-17,"Nelson Mandela's wife thanks Africa, world for 'love, generosity' shown during hospitalization",foxnews.com
2013-06-17,"Nelson Mandela's wife thanks Africa, world for 'love, generosity' shown during hospitalization",startribune.com
2013-06-17,"Nelson Mandela's wife thanks Africa, world for 'love, generosity' shown during hospitalization",startribune.com
2013-06-17,"Nelson Mandela's wife thanks Africa, world for 'love, generosity' shown during hospitalization",startribune.com
2013-06-17,Nelson Mandela's wife stirred by global support for ailing husband,cnn.com
2013-06-16,Nelson Mandela's health said to be improving,cbsnews.com
2013-06-14,Mandela getting better but remains 'serious',reuters.com
2013-06-17,"Mandela’s Absence Is Felt, if Not Addressed",nytimes.com
2013-06-18,Grandson takes up Mandela challenge to serve,foxnews.com
2013-06-20,All-white town fights to preserve segregation in Mandela's 'Rainbow Nation',nbcnews.com
2013-06-20,30G Mandela portrait swiped,nypost.com
2013-06-12,"Nelson Mandela 'responding better' to treatment, Zuma says",latimes.com
2013-06-19,Nelson Mandela's health: Is it time to let go?,cbsnews.com
2013-06-19,"Critics worry family, government are prolonging Mandela's suffering",cbsnews.com
2013-06-21,Grandson: Mandela hopefully coming home soon,cbsnews.com
2013-06-21,SAfrica: Former president says Mandela improving,sacbee.com
2013-06-21,JOHANNESBURG: SAfrica: Former president says Mandela improving,miamiherald.com
2013-06-21,SAfrica: Former president says Mandela improving,kansascity.com
2013-06-21,Former president says Mandela improving,seattletimes.com
2013-06-21,JOHANNESBURG: SAfrica: former president says Mandela improving,miamiherald.com
2013-06-21,Former South African president says health of Nelson Mandela is getting better,foxnews.com
2013-06-21,Former South African president says Mandela's health is improving,foxnews.com
2013-06-21,Former South African president says health of Nelson Mandela is getting better,startribune.com
2013-06-21,Former South African president says health of Nelson Mandela is getting better,startribune.com
2013-06-21,SAfrica: former president says Mandela improving,kansascity.com
2013-06-22,South Africa: Mandela ambulance had engine problem,mercurynews.com
2013-06-22,Nelson Mandela's ambulance broke down on way to hospital in S. Africa,upi.com
2013-06-22,Mandela hasn't opened his eyes in days,cbsnews.com
2013-06-22,Ailing Nelson Mandela stranded by ambulance breakdown,chicagotribune.com
2013-06-22,Mandela's Ambulance Broke Down on Way to Hospital,abcnews.go.com
2013-06-22,Spokesman: Ambulance rushing Mandela to hospital broke down,cnn.com
2013-06-22,South Africa: Mandela ambulance had engine problem,sacbee.com
2013-06-21,South Africa: Mandela ambulance had engine problem,sacbee.com
2013-06-22,Nelson Mandela's ambulance broke down on way to hospital,nbcnews.com
2013-06-22,JOHANNESBURG: South Africa: Mandela ambulance had engine problem,miamiherald.com
2013-06-22,South Africa: Mandela ambulance had engine problem,kansascity.com
2013-06-22,Spokesman: Ambulance rushing Mandela to hospital broke down,cnn.com
2013-06-22,Spokesman: Ambulance rushing Mandela to hospital broke down,cnn.com
2013-06-22,South Africa: Mandela Ambulance Had Engine Problem,abcnews.go.com
2013-06-22,South African presidency says ambulance carrying Nelson Mandela on June 8 had engine trouble,startribune.com
2013-06-22,"SAfrica: Ambulance carrying Mandela to hospital had engine trouble, 'no harm' to condition",startribune.com
2013-06-22,"SAfrica: Ambulance carrying Mandela to hospital had engine trouble, 'no harm' to condition",startribune.com
2013-06-22,Mandela ambulance to hospital broke down,foxnews.com
2013-06-22,"SAfrica: Ambulance carrying Mandela to hospital had engine trouble, 'no harm' to condition",foxnews.com
2013-06-22,"SAfrica: Ambulance carrying Mandela to hospital had engine trouble, 'no harm' to condition",startribune.com
2013-06-21,Nelson Mandela remains in serious but stable condition: government,reuters.com
2013-06-22,Nelson Mandela's liver and kidneys 'functioning at 50%': report,nydailynews.com
2013-06-21,Mixed reports on Mandela's health,startribune.com
2013-06-22,Nelson Mandela's liver and kidneys 'functioning at 50%': report,nydailynews.com
2013-06-21,"Mandela's ambulance broke down, stranding him for 40 minutes",cbsnews.com
2013-06-21,"Sources: Mandela unresponsive, despite reports of improvement",cbsnews.com
2013-06-23,"Mandela in critical condition, South African president says",sacbee.com
2013-06-23,"Exclusive: 'I believe he is at peace,' Nelson Mandela's daughter says",cnn.com
2013-06-23,South Africans worry about Mandela and his legacy,usatoday.com
2013-06-23,Nelson Mandela in critical condition,politico.com
2013-06-23,"Exclusive: 'I believe he is at peace,' Nelson Mandela's daughter says",cnn.com
2013-06-23,South Africa's Nelson Mandela in Critical Condition,wsj.com
2013-06-23,"Nelson Mandela in critical condition, South Africa says",cnn.com
2013-06-23,South Africa: Anti-apartheid leader Nelson Mandela's condition has turned critical,startribune.com
2013-06-23,"South Africa: Mandela's condition worsened to ""critical""",cbsnews.com
2013-06-23,South Africa: Nelson Mandela in critical condition,nypost.com
2013-06-23,"Nelson Mandela in critical condition, South Africa says",cnn.com
2013-06-23,Nelson Mandela in critical condition as former South African president fights for life,nydailynews.com
2013-06-23,Nelson Mandela in critical condition as former South African president fights for life,nydailynews.com
2013-06-23,South Africa: Nelson Mandela in critical condition,kansascity.com
2013-06-23,South African presidency says condition of Nelson Mandela has become critical,foxnews.com
2013-06-23,South African Presidency: Mandela in Critical Condition,newsmax.com
2013-06-23,"Nelson Mandela in critical condition, South Africa says",cnn.com
2013-06-23,"Nelson Mandela in critical condition, South Africa says",cnn.com
2013-06-23,VERY SAD — NELSON MANDELA IN CRITICAL CONDITION,foxnews.com
2013-06-23,Former president Mandela's condition now 'critical': government,chicagotribune.com
2013-06-23,South Africa: Anti-apartheid leader Nelson Mandela's condition has turned critical,startribune.com
2013-06-22,Ex-president Mandela's condition now 'critical': government,reuters.com
2013-06-23,Hospitalized Nelson Mandela In Critical Condition,npr.org
2013-06-23,South African presidency says condition of Nelson Mandela has become 'critical',startribune.com
2013-06-23,Mandela now critical: presidency,foxnews.com
2013-06-23,"Ambulance carrying Mandela to hospital broke down, officials say",denverpost.com
2013-06-21,"Mandela's ambulance broke down, stranding him for 40 minutes",cbsnews.com
2013-06-24,Zuma: ‘What we need to do as a country is pray for’ Mandela,washingtonpost.com
2013-06-24,Zuma: ‘What we need to do as a country is pray for’ Mandela,washingtonpost.com
2013-06-16,South Africans prepare to say goodbye to Mandela,reuters.com
2013-06-24,S. Africa marks 18 years since Mandela's rugby victory,foxnews.com
2013-06-24,Federer thoughts with Mandela after easy first win at Wimbledon,cnn.com
2013-06-24,Federer thoughts with Mandela after easy first win at Wimbledon,cnn.com
2013-06-24,Hospitalized Nelson Mandela in 'Critical' Condition,usnews.com
2013-06-24,Why Nelson Mandela has six names,cnn.com
2013-06-24,Nelson Mandela Remains in Critical Condition,wsj.com
2013-06-24,Why Nelson Mandela has six names,cnn.com
2013-06-24,South Africa: Mandela in critical condition,twincities.com
2013-06-24,South Africa: Mandela in critical condition,seattletimes.com
2013-06-24,"Mandela condition ""critical"" in Pretoria hospital",cbsnews.com
2013-06-24,"South African president says Nelson Mandela was ""asleep"" during nighttime visit to hospital",startribune.com
2013-06-24,South Africa: Mandela in critical condition,denverpost.com
2013-06-24,Difficult time': Nelson Mandela in critical condition in hospital,nbcnews.com
2013-06-25,Post-Mandela: New South African Political Party Formed To Challenge Dominant ANC,ibtimes.com
2013-06-24,Everything Possible' Being Done For Ailing Nelson Mandela,npr.org
2013-06-24,Nelson Mandela’s famous quote on education,washingtonpost.com
2013-06-24,Nelson Mandela in critical condition for second straight day: officials,nypost.com
2013-06-24,South Africans resigned over 'critical' Mandela,chicagotribune.com
2013-06-24,Nelson Mandela remains in critical condition,sacbee.com
2013-06-24,South Africans resigned over 'critical' Mandela,chicagotribune.com
2013-06-24,South Africans resigned over 'critical' Mandela,chicagotribune.com
2013-06-24,Nelson Mandela in critical condition an anxious nation waits,cnn.com
2013-06-24,South Africans resigned over 'critical' Mandela,baltimoresun.com
2013-06-24,South Africans resigned over 'critical' Mandela,baltimoresun.com
2013-06-24,South Africans resigned over 'critical' Mandela,baltimoresun.com
2013-06-24,South Africans resigned over 'critical' Mandela,baltimoresun.com
2013-06-24,South Africans resigned over 'critical' Mandela,chicagotribune.com
2013-06-24,South Africans resigned over 'critical' Mandela,baltimoresun.com
2013-06-24,South Africans resigned over 'critical' Mandela,baltimoresun.com
2013-06-24,South Africans resigned over 'critical' Mandela,baltimoresun.com
2013-06-24,Everything Possible' Being Done For Ailing Nelson Mandela,npr.org
2013-06-24,South Africans resigned over 'critical' Mandela,baltimoresun.com
2013-06-16,Zuma: Mandela remains in critical condition,reuters.com
2013-06-24,Nelson Mandela Remains in Critical Condition,wsj.com
2013-06-24,"Mandela now critical, and gov't still tight-lipped",cbsnews.com
2013-06-24,Nelson Mandela Remains in Critical Condition,wsj.com
2013-06-25,Nelson Mandela Still in Critical Condition,nytimes.com
2013-06-24,South Africa's president says Mandela remains in critical condition,foxnews.com
2013-06-23,South Africans resigned over 'critical' Mandela,reuters.com
2013-06-24,South Africa's president says Mandela remains in critical condition,foxnews.com
2013-06-24,South Africa president says anti-apartheid leader Nelson Mandela's condition remains critical,foxnews.com
2013-06-24,South African presidency says Nelson Mandela remains in the hospital in critical condition,startribune.com
2013-06-23,South Africa: Mandela still in critical condition,sacbee.com
2013-06-24,South Africa Prays for Nelson Mandela's Health as Icon's Condition Worsens,ibtimes.com
2013-06-24,Nelson Mandela in critical condition an anxious nation waits,cnn.com
2013-06-23,Former President Mandela is critical in hospital,newsblaze.com
2013-06-24,"Nelson Mandela's Health Turns Critical, Says South African Presidency",ibtimes.com
2013-06-24,Nelson Mandela in critical condition an anxious nation waits,cnn.com
2013-06-24,Nelson Mandela in critical condition an anxious nation waits,cnn.com
2013-06-23,South Africa: Nelson Mandela in critical condition,cbsnews.com
2013-06-23,Nelson Mandela in Critical Condition,wsj.com
2013-06-23,Nelson Mandela in Critical Condition,wsj.com
2013-06-23,South Africa gov't says Mandela's condition deteriorated to critical,upi.com
2013-06-24,Is Nelson Mandela's Death Looming? South African Hero In Critical Condition,ibtimes.com
2013-06-23,"Exclusive: 'I believe he is at peace,' Nelson Mandela's daughter says",cnn.com
2013-06-23,"Mandela's health worsens, condition now 'critical'",orlandosentinel.com
2013-06-23,Nelson Mandela in Critical Condition,abcnews.go.com
2013-06-25,The Silver Lining of Almost Meeting Nelson Mandela,usnews.com
2013-06-25,Insider: Nelson Mandela has 'waited a long time' to see biopic,latimes.com
2013-06-25,Insider: Nelson Mandela has 'waited a long time' to see biopic,latimes.com
2013-06-25,The Silver Lining of Almost Meeting Nelson Mandela,usnews.com
2013-06-25,Obama unlikely to see Mandela on trip: SA minister,foxnews.com
2013-06-25,"Ailing Mandela opens eyes, smiles on hearing of Obama's South Africa trip",nbcnews.com
2013-06-25,Nelson Mandela lingers in critical condition as South Africa fears worst for ‘father of democracy’,nydailynews.com
2013-06-26,India’s Greatest Film Star Amitabh Bachchan Prays For Nelson Mandela,ibtimes.com
2013-06-25,Family meeting called as Mandela's condition deteriorates,upi.com
2013-06-08,S African man releases doves for Mandela,reuters.com
2013-06-16,Mandela family meet in Qunu,reuters.com
2013-06-25,Mandela still 'critical': South African government,chicagotribune.com
2013-06-25,"Obama’s Itinerary In South Africa: An Ailing Mandela And Planned Protests by Opposition Parties, Unions, Communists",ibtimes.com
2013-06-24,Hospitalized Nelson Mandela in 'Critical' Condition,usnews.com
2013-06-25,VIDEO For Nelson Mandela: Johnny Clegg's 'Asimbonanga',npr.org
2013-06-25,VIDEO For Nelson Mandela: Johnny Clegg's 'Asimbonanga',npr.org
2013-06-25,Nelson Mandela lingers in critical condition as South Africa fears worst for ‘father of democracy’,nydailynews.com
2013-06-25,Nelson Mandela lingers in critical condition as South Africa fears worst for ‘father of democracy’,nydailynews.com
2013-06-25,Nelson Mandela remains in critical condition,cbsnews.com
